titre,journal,date
Affaire Duhamel : La familia grande tiré à 225.000 exemplaires,Figaro,2021-01-13
Immigration : l'Europe enquête sur des possibles refoulements illégaux menés par l'agence Frontex,Figaro,2021-01-13
Accord commercial UE-Chine: que valent vraiment les engagements de Pékin?,Figaro,2021-01-13
"À Beaubourg et Orsay, des icônes sous influence",Figaro,2021-01-13
Nouvelle baisse des stocks de pétrole brut américains,Figaro,2021-01-13
Energies renouvelables : Engie se dit en bonne voie pour atteindre ses objectifs,Figaro,2021-01-13
«Comment redresser la France: la parabole du cyclone et du porte-avions»,Figaro,2021-01-13
Une entreprise souhaite munir ses salariés d'un boîtier anti-rapprochement physique,Figaro,2021-01-13
Honda fait une pause dans son usine britannique faute de composants,Figaro,2021-01-13
Couche-Tard propose 20 euros par action à Carrefour,Figaro,2021-01-13
D’où viennent ces plastrons en laine qui fleurissent autour des cous?,Figaro,2021-01-13
Espagne: le parlement rejette une demande de commission d'enquête sur Juan Carlos,Figaro,2021-01-13
"Lucie Leguay, le sens de l’écoute",Figaro,2021-01-13
Petit Cambodge : le propriétaire a repris possession des lieux après intervention de la police,Figaro,2021-01-13
"Pourquoi le SVP, Serveur Vocal Poétique, associé à tort au ministère de la Culture, ne répond plus",Figaro,2021-01-13
"New York coupe ses liens avec la Trump Organization, gestionnaire d'attractions touristiques",Figaro,2021-01-13
Décès du chorégraphe congolais Dorine Mokha à 31 ans,Figaro,2021-01-13
"Les Maréchaux de Staline, de Jean Lopez et Lasha Otkhmezuri: les hommes clés de l’Armée rouge",Figaro,2021-01-13
Hammett détective: la moisson noire,Figaro,2021-01-13
"Un garçon comme vous et moi, d’Ivan Jablonka: le mâle et le bien",Figaro,2021-01-13
"Ce monde est tellement beau, de Sébastien Lapaque: hymne à la grâce",Figaro,2021-01-13
"Serge, de Yasmina Reza: les Popper, quelle famille!",Figaro,2021-01-13
Sœurs de Daisy Johnson: deux étranges adolescentes,Figaro,2021-01-13
Melancolia de Mircea Cartarescu: l’enfant et les sortilèges,Figaro,2021-01-13
"Le siège de Paris de Frédéric Mounier, ces 135 jours qui ont fait la République",Figaro,2021-01-13
"Un bref instant de splendeur, d’Ocean Vuong: confessions d’un garçon égaré",Figaro,2021-01-13
Premiers romans: huit auteurs à découvrir en 2021,Figaro,2021-01-13
"Sylvie Germain: «Rester humain, un exercice quotidien»",Figaro,2021-01-13
"Sous pression d'un actionnaire activiste, Intel annonce le départ de son PDG",Figaro,2021-01-13
Le pape François vacciné au Vatican,Figaro,2021-01-13
La recette de donburi végétarien du chef étoilé Julien Lemarié,Figaro,2021-01-13
Épargne : plus de mille sites frauduleux en 2020,Figaro,2021-01-13
Virus : le variant britannique présent dans 50 pays et territoires,Figaro,2021-01-13
Les ZFE sous le feu de la vidéoverbalisation,Figaro,2021-01-13
Marne : une famille retrouve sa chatte 11 ans après sa disparition,Figaro,2021-01-13
Comment profiter de son jardin en hiver?,Figaro,2021-01-13
Covid: l'Afrique du Sud face à l'immense défi de la vaccination,Figaro,2021-01-13
Affaire Diary Sow: que sait-on de la disparition de cette étudiante sénégalaise?,Figaro,2021-01-13
"Alice Guy, pionnière du cinéma, va retrouver la lumière sur grand écran",Figaro,2021-01-13
Les chauves sont-ils en voie de disparition?,Figaro,2021-01-13
La Suisse durcit ses mesures pour lutter contre la pandémie,Figaro,2021-01-13
Le spectre d'une nouvelle fermeture des cantines scolaires inquiète les parents d'élèves,Figaro,2021-01-13
Le jambon cuit bientôt condamné à passer du rose au gris ?,Figaro,2021-01-13
Réindustrialisation: le Cese préconise la création d'un grand ministère de l'Industrie,Figaro,2021-01-13
Pau : un homme frappé et paralysé pour avoir demandé le port du masque dans un bar-tabac,Figaro,2021-01-13
"USA: accélération de l'inflation en décembre, à 0,4% sur un mois (CPI)",Figaro,2021-01-13
"Vacances de février : Dubaï, la Guadeloupe et la Martinique séduisent les voyageurs français",Figaro,2021-01-13
Bruno Mettling: «Le Covid est un virus dans un système à bout de souffle»,Figaro,2021-01-13
"Portugal: nouvelle baisse des prix en décembre (-0,2%)",Figaro,2021-01-13
"Syrie : 57 morts dans les raids d'Israël, les plus meurtriers depuis des années selon une ONG",Figaro,2021-01-13
Attentat Hariri: l'accusation fait appel du jugement du TSL,Figaro,2021-01-13
"Infosys: bénéfice net en hausse de 16,6% au 3T, à la faveur de la pandémie",Figaro,2021-01-13
France: UE: feu vert au rachat de Refinitiv par le LSE pour 27 milliards de dollars,Figaro,2021-01-13
Les actes de piraterie en hausse de 20% l'an dernier,Figaro,2021-01-13
"Savoie : percuté par un train, un cheminot décède",Figaro,2021-01-13
"La Bourse de Paris hésite (-0,01%), Carrefour va crescendo",Figaro,2021-01-13
"Camille Kouchner: «Ma mère, elle a très bien compris. Elle a minimisé, c'est encore pire»",Figaro,2021-01-13
Coronavirus : Poutine ordonne une vaccination massive en Russie à partir de la semaine prochaine,Figaro,2021-01-13
"L'euro numérique, une réalité espérée «d'ici 5 ans», selon Lagarde",Figaro,2021-01-13
Antoine Gerlier ou l’anxiété fructueuse,Figaro,2021-01-13
"Mort de David Barclay, propriétaire du Telegraph ",Figaro,2021-01-13
Le travail à domicile en forte hausse en 2020,Figaro,2021-01-13
Séparatisme : les syndicats jugent le texte du projet de loi «déséquilibré»,Figaro,2021-01-13
Lutte contre la précarité où urgence climatique... Quand la gauche et les écologistes se déchirent à Paris,Figaro,2021-01-13
"Un narcotrafiquant belge, réclamé par son pays, arrêté en Espagne",Figaro,2021-01-13
Urgence sanitaire sans vote au Parlement : «ce projet liberticide que le gouvernement a bien fait d'abandonner»,Figaro,2021-01-13
Un ancien eurodéputé RN visé par une enquête liée à deux prêts consentis au RN,Figaro,2021-01-13
Arnaques financières: l'AMF et la police nationale renforcent leur coopération,Figaro,2021-01-13
«Le tueur de la gare de Perpignan» renvoyé aux assises de la Somme pour un autre viol et meurtre,Figaro,2021-01-13
La BCE confiante dans la reprise en 2021 malgré la pandémie,Figaro,2021-01-13
Maroc : peine de mort pour le meurtre et le viol d'un garçon de 11 ans,Figaro,2021-01-13
Vaccins: l'UE rappelle à l'ordre les Etats sur les contrats individuels,Figaro,2021-01-13
"Porsche Boxster Edition 25 ans, le roadster hommage ",Figaro,2021-01-13
Olivier Babeau: «Notre civilisation est rendue malade par les images»,Figaro,2021-01-13
Chine: forte hausse des ventes de véhicules verts en 2020,Figaro,2021-01-13
Deux Magots 2021 : trois finalistes pour un prix,Figaro,2021-01-13
Le nombre de dossiers de surendettement en nette baisse en 2020,Figaro,2021-01-13
"Covid-19 : «Il va falloir prendre de nouvelles mesures», selon l'ARS Île-de-France",Figaro,2021-01-13
"Pour Olivier Babeau, la « censure » de Donald Trump confirme les thèses complotistes",Figaro,2021-01-13
"La livre grimpe face au dollar, la BoE adopte un ton prudent",Figaro,2021-01-13
Enquête ouverte pour «prise illégale d'intérêts» visant le ministre Sébastien Lecornu,Figaro,2021-01-13
Vaccination : François Bayrou défend la mise en place d'un passeport vaccinal,Figaro,2021-01-13
L'innovation spatiale bénéficie de 300 millions d'euros du Fonds européen d'investissement,Figaro,2021-01-13
Rappel de produits : du riz basmati vendu par Carrefour pourrait contenir une toxine,Figaro,2021-01-13
Un film polémique sur Jénine interdit par décision de justice en Israël,Figaro,2021-01-13
Etes-vous favorable à un couvre-feu à 18h généralisé à l’ensemble du pays ?,Figaro,2021-01-13
"Pour Roselyne Bachelot, il serait «irresponsable» de fixer une date de réouverture des lieux culturels",Figaro,2021-01-13
"Covid-19 : après l'opéra, Facebook tente le streaming payant au théâtre",Figaro,2021-01-13
Italie: la production industrielle repart à la baisse en novembre,Figaro,2021-01-13
Covid-19 : que font nos voisins pour contenir la propagation de l'épidémie dans les écoles ?,Figaro,2021-01-13
«Prise illégale d'intérêts» : ouverture d'une enquête visant Éric Dupond-Moretti,Figaro,2021-01-13
Le pass culture généralisé cette année à la réouverture des lieux culturels,Figaro,2021-01-13
La France a rapatrié sept jeunes mineurs du nord-est de la Syrie,Figaro,2021-01-13
"Fiançailles: malgré le report des mariages, les Français s’engagent plus que jamais ",Figaro,2021-01-13
"La haine en ligne restera la plaie des réseaux sociaux, comme les accidents de la route et l'automobile",Figaro,2021-01-13
"Malgré le Covid, le Off d'Avignon espère «se relancer» en 2021",Figaro,2021-01-13
La Bourse de Londres ouvre en petite hausse,Figaro,2021-01-13
"Les défaillances d'entreprises ont baissé de 36,1% en novembre",Figaro,2021-01-13
"Cécilia Attias, ex-épouse de Nicolas Sarkozy, aurait été rémunérée par l'Assemblée quand il était ministre",Figaro,2021-01-13
Navalny annonce son retour en Russie pour dimanche,Figaro,2021-01-13
"Telefonica vend ses tours de télécommunication en Europe et Amérique latine pour 7,7 milliards d'euros",Figaro,2021-01-13
Pékin se mobilise face à une résurgence du Covid,Figaro,2021-01-13
L'ancien président de Barakacity jugé pour injure et cyberharcèlement envers la journaliste Zineb El-Razhoui,Figaro,2021-01-13
Bon plan: MacBook Pro 15 pouces en promo de -980 euros,Figaro,2021-01-13
PSG-OM: à quelle heure et sur quelle chaîne regarder le match,Figaro,2021-01-13
La Bourse de Francfort ouvre sans direction,Figaro,2021-01-13
La Bourse de Paris ouvre à l'équilibre,Figaro,2021-01-13
Canada: Colas remporte un contrat à 1 milliard d'euros pour une ligne de métro,Figaro,2021-01-13
"La Bourse de Tokyo finit en nette hausse, la tech en vedette",Figaro,2021-01-13
Un vaste site de production d'hydrogène vert Total-Engie pour la raffinerie de La Mède,Figaro,2021-01-13
Carrefour a été sollicité par le canadien Couche-Tard pour un «rapprochement»,Figaro,2021-01-13
VTC: Free Now rejoint Uber sur un bilan «zéro carbone» pour 2030,Figaro,2021-01-13
Lyon : une étudiante sauvée in extremis du suicide par ses camarades,Figaro,2021-01-13
"Non, 2021 ne sera pas l'année des sociétés «zombies»...",Figaro,2021-01-13
Macron répond aux critiques sur la vaccination : «Ça prend plus de temps qu'un tweet»,Figaro,2021-01-13
"Lutte contre le Covid, procédure de destitution de Trump, chutes de neige... Les 5 infos à connaître ce 13 janvier",Figaro,2021-01-13
"Estonie : le premier ministre Juri Ratas démissionne, son parti visé par une enquête pour corruption",Figaro,2021-01-13
"Malgré le déconfinement, l'activité n'a que partiellement redémarré en décembre",Figaro,2021-01-13
Pascal Obispo lance sa propre application All access,Figaro,2021-01-13
«Papy et mamie dans la cuisine»...: pourquoi les politiques nous infantilisent?,Figaro,2021-01-13
"Nos Vallées, un single pour soutenir les victimes de la tempête Alex",Figaro,2021-01-13
"«Métiers de l'ombre», les fournisseurs des hôtels et restaurants crient à l'aide",Figaro,2021-01-13
EN DIRECT - Covid-19: 23.852 nouveaux cas et plus de 57.000 personnes vaccinées en 24 heures,Figaro,2021-01-13
"Covid-19 : les États-Unis submergés, un nouveau variant au Japon",Figaro,2021-01-13
États-Unis : première exécution fédérale d'une femme en près de 70 ans,Figaro,2021-01-13
Jambon: un rapport parlementaire recommande l'interdiction totale des nitrites d'ici à 2025,Figaro,2021-01-13
Plastic Bertrand en fan inconditionnel de David Bowie et Andy Warhol pour son dernier clip,Figaro,2021-01-13
"Destination Montélimar, pour son nougat et ses vestiges médiévaux",Figaro,2021-01-13
La lettre du Figaro du 13 janvier 2021,Figaro,2021-01-13
Les géants de la tech espèrent une loi américaine sur la confidentialité des données,Figaro,2021-01-13
WhatsApp tente de rassurer ses utilisateurs sur la confidentialité des données,Figaro,2021-01-13
Des chauffeurs Uber poursuivent la Californie en justice sur la question de leur statut,Figaro,2021-01-13
"La Daronne, Coco, One Night in Miami... Les films en ligne à voir ou pas cette semaine",Figaro,2021-01-13
Venezuela: Maduro veut tripler la production pétrolière,Figaro,2021-01-13
La persécution des chrétiens dans le monde s’aggrave,Figaro,2021-01-13
"Covid-19: à Saint-Pierre et Miquelon, un mois pour vacciner tous les adultes",Figaro,2021-01-13
Covid-19: le Japon va isoler un variant venu du Brésil pour mieux l'analyser,Figaro,2021-01-13
Covid-19: le Mexique envisage l'achat de 24 millions de doses du vaccin russe,Figaro,2021-01-13
"Syrie: raids israéliens dans l'est, 5 soldats et 11 combattants alliés tués",Figaro,2021-01-13
Équateur: quatre cas d'infection au variant britannique du coronavirus,Figaro,2021-01-13
YouTube suspend la chaîne de Trump et supprime une vidéo pour «risque de violence»,Figaro,2021-01-13
"Covid-19: débordé, le Panama va louer des conteneurs réfrigérés pour conserver les cadavres",Figaro,2021-01-13
"Seconde vague de Covid-19 au Pérou, déclare le gouvernement",Figaro,2021-01-13
Covid-19: les États-Unis enregistrent un record de près de 4.500 morts en 24 heures,Figaro,2021-01-13
Kim s'engage à renforcer l'arsenal nucléaire de la Corée du Nord,Figaro,2021-01-13
Mike Pence refuse d'invoquer le 25e amendement contre Donald Trump,Figaro,2021-01-13
Les «fronts de déforestation» se multiplient sur la planète,Figaro,2021-01-13
"Italie : le gouvernement adopte un plan de relance, au risque d'imploser",Figaro,2021-01-13
Présidentielle en Ouganda: l'Onu et Washington appellent au respect des droits humains,Figaro,2021-01-13
"Le PDG d'Apple veut que les émeutiers du Capitole rendent des comptes, même Trump",Figaro,2021-01-13
"L'une des principales élues républicaines, Liz Cheney, votera la mise en accusation de Trump",Figaro,2021-01-13
Les chefs du Pentagone condamnent l'assaut du Capitole,Figaro,2021-01-13
Une journaliste de Voice of America «punie» pour avoir tenté d'interroger Pompeo,Figaro,2021-01-13
Un ancien régulateur financier pressenti à la tête du gendarme boursier américain,Figaro,2021-01-13
