titre,journal,date
Photos de Daech sur Twitter : Marine Le Pen invoque sa « liberté d’expression »,La Point,2021-02-10
Vaccins anti-Covid-19 : l’Afrique du Sud face à un dilemme,La Point,2021-02-10
"Vaccins: l'OMS au secours d'AstraZeneca, l'UE veut des preuves d'efficacité contre les variants",La Point,2021-02-10
"Landes: l'hôpital de Dax perturbé par une attaque informatique d'""ampleur""",La Point,2021-02-10
Ursula von der Leyen face à la bronca des eurodéputés,La Point,2021-02-10
Séisme dans le Pacifique: alerte au tsunami en Nouvelle-Zélande et Australie,La Point,2021-02-10
L’otage suisse a bien été exécuté par ses ravisseurs au Mali,La Point,2021-02-10
"Daryl Davis, l’Afro-Américain qui met le Ku Klux Klan dans sa poche",La Point,2021-02-10
"Présidentielle au Tchad : face à Déby Itno, l’opposition veut s’unir",La Point,2021-02-10
"Dans un Paris gelé et sous couvre-feu, des sans-abri luttent pour leur survie",La Point,2021-02-10
Covid : le combat d’Israël contre les antivaccins,La Point,2021-02-10
Le parcours politique de Marine Le Pen,La Point,2021-02-10
"Gérard Bertrand, le bio aux mille hectares",La Point,2021-02-10
"L'anglais, nouvelle fracture idéologique",La Point,2021-02-10
"Mario Vargas Llosa : « Plus l’État grossit, plus son efficacité diminue »",La Point,2021-02-10
"Tianwen-1, la sonde chinoise, entre en orbite autour de Mars",La Point,2021-02-10
"Soeur André, 117 ans jeudi et un Covid passé presque inaperçu",La Point,2021-02-10
Coronavirus : le point sur la pandémie,La Point,2021-02-10
"Dans le sud du Portugal, la ""Portimao Arena"" transformée en hôpital de campagne",La Point,2021-02-10
Photos d'exactions de l'EI sur Twitter: amende requise contre Marine Le Pen,La Point,2021-02-10
"Hannah Arendt, une pensée politique en action",La Point,2021-02-10
La justice empêche-t-elle Bernard Tapie de rembourser ses dettes ?,La Point,2021-02-10
Les îles Loyauté et la Nouvelle-Calédonie frappées par un violent séisme,La Point,2021-02-10
"""La Cène"" de Léonard de Vinci à Milan se déconfine enfin",La Point,2021-02-10
"Photos d'exactions de l'EI sur Twitter: Le Pen dénonce un ""procès politique""",La Point,2021-02-10
Un actif sur cinq est engagé dans une reconversion professionnelle,La Point,2021-02-10
Hommages à gauche à l'étudiant retrouvé mort après avoir accusé un élu PCF de viol,La Point,2021-02-10
Les îles Loyauté et la Nouvelle-Calédonie frappées par un violent séisme,La Point,2021-02-10
Triangle de Gonesse : Valérie Pécresse réclame l’évacuation de la ZAD,La Point,2021-02-10
"En Bretagne, les routiers bloqués par la neige tempêtent",La Point,2021-02-10
"Roger Pielke : « Plus nos sociétés s’enrichissent, mieux c’est pour l’environnement »",La Point,2021-02-10
Philippe Raynaud : « Arendt n’est pas une madone de l’humanitaire »,La Point,2021-02-10
"Proportionnelle: un ""débat important"" qui ""doit se poursuivre"" selon Macron",La Point,2021-02-10
Violences et stupéfiants : 8 policiers en garde à vue,La Point,2021-02-10
Le président du CNC en garde à vue pour soupçons d'agression sexuelle,La Point,2021-02-10
"Covid: ""un chemin"" toujours possible pour éviter le reconfinement, affirme Attal",La Point,2021-02-10
Suppression de l’ENA : vers un renoncement d’Emmanuel Macron ?,La Point,2021-02-10
"Seine-Saint-Denis: huit policiers en garde à vue pour ""violences"" et ""détention de stupéfiants"" (parquet)",La Point,2021-02-10
Lutte contre la pauvreté : Les Républicains jouent les équilibristes,La Point,2021-02-10
"Hannah Arendt, icône de la culture populaire",La Point,2021-02-10
"A Djibouti, les jeunes lieutenants français à l'Ecole du désert",La Point,2021-02-10
Défilés en Iran pour le 42e anniversaire de la Révolution islamique,La Point,2021-02-10
Accident d'hélicoptère à Courchevel : comment va se dérouler l'enquête,La Point,2021-02-10
"Djibouti, confetti à haute valeur stratégique pour Paris, et bien d'autres",La Point,2021-02-10
"Avec « Les Archives de Roshar », le meilleur de la fantasy revient en librairie !",La Point,2021-02-10
Hannah Arendt au secours de l’éducation traditionnelle,La Point,2021-02-10
Les élections régionales et départementales prévues pour les 13 et 20 juin,La Point,2021-02-10
"Cinéma: le patron du CNC en garde à vue, accusé d'agression sexuelle",La Point,2021-02-10
"Mouret, Ozon, Dupontel , trio de réalisateurs en tête pour les César",La Point,2021-02-10
"Covid-19: un hiver sans confinement, objectif sérieux ou mirage ?",La Point,2021-02-10
Delphine Jubillar : son téléphone se serait mystérieusement réactivé,La Point,2021-02-10
"Covid-19: la mort dans l'âme, le Musée d'art moderne de Strasbourg remballe son expo phare",La Point,2021-02-10
Une montre pour deux,La Point,2021-02-10
"Les bobos, les « Guignols » et les paparazzis : Jean-Pierre Pernaut se lâche",La Point,2021-02-10
Les faux chiffres de la Fondation Nicolas Hulot,La Point,2021-02-10
Le FC Nantes confirme le renvoi de Raymond Domenech,La Point,2021-02-10
"Hannah Arendt, Adolf Eichmann et la banalité du mal",La Point,2021-02-10
Sahel : l’après-Barkhane questionné au Sénat,La Point,2021-02-10
"A Calais, des migrants entre besoin vital de chaleur, méfiance et rage de passer en Angleterre",La Point,2021-02-10
César 2021 : le réalisateur Emmanuel Mouret en tête des nominations,La Point,2021-02-10
Affaire Duhamel : comment le Siècle tente de se refaire une beauté,La Point,2021-02-10
"En Australie, la stricte quarantaine des voyageurs n'empêche pas des contaminations",La Point,2021-02-10
"J’ai écouté ClubHouse, l’appli censurée qui a cartonné en Chine",La Point,2021-02-10
Rupture d'un glacier en Inde: colère et désespoir des proches des disparus,La Point,2021-02-10
"Procès en destitution de Trump : zéro suspense, gros enjeux",La Point,2021-02-10
"Birmanie: la mobilisation se poursuit contre le coup d'État, Biden annonce des sanctions",La Point,2021-02-10
Pourquoi la voiture hybride rechargeable est un casse-tête,La Point,2021-02-10
"Un trio Mouret, Ozon, Dupontel, en tête des nominations aux César 2021",La Point,2021-02-10
"Cinéma: Dominique Boutonnat, patron du CNC, en garde à vue pour soupçons d'agression sexuelle",La Point,2021-02-10
Accident d’hélicoptère à Courchevel : comment va se dérouler l’enquête,La Point,2021-02-10
Les choix culture du « Point » : Jude Law en golden-boy et 25 fois Frida Kahlo,La Point,2021-02-10
Le président du CNC en garde à vue pour soupçons d’agression sexuelle,La Point,2021-02-10
Indonésie : une « anomalie » sur les automanettes du Boeing disparu en janvier,La Point,2021-02-10
Pourquoi il faut lire Hannah Arendt,La Point,2021-02-10
"A Nice, un ""bizarre"" mois de février sans carnaval",La Point,2021-02-10
"Les Murs blancs, un lieu où souffle l’esprit…",La Point,2021-02-10
Trappes : le cri désespéré du professeur Lemaire,La Point,2021-02-10
L’incroyable odyssée du masseur de Himmler,La Point,2021-02-10
Cannabis: le grand boom des boutiques de CBD,La Point,2021-02-10
Ces millions de dollars volés par des hackers nord-coréens pour acheter des armes nucléaires,La Point,2021-02-10
Musées et salles de spectacle : Roselyne Bachelot contre le passeport vaccinal,La Point,2021-02-10
« Je ne suis pas un chat » : la visioconférence à l’épreuve des filtres,La Point,2021-02-10
Nos 5 click and collect de « Top Chef » en France,La Point,2021-02-10
"Syrie: dix ans après le début de la guerre, l'ONU toujours paralysée",La Point,2021-02-10
Vendôme: le maire défend la vente du nom de sa ville à LVMH,La Point,2021-02-10
"Dans le nord-est du Kenya, le désespoir gagne face aux islamistes shebab",La Point,2021-02-10
Covid-19 : l’Estonie en première ligne pour le passeport vaccinal,La Point,2021-02-10
Birmanie: des dizaines de milliers de manifestants au 5e jour de mobilisation,La Point,2021-02-10
L'étudiant qui a accusé un élu parisien de viol retrouvé mort,La Point,2021-02-10
Covid-19 : un expert de l’OMS défend l’enquête réalisée en Chine,La Point,2021-02-10
Ces éléments qui montrent que l’assaut contre le Capitole était planifié,La Point,2021-02-10
"En Libye, après 10 ans de guerre, une riche économie aujourd'hui à terre",La Point,2021-02-10
Loi climat : un projet déjà sous le feu des critiques,La Point,2021-02-10
Pourquoi la voiture hybride rechargeable est un casse-tête,La Point,2021-02-10
Michel Moulin : « Notre football est à l’agonie »,La Point,2021-02-10
Kervasdoué – La réforme de la recherche française en question,La Point,2021-02-10
"Italie : Salvini-Draghi, l’improbable alliance",La Point,2021-02-10
Coignard – Dingue ! Il neige en hiver !,La Point,2021-02-10
Fusillade dans une clinique aux États-Unis : un mort et plusieurs blessés,La Point,2021-02-10
EDF: la mobilisation contre Hercule fait étape devant l'Assemblée nationale,La Point,2021-02-10
"L'exécutif défend son ""ambitieuse"" loi Climat face aux critiques des écologistes",La Point,2021-02-10
Rupture d’un glacier en Inde : 34 survivants bloqués dans un tunnel,La Point,2021-02-10
"Pandémie: l'OMS doute des renseignements américains, l'UE veut muscler la production de vaccins",La Point,2021-02-10
"Birmanie: 5e jour de manifestations, raid contre le siège du parti d'Aung San Suu Kyi",La Point,2021-02-10
Limoges : la police intervient pour un enfant… qui refuse de débarrasser la table,La Point,2021-02-10
"Neige, verglas, crues : 17 départements toujours en vigilance orange",La Point,2021-02-10
Vidéos et citations choisies: l'exposé choc de l'accusation au procès de Trump,La Point,2021-02-10
La performance d'un des avocats de Trump suscite consternation et ironie,La Point,2021-02-10
Covid-19 : quelles restrictions pour nos voisins européens ?,La Point,2021-02-10
Comment le prince Charles a empêché ses locataires d’acheter leur maison,La Point,2021-02-10
L’étudiant qui a accusé un élu parisien de viol retrouvé mort,La Point,2021-02-10
Michel Drucker bientôt de retour à la télé : Cette élément qui pourrait tout faire capoter !,Public,2021-02-10
"Cauet de nouveau en couple : ""Je l'ai rencontrée hors Tinder""",Public,2021-02-10
"Loana : la proposition très (très) étrange de Cyril Hanouna juste avant la fin de ""TPMP""...",Public,2021-02-10
"Zapping : ""Je prenais de la cocaïne au réveil"", les confessions choc de Loana",Public,2021-02-10
Stéphane Plaza et Wejdene : champagne et petits fours… Cette bonne nouvelle qu’ils fêtent ensemble !,Public,2021-02-10
"Loft Story ""violent"" et ""injuste"" : Laure de Lattre, finaliste face à Loana et encore choquée, elle fracasse la production de l'émission",Public,2021-02-10
"""On m’a jamais parlé comme ça"" : Cyril Hanouna choqué par un invité qui traite tous ses chroniqueurs de ""fous""",Public,2021-02-10
Sara et Rania (The Voice Kids) : Comment elles ont ébloui Brigitte Macron !,Public,2021-02-10
"PHOTOS : Alizée : sa fille Annily plus amoureuse que jamais, elle partage un baiser très fougueux avec son chéri",Public,2021-02-10
"""J'ai compris que c'était cuit"", très affaibli, Serge Lama fait une terrible annonce...",Public,2021-02-10
TPMP : Ce chroniqueur que les internautes ne supportent déjà plus !,Public,2021-02-10
"""Va te faire soigner"" : après le passage de Loana dans TPMP, Fred Cauvin publie une violente vidéo à charge...",Public,2021-02-10
PHOTO - Vincent Cassel et Tina Kunakey : le couple devient les nouveaux ambassadeurs de la marque The Kooples,Public,2021-02-10
"Après avoir bazardé sa mère, Loana s’en prend à Mindy, sa ""fille cachée"" en plein direct dans TPMP !",Public,2021-02-10
PHOTO - Marion Cotillard : ce souvenir qui rend dingue ses fans !,Public,2021-02-10
"Alexandra Lamy gênée par son physique, « J’ai eu le complexe de la jolie fille »",Public,2021-02-10
"Mario (Star Ac) : en pleurs, il révèle avoir donné la mort à son père : ""J'ai débranché la machine""",Public,2021-02-10
Télé-réalité : Le programme TV de ce mercredi 10 février 2021,Public,2021-02-10
Emily Ratajkowski : La future maman dévoile deux clichés hyper sexy !,Public,2021-02-10
Nagui : scandale autour d'un contrat à (tenez-vous bien) 100 millions d'euros signé avec France Télévisions !,Public,2021-02-10
"Julie Zenatti : en larmes, la chanteuse révèle en direct à la radio, avoir été agressée sexuellement",Public,2021-02-10
Jamel Debbouze : Surprise... Nadine Morano est fan du Marrakech du rire !,Public,2021-02-10
Laeticia et David Hallyday : ce noble geste qu'ils s'accordent à payer ensemble...,Public,2021-02-10
PHOTO : Mélanie Page : découvrez ce look extravagant de la femme de Nagui !,Public,2021-02-10
New Balance 327 : où trouver la paire de baskets que même les stars s'arrachent,Public,2021-02-10
Marie Drucker dévoile son tout nouveau projet !,Public,2021-02-10
Photos - Top Chef revient sur M6 : qui sont vos jurés préférés ?,Public,2021-02-10
Instagram : voici pourquoi ce masque cheveux signé Coco & Eve fait le buzz,Public,2021-02-10
Clémence Botino de retour en Guadeloupe : cette petite phrase qui ne va pas plaire aux parisiens...,Public,2021-02-10
Brigitte Macron : ce pas de danse qui fait le buzz !,Public,2021-02-10
"Koh-Lanta : Un candidat emblématique complètement défiguré après une opération, cette vidéo qui choque les internautes...",Public,2021-02-10
Le magnat de l'industrie pornographique Larry Flynt est mort,Figaro,2021-02-10
Turquie: les États-Unis appellent à la libération «immédiate» du mécène Kavala,Figaro,2021-02-10
Baccarat: une assemblée générale ordonnée pour sortir de l'administration judiciaire,Figaro,2021-02-10
Cuba dénonce l'utilisation de la culture «contre la révolution»,Figaro,2021-02-10
Haïti: la police disperse une manifestation d'opposants au président,Figaro,2021-02-10
Uber réduit ses pertes trimestrielles malgré un chiffre d'affaires en baisse à cause de la pandémie,Figaro,2021-02-10
Un élevage de porcs de l'Allier à nouveau ciblé par L214,Figaro,2021-02-10
La livre au plus haut en près de trois ans face au dollar,Figaro,2021-02-10
"Cuba: presse, santé et enseignement resteront interdits au secteur privé",Figaro,2021-02-10
"Wall Street finit sans direction, le Dow Jones à un record",Figaro,2021-02-10
Cameroun: l'armée dit avoir tué le chef du commando responsable d'un massacre d'écoliers en zone anglophone,Figaro,2021-02-10
Chicago: les cours des céréales baissent avec la faible inflation américaine,Figaro,2021-02-10
Elections en Equateur: le président Moreno demande des résultats fiables,Figaro,2021-02-10
Le pétrole monte après un fort recul des stocks de brut américain,Figaro,2021-02-10
Macron «se réjouit» de la libération de la féministe saoudienne Loujain al-Hathloul,Figaro,2021-02-10
Poids lourds : Valérie Pécresse en faveur d'une écotaxe en Île-de-France,Figaro,2021-02-10
Biden annonce la création d'un groupe de travail au Pentagone sur la Chine,Figaro,2021-02-10
"Au procès des policiers de la BAC, «l'assurance» et «l'habillage»",Figaro,2021-02-10
Les États-Unis appellent toujours la Turquie à renoncer à ses missiles russes,Figaro,2021-02-10
Italie : le Mouvement 5 Étoiles se prononce jeudi sur son soutien à Mario Draghi,Figaro,2021-02-10
Amazon va créer 3000 emplois en 2021 en France,Figaro,2021-02-10
Force ouvrière: «plusieurs plaintes» à caractère sexuel contre un ancien responsable,Figaro,2021-02-10
«Séparatisme»: les députés adoptent l'article dit «Samuel Paty»,Figaro,2021-02-10
Karl Olive: «On ne peut pas rester bras croisés devant la délinquance des mineurs»,Figaro,2021-02-10
"L'Iran a entamé la production d'uranium métal, nouvelle violation de l'accord de 2015",Figaro,2021-02-10
"Macron a proposé à Biden de régler le litige opposant Airbus et Boeing, selon CNBC",Figaro,2021-02-10
Drôme: un homme condamné à neuf ans de réclusion pour avoir tué son bébé en 1998,Figaro,2021-02-10
Vaccins: le patron de Sanofi France dénonce le «bashing» à l'encontre du laboratoire,Figaro,2021-02-10
«Zéro Covid»: un défi à relever pour sortir d’une crise usante,Figaro,2021-02-10
Plus de 1500 migrants secourus au large de la Libye en une semaine,Figaro,2021-02-10
Etats-Unis : le marché du travail encore «très loin» d'être solide,Figaro,2021-02-10
"Laïcité à l’école: «Il faut réinitialiser le logiciel républicain, notamment pour les jeunes générations»",Figaro,2021-02-10
Viols sur mineur: le gouvernement corse la loi ,Figaro,2021-02-10
La guerre du nickel déstabilise la Nouvelle-Calédonie,Figaro,2021-02-10
Birmanie : Biden annonce des sanctions contre la junte militaire,Figaro,2021-02-10
Les sous-vêtements Dim vont à nouveau changer de propriétaire,Figaro,2021-02-10
«Le climat d’une loi»,Figaro,2021-02-10
Covid-19: «accélération préoccupante» de la circulation du virus et du variant anglais à Dunkerque,Figaro,2021-02-10
«Vous seriez fous de regarder l’Amérique et de dire: “Nous devrions faire pareil”»,Figaro,2021-02-10
"Les crédits aux entreprises ont augmenté de 13,3% en 2020, selon la Banque de France",Figaro,2021-02-10
«League of Legends» : le patron français de Riot Games accusé de harcèlement sexuel,Figaro,2021-02-10
"Charles Jaigu: «L’égalité de masse, cette grande faucheuse»",Figaro,2021-02-10
"Éric Zemmour: «Guerre civile, retour à la case départ»",Figaro,2021-02-10
La préparation du Brexit a coûté 200 millions d'euros à la France,Figaro,2021-02-10
Luc Ferry: «Décider en temps de crise» ,Figaro,2021-02-10
ENA: Macron renonce à s’attaquer au cœur du problème,Figaro,2021-02-10
Parité en entreprise : la ministre de l'Industrie «un peu vexée» du sur-place français,Figaro,2021-02-10
Macron peine à mettre en scène son bilan social,Figaro,2021-02-10
Twitter ne laissera pas revenir Donald Trump sur le réseau social,Figaro,2021-02-10
Rachida Dati: «Il faut mettre fin à une politique de peuplement qui a favorisé le séparatisme»,Figaro,2021-02-10
Le référendum sur le climat perçu comme une démarche politicienne,Figaro,2021-02-10
Loi climat: le monde de la publicité redoute le passage à l’Assemblée nationale,Figaro,2021-02-10
"UniCredit: perte nette de 2,78 milliards d'euros en 2020",Figaro,2021-02-10
Faut-il croire à la stratégie «zéro Covid»?,Figaro,2021-02-10
"Société générale, récit d’un déclassement",Figaro,2021-02-10
Loi climat: un projet jugé trop timide par les écologistes,Figaro,2021-02-10
"Condamnée à l'inéligibilité, la maire de Montauban dénonce «un piège politique»",Figaro,2021-02-10
Loi climat: le périlleux pari vert de Macron,Figaro,2021-02-10
Lorient : une mère de famille mise en examen après la mort de son fils de 7 ans,Figaro,2021-02-10
Loi climat: «Du “ jamais assez” au “mieux que rien”»,Figaro,2021-02-10
"Agriculteurs, industriels... Les multiples victimes collatérales de la fermeture des restaurants",Figaro,2021-02-10
Ce que les baskets propres disent de l’époque,Figaro,2021-02-10
Covid-19: l'Allemagne prolonge ses restrictions jusqu'au 7 mars,Figaro,2021-02-10
Les Américains fous de nos chefs d’orchestre,Figaro,2021-02-10
Suez-Veolia: Bruno Le Maire favorable à la désignation d'un médiateur,Figaro,2021-02-10
Espionnage: Londres se rebiffe contre Pékin,Figaro,2021-02-10
Tensions autour d’une maison squattée,Figaro,2021-02-10
"Une deuxième année sans Solidays, le festival annule son édition 2021",Figaro,2021-02-10
"Affaire Griveaux: Juan Branco, avocat de Pavlenski, placé sous le statut de témoin assisté",Figaro,2021-02-10
"Covid-19: 25.387 nouveaux cas en 24 heures, 146.370 personnes vaccinées en France",Figaro,2021-02-10
"Frappé par la crise du Covid-19, Unibail veut accélérer les cessions",Figaro,2021-02-10
Changement de patron à la tête du géant de la gestion Amundi,Figaro,2021-02-10
Le fabuleux destin de Gignac le Mexicain,Figaro,2021-02-10
L'aide de 1500 euros du fonds de solidarité est prolongée en janvier et février,Figaro,2021-02-10
Affaire de la «grotte sanglante» : les condamnés ne font pas appel,Figaro,2021-02-10
Europe: le fonds de relance franchit une haie,Figaro,2021-02-10
Vendée Globe: les coulisses des 87 jours en mer de Clarisse Crémer,Figaro,2021-02-10
France Médias Monde dans la cour des grands,Figaro,2021-02-10
La PJ frappe la mafia des «voleurs dans la loi»,Figaro,2021-02-10
"Olivier Babeau: «Avec le délit d’écocide, nous mettons un boulet au pied de notre économie»",Figaro,2021-02-10
"La City de Londres a un «futur radieux» loin des régulations européennes, selon la Banque d'Angleterre",Figaro,2021-02-10
"11,3 millions d'euros de contrats entre le ministère de la Santé et des cabinets de conseil",Figaro,2021-02-10
"«Gilets jaunes» : deux policiers mis en examen pour violences, dont l'éborgnement de Jérôme Rodrigues",Figaro,2021-02-10
"Villefranche, Dax, AP-HP... Les hôpitaux français sont des cibles de choix pour les cyberattaques",Figaro,2021-02-10
Inditex (Zara) France: 72 salariés pourraient quitter l'entreprise en étant «remplacés»,Figaro,2021-02-10
Entre 13 et 186 euros par mois : le coût très variable du télétravail,Figaro,2021-02-10
Neuilly-sur-Seine : un père condamné à 25 ans de prison pour le meurtre de son fils,Figaro,2021-02-10
La sélection Figaro Live: les vidéos qu'il ne fallait pas rater,Figaro,2021-02-10
La militante saoudienne Loujain al-Hathloul libérée,Figaro,2021-02-10
Voici la moins connectée (et la plus suisse) des Apple Watch,Figaro,2021-02-10
La santé et l’électronique sont l’oxygène d’Air Liquide,Figaro,2021-02-10
"Cyclisme: les coulisses de la rentrée du champion du monde, Julian Alaphilippe",Figaro,2021-02-10
Une enquête ouverte sur l'emploi et l'hébergement de travailleurs détachés dans le Sud,Figaro,2021-02-10
"Après la démission de Frédéric Mion, avis de tempête sur Sciences Po",Figaro,2021-02-10
"Régionales : «Je mènerai la bataille dans le Grand Est», officialise Laurent Jacobelli, nouvelle tête de liste du RN",Figaro,2021-02-10
"Unibail-Rodamco-Westfield va vendre pour 3,2 milliards d'euros d'actifs en Europe",Figaro,2021-02-10
Twitter n’a pas souffert de l’éviction de Donald Trump,Figaro,2021-02-10
"2020, année apocalyptique pour l’intérim",Figaro,2021-02-10
Nucléaire: la Pologne choisira des EPR français selon les décisions prises sur l'avenir d'EDF,Figaro,2021-02-10
Forte hausse de la diffusion numérique de la presse en 2020,Figaro,2021-02-10
"«Périscope» N° 35: L'Europe, quelle autonomie?",Figaro,2021-02-10
"Trains du RER B: le dialogue est renoué avec la RATP et la SNCF, indique Alstom",Figaro,2021-02-10
Covid-19 : quatre communes de La Réunion sous couvre-feu,Figaro,2021-02-10
"Impeachment: en découvrant ses avocats, Donald Trump fulmine",Figaro,2021-02-10
"La Bourse de Paris recule de 0,36% à la clôture",Figaro,2021-02-10
"Vêtements enfant: La Compagnie des petits en redressement judiciaire, 260 emplois menacés",Figaro,2021-02-10
Harcèlement à l'Ensam Montpellier: Roselyne Bachelot nomme une administratrice provisoire,Figaro,2021-02-10
Les plateformes en ligne vont bientôt collecter la TVA,Figaro,2021-02-10
Séisme dans le Pacifique: fin de l'alerte au tsunami,Figaro,2021-02-10
"Les danseurs étoiles brillent loin, très loin",Figaro,2021-02-10
"Birkinstock, ou l'art de transformer le plus cher des sacs en tatanes",Figaro,2021-02-10
La pression monte sur les alliés de Navalny,Figaro,2021-02-10
La pandémie a bien nourri le géant agricole américain Bunge en 2020,Figaro,2021-02-10
Brexit: le casse-tête de l’exonération des droits de douane,Figaro,2021-02-10
"Le platine au plus haut en six ans, la Chine veut verdir ses moteurs diesel",Figaro,2021-02-10
Ladj Ly placé en garde à vue pour «abus de confiance» et «abus de biens sociaux»,Figaro,2021-02-10
Le Metropolitan Museum pourrait céder des pièces de ses collections afin d'éviter le naufrage financier,Figaro,2021-02-10
Banque: la norvégienne DNB reprend le versement de dividendes après une pause Covid,Figaro,2021-02-10
"Gironde : mécontent après une inondation, il frappe le maire de son village",Figaro,2021-02-10
Lyon : un homme entre dans une église et menace les fidèles,Figaro,2021-02-10
"Chez Salesforce, la journée de bureau de 9H00 à 17H00 est «morte»",Figaro,2021-02-10
Prêts garantis par l'État : il est temps d'allonger la durée de remboursement à 8 ou 10 ans,Figaro,2021-02-10
"Avraham Burg, le Juif qui renie le camp des «maîtres» en Israël",Figaro,2021-02-10
Cuba autorise de nouvelles professions à exercer dans le privé,Figaro,2021-02-10
"USA: les stocks de pétrole ont reculé de 6,6 millions de barils au 5 février",Figaro,2021-02-10
"César 2021, du vieux avec du peu",Figaro,2021-02-10
Disparition de Delphine Jubillar : son téléphone portable s'est réactivé mardi soir,Figaro,2021-02-10
"Danse, musique, musées: ces talents français qui rayonnent à l’étranger",Figaro,2021-02-10
"Covid-19 : le vaccin AstraZeneca valable aussi pour les plus de 65 ans, selon les experts de l'OMS",Figaro,2021-02-10
"Devenir quelqu’un de Willy Vlautin, espoirs déçus ",Figaro,2021-02-10
"«Revenez dans quatre mois» : dans le public, le suivi psychologique vire à l'impossible",Figaro,2021-02-10
"Thibault de Montalembert, Isabelle Huppert, Emmanuelle Devos... Les oubliés des César 2021",Figaro,2021-02-10
LVMH «suspend» le prêt-à-porter de la marque de Rihanna,Figaro,2021-02-10
"Michel Morauw, hôtelier optimiste",Figaro,2021-02-10
Opéra de Paris: le rapport sur la diversité bouscule le recrutement et questionne le répertoire,Figaro,2021-02-10
Fini le badge : le contrôle d'accès biométrique s'installe à la porte des entreprises,Figaro,2021-02-10
