titre,journal,date
Le contrôleur général des prisons demande «une stratégie de vaccination spécifique» en détention,Figaro,2021-01-26
Affaire Zecler: recours de SOS Racisme contre l'aide financière accordée aux policiers,Figaro,2021-01-26
"Ademo, du groupe PNL, jugé ce mercredi  pour usage de stupéfiants, outrage et rébellion",Figaro,2021-01-26
"Le bénéfice de 3M, qui a livré 2 milliards de masques en 2020, bondit",Figaro,2021-01-26
Agression à Beaugrenelle : Yuriy avait été contrôlé sur la dalle,Figaro,2021-01-26
Alimentation : le fonds Sagard va racheter Nutrisens,Figaro,2021-01-26
Les raffineurs en grève de Grandpuits manifestent devant le siège de Total à La Défense,Figaro,2021-01-26
La pandémie amputera lourdement le PIB mondial,Figaro,2021-01-26
"Covid-19 : dans l'espoir de revoir les touristes, l'île Maurice lance sa campagne de vaccination",Figaro,2021-01-26
Mort de la gendarme Myriam Sakhri en 2011 : décision le 30 mars sur une réouverture de l'enquête,Figaro,2021-01-26
"Année 2020 en demi-teinte pour Johnson and Johnson, en train de développer son vaccin anti-Covid",Figaro,2021-01-26
"Emmanuel Ruben, prix des Deux Magots à grands coups de Sabre ",Figaro,2021-01-26
"Avec le Covid-19, la Chine deviendra-t-elle la première économie mondiale avant 2030 ?",Figaro,2021-01-26
«Twitter est devenu l’outil de la confession publique et le tribunal d’un nouvel ordre moral»,Figaro,2021-01-26
France: Virus: Merkel exhorte à une répartition «équitable» des vaccins dans le monde,Figaro,2021-01-26
L'Indonésie récolte 10 milliards de dollars en vue d'un fonds souverain,Figaro,2021-01-26
Les pêcheurs français évaluent leur baisse de chiffre d'affaires entre 30% et 40% en 2020,Figaro,2021-01-26
Les variants du Covid-19 rendront-ils les réinfections plus fréquentes?,Figaro,2021-01-26
General Electric repasse dans le vert en 2020 et améliore sa trésorerie,Figaro,2021-01-26
Covid-19 : le délai entre les deux doses du vaccin Pfizer maintenu à «3 ou 4 semaines»,Figaro,2021-01-26
Protocole sanitaire à l'école : une journée «en enfer» avec les assistants d'éducation,Figaro,2021-01-26
Huawei devrait ouvrir en 2023 en Alsace sa première usine hors de Chine,Figaro,2021-01-26
Deux morts sur l'A8 près de Nice : un transporteur bulgare condamné,Figaro,2021-01-26
"Vaccin Moderna : jusqu'à 6 semaines entre les deux injections, assure l'OMS",Figaro,2021-01-26
Les «Boulets du climat» de Greenpeace attribués à Macron et Pompili,Figaro,2021-01-26
Italie : le chef du gouvernement Giuseppe Conte a remis sa démission au président Sergio Mattarella,Figaro,2021-01-26
Covid - 19: pas de vaccination privilégiée pour les voyageurs internationaux (experts OMS),Figaro,2021-01-26
Va-t-on en finir avec le «quoi qu'il en coûte» dès 2021?,Figaro,2021-01-26
Six mois de prison avec sursis pour avoir tiré sur ses compagnons de chasse,Figaro,2021-01-26
Cédric Klapisch fustige le «déchaînement médiatique» autour de la mort de Jean-Pierre Bacri,Figaro,2021-01-26
Covid-19 : le délai entre les deux doses du vaccin Pfizer maintenu à 3 ou 4 semaines,Figaro,2021-01-26
Reconfinement : Ciotti appelle à frapper «un coup très fort»,Figaro,2021-01-26
Plan de relance: l'Assemblée nationale s'apprête à ratifier une réforme budgétaire-clé de l'UE,Figaro,2021-01-26
"L'euro recule un peu face au dollar, l'Italie et le virus inquiètent",Figaro,2021-01-26
"Après l'échec d'Europacity, Auchan promet de poursuivre ses grands projets",Figaro,2021-01-26
Cisjordanie : l'auteur d'une tentative d'attaque tué,Figaro,2021-01-26
"Après avoir plaidé coupable pour harcèlement sexuel, le manager de Lorde renvoyé par Warner",Figaro,2021-01-26
Noyade à Saint-Cyr: le parquet ne fait pas appel,Figaro,2021-01-26
Brittany ferries relance ses laisons entre la Bretagne et l'Irlande,Figaro,2021-01-26
King Kong contre Godzilla : une rivalité titanesque pour exorciser le blues du Covid,Figaro,2021-01-26
Taxe sur les produits importés: la France continuera à défendre l'outre-mer dans les négociations européennes,Figaro,2021-01-26
Birmanie : l'armée dénonce des irrégularités lors des élections et n'exclut pas un coup d'État,Figaro,2021-01-26
"Charlie, au nom de la liberté sur France 5",Figaro,2021-01-26
Toulouse : soupçon de «déstabilisation électorale» à l'encontre de la candidate LR lors des élections législatives de 2017,Figaro,2021-01-26
"Vaccins : les fabricants «doivent tenir leurs promesses», avertit Ursula von der Leyen",Figaro,2021-01-26
Emissions d'obligations vertes: 15 milliards d'euros de dépenses éligibles au programme de l'Etat en 2021,Figaro,2021-01-26
"Meurtre de Jonathan Coulom : 17 ans après les faits, un tueur en série allemand mis en examen",Figaro,2021-01-26
Régulation du numérique: Ursula von der Leyen invite les Etats-Unis à rejoindre les initiatives de l'UE,Figaro,2021-01-26
Camélia Jordana étrille l'académie des Victoires de la musique pour son «manque de parité»,Figaro,2021-01-26
Moscou et Téhéran appellent à «sauver» l'accord sur le nucléaire iranien,Figaro,2021-01-26
Covid-19 : l'Allemagne veut restreindre les exportations hors UE des vaccins produits en Europe,Figaro,2021-01-26
"Les Bourses européennes rebondissent, mais la prudence reste de mise",Figaro,2021-01-26
Pensez-vous qu’un troisième confinement serait respecté ?,Figaro,2021-01-26
"Tourist, l'album culte de St Germain, célèbre ses 20 ans avec une édition remixée",Figaro,2021-01-26
Aérien: les livraisons d'Airbus Helicopters en baisse de 10% en 2020,Figaro,2021-01-26
Covid-19 : la vaccination au Royaume-Uni pas affectée par les retards,Figaro,2021-01-26
"Un reconfinement est encore incertain à ce stade, assurent Bruno Le Maire et Agnès Pannier-Runacher",Figaro,2021-01-26
Pierre et Vacances étudie «plusieurs mesures» face aux difficultés de la crise sanitaire,Figaro,2021-01-26
"Pour éviter les faillites, Bercy et les professionnels du secteur pressent les PME de se rendre au tribunal",Figaro,2021-01-26
Energie: le fonds IFM lance une OPA partielle sur l'espagnol Naturgy pour 5 milliards d'euros,Figaro,2021-01-26
"Gaz : les tarifs réglementés vont augmenter de 3,5% en février",Figaro,2021-01-26
Construction: Bouygues s'engage à diminuer fortement son empreinte carbone,Figaro,2021-01-26
Le nouveau géant de l'automobile Stellantis et Engie EPS vont créer une coentreprise dans les mobilités électriques,Figaro,2021-01-26
Hyundai: hausse de 78% du bénéfice net au 4ème trimestre,Figaro,2021-01-26
"Reconfinement, couvre-feu, vacances prolongées... Macron temporise avant d'opter pour un scénario",Figaro,2021-01-26
Ferroviaire: Alstom achète une entreprise de signalisation aux USA,Figaro,2021-01-26
"Gustave Flaubert, la fureur d'écrire : mort de l'écrivain à 58 ans",Figaro,2021-01-26
"Utopia 56, l'association pro-migrants qui défie l'État",Figaro,2021-01-26
Bulgari dévoile deux nouvelles Octo Finissimo S en acier,Figaro,2021-01-26
Opérations anti-migrants : enquête préliminaire ouverte contre Génération identitaire pour provocation à la haine raciale,Figaro,2021-01-26
Partage illégal des données: l'application Grindr risque une amende record en Norvège,Figaro,2021-01-26
"Covid-19 : 2,5 milliards d'euros accordés à l'industrie du vison au Danemark",Figaro,2021-01-26
Air Liquide lance sa nouvelle unité d'hydrogène bas carbone au Québec,Figaro,2021-01-26
"«Le quoi qu'il en coûte durera aussi longtemps que nécessaire», martèle la ministre du Travail",Figaro,2021-01-26
La Bourse de Paris ouvre à l'équilibre,Figaro,2021-01-26
Carburants: le Superéthanol plébiscité par les Français malgré la crise,Figaro,2021-01-26
"«Fragilité numérique» : l'écran, boulevard vers le burn-out",Figaro,2021-01-26
Royaume-Uni: la pandémie fait grimper le taux de chômage à 5% à fin novembre,Figaro,2021-01-26
Un médecin condamné à un an de prison pour trafic de drogue,Figaro,2021-01-26
Covid-19 : le maire de Cabourg rétropédale après avoir annoncé un reconfinement,Figaro,2021-01-26
"AccorInvest va obtenir un prêt garanti par l'État de 500 millions d'euros, annonce Bruno Le Maire",Figaro,2021-01-26
Interparfums: chiffre d'affaires amputé d'un quart en 2020,Figaro,2021-01-26
"Italie : confinée dans son appartement, une femme découvre un trésor de 475.000 euros",Figaro,2021-01-26
Covid-19: les 1600 discothèques de France prêtes à se muer en «centres de vaccination d'urgence»,Figaro,2021-01-26
"Happn, le champion français de la rencontre en ligne",Figaro,2021-01-26
Covid-19 : Berlin veut renoncer durablement aux limitations de son déficit,Figaro,2021-01-26
"Covid-19, grève des enseignants, impeachment de Trump... Les 5 infos à connaître ce 26 janvier",Figaro,2021-01-26
L’Australie croise le fer avec Google et Facebook,Figaro,2021-01-26
Le Vietnam se félicite de sa croissance économique malgré la pandémie,Figaro,2021-01-26
"Apple redevient la marque la plus valorisée au monde, WeChat sacrée marque la plus forte",Figaro,2021-01-26
Les Impatientes de Djaïli Amadou Amal: découvrez l’avis du Club de lecture du Figaro,Figaro,2021-01-26
L'Union Européenne souhaite fêter la fin de la pandémie avec une série de concerts,Figaro,2021-01-26
Pharma: Novartis enregistre un bénéfice net en hausse de 13% en 2020,Figaro,2021-01-26
Entreprises : le Haut Conseil à l'égalité veut 40% de femmes dans les comités exécutifs et de direction,Figaro,2021-01-26
"UBS: bénéfice net 2020 en hausse de 54% à 6,6 milliards de dollars",Figaro,2021-01-26
Êtes-vous favorable à l’instauration de la proportionnelle aux prochaines élections législatives ?,Figaro,2021-01-26
"Covid-19 : 2e nuit d'émeutes aux Pays-Bas, Joe Biden entrevoit l'immunité collective",Figaro,2021-01-26
Covid-19 : la Nouvelle-Zélande devrait fermer les frontières pendant une grande partie de 2021,Figaro,2021-01-26
La lettre du Figaro du 26 janvier 2021,Figaro,2021-01-26
Connaissez-vous le «vaxxie»? ,Figaro,2021-01-26
Un artiste israélien peint à l'infini «la figure tragique» de Donald Trump,Figaro,2021-01-26
Sept raisons de découvrir Cadix et le sud de la Costa de la Luz,Figaro,2021-01-26
Haute-Savoie : ces hôtels de famille pour se sentir «comme à la maison»,Figaro,2021-01-26
Pourquoi le chômage peut s'avérer financièrement plus intéressant que… le travail,Figaro,2021-01-26
Mooncard mise sur Air France pour accélérer son développement,Figaro,2021-01-26
Ils veulent faire du chômage une expérience constructive,Figaro,2021-01-26
"Chez les Miyazaki, le fils initie le père à l'animation numérique",Figaro,2021-01-26
«Journée de l'invasion» : des Australiens dénoncent leur fête nationale,Figaro,2021-01-26
"Covid-19 : fragilisées, les TPE et PME craignent pour leur survie",Figaro,2021-01-26
Justice des mineurs : une réforme «attendue» arrive au Sénat,Figaro,2021-01-26
Vaccins Covid: des médecins libéraux dénoncent une répartition «aux dépens des soignants»,Figaro,2021-01-26
Le Mexique dépasse la barre des 150.000 morts du Covid-19,Figaro,2021-01-26
La Floride se propose d'accueillir les JO si Tokyo renonce,Figaro,2021-01-26
Arrestation en Colombie d'un ex-chef paramilitaire déporté des États-Unis,Figaro,2021-01-26
Covid-19: enquête sur un ministre brésilien après le chaos en Amazonie,Figaro,2021-01-26
"Corée du Sud: contraction de 1% du PIB en 2020, inédit en plus de 20 ans",Figaro,2021-01-26
"Empêtré dans le scandale Epstein, le milliardaire Leon Black se retire du fonds Apollo",Figaro,2021-01-26
Covid-19: Las Vegas veut rouvrir ses écoles par crainte d'une hausse des suicides,Figaro,2021-01-26
La population du Mexique a augmenté de 14 millions de personnes en dix ans,Figaro,2021-01-26
AstraZeneca défend l'efficacité de son vaccin sur les personnes âgées,Figaro,2021-01-26
Covid-19: un premier cas du variant brésilien recensé aux États-Unis,Figaro,2021-01-26
Royaume-Uni: les supermarchés toujours accros aux emballages plastiques,Figaro,2021-01-26
Le Nicaragua institue la prison à perpétuité contre les féminicides,Figaro,2021-01-26
Impeachment : l'acte d'accusation contre Trump transmis au Sénat,Figaro,2021-01-26
"Mort de la petite Hyana: la mère condamnée à quinze ans, le compagnon à trente ans",Figaro,2021-01-26
Extraire six doses d'un flacon de vaccins Pfizer? Le géant de la seringue prudent,Figaro,2021-01-26
Janet Yellen confirmée pour diriger le Trésor américain,Figaro,2021-01-26
