titre,journal,date
"Génération identitaire : dissoudre, ce n'est pas résoudre",Charlie Hebdo,2021-02-09
Lettre des animaux : le bœuf,Charlie Hebdo,2021-02-09
Formation continue des enseignants : «Le gros paquebot de l’Education nationale commence à bouger»,Libération,2021-02-09
Covid-19 : dans quelles régions les variants circulent-ils le plus ?,Libération,2021-02-09
Frappe de Barkhane : le Parlement timoré face au secret-défense,Libération,2021-02-09
"Prolongation de l’état d’urgence sanitaire, interdiction des certificats de virginité, mort de Jean-Claude Carrière... l’actu de ce mardi matin",Libération,2021-02-09
Faut-il encore fêter la Saint-Valentin ?,Libération,2021-02-09
Des vaccinations VIP à l’hôpital américain de Paris,Libération,2021-02-09
Revenu universel : les partis prennent la mesure,Libération,2021-02-09
Bruno Le Maire fait un CAC nerveux,Libération,2021-02-09
La France a franchi la barre des 80 000 morts du coronavirus,Libération,2021-02-09
"Sida, la prévention en panne",Libération,2021-02-09
La civilisation du canapé,Libération,2021-02-09
"Pour une allocation d’autonomie pour les étudiants, maintenant",Libération,2021-02-09
"De la SF à la fantasy, «l’œuvre aimée appartient de plus en plus à ceux qui la font vivre»",Libération,2021-02-09
Viols sur mineurs : quatre nouvelles plaintes déposées contre le couple Louvin-Moyne,Libération,2021-02-09
"John Carpenter, toujours le plus BO",Libération,2021-02-09
Défendons la maternelle,Libération,2021-02-09
"A droite, LR émancipe ses jeunes",Libération,2021-02-09
Bouffons la vie contre le Covid : les œufs farcis et oignons acidulés de Sébastien Bras,Libération,2021-02-09
LREM en a un peu marre de la Convention ̶d̶u̶ ̶b̶u̶z̶z̶ climat,Libération,2021-02-09
La Terre débarque sur Mars,Libération,2021-02-09
Poissonnière intersectionnelle,Libération,2021-02-09
Impeachment : un second procès et de nombreuses questions,Libération,2021-02-09
Une flopée de procès en diffamation contre les pro-Trump,Libération,2021-02-09
Piscines : pourquoi certains bassins sont ouverts et d’autres non ?,Libération,2021-02-09
Où est la «nouvelle croissance» façon Macron ?,Libération,2021-02-09
Manifestations en Birmanie : «Je n’ai pas peur de mourir»,Libération,2021-02-09
Revenu de base : des départements PS attendent toujours un feu vert,Libération,2021-02-09
Revenu universel : qu’attendons-nous pour l’expérimenter ?,Libération,2021-02-09
"A droite, la bataille du «revenu vital»",Libération,2021-02-09
"Pour Olivier Véran, «il est possible qu’on ne soit jamais reconfinés»",Libération,2021-02-09
Décès à la prison de Meaux : «C’est étrange comment tous ces jeunes font des crises cardiaques»,Libération,2021-02-09
Un décès sur cinq serait dû à la pollution de l’air par les énergies fossiles dans le monde,Libération,2021-02-09
Peut-on se faire vacciner dans un autre département ?,Libération,2021-02-09
Réduction des pesticides : seul 1% des financements publics jugé efficace par la Fondation Nicolas Hulot,Libération,2021-02-09
#SciencesPorcs : les étudiants des IEP dénoncent la «culture du viol»,Libération,2021-02-09
"Sur les origines du virus, l’OMS rend ses conclusions après une enquête sous pression",Libération,2021-02-09
"Dans les écoles, tour de vis face à la menace des variants",Libération,2021-02-09
«La gêne par rapport au bijou pour homme a presque réussi à effacer deux mille ans de flamboyance»,Libération,2021-02-09
Famille au bord de la crise de «Nest»,Libération,2021-02-09
Affaire Mila : cinq personnes en garde à vue pour menaces de mort,Libération,2021-02-09
Traitement contre le Covid : encore une bonne nouvelle pour le Molnupiravir,Libération,2021-02-09
Réforme des IUT : pourquoi tant d’urgence ?,Libération,2021-02-09
La maire de Montauban priée de lâcher son fauteuil sur le champ,Libération,2021-02-09
"Phoebe Bridgers, j’entends plus la guitare",Libération,2021-02-09
"Fabrice Midal, méditator",Libération,2021-02-09
Violences du 1er-Mai : le parquet demande un procès pour Benalla,Libération,2021-02-09
Paulien à la page,Libération,2021-02-09
Projet de loi climat : quatre mesures à la loupe,Libération,2021-02-09
"Affaire Duhamel : le préfet d’Ile-de-France, Marc Guillaume, au courant de «problèmes sexuels»",Libération,2021-02-09
"Sur le tournage de «Je voudrais vous parler de Duras», entre prises et emprise",Libération,2021-02-09
"Black Country, New Road : sortie de classe",Libération,2021-02-09
"Non, le nombre de morts en Espagne n’est pas moins important en 2020 qu’en 2019",Libération,2021-02-09
Renforcement des mesures de quarantaine au Royaume-Uni : le gouvernement attaque au porte-monnaie,Libération,2021-02-09
"Oui, les règles nous coûtent cher",Libération,2021-02-09
Affaire Duhamel : le directeur de Sciences-Po  démissionne,Libération,2021-02-09
Kirill Serebrennikov poussé à la porte de son théâtre,Libération,2021-02-09
"La neige en Bretagne ? A Rostrenen, «on est très adaptables»",Libération,2021-02-09
"Démission du directeur de Sciences-Po,  campagne de témoignages #SciencesPorcs, vague de froid... l’actu de ce mardi",Libération,2021-02-09
Est-il vrai que quatorze pensionnaires d’une maison de retraite en Allemagne ont été infectés par le variant britannique après avoir été vaccinés ?,Libération,2021-02-09
"En Espagne, «aucune femme protégée par le bracelet antirapprochement n’a perdu la vie depuis 2009»",Libération,2021-02-09
"La Colombie régularise 1,7 million de Vénézuéliens",Libération,2021-02-09
Violences conjugales : un bracelet antirapprochement pour «retrouver une vie normale»,Libération,2021-02-09
Les lobbys à l’assaut de la loi climat,Libération,2021-02-09
Le gouvernement veut criminaliser «tout acte de pénétration sexuelle commis par un majeur sur un mineur de moins de 15 ans»,Libération,2021-02-09
Manifestations en Birmanie : «Les prochains jours vont être plus violents»,Libération,2021-02-09
"Schwizgebel et Miailhe, live d’images",Libération,2021-02-09
"Jean-Claude Carrière, «un immense arbre avec beaucoup de feuilles qui ne faisait de l’ombre à personne»",Libération,2021-02-09
"Sept films de mutants, ces variants du grand écran",Le Monde,2021-02-09
Destitution : le Sénat juge le procès de Donald Trump conforme à la Constitution,Le Monde,2021-02-09
Patrick Balkany mis en examen pour « prise illégale d’intérêts » et « abus de biens sociaux »,Le Monde,2021-02-09
Le gouvernement souhaite un « nouveau crime » pour pénaliser toute pénétration sexuelle sur mineur de 15 ans,Le Monde,2021-02-09
"Affaire Olivier Duhamel : Frédéric Mion, le directeur de Sciences Po Paris, démissionne",Le Monde,2021-02-09
"Non, le Conseil d’Etat italien n’a pas interdit le port du masque à l’école",Le Monde,2021-02-09
"Covid-19 : dans les outre-mer, début timide de la campagne de vaccination",Le Monde,2021-02-09
"Un an après la mort de Kobe Bryant, l’enquête conclut que le pilote a violé les règles en volant dans un épais brouillard",Le Monde,2021-02-09
"« L’Enfant du double espoir », sur France 5 : un petit frère « médicament » pour sauver César",Le Monde,2021-02-09
Les majors du pétrole affectées par des pertes historiques en 2020,Le Monde,2021-02-09
Des violences contre des migrants aux Canaries suscitent l’indignation au Maroc,Le Monde,2021-02-09
"« Une planète parfaite », sur France 2 : les saisissants jeux d’équilibre de la nature",Le Monde,2021-02-09
L’état d’urgence sanitaire prolongé jusqu’au 1er juin en France,Le Monde,2021-02-09
Birmanie : la rue résiste encore…,Le Monde,2021-02-09
"Un professeur de Trappes se dit menacé, les autorités locales font part de leur incompréhension",Le Monde,2021-02-09
"« Confinons vite, fort, mais le moins de temps possible » : l’appel du directeur médical de crise de l’AP-HP",Le Monde,2021-02-09
"Au Ghana, l’obésité est devenue un enjeu de santé publique",Le Monde,2021-02-09
PMA pour toutes : « Il ne faut pas croire que la structure familiale est le véritable objet de l’opposition à cette avancée sociétale »,Le Monde,2021-02-09
Défilé Celine à Chambord : la Renaissance sur des airs de rock’n’roll,Le Monde,2021-02-09
RDC : des policiers en exil affirment avoir participé à l’assassinat du militant Floribert Chebeya,Le Monde,2021-02-09
Dialogue rompu et menaces de sanctions entre l’UE et la Russie,Le Monde,2021-02-09
"En Hongrie, la radio indépendante Klubradio privée d’antenne",Le Monde,2021-02-09
"Contrôles aux frontières du Royaume-Uni, confinement plus strict en Grèce : le point sur les restrictions en Europe",Le Monde,2021-02-09
On a testé… l’étonnant prototype de smartphone à écran enroulable d’Oppo,Le Monde,2021-02-09
"La mort de George Shultz, ancien secrétaire d’Etat et artisan de la détente avec l’URSS",Le Monde,2021-02-09
"#sciencesporcs, une nouvelle vague de dénonciations de violences sexuelles, cette fois dans les IEP",Le Monde,2021-02-09
"Dans le Tyrol autrichien et ses stations de ski, un important cluster de variant sud-africain détecté",Le Monde,2021-02-09
Le CESE propose des pistes d’amélioration pour le commerce,Le Monde,2021-02-09
"La galerie Pièce unique, à Paris, un lieu pour une seule œuvre",Le Monde,2021-02-09
"Voyage immobile à Nassau, la pirate des Caraïbes",Le Monde,2021-02-09
"« La question du temps d’écran, c’est le degré zéro de l’analyse »",Le Monde,2021-02-09
"Condamnée à cinq ans d’inéligibilité, la maire de Montauban, Brigitte Barèges, va devoir quitter son poste",Le Monde,2021-02-09
La ville de Perpignan rouvre quatre musées malgré l’interdiction,Le Monde,2021-02-09
"Le parquet demande un procès pour Alexandre Benalla, accusé des « violences volontaires » lors des manifestations du 1er mai 2018",Le Monde,2021-02-09
Un album en duo pour le saxophoniste Archie Shepp et le pianiste Jason Moran,Le Monde,2021-02-09
Aide au développement : « La France investit presque deux fois plus dans des projets agro-industriels que dans des projets d’agroécologie »,Le Monde,2021-02-09
"De la Bretagne au Grand-Est, 31 départements en vigilance orange neige-verglas",Le Monde,2021-02-09
On a testé… l’ordinateur portable à deux écrans d’Asus : futuriste ou excessif ?,Le Monde,2021-02-09
Une accusation de viol contre l’opposant Ousmane Sonko secoue le Sénégal,Le Monde,2021-02-09
Le député LRM Pierre Henriet sanctionné pour « insulte sexiste » à l’Assemblée nationale,Le Monde,2021-02-09
Le palmarès des start-up françaises gagne en consistance,Le Monde,2021-02-09
Participation citoyenne : « Le “flou participatif” persistera tant que le droit ne sera pas plus clair »,Le Monde,2021-02-09
"Le mariage des musées et des marques, une tendance qui s’amplifie depuis trois ans",Le Monde,2021-02-09
Les Etats-Unis cherchent une porte de sortie au bourbier afghan,Le Monde,2021-02-09
La vente des biens culturels résiste à la pandémie,Le Monde,2021-02-09
Veolia-Suez : « Comment l’opération pourrait-elle être autrement que guerrière ? »,Le Monde,2021-02-09
"Sur le marché du travail, des jeunes inquiets et des entreprises frileuses",Le Monde,2021-02-09
L’UE veut tirer les leçons de la confrontation avec la Russie après l’affaire Navalny,Le Monde,2021-02-09
L’« effet cicatrice » ou les carrières abîmées des jeunes diplômés de la « génération Covid »,Le Monde,2021-02-09
Faut-il libérer les brevets des vaccins pour en produire plus contre le Covid-19 ?,Le Monde,2021-02-09
"Jean-Claude Carrière, en 2015 : « Comment peut-on tuer au nom d’une croyance ? »",Le Monde,2021-02-09
Covid-19 : la piste fragile d’un traitement par le Prozac,Le Monde,2021-02-09
110 organisations interpellent Emmanuel Macron sur la loi climat,Le Monde,2021-02-09
Ambiance de fin de règne autour de la Mercedes Classe S,Le Monde,2021-02-09
"En Allemagne, la course à l’après-Merkel reste incertaine",Le Monde,2021-02-09
"Dans l’Himalaya, une crue éclair meurtrière",Le Monde,2021-02-09
« Nous sommes dans une phase très délicate politiquement » : la bataille de la ratification du plan de relance européen,Le Monde,2021-02-09
Un décès sur cinq dans le monde serait lié à la pollution de l’air,Le Monde,2021-02-09
La junte militaire durcit le ton contre les manifestants en Birmanie,Le Monde,2021-02-09
La sonde émiratie Al-Amal se place en orbite autour de Mars,Le Monde,2021-02-09
"La Bavière, tremplin politique pour Markus Söder",Le Monde,2021-02-09
Covid-19 : les radios apportent leurs bonnes ondes à la jeunesse en détresse,Le Monde,2021-02-09
"Au Royaume-Uni, premiers doutes concernant le vaccin AstraZeneca",Le Monde,2021-02-09
"Jeux vidéo : CD Projekt Red, l’éditeur de « Cyberpunk 2077 », piraté",Le Monde,2021-02-09
Annuler la dette des pays de l’Union européenne : un débat théorique,Le Monde,2021-02-09
L’avenir du régime de garantie des salariés inquiète les partenaires sociaux,Le Monde,2021-02-09
Algérie : le gouvernement réclame « la reconnaissance des crimes coloniaux » de la France,Le Monde,2021-02-09
Crise politique en Somalie : le Conseil de sécurité de l’ONU se réunit à huis clos,Le Monde,2021-02-09
Premier rendez-vous manqué pour le « Beauvau » de la sécurité,Le Monde,2021-02-09
Des mesures exceptionnelles pour accompagner le report des élections régionales en juin,Le Monde,2021-02-09
L’Opéra de Paris veut œuvrer pour la diversité,Le Monde,2021-02-09
Coffret DVD : vingt courts-métrages audacieux sortis du laboratoire clermontois,Le Monde,2021-02-09
"Pour les jeunes, des discriminations à l’emploi décuplées en temps de crise",Le Monde,2021-02-09
Il faut « donner une valeur aux impacts écologiques et sociaux de l’entreprise »,Le Monde,2021-02-09
"Cadeaux, rendez-vous et propositions d’amendement : vingt-cinq mesures pour mieux contrôler les lobbys à l’Assemblée nationale",Le Monde,2021-02-09
"Pour les futurs cuisiniers, un apprentissage entravé par la crise liée au Covid-19",Le Monde,2021-02-09
Horlogerie : la valse à mille temps des débutants,Le Monde,2021-02-09
Top chrono pour l’horlogerie,Le Monde,2021-02-09
Epargne solidaire : une année 2020 record,Le Monde,2021-02-09
"DVD : « Jardins de pierre » et « Peggy Sue s’est mariée », le versant intimiste de Francis Ford Coppola",Le Monde,2021-02-09
Juliette Méadel : « Un pouvoir confiant dans ses décisions ne doit craindre ni la contradiction ni le jeu normal des contre-pouvoirs »,Le Monde,2021-02-09
Cédric Villani : « Ne laissons pas l’instruction en famille servir de bouc émissaire dans la lutte contre le séparatisme »,Le Monde,2021-02-09
Climat : « Les banques centrales ne doivent plus attendre pour agir »,Le Monde,2021-02-09
« Comment former des élèves performants et enthousiastes ? »,Le Monde,2021-02-09
Un réseau d’eau potable victime d’un piratage informatique en Floride,Le Monde,2021-02-09
"Le scrutin proportionnel, une piste contre la concentration des pouvoirs",Le Monde,2021-02-09
"« Stève le phoque », nageur de combats",Le Monde,2021-02-09
"Baisse du niveau en maths : « La formation des enseignants est au centre des préoccupations, mais son contenu ne fait pas consensus »",Le Monde,2021-02-09
Le chemin de croix du vaccin d’AstraZeneca,Le Monde,2021-02-09
OpenLux : l’insatiable appétit des Français pour les sociétés luxembourgeoises,Le Monde,2021-02-09
"L’entraîneur, l’enfant et les perversions d’un système",Le Monde,2021-02-09
Covid-19 dans les Ehpad : « Le virus semble avoir déboussolé les autorités »,Le Monde,2021-02-09
Epargne de précaution : quelles sont les alternatives qui rapportent plus que le Livret A ?,Le Monde,2021-02-09
"Trop courte, trop hors-sol : les faiblesses de la formation continue des enseignants",Le Monde,2021-02-09
"OpenLux : entre la France et le Luxembourg, une faille fiscale pour l’immobilier de luxe",Le Monde,2021-02-09
"OpenLux : la fin des paradis immatériels pour les footballeurs, les pop stars et les chefs étoilés",Le Monde,2021-02-09
"OpenLux : à quoi sert une « holding » luxembourgeoise, ces « entreprises fantômes » ?",Le Monde,2021-02-09
Destitution de Donald Trump : les deux avocats atypiques de l’ancien président américain,Le Monde,2021-02-09
Hervé Le Bras : « La crainte engendrée par le Covid-19 semble en relation inverse de sa létalité »,Le Monde,2021-02-09
"Après un mois d’enquête à Wuhan, l’OMS n’a pas établi avec certitude l’origine de la pandémie de Covid-19",Le Monde,2021-02-09
"En Birmanie, le parti d’Aung San Suu Kyi dénonce un raid de l’armée contre son siège",Le Monde,2021-02-09
"Pour les élections régionales en Ile-de-France, Julien Bayou rassemble Benoît Hamon et les écologistes centristes",Le Monde,2021-02-09
Un juif autrichien lègue sa fortune au village de Haute-Loire qui l’a sauvé pendant la seconde guerre mondiale,Le Monde,2021-02-09
"Emmanuel Macron et Barbara Pompili, un attelage politique à l’épreuve de la loi « convention climat »",Le Monde,2021-02-09
Des gadgets d’espions du KGB sont vendus aux enchères à Beverly Hills,Le Monde,2021-02-09
"Quatre nouvelles plaintes contre le couple de producteurs Louvin-Moyne, pour viols et agressions sexuelles",Le Monde,2021-02-09
Comment se déroule le second procès en destitution de Donald Trump,Le Monde,2021-02-09
"« La solidarité, l’impensé du quinquennat d’Emmanuel Macron »",Le Monde,2021-02-09
"A Marseille, l’avenue où Ibrahim Ali a été tué par des colleurs d’affiches du FN en 1995 portera son nom",Le Monde,2021-02-09
Vaccins chez Disney et quarantaine à l’hôtel : l’industrie touristique se cherche une utilité,Le Monde,2021-02-09
La Colombie prévoit de régulariser provisoirement un million de migrants vénézuéliens,Le Monde,2021-02-09
Agriculture : les financements publics entretiennent la dépendance aux pesticides,Le Monde,2021-02-09
Cet institut d’esthétique polonais travaille à des prix défiants toute concurrence ! Ten polski instytut estetyczny działa w bezkonkurencyjnych cenach!,Nord Presse,2021-02-09
Twitter dit s'attendre à un ralentissement de la croissance des utilisateurs,Science et Avenir,2021-02-09
"En Floride, une cyberattaque contre l’eau potable",Science et Avenir,2021-02-09
Algues vertes: baisse des échouages en Bretagne en 2020,Science et Avenir,2021-02-09
Une technologie bluetooth de localisation des victimes d'avalanches développée à Grenoble,Science et Avenir,2021-02-09
Twitch avec Jacques-Marie Bardintzeff : tout sur les éruptions volcaniques,Science et Avenir,2021-02-09
Des tombes plurimillénaires découvertes à Stonehenge,Science et Avenir,2021-02-09
Covid-19 : les temps forts de la semaine du 9 février 2021,Science et Avenir,2021-02-09
"Mise en orbite d'Al-Amal, satellites et plomb : l'actu des sciences",Science et Avenir,2021-02-09
"Eau, électricité, transports: les secteurs d'importance ""vitale"" face au risque d'attaques informatiques",Science et Avenir,2021-02-09
"Le corps de Khaled Al-Asaad, l’archéologue martyre de Palmyre, aurait été retrouvé",Science et Avenir,2021-02-09
Perturbations en Allemagne et au Royaume-Uni à cause de la neige,Science et Avenir,2021-02-09
La catastrophe en Inde souligne les pressions environnementales sur les cours d'eau d'Asie,Science et Avenir,2021-02-09
Loi climat: le difficile pari vert de Macron,Science et Avenir,2021-02-09
"Coronavirus : à Wuhan, l'OMS privilégie la piste de l'animal ""intermédiaire"" à l'origine de la transmission",Science et Avenir,2021-02-09
La sonde émiratie Al-Amal a réussi son insertion en orbite,Science et Avenir,2021-02-09
"Climat: en Finlande, une ville polaire candidate aux JO... d'été",Science et Avenir,2021-02-09
Inondations de la Charente: une lente décrue s'amorce,Science et Avenir,2021-02-09
"Le bois, une solution d'avenir pour les satellites ?",Science et Avenir,2021-02-09
TRIBUNE. Il faut au moins cent heures de formation en sciences pour les enseignants du primaire,Science et Avenir,2021-02-09
Coronavirus : le point sur la pandémie,Science et Avenir,2021-02-09
Référendum sur le climat: étape à l'Assemblée nationale le 9 mars,Science et Avenir,2021-02-09
Covid-19: la France franchit la barre des 80.000 morts,Science et Avenir,2021-02-09
"Covid-19: à Avicenne, la ""réa"" s'agrandit pour éviter la submersion",Science et Avenir,2021-02-09
France: Première réunion auto-électronique sur la pénurie de puces,Science et Avenir,2021-02-09
Covid-19: l'Iran lance sa campagne de vaccination,Science et Avenir,2021-02-09
Naufrage du Costa Concordia : les comportements des passagers enfin décryptés,Science et Avenir,2021-02-09
Rupture d'un glacier en Inde : tenter à tout prix de retrouver des survivants dans un tunnel,Science et Avenir,2021-02-09
"Jean-Claude Carrière : ""Toute image scientifique est un miroir""",Science et Avenir,2021-02-09
"""Il faut pouvoir montrer des innovations de classe mondiale""",Science et Avenir,2021-02-09
Covid-19 : l'opinion des experts sur la stratégie du gouvernement,Science et Avenir,2021-02-09
"Il est temps de porter de meilleurs masques, plaident les experts",Science et Avenir,2021-02-09
"L'ambassadeur de l'UE aux USA optimiste sur un accord sur la ""taxe Gafa""",Science et Avenir,2021-02-09
"A Wuhan, l'équipe de l'OMS se cantonne à des hypothèses sur l'origine du coronavirus",Science et Avenir,2021-02-09
"Alerte à la neige de la Bretagne au Grand Est, grand froid dans le nord",Science et Avenir,2021-02-09
"La sonde ""Hope"" se place en orbite autour de Mars, une première arabe",Science et Avenir,2021-02-09
L'île de Pâques lance sa campagne de vaccination,Science et Avenir,2021-02-09
Angelina Jolie : pourquoi s'est-elle rapprochée de Brad Pitt en pleine pandémie ?,Closer,2021-02-09
Armie Hammer au coeur d'une enquête pour meurtre ? La police obligée de donner des explications,Closer,2021-02-09
Kobe Bryant : le pilote de l'hélicoptère n'était pas qualifié pour piloter dans le brouillard,Closer,2021-02-09
Cyril Lignac poste un cliché de son père et il y a un air de famille,Closer,2021-02-09
Hommage à Robert Hossein : Brigitte Macron complice avec Claude Lelouch pour leur dernier adieu,Closer,2021-02-09
La princesse Eugenie est devenue maman pour la première fois,Closer,2021-02-09
Marie Drucker passionnée de yoga : elle dévoile son futur projet,Closer,2021-02-09
"Aux États-Unis, une femme gagne à la loterie deux fois en deux jours",Closer,2021-02-09
"Sœur André, doyenne des Européens, a vaincu le Covid-19 : ""Je n'ai pas su que je l'avais""",Closer,2021-02-09
Charlene de Monaco le crâne rasé : elle opte pour une coupe encore plus courte,Closer,2021-02-09
Lady Di : les suppositions choc d'un ami de la princesse sur la querelle de ses deux fils,Closer,2021-02-09
"Edouard Baer touché par la Covid-19 : ""J'ai failli tuer tout le cinéma français""",Closer,2021-02-09
Meghan Markle : cette petite habitude qu'Archie adore avec la reine,Closer,2021-02-09
"“Vraies victimes”, “faux coupables” : la réaction très forte de Gérard Louvin après les nouvelles plaintes pour violences sexuelles",Closer,2021-02-09
"Au bord des larmes face à Philippe Vandel, Julie Zenatti révèle avoir subie, enfant, une agression sexuelle",Closer,2021-02-09
Meghan Markle et Harry engagés : leur visite surprise durant un cours de poésie fait l'unanimité,Closer,2021-02-09
Le terrible mensonge de Loana à propos de sa fille Mindy,Closer,2021-02-09
Julien Courbet en deuil : son déchirant message après la disparition de son compagnon,Closer,2021-02-09
"Camille Lou bientôt maman ? ""Je suis née pour avoir des enfants""",Closer,2021-02-09
Julien Clerc féministe : ces attitudes envers les femmes qu'il revendique,Closer,2021-02-09
"Les Anges : après la bagarre à la Réunion, le tournage reprend à Saint-Domingue",Closer,2021-02-09
Rebel Wilson métamorphosée : son look totalement inspiré de Meghan Markle ,Closer,2021-02-09
"François Bayrou tente d'éteindre la polémique après ses propos sur la ""classe moyenne""",Closer,2021-02-09
Frédéric François confiné : comment le chanteur et sa femme ont ravivé la flamme dans leur couple,Closer,2021-02-09
"Syndrome du cœur brisé : avec le Covid-19, les cas se multiplient",Closer,2021-02-09
"Britney Spears sous tutelle depuis 20 ans : un mouvement créé pour la ""libérer""",Closer,2021-02-09
Salaud on t'aime : cette phrase ambigüe que Johnny avait eu envers Sandrine Bonnaire,Closer,2021-02-09
Gérard Louvin et Daniel Moyne accusés de viol : quatre nouvelles plaintes révélées,Closer,2021-02-09
Flavie Flament et Benjamin Castaldi : leurs magnifiques déclarations pour les 17 ans de leur fils Enzo,Closer,2021-02-09
Raphaël : le chanteur se confie sur son confinement et revient sur sa scène de ménage avec Mélanie Thierry,Closer,2021-02-09
Bénabar : ses rares confidences sur “ses moments difficiles”,Closer,2021-02-09
Bénabar : cette chanson qui aurait dû être pour Johnny Hallyday,Closer,2021-02-09
Priyanka Chopra : cette opération de chirurgie esthétique qu'on lui a recommandée pour devenir actrice,Closer,2021-02-09
Jean-Claude Carrière : l'incroyable récit qu'il avait fait de la naissance de sa fille Kiara,Closer,2021-02-09
Bruno Questel effondré : le député craque en évoquant son viol à la télévision,Closer,2021-02-09
Renaud : son ami Bénabar donne de rares nouvelles du chanteur,Closer,2021-02-09
Mort de Jean-Claude Carrière : qui sont les femmes de sa vie ?,Closer,2021-02-09
Le scénariste Jean-Claude Carrière est mort à l'âge de 89 ans,Closer,2021-02-09
