titre,journal,date
"Caillebotte, Degas, Rodin… Le Musée d'art moderne de   Strasbourg remballe son exposition",Figaro,2021-02-10
Soldes: La folie de l’aspirateur Dyson V11 pour la Saint Valentin,Figaro,2021-02-10
Erdogan veut faire de la Turquie une puissance spatiale,Figaro,2021-02-10
Laure Moulin de Thomas Rabino: la résistance discrète,Figaro,2021-02-10
"Les Murs blancs, de Léa et Hugo Domenach et La Familia grande, de Camille Kouchner: familles, je vous (h)aime(s)",Figaro,2021-02-10
Tout peut s’oublier d’Olivier Adam: le cœur en miettes,Figaro,2021-02-10
"Baiser ou faire des films, de Chris Kraus: des ombres sur l’Hudson",Figaro,2021-02-10
Frink et Freud de Pierre Péju et Lionel Richerand: la psychanalyse à l’assaut de l’Amérique ,Figaro,2021-02-10
Rien ne t’efface de Michel Bussi: les âmes errantes ,Figaro,2021-02-10
"Paris Allemand, de Dominique Veillon: les visages du Paris de l’Occupation",Figaro,2021-02-10
"Dans les yeux de Jade, de Patrice Lelorain: une vie de chat face au chaos du monde ",Figaro,2021-02-10
"Fraenkel, un éclair dans la nuit de Gérard Guégan: l’artiste décompositeur",Figaro,2021-02-10
TikTok va échapper à une vente forcée aux États-Unis,Figaro,2021-02-10
«Les procès civils sans audience se généralisent: c’est dangereux pour la justice» ,Figaro,2021-02-10
5000 euros d'amende requis contre Marine Le Pen et Gilbert Collard pour avoir diffusé des photos d'exactions de Daech,Figaro,2021-02-10
25 ans de réclusion pour avoir poignardé un étudiant à mort dans une rue de Montpellier,Figaro,2021-02-10
La sonde chinoise «Tianwen-1» entre en orbite autour de Mars,Figaro,2021-02-10
Uber offre des trajets jusqu'aux centres de vaccination en France,Figaro,2021-02-10
«Aucune puissance ne risquera ses intérêts en Birmanie pour sauver la  démocratisation du pays»,Figaro,2021-02-10
"Bentley Flying Spur, une entorse aux traditions",Figaro,2021-02-10
"Mercedes Classe S, la voiture préférée du boss",Figaro,2021-02-10
"Un séisme de magnitude 7,7 ébranle les îles Loyauté et la Nouvelle-Calédonie",Figaro,2021-02-10
Troisième interpellation pour un mineur de 15 ans soupçonné de 34 cambriolages,Figaro,2021-02-10
AirPods: les écouteurs Apple sont en promo pour les soldes,Figaro,2021-02-10
Vaccins en Europe: le mea culpa d’Ursula von der Leyen devant les eurodéputés,Figaro,2021-02-10
"Covid-19 : plus de 500.000 décès dans l'UE, mais amélioration dans les pays les plus touchés",Figaro,2021-02-10
L'Estonie teste des passeports de vaccination pour le monde entier,Figaro,2021-02-10
"General Motors repasse dans le vert au 4ème trimestre, prévoit une hausse de ses profits en 2021",Figaro,2021-02-10
Seine-Saint-Denis : huit policiers en garde à vue pour «violences» et «détention de stupéfiants»,Figaro,2021-02-10
"Thierry Lentz: «Nous commémorerons Napoléon, il en va de ce que nous sommes!»",Figaro,2021-02-10
Des chercheurs mexicains contestent la vente record d'objets précolombiens chez Christie's Paris,Figaro,2021-02-10
Les médias indépendants polonais en grève contre le gouvernement,Figaro,2021-02-10
Fast and Loose: Will Smith signe pour un thriller réalisé par David Leitch,Figaro,2021-02-10
Arabie : un avion civil en feu après l'attaque d'un aéroport par des Houthis,Figaro,2021-02-10
La BEI va prêter 600 millions d'euros à Valeo,Figaro,2021-02-10
Hongrie : Bruxelles dénonce la suspension d'une radio indépendante,Figaro,2021-02-10
Virus: le livreur Delivery Hero double ses ventes en 2020 mais reste déficitaire,Figaro,2021-02-10
"César 2021: Les Choses qu'on dit, Les Choses qu'on fait, Été 85 et Adieu les cons en pole position",Figaro,2021-02-10
Mali : une vingtaine de Casques bleus blessés dans une attaque contre leur camp,Figaro,2021-02-10
«Un formidable engouement» : le ski de randonnée profite de l'arrêt des remontées mécaniques,Figaro,2021-02-10
Une attaque informatique paralyse une partie de l'hôpital de Dax,Figaro,2021-02-10
Les défaillances d'entreprises ont chuté de 39% en 2020,Figaro,2021-02-10
Monuments et musées se tiennent prêts pour rouvrir «dès qu'une décrue du virus» sera constatée,Figaro,2021-02-10
«Arrêtez de vous plaindre»: un dirigeant de KPMG au Royaume- Uni présente ses excuses aux salariés,Figaro,2021-02-10
L'infectiologue Gilles Pialoux alarmé par la «poussée incroyable» du variant britannique en Île-de-France,Figaro,2021-02-10
"Aperam: bénéfice net en hausse en 2020, tiré par un fort quatrième trimestre",Figaro,2021-02-10
Crimes sexuels sur mineurs : Jadot réclame l'imprescriptibilité,Figaro,2021-02-10
Roselyne Bachelot s'oppose au passeport vaccinal et espère un retour des festivals cet été,Figaro,2021-02-10
Climat : êtes-vous favorable à un référendum pour inscrire la préservation de l’environnement dans la constitution ?,Figaro,2021-02-10
EDF: la réforme Hercule est «nécessaire» pour son PDG,Figaro,2021-02-10
Vestas accélère dans l'éolien en mer après un bond de ses ventes en 2020,Figaro,2021-02-10
La BMPS creuse sa perte en 2020,Figaro,2021-02-10
Pharmacie: Giphar implante une plateforme à Dijon,Figaro,2021-02-10
"Dominique Boutonnat, le président du CNC, en garde à vue, accusé d'agression sexuelle et tentative de viol",Figaro,2021-02-10
Lever de rideau émouvant au procès Trump du Sénat,Figaro,2021-02-10
Masques et appels d'offres : les contradictions de l'État face au «made in France»,Figaro,2021-02-10
Accident de Boeing en Indonésie : les automanettes montraient une «anomalie»,Figaro,2021-02-10
"Téléphone fixe, connexion Internet : Orange sommé d'améliorer la qualité de son réseau cuivre",Figaro,2021-02-10
Forte chute de l'audience télévisée du Super Bowl,Figaro,2021-02-10
Bourse: Natixis grimpe de plus de 7% après l'offre de rachat de BPCE,Figaro,2021-02-10
Allemagne : retour de l'inflation confirmé en janvier,Figaro,2021-02-10
Oscars 2021: le film français Deux dans la pré-sélection du meilleur film étranger,Figaro,2021-02-10
"La Bourse de Paris ouvre en hausse de 0,48% à 5.719,32 points",Figaro,2021-02-10
"ALD (location longue durée): bénéfice net en recul de 9,6% en 2020",Figaro,2021-02-10
France: la production industrielle en léger repli en décembre,Figaro,2021-02-10
Sanofi: approbation américaine pour le traitement d'un cancer de la peau,Figaro,2021-02-10
Ile-de-France: la situation s'améliore sur les routes,Figaro,2021-02-10
La Bourse de Tokyo soutenue par les résultats très solides de Toyota,Figaro,2021-02-10
Proportionnelle : le MoDem dépose une proposition de loi,Figaro,2021-02-10
"Neige, Covid-19, démission du directeur de Sciences Po... Les 5 infos à connaître ce 10 février",Figaro,2021-02-10
"Les élections régionales et départementales se tiendront les 13 et 20 juin, annonce Schiappa",Figaro,2021-02-10
"Maersk a presque sextuplé son bénéfice net en 2020, à 2,9 milliards de dollars",Figaro,2021-02-10
Deux retraités ligotés et cambriolés par des malfaiteurs en Meurthe-et-Moselle,Figaro,2021-02-10
Casino promet à son tour des dons et des réductions pour les étudiants,Figaro,2021-02-10
Heineken va supprimer 8.000 postes à cause du Covid-19,Figaro,2021-02-10
Equipements de protection: acquisition chinoise pour Coverguard,Figaro,2021-02-10
Le Club des cinq: les versions «politiquement correctes» se vendent mal,Figaro,2021-02-10
"Air Liquide: bénéfice et marge en hausse en 2020, aidé les activités de santé",Figaro,2021-02-10
Le gouvernement veut un «nouveau crime» pour pénaliser toute pénétration sexuelle sur mineur de 15 ans,Figaro,2021-02-10
EDF: en quoi consiste le projet Hercule ?,Figaro,2021-02-10
Où dormir à Bordeaux à moins de 150 € la nuit ? Nos 10 adresses préférées,Figaro,2021-02-10
La lettre du Figaro du 10 février 2021,Figaro,2021-02-10
"Nettement dans le rouge en 2020, Equinor fait le ménage dans ses actifs américains",Figaro,2021-02-10
Covid-19 : l'Europe resserre encore la vis face aux variants,Figaro,2021-02-10
"Le Covid-19 plonge Société Générale dans le rouge en 2020, avec une perte de 258 millions d'euros",Figaro,2021-02-10
Amundi: Valérie Baudson deviendra directrice générale en mai,Figaro,2021-02-10
La Corée du Nord a dérobé 300 millions de dollars de cryptomonnaies pour financer des projets interdits,Figaro,2021-02-10
"Le corps de l'archéologue Khaled al-Asaad, assassiné par Daech en 2015, aurait été retrouvé à Palmyre",Figaro,2021-02-10
Il oublie sa flûte à 22.000 dollars dans un métro de Chicago et la retrouve grâce à des sans-abris,Figaro,2021-02-10
Seul un fou de la langue française aura un 10/10 à ce test sur les adjectifs ,Figaro,2021-02-10
Le Covid oblige les entreprises à innover pour s'adapter,Figaro,2021-02-10
"Dans un hôtel de Bruxelles, un dîner de Saint-Valentin garanti sans Covid",Figaro,2021-02-10
Les Bourses chinoises orientées à la hausse,Figaro,2021-02-10
Chine: l'épidémie plombe les prix à la consommation en janvier,Figaro,2021-02-10
La Bourse de Tokyo reprend son souffle,Figaro,2021-02-10
"Elle se coiffe avec de la colle extra forte, Internet lui vient en aide",Figaro,2021-02-10
Le groupe américain de pétrole et gaz naturel Chesapeake Energy sort de faillite,Figaro,2021-02-10
Hyundai dévoile une version robot de son véhicule qui roule et qui rampe,Figaro,2021-02-10
Des entreprises brésiliennes s'unissent pour accélérer la vaccination,Figaro,2021-02-10
Télétravail : les Français sont-ils de si mauvais élèves ?,Figaro,2021-02-10
"Technologie : au ton de votre voix, Spotify va identifier la playlist qu'il vous faut",Figaro,2021-02-10
Toyota relève nettement ses prévisions 2020/21,Figaro,2021-02-10
EDF: la mobilisation contre Hercule fait étape devant l'Assemblée nationale,Figaro,2021-02-10
"The Nest, La Mission, Palm Springs... Les films en ligne à voir, ou pas, cette semaine",Figaro,2021-02-10
Cinquième jour de manifestations en Birmanie,Figaro,2021-02-10
"En Allemagne, bronca des agriculteurs contre une loi protégeant des insectes",Figaro,2021-02-10
Twitter se porte très bien sans Trump,Figaro,2021-02-10
Costa Rica: vingt touristes français testés positifs au Covid-19,Figaro,2021-02-10
Covid-19: plus d'un million de Chiliens vaccinés en six jours,Figaro,2021-02-10
"Syrie: dix ans après le début de la guerre, l'Onu toujours paralysée",Figaro,2021-02-10
Nanterre : un étudiant qui a accusé un élu parisien de viol retrouvé mort,Figaro,2021-02-10
