titre,journal,date
"La Bourse de Paris ouvre en léger repli de 0,14%",Figaro,2021-02-18
Chargeurs: résultats record en 2020 portés par la nouvelle division Santé,Figaro,2021-02-18
EDF s'inquiète de son risque de déclassement,Figaro,2021-02-18
SoLocal (ex-PagesJaunes) est parvenu à diviser son endettement par deux en 2020,Figaro,2021-02-18
Géorgie : le premier ministre démissionne après l'ordre d'arrêter un opposant,Figaro,2021-02-18
La Bourse de Tokyo finit de nouveau en petit repli,Figaro,2021-02-18
"Air France-KLM, Covid-19, Nasa... Les 5 infos à connaître ce 18 février",Figaro,2021-02-18
"Pétrole: Repsol enregistre une perte nette de près de 3,3 milliards d'euros en 2020",Figaro,2021-02-18
Atos promet un retour à une croissance soutenue,Figaro,2021-02-18
Barclays annonce une chute de 38% de son bénéfice net en 2020,Figaro,2021-02-18
Automobile: Daimler (Mercedes-Benz) prévoit une hausse «significative» des ventes en 2021,Figaro,2021-02-18
Le bénéfice net de Bouygues chute de plus de 40% en 2020,Figaro,2021-02-18
"Carrefour accélère, porté par son plan de transformation et la crise du Covid-19",Figaro,2021-02-18
Nestlé voit son bénéfice net en baisse de 3% en 2020,Figaro,2021-02-18
"Orange lance Totem, une société destinée à la gestion de ses pylônes",Figaro,2021-02-18
Automobile: l'équipementier Plastic Omnium limite le recul de son chiffre d'affaires en 2020,Figaro,2021-02-18
"Destination le Pays des Écrins, pour profiter au mieux de la montagne sans remontées mécaniques",Figaro,2021-02-18
"Avec des pertes records, Air France KLM fait le forcing pour renforcer ses fonds propres",Figaro,2021-02-18
Credit Suisse voit son bénéfice net en baisse de 22% en 2020,Figaro,2021-02-18
"Après une année noire, Airbus s'organise pour bien rebondir",Figaro,2021-02-18
"Covid-19 : statu quo après le Conseil de défense sanitaire, l'ONU veut un plan mondial de vaccination",Figaro,2021-02-18
La lettre du Figaro du 18 février 2021,Figaro,2021-02-18
BioNTech s'engage à fournir son vaccin à Taïwan,Figaro,2021-02-18
Dix mots qui nous viennent du «loup» ,Figaro,2021-02-18
"Le Maximilian Hotel à Prague, l'avis d'expert du Figaro ",Figaro,2021-02-18
Velib' va devenir plus cher pour les villes et pour certains usagers,Figaro,2021-02-18
«J'ai compris que j'étais concernée par le Covid long»,Figaro,2021-02-18
Des hackers ciblent des sites gouvernementaux en Birmanie,Figaro,2021-02-18
Européens et Américains discutent du sauvetage de l'accord nucléaire iranien,Figaro,2021-02-18
Polynésie: un marin chute d'un cargo et survit 16 heures dans l'océan Pacifique,Figaro,2021-02-18
Violences sexuelles sur mineurs: étape à l'Assemblée pour un renforcement de la loi,Figaro,2021-02-18
Internet: l'intelligence artificielle donne des couleurs à Baidu au 4T,Figaro,2021-02-18
"Mort de Rush Limbaugh, provocateur et précurseur de Trump",Figaro,2021-02-18
Arrestation du chauffard accusé d'avoir tué le père de Nicki Minaj,Figaro,2021-02-18
La Colombie recherche parmi 400 corps des personnes disparues dans le conflit armé,Figaro,2021-02-18
Le Sénégal a reçu ses premiers vaccins anti-Covid de Chine,Figaro,2021-02-18
Biden renouvelle l'alliance du «Quad» malgré la pression de Pékin,Figaro,2021-02-18
Un tiers des militaires américains ne souhaitent pas se faire vacciner,Figaro,2021-02-18
