titre,journal,date
"À Stockholm, le vélo par tous les temps",Figaro,2021-02-09
La croissance russe est «insuffisante» pour rattraper les économies avancées selon le FMI,Figaro,2021-02-09
"Popularisé par l'affaire GameStop, le forum Reddit est valorisé six milliards de dollars",Figaro,2021-02-09
"Louis Jouvet, tout un style",Figaro,2021-02-09
"«Non, les enfants n’appartiennent pas d’abord à la République»",Figaro,2021-02-09
Réouverture des musées à Perpignan: le tribunal administratif statuera le 15 février,Figaro,2021-02-09
"Contre les variants du coronavirus, le Royaume-Uni impose un tour de vis à ses frontières",Figaro,2021-02-09
"Masques, gestes barrières: quelle nouvelle civilité après un an de Covid? ",Figaro,2021-02-09
"En 2020, le moral des ménages a évolué au rythme des confinements",Figaro,2021-02-09
Vélo: comment s’équiper à la suédoise?,Figaro,2021-02-09
200.000 personnes concernées par un bug informatique de Pôle emploi,Figaro,2021-02-09
"Pour Dave Grohl, l'attaque du Capitole est «la chose la plus folle» qu'il a jamais vue",Figaro,2021-02-09
"Les salariés partent à la retraite à 62,8 ans en moyenne",Figaro,2021-02-09
"Rejoints par des militants écolos, des ouvriers de Grandpuits contestent la reconversion de la raffinerie Total",Figaro,2021-02-09
"Le bitcoin dépasse pour la première fois les 45.000 dollars, porté par Tesla",Figaro,2021-02-09
Inondations : l'état de catastrophe naturelle décrété «d'ici vendredi» assure Darmanin,Figaro,2021-02-09
Bien acheter ses montres aux enchères,Figaro,2021-02-09
"UniCredit: Andrea Orcel, le Cristiano Ronaldo des banquiers",Figaro,2021-02-09
Russie : Josep Borrell va proposer aux dirigeants de l'UE des sanctions contre le Kremlin,Figaro,2021-02-09
Haute-Loire : manifestation d'agriculteurs pour une meilleure rémunération,Figaro,2021-02-09
Pyrénées-Orientales : l'un des deux loups en fuite d'un parc animalier retrouvé mort,Figaro,2021-02-09
Wall Street ouvre en légère baisse,Figaro,2021-02-09
"«Instants classiques» N°39: Verdi, une leçon de théâtre",Figaro,2021-02-09
"Avec Luminar AI, la retouche photo n’a jamais été aussi simple",Figaro,2021-02-09
Covid-19 : les questions posées par la situation «totalement hors de contrôle» à Mayotte,Figaro,2021-02-09
Maison d'un octogénaire squattée : groupes de soutien et tensions à Toulouse,Figaro,2021-02-09
Marine Le Pen et Gilbert Collard jugés ce mercredi pour avoir tweeté des photos d'exactions de Daech,Figaro,2021-02-09
Le maire de Trappes annonce vouloir attaquer le professeur Didier Lemaire en «diffamation»,Figaro,2021-02-09
Le metteur en scène Kirill Serebrennikov poussé au départ de son théâtre,Figaro,2021-02-09
"La maire LR de Montauban, condamnée à 5 ans d'inéligibilité, doit quitter son poste",Figaro,2021-02-09
"Jean-Claude Carrière, l'éternel complice de Luis Buñuel",Figaro,2021-02-09
Affaire Benalla : le parquet demande un procès pour les violences du 1er mai 2018,Figaro,2021-02-09
L'ONU condamne l'usage de la force contre les manifestants en Birmanie,Figaro,2021-02-09
La République doit-elle rendre un hommage officiel à Napoléon ?,Figaro,2021-02-09
Les créateurs du jeu Cyberpunk 2077 victimes d'une cyberattaque,Figaro,2021-02-09
Trois doigts levés vers le ciel : comment le film Hunger Games inspire la contestation en Birmanie,Figaro,2021-02-09
Inondations sur la Charente : une lente décrue s'amorce,Figaro,2021-02-09
Des salariés d'Euronews se mettent en grève pour 24 heures.,Figaro,2021-02-09
Vaccins : le PCF demande à Emmanuel Macron de «saisir l'OMS»,Figaro,2021-02-09
Covid-19 : les fâcheuses polémiques du piston à la vaccination,Figaro,2021-02-09
"En Grèce, le mouvement #MeToo secoue le milieu artistique",Figaro,2021-02-09
Irak : cinq Irakiens condamnés pour «terrorisme» ont été exécutés,Figaro,2021-02-09
Nouvel an chinois: les menus à se faire livrer pour le fêter à Paris,Figaro,2021-02-09
OPA de Veolia sur Suez : l'État promet aux syndicats qu'il «jouera son rôle»,Figaro,2021-02-09
"Les nominations aux César, dernière chance pour les films sortis en 2020",Figaro,2021-02-09
"En voiture pour l'Eurovision 2021, Barbara Pravi dévoile son clip de Voilà ",Figaro,2021-02-09
British Airways veut assurer des vols grâce à du carburant «propre» dès 2022,Figaro,2021-02-09
«Il ne faut pas opposer religion et liberté»,Figaro,2021-02-09
«Je veux emmener ma fille voir un psy mais son père refuse»,Figaro,2021-02-09
Nigeria : l'un des responsables du rapt de centaines de garçons en décembre se rend aux autorités,Figaro,2021-02-09
"Nicolas Aguzin, de JP Morgan, nommé à la tête de la Bourse de Hong Kong",Figaro,2021-02-09
"Julia Bijaoui, business model",Figaro,2021-02-09
CEDH : La Turquie condamnée pour défaillance de protection d'un mineur exploité sexuellement,Figaro,2021-02-09
"Le gouvernement russe vise des revenus réels en hausse de 2,5% par an",Figaro,2021-02-09
"«La mère peut commencer à faire son deuil» : le père d'Andréa écope de 9 ans de prison, 23 ans après l'avoir tuée",Figaro,2021-02-09
L'Égypte ouvre sa frontière avec Gaza pour une durée indéterminée,Figaro,2021-02-09
"Cette vie d’agriculteur, quelle vacherie sur Canal +!",Figaro,2021-02-09
Jean-Claude Carrière ou le charme insolent du Cyrano des scénaristes,Figaro,2021-02-09
"«Il était le savoir vivant», déluge d'éloges pour le regretté Jean-Claude Carrière",Figaro,2021-02-09
Covid-19 : la protection induite par les anticorps peut-elle vraiment disparaître en quelques semaines ?,Figaro,2021-02-09
"Le dollar faiblit, la livre au plus haut depuis près de trois ans",Figaro,2021-02-09
"Un ouvrier, coincé sur un chantier à Marseille, secouru après 20 heures d'intervention",Figaro,2021-02-09
Next 40 et French Tech 120 : la liste complète des entreprises,Figaro,2021-02-09
«Insulte sexiste» dans l'hémicycle : un député LREM sanctionné,Figaro,2021-02-09
Le producteur d'engrais Yara veut prendre le tournant de l'hydrogène,Figaro,2021-02-09
Les Tuileries se refont une beauté avec une allée d'ormes comme avant la Révolution,Figaro,2021-02-09
"Italie: chute de la production industrielle de 11,4% en 2020 sous l'effet du virus",Figaro,2021-02-09
Paris : des policiers découvrent un mystérieux butin dans une fonderie clandestine,Figaro,2021-02-09
Japan Tobacco va fermer deux usines au Japon et prévoit des résultats inférieurs en 2021,Figaro,2021-02-09
Mozambique: le PDG de Total estime que le projet gazier est «sur les rails»,Figaro,2021-02-09
La ville de Marseille peut-elle vendre le Vélodrome?,Figaro,2021-02-09
"La chanteuse Mary Wilson, fondatrice de The Supremes, est morte à 76 ans",Figaro,2021-02-09
"Le géant des jeux vidéo EA acquiert le studio Glu Mobile pour 2,1 milliards de dollars",Figaro,2021-02-09
Menaces de mort contre Mila : cinq personnes en garde à vue,Figaro,2021-02-09
"Recul des libertés, fonctionnement des institutions : la France est-elle devenue une démocratie «défaillante» ?",Figaro,2021-02-09
"Jean-Claude Carrière, jamais loin du conte",Figaro,2021-02-09
Décès de Jean-Claude Carrière : les grandes dates de sa vie,Figaro,2021-02-09
Un homme retrouve son portefeuille perdu en Antarctique 53 ans après,Figaro,2021-02-09
"Eric Woerth : «Quand on ne rembourse pas une dette, on le paie souvent très cher»",Figaro,2021-02-09
Le voyagiste TUI creuse ses pertes au premier trimestre mais reste confiant pour l'été,Figaro,2021-02-09
"Après une année d'utilisation intensive du numérique, les Français restent méfiants",Figaro,2021-02-09
"Office Depot, en redressement judiciaire, a été victime d'un «fonds vautour», accuse le CSE",Figaro,2021-02-09
"Covid-19 : «Il est possible qu'on ne soit jamais reconfinés», assure Olivier Véran",Figaro,2021-02-09
Cacao: les négociants ivoiriens exigent la fin du monopole des multinationales,Figaro,2021-02-09
"La Bourse de Paris ouvre en hausse de 0,31% à 5.703,53 points",Figaro,2021-02-09
Swisscom vend ses parts dans Bics au groupe belge Proximus pour 110 millions d'euros,Figaro,2021-02-09
Arnaud Benedetti: «Peut-on communiquer sans infantiliser?»,Figaro,2021-02-09
La pollution de l'air provoquerait près de 100.000 morts prématurées par an en France,Figaro,2021-02-09
Nissan relève plusieurs de ses prévisions 2020/21 après un troisième trimestre en amélioration,Figaro,2021-02-09
Chine: la reprise du marché automobile s'accélère fortement en janvier,Figaro,2021-02-09
"Alerte à la neige, Covid-19, mort de Jean-Claude Carrière... Les 5 infos à connaître ce 9 février",Figaro,2021-02-09
Total se rebaptise TotalEnergies pour mieux s'ancrer dans le renouvelable,Figaro,2021-02-09
Allemagne : baisse de 9% des exportations et de 20% de l'excédent commercial sur l'année 2020,Figaro,2021-02-09
"Avignon : Anaïs, 21 ans, est portée disparue depuis samedi",Figaro,2021-02-09
Bourse de Tokyo: le Nikkei continue à tutoyer les sommets,Figaro,2021-02-09
"Aéroport du Bourget : un avion atterrit «sur le ventre», quatre blessés",Figaro,2021-02-09
Un célèbre alpiniste italien meurt dans une avalanche à Sestrière,Figaro,2021-02-09
"Honda: bénéfice net plus que doublé au troisième trimestre, prévisions 2020/21 relevées",Figaro,2021-02-09
Sarthe : un homme appelle la gendarmerie 115 fois en 1 mois et demi,Figaro,2021-02-09
24 heures photo du 8 février 2021,Figaro,2021-02-09
"Covid-19 : l'animal à l'origine du virus «pas encore identifié», selon l'équipe de l'OMS dépêchée à Wuhan",Figaro,2021-02-09
Covid-19: l'activité en janvier 5% en dessous de son niveau d'avant-crise,Figaro,2021-02-09
Cinq jolies formules pour dire que l’on part en vacances,Figaro,2021-02-09
Covid-19 : trois scénarios pour sauver les festivals de musique cet été,Figaro,2021-02-09
À quoi servent donc les mensonges au bureau?,Figaro,2021-02-09
Angela Gheorghiu donne un concert caritatif pour les musiciens du Metropolitan Opera,Figaro,2021-02-09
"Singapour : de jardins suspendus en quartiers atypiques, nos incontournables dans la cité-État",Figaro,2021-02-09
La lettre du Figaro du 9 février 2021,Figaro,2021-02-09
La Bourse de Tokyo soutenue par l'espoir d'un lancement rapide de la campagne de vaccination au Japon,Figaro,2021-02-09
Les plus réticents au télétravail ne sont pas les patrons mais… les manageurs,Figaro,2021-02-09
Prolongation de l'urgence sanitaire jusqu'au 1er juin : vers un vote tiède du Parlement,Figaro,2021-02-09
La Nouvelle-Zélande suspend les contacts politiques et militaires avec la Birmanie,Figaro,2021-02-09
États-Unis: vote des employés d'Amazon sur une possible syndicalisation,Figaro,2021-02-09
Le patron de Huawei attend une «ouverture» de l'administration Biden,Figaro,2021-02-09
"En Birmanie, la rue se rebelle et brave l'armée",Figaro,2021-02-09
Hongkong: la justice ordonne le maintien en détention provisoire de Jimmy Lai,Figaro,2021-02-09
Pyongyang et Téhéran auraient repris une coopération en matière de missiles,Figaro,2021-02-09
Le courtier en ligne Robinhood poursuivi suite au suicide d'un trader amateur,Figaro,2021-02-09
La marine française a patrouillé en mer de Chine méridionale,Figaro,2021-02-09
Des gadgets d'espions du KGB aux enchères à Beverly Hills,Figaro,2021-02-09
Les députés adoptent l'interdiction des certificats de virginité,Figaro,2021-02-09
Le livreur américain Doordash achète un robot à salades,Figaro,2021-02-09
Floride: un réseau d'eau potable contaminé par... piratage informatique,Figaro,2021-02-09
L'île de Pâques lance sa campagne de vaccination,Figaro,2021-02-09
Contournement est de Rouen: la Métropole se retire du financement,Figaro,2021-02-09
Covid-19: premier décès d'un parlementaire siégeant au Congrès américain,Figaro,2021-02-09
