titre,journal,date
Jeune Liégoise tuée car elle voulait «vivre à l'européenne» : son frère recherché,Figaro,2021-01-07
"Le plaignant britannique coincé en Angleterre, le procès de trois CRS poursuivis pour faux renvoyé",Figaro,2021-01-07
Invasion du Capitole à Washington: la sélection vidéos de Figaro Live,Figaro,2021-01-07
Assurance: le superviseur rappelle les compagnies à l'ordre sur les pratiques commerciales,Figaro,2021-01-07
"La plateforme de jeux Roblox valorisée 29,5 milliards de dollars",Figaro,2021-01-07
Viticulteurs : Bercy planche sur des aides pour compenser les droits de douanes américains,Figaro,2021-01-07
Le musée de Lohéac vend ses Groupe B ,Figaro,2021-01-07
Coronavirus: premiers vaccins pour l'Afrique du Sud dès janvier,Figaro,2021-01-07
EN DIRECT - Covid-19: la fermeture des écoles «envisagée en dernier recours» selon Jean Castex,Figaro,2021-01-07
"Donald Trump, l'épine dans le pied des réseaux sociaux américains",Figaro,2021-01-07
"Fête sauvage en Bretagne: quatre placements en garde à vue, selon le parquet",Figaro,2021-01-07
Des salariés de Michelin débrayent à Clermont-Ferrand,Figaro,2021-01-07
L'assaut du Capitole a généré 430 tweets par seconde en moyenne,Figaro,2021-01-07
"Jorge Carreto et Nathalie Arrari, les soignants de YouTube",Figaro,2021-01-07
Golf: deux mois pour devenir un champion,Figaro,2021-01-07
L'homme qui a attaqué des militaires au Louvre en 2017 renvoyé aux assises,Figaro,2021-01-07
Bourges en lice pour devenir la première «Capitale française de la culture»,Figaro,2021-01-07
Golf: rester au chaud de la tête aux pieds,Figaro,2021-01-07
Qui sont les pro-Trump qui ont pris d'assaut le Congrès américain ?,Figaro,2021-01-07
Seine-et-Marne : un «tagueur fou» de croix gammées interné en psychiatrie,Figaro,2021-01-07
"Six ans après les attentats de janvier 2015, des hommages aux victimes en comité restreint",Figaro,2021-01-07
Bruno Le Maire: «Nous mettrons l'argent nécessaire»,Figaro,2021-01-07
"L'endettement des entreprises, premier risque pour le système financier français",Figaro,2021-01-07
"«L'Homme ne descend pas du singe, il a été créé par Allah» : à l'école, aucun cours n'échappe aux revendications religieuses",Figaro,2021-01-07
Inde : le corps d'un homme présenté à sa banque pour retirer l'argent de sa crémation,Figaro,2021-01-07
Le maire de Marseille veut élargir la vaccination prioritaire aux personnels des écoles,Figaro,2021-01-07
"Le pétrole poursuit sa marche en avant, nouveaux plus hauts depuis fin février",Figaro,2021-01-07
Retard dans les vaccinations: «Il est indispensable de réaffirmer notre souveraineté pharmaceutique»,Figaro,2021-01-07
Logement: l'aide aux sans-abri encore trop centrée sur les solutions d'urgence,Figaro,2021-01-07
Royaume-Uni: 4000 sociétés financières risquent la faillite avec la pandémie,Figaro,2021-01-07
Sénégal: première nuit d'incidents à Dakar à nouveau sous couvre-feu,Figaro,2021-01-07
Chine : un ex-patron de banque condamné à la prison à vie pour corruption,Figaro,2021-01-07
Hérault : le maire de la Grande Motte organise une cérémonie de vœux en drive-in,Figaro,2021-01-07
Grippe aviaire : «hors de contrôle» dans le Sud-Ouest,Figaro,2021-01-07
"Capton, Missonnier, Frémaux... le cinéma français reste optimiste malgré la crise sanitaire",Figaro,2021-01-07
Covid-19 : l'Espagne serre la vis mais exclut un confinement généralisé,Figaro,2021-01-07
FreeWifi : la fin du service emblématique de Free,Figaro,2021-01-07
Confinements : Ryanair supprime des vols et abaisse ses objectifs de trafic,Figaro,2021-01-07
Emmanuel Macron à Jean Castex : «Restez cet homme indifférent aux commentaires et aux sondages»,Figaro,2021-01-07
"Le dollar monte, les cambistes ignorent le chaos au Capitole",Figaro,2021-01-07
Covid-19 : plus de 80.000 ruptures de contrats liées à un PSE envisagées depuis mars,Figaro,2021-01-07
Covid-19 : les hôpitaux britanniques au bord de la crise,Figaro,2021-01-07
"Cardi B, Pink et Stevie Wonder, «consternés» par la prise du Capitole",Figaro,2021-01-07
"Après le Capitole, le Bundestag allemand veut renforcer sa sécurité",Figaro,2021-01-07
"Trump, la foule et le Capitole : que dit la presse américaine des événements du 6 janvier ?",Figaro,2021-01-07
Zone euro : l'inflation négative en décembre pour le cinquième mois consécutif,Figaro,2021-01-07
Irak : mandat d'arrêt contre Trump pour la mort du lieutenant de Soleimani,Figaro,2021-01-07
Marseille : un délégué syndical FO condamné pour avoir voté à la place de 8 agents,Figaro,2021-01-07
"Fête sauvage en Bretagne : plusieurs interpellations, selon le parquet",Figaro,2021-01-07
Lancement d'un «éco-score» pour évaluer l'impact environnemental des produits alimentaires,Figaro,2021-01-07
Donald Trump doit-il se retirer de la vie politique américaine ?,Figaro,2021-01-07
"Ciblée par LREM, Marine Le Pen se désolidarise de Donald Trump et dénonce l'invasion du Capitole",Figaro,2021-01-07
"Environnement : il y a 50 ans, la création du «ministère de l'impossible»",Figaro,2021-01-07
Veolia a envoyé une proposition formelle à Suez pour lui détailler son projet de rachat,Figaro,2021-01-07
Variant du coronavirus : l'Europe doit «faire plus» face à «une situation alarmante»,Figaro,2021-01-07
Allemagne: nouvelle progression des commandes industrielles en novembre,Figaro,2021-01-07
"Richard Berry, Julie Gayet, François Cluzet... 200 personnalités appellent à se faire vacciner contre le Covid-19",Figaro,2021-01-07
"Il harcèle son ex avec plus de 3500 sms et appels, il est interpellé",Figaro,2021-01-07
Bretagne : quatre mois avec sursis pour avoir menacé un sociologue de le décapiter,Figaro,2021-01-07
Rhône : un train percute une voiture à un passage à niveau sans faire de blessés,Figaro,2021-01-07
"Île de Ré : échoués, 29 dauphins ont été secourus",Figaro,2021-01-07
Publicité: les plans de WPP pour se redresser,Figaro,2021-01-07
Covid-19: alliance entre Bayer et CureVac pour développer un vaccin,Figaro,2021-01-07
«Périscope» N° 31: Une fin de règne dans la violence et l'indignité,Figaro,2021-01-07
Too Good To Go lance son rêve américain,Figaro,2021-01-07
Covid-19 : Tokyo et sa grande banlieue en état d'urgence,Figaro,2021-01-07
"La Bourse de Paris monte de 0,36%",Figaro,2021-01-07
La Bourse de Francfort lorgne les 14.000 points,Figaro,2021-01-07
"Coronavirus, ce qu'il faut savoir cette semaine : accélérer la vaccination",Figaro,2021-01-07
Charles Jaigu: «Le grand gâchis de nos neurones»,Figaro,2021-01-07
Syrie : trois combattants pro-Iran tués dans des frappes israéliennes,Figaro,2021-01-07
La Bourse de Londres progresse malgré le chaos au Capitole,Figaro,2021-01-07
IBM recrute l’ex-président de Goldman Sachs,Figaro,2021-01-07
"LafargeHolcim se renforce aux États-Unis avec un rachat à 3,4 milliards de dollars",Figaro,2021-01-07
"Covid-19 : Dupont-Aignan, Asselineau et Philippot réclament une information sur les traitements",Figaro,2021-01-07
Covid-19: les PME françaises ont bien résisté à la crise,Figaro,2021-01-07
Supermarchés: Sainsbury's davantage confiant après un bond des ventes à Noël,Figaro,2021-01-07
Variant du Covid-19 : le professeur Delfraissy invite à «retarder» sa propagation,Figaro,2021-01-07
"Éric Zemmour: «Justice partout, justice nulle part»",Figaro,2021-01-07
Kuehne+Nagel signe un accord avec Moderna pour la distribution de vaccins,Figaro,2021-01-07
"Chaos aux États-Unis, coronavirus, restrictions en France...  Les 5 infos à connaître ce 7 janvier",Figaro,2021-01-07
Quand McKinsey conseille la stratégie vaccinale: comment les cabinets de conseils se sont imposés dans la gestion de l'État,Figaro,2021-01-07
Les grossistes en boissons autour de Lille lancent une opération escargot,Figaro,2021-01-07
Eurotunnel: le trafic 2020 en baisse limitée pour les camions,Figaro,2021-01-07
"Destination Chambéry, un doux parfum d'Italie au cœur de la Savoie",Figaro,2021-01-07
La Bourse de Tokyo applaudit l'avènement des démocrates à Washington,Figaro,2021-01-07
"Du deux-étoiles au palace, dix hôtels pour les familles à Paris",Figaro,2021-01-07
Covid-19 : feu vert pour le vaccin Moderna et reconfinements en Europe,Figaro,2021-01-07
Les expositions d'art moderne et contemporain au programme hypothétique de 2021,Figaro,2021-01-07
États-Unis : la victoire de Joe Biden certifiée par le Congrès,Figaro,2021-01-07
"La Garantie jeunes doit devenir «un droit» pour tous les jeunes précaires, selon un rapport",Figaro,2021-01-07
"Hongkong : Joshua Wong, actuellement en prison, est désormais poursuivi pour «subversion»",Figaro,2021-01-07
"Hongkong : Pompeo exige la libération «immédiate» des opposants arrêtés, menace de sanctions",Figaro,2021-01-07
"Adele, Julien Clerc, Eddy de Pretto... les albums les plus attendus en 2021",Figaro,2021-01-07
La lettre du Figaro du 7 janvier 2021,Figaro,2021-01-07
Prix des services bancaires: les clients appelés plus que jamais à jouer la concurrence,Figaro,2021-01-07
"En Israël, un impressionnant coup de filet chez les pilleurs d'antiquités",Figaro,2021-01-07
Landes : ils font pousser une «forêt nourricière» de 7 hectares,Figaro,2021-01-07
États-Unis : le récit de notre envoyé spécial à l'intérieur du Capitole,Figaro,2021-01-07
Drahi attend le feu vert pour contrôler entièrement Altice Europe,Figaro,2021-01-07
Washington songe à bannir les groupes chinois Alibaba et Tencent de la cote,Figaro,2021-01-07
Covid-19: nouveau record quotidien de décès et de contaminations au Mexique,Figaro,2021-01-07
Les nouveaux cas de Covid-19 au plus haut depuis six mois en Chine,Figaro,2021-01-07
Équateur: les autorités électorales destituées à un mois des élections,Figaro,2021-01-07
L'interdiction d'entrée en Uruguay prorogée jusqu'à la fin janvier,Figaro,2021-01-07
Mike Pence résiste aux appels à démettre Donald Trump,Figaro,2021-01-07
Une personne sur 100.000 a fait un choc allergique au vaccin Pfizer,Figaro,2021-01-07
