titre,journal,date
"Décoloniaux, racialistes, identitaristes : enquête sur les nouveaux fanatiques",La Point,2021-01-13
Assises: des menaces au passage à l'acte d'un marginal privé de son chien,La Point,2021-01-13
Eure-et-Loir : un policier jugé pour « mise en danger de la vie d’autrui »,La Point,2021-01-13
Covid-19 : le couvre-feu à 18 heures bientôt étendu ?,La Point,2021-01-13
Affaire Duhamel: Elisabeth Guigou renonce à sa mission sur l'inceste,La Point,2021-01-13
Jean-Marie Le Pen a été atteint d'une forme atténuée de Covid,La Point,2021-01-13
"« Le Colibri », de Sandro Veronesi, remporte le prix du livre étranger « Le Point »-France Inter",La Point,2021-01-13
New York décide de rompre ses liens avec la Trump Organization,La Point,2021-01-13
Cinq obstacles à la campagne de vaccination contre le Covid-19,La Point,2021-01-13
Affaire Duhamel : Élisabeth Guigou renonce à sa mission sur l’inceste,La Point,2021-01-13
« Le latin ne doit pas être obligatoire »,La Point,2021-01-13
Quand la fièvre identitaire frappe l’université,La Point,2021-01-13
Christian Estrosi veut interdire les locations saisonnières en février,La Point,2021-01-13
Appel de l’Observatoire du décolonialisme et des idéologies identitaires,La Point,2021-01-13
Les autocollants interdits sur les plaques d’immatriculation,La Point,2021-01-13
"Décoloniaux, racialistes, identitaristes : enquête sur les nouveaux fanatiques",La Point,2021-01-13
"Coronavirus : le variant britannique présent dans 50 pays, selon l’OMS",La Point,2021-01-13
"La destitution de Trump, patate chaude pour les élus américains",La Point,2021-01-13
Les nouvelles aventures du manteau de Marcel Proust,La Point,2021-01-13
André Kaspi : « Le projet démocratique ne réunit plus les Américains »,La Point,2021-01-13
Comment l’éolien veut rattraper son retard,La Point,2021-01-13
Le pape François s’est fait vacciner,La Point,2021-01-13
LR regagne des adhérents après plusieurs années de baisse,La Point,2021-01-13
"Scandale des maisons pour mères célibataires en Irlande: ""Excuses"" officielles de l'Etat",La Point,2021-01-13
"Gérard Araud : « L'équipe de Biden, c'est Obama 3 »",La Point,2021-01-13
Une candidate UDI en Normandie invente le... camembert de campagne,La Point,2021-01-13
"Circulation ""moins importante"" du virus dans les départements sous couvre-feu à 18H00, selon Attal",La Point,2021-01-13
Dépistage massif du Covid: les Stéphanois au rendez-vous,La Point,2021-01-13
"Covid: Castex appelle à ne pas ""s'auto-flageller"" et à être ""fier"" de la stratégie française",La Point,2021-01-13
"Confinement, télétravail… Il y a eu moins d’embouteillages en 2020",La Point,2021-01-13
"Logement: les pires ""passoires énergétiques"" interdites de location dès 2023",La Point,2021-01-13
Covid-19 : le couvre-feu à 18 heures bientôt étendu ?,La Point,2021-01-13
"Nancy Pelosi, une dernière fois dans le rôle de première opposante à Donald Trump",La Point,2021-01-13
"La procédure de destitution: une arme rare, sauf contre Trump",La Point,2021-01-13
"A Madrid, un bidonville sans électricité en pleine vague de froid",La Point,2021-01-13
De l'insurrection à la mise en accusation: une semaine où l'Amérique a basculé,La Point,2021-01-13
"R5 électrique, Twizy? Ce que mijote Luca de Meo pour doper Renault",La Point,2021-01-13
"Vaccination: Jacob (LR) se dit ""affolé"" et dénonce un ""fiasco""",La Point,2021-01-13
« Les cas d’échec vaccinal doivent être absolument investigués »,La Point,2021-01-13
Val-d'Oise : le « suprémaciste noir » et son épouse en garde à vue,La Point,2021-01-13
Prof menacée à Aix : comment tout cela a-t-il pu arriver ?,La Point,2021-01-13
"Navalny, l'infatigable opposant anticorruption qui a survécu à son empoisonnement",La Point,2021-01-13
Coronavirus en Russie : Poutine réclame une vaccination massive,La Point,2021-01-13
"Inde: des milliers d'hindous au bord du Gange pour Kumbh Mela, malgré le Covid-19",La Point,2021-01-13
"Étudiante lambda à Paris, star au Sénégal… Qui est vraiment Diary Sow ?",La Point,2021-01-13
Rapatriement de sept enfants français détenus en Syrie,La Point,2021-01-13
Jambon: un rapport parlementaire déclare les nitrites indésirables,La Point,2021-01-13
Avec qui Joe Biden va diriger les États-Unis,La Point,2021-01-13
Netflix et ses 71 films en 2021 : les plateformes à l’assaut,La Point,2021-01-13
Affaire Duhamel : le préfet Guillaume quitte ses fonctions à Sciences Po,La Point,2021-01-13
"Équipe Biden : Janet Yellen, Wall Street cède la place à Yale",La Point,2021-01-13
Covid : la bataille des « vaccinodromes »,La Point,2021-01-13
"Estonie: le Premier ministre démissionne, son parti visé par une enquête pour corruption",La Point,2021-01-13
Succession de Merkel : drôle de fin de règne,La Point,2021-01-13
Serigne Mbaye Thiam sur Diary Sow : « Rien ne présageait une inquiétude »,La Point,2021-01-13
"Après 12 mois dans l’espace, des bouteilles de vin reviennent sur la Terre",La Point,2021-01-13
"Anne Hidalgo annonce un ""changement profond de modèle"" à Paris en 2021",La Point,2021-01-13
Le pied de nez d’Enrico Macias au coronavirus,La Point,2021-01-13
Covid : les désillusions du vaccin chinois,La Point,2021-01-13
"Solidarité au menu entre vignerons, artistes et restaurants lyonnais",La Point,2021-01-13
Cinéma - La garde noire d’Hollywood,La Point,2021-01-13
Un almanach philosophique pour 2021,La Point,2021-01-13
Le prof en liberté #26 – Ce fut une drôle d’année,La Point,2021-01-13
L'opposant Alexeï Navalny rentrera en Russie dimanche,La Point,2021-01-13
« Prise illégale d’intérêts » : le ministre Lecornu visé par une enquête,La Point,2021-01-13
"Présidentielle en Ouganda : Museveni, le pouvoir coûte que coûte",La Point,2021-01-13
"Enquête ouverte pour ""prise illégale d'intérêts"" visant le ministre Sébastien Lecornu",La Point,2021-01-13
Centrafrique : les groupes armés foncent vers Bangui,La Point,2021-01-13
Enquête pour « prise illégale d'intérêts » : Dupond-Moretti est serein,La Point,2021-01-13
"CJR: instruction ouverte pour ""prise illégale d'intérêts"" visant Dupond-Moretti",La Point,2021-01-13
Des soupçons autour de l'emploi parlementaire occupé par Cécilia Attias,La Point,2021-01-13
"« M. Dupond-Moretti est victime et se retrouve accusé, c'est aberrant »",La Point,2021-01-13
Centrafrique: premières attaques rebelles aux environs de Bangui,La Point,2021-01-13
"Diary Sow, une inquiétude sénégalaise",La Point,2021-01-13
Les choix culture du « Point » : voter Coluche ou chasser les ovnis,La Point,2021-01-13
Affaire Duhamel: le préfet Marc Guillaume démissionne de ses fonctions à Sciences Po,La Point,2021-01-13
Affaire Duhamel : le préfet Guillaume quitte ses fonctions à Sciences Po,La Point,2021-01-13
"Chine-Europe : un pas en avant, deux pas en arrière",La Point,2021-01-13
"Covid-19: les variants essaiment, le virus menace toujours plus",La Point,2021-01-13
"États-Unis : le gouvernement fédéral exécute une femme, une première en 70 ans",La Point,2021-01-13
"France: léger mieux de l'activité en décembre, pas de progrès attendu en janvier",La Point,2021-01-13
À quoi servent les différents cadrans d’un chronographe ?,La Point,2021-01-13
Covid-19 : les espoirs de Jean-François Delfraissy pour septembre 2021,La Point,2021-01-13
"En Israël, le réseau sanitaire de proximité au coeur de l'ambitieuse campagne de vaccination",La Point,2021-01-13
"Egypte: 50 ans après, le barrage d'Assouan est toujours contesté",La Point,2021-01-13
Le groupe Carrefour aiguise l'appétit du canadien Couche-Tard,La Point,2021-01-13
Italie: début en Calabre du procès de centaines de mafieux,La Point,2021-01-13
"""Métiers de l'ombre"", les fournisseurs des hôtels et restaurants crient à l'aide",La Point,2021-01-13
"Thierry Breton, la tête dans les étoiles",La Point,2021-01-13
Des millionnaires du bitcoin désemparés après avoir perdu leurs mots de passe,La Point,2021-01-13
Neige: 2.000 automobilistes bloqués sur l'A40 cette nuit dans l'Ain,La Point,2021-01-13
Neige dans l’Ain : nuit difficile pour des centaines d’automobilistes,La Point,2021-01-13
"Désertée, quadrillée, calfeutrée: Washington sous haute tension",La Point,2021-01-13
Le dernier coup d'éclat de Trump au Moyen-Orient,La Point,2021-01-13
Corée du Nord: Kim s'engage à renforcer l'arsenal nucléaire du pays,La Point,2021-01-13
"« M. Dupond-Moretti est victime et se retrouve accusé, c’est aberrant »",La Point,2021-01-13
Le Conseil de sécurité de l'ONU au chevet de la Centrafrique,La Point,2021-01-13
Un rapport parlementaire pour en finir avec les nitrites dans le jambon,La Point,2021-01-13
"L'ultime sanction de Trump contre Cuba, un coup dur pour les habitants",La Point,2021-01-13
Accident de Boeing en Indonésie: les enquêteurs espèrent trouver la 2e boîte noire,La Point,2021-01-13
Coignard – Vaccination : les réponses en clair-obscur d’Olivier Véran,La Point,2021-01-13
États-Unis : au tour de YouTube de suspendre la page de Donald Trump,La Point,2021-01-13
Covid : les désillusions du vaccin chinois,La Point,2021-01-13
"L’escalator de la Trump Tower, là où tout a commencé…",La Point,2021-01-13
"R5 électrique, Twizy… Ce que mijote Luca de Meo pour doper Renault",La Point,2021-01-13
« L’administration Biden continuera de soutenir Taïwan »,La Point,2021-01-13
Le groupe Stellantis n’est que le sixième constructeur automobile mondial,La Point,2021-01-13
Le groupe Carrefour aiguise l’appétit du canadien Couche-Tard,La Point,2021-01-13
Kim Jong-un s’engage à renforcer l’arsenal nucléaire de la Corée du Nord,La Point,2021-01-13
Météo : 9 départements en vigilance orange « neige-verglas »,La Point,2021-01-13
"Covid-19 : 4 500 décès en 24 heures aux États-Unis, un record",La Point,2021-01-13
Des millionnaires du bitcoin désemparés après avoir perdu leurs mots de passe,La Point,2021-01-13
Macron charge le gouvernement de faire avancer quatre chantiers prioritaires,La Point,2021-01-13
"Trump mis en accusation, un deuxième ""impeachment"" historique",La Point,2021-01-13
"Covid-19: nouvelles décisions attendues en France, dans une ""course de vitesse"" contre le virus",La Point,2021-01-13
Destitution de Donald Trump : Pence refuse d’invoquer le 25e amendement,La Point,2021-01-13
L'Italie adopte un plan de relance mais le gouvernement risque d'imploser,La Point,2021-01-13
Concilier transitions numérique et écologique: le Sénat adopte un texte transpartisan,La Point,2021-01-13
Céline Dion : la triste nouvelle qui vient de tomber...,Public,2021-01-13
"""Faites attention !"", Jean-Luc Reichmann scotché face à un candidat qui lui parle de son grand-père disparu...",Public,2021-01-13
"Nathalie Marquay, ancienne Miss et compagne de Jean-Pierre Pernaut, s’affiche totalement nue à la télé !",Public,2021-01-13
"""De gros dérapages"" : dans TPMP, Benjamin Castaldi parle drogues et alcool et va très loin dans ses révélations...",Public,2021-01-13
Nabilla en larmes... Rien ne va plus avec son mari Thomas,Public,2021-01-13
Nouvelle polémique pour cette star américaine qui s'est filmée en train de déterrer son chat mort avant de le bouillir !,Public,2021-01-13
Jean-Marie Le Pen atteint par la Covid-19... Et il ne le savait pas !,Public,2021-01-13
À prendre ou à laisser : Cyril Hanouna ému aux larmes... Cette surprise inattendue !,Public,2021-01-13
"""Pour un milliard"", ce que Nabilla a refusé de complètement fou !",Public,2021-01-13
"Cette imitation de Christophe Maé par Yann Barthès en direct dans ""Quotidien"" fait scandale !",Public,2021-01-13
Horoscope du jour (mercredi 13 janvier 2021),Public,2021-01-13
Télé-réalité : Le programme TV de ce mercredi 13 janvier 2021,Public,2021-01-13
Elodie Gossuin dévoile un sein : son gros craquage sur Instagram,Public,2021-01-13
"Luca Argentero : l'acteur de la série ""Doc"" (TF1) en couple avec la jolie Cristina Marino",Public,2021-01-13
Alain Delon et Jean-Paul Belmondo bouleversés : ce drame survenu à la veille de 2021,Public,2021-01-13
Naomi Osaka : la championne de tennis devient ambassadrice Louis Vuitton,Public,2021-01-13
Secret Story 5 : Une ex-candidate vient d'annoncer une très mauvaise nouvelle sur Instagram,Public,2021-01-13
"Omar Sy dans le métro : il fait la promotion de ""Lupin"" et passe incognito !",Public,2021-01-13
"""Avec ton décolleté, je pensais que tu étais open"" : Enora Malagré se confie sur ""ses gros porcs mariés"" qui l'ont dragué dans TPMP",Public,2021-01-13
"Exclu Public : Slimane, Vitaa, Diam’s : leur projet TOTALEMENT fou au Maroc !",Public,2021-01-13
PHOTOS : Ces couples de stars qui s'aiment et durent depuis plus de 10 ans !,Public,2021-01-13
Gucci : Cette star française qui jouera aux cotés de Lady Gaga dans le biopic évènement !,Public,2021-01-13
Vitaa et Slimane : Découvrez le chiffre impressionnant des ventes de leur album Versus !,Public,2021-01-13
"""La tête dans les nichons"" : Karine Le Marchand balance sur sa rencontre avec Hélène Ségara et Marianne James !",Public,2021-01-13
Mujdat Saglam et Feliccia installés à Los Angeles : les images de leur sublime nouvelle villa,Public,2021-01-13
Zapping : Covid-19 : des gorilles testés positifs aux États-Unis,Public,2021-01-13
Belle peau : 3 soins au Kombucha pour renforcer le microbiote cutané,Public,2021-01-13
"""Je suis à découvert"" : François Berléand évoque sa situation financière très compliquée",Public,2021-01-13
Elizabeth II au coeur d'une polémique malgré elle : Ce nouveau scandale sexuel qui touche la famille royale !,Public,2021-01-13
"Rayane Bensetti et Denitsa Ikonomova : ""C'est la guerre"" sur les réseaux sociaux !",Public,2021-01-13
"Elie Semoun censuré à deux reprises par Instagram : L'humoriste puni à cause d'un ""discours haineux"" !",Public,2021-01-13
"Emploi fictif : Nicolas Sarkozy éclaboussé par une affaire impliquant son ex, Cécilia !",Public,2021-01-13
Brigitte Macron s’apprête à faire sa première apparition télé… dans un jeu sur TF1 !,Public,2021-01-13
Une ancienne Miss France violemment percutée par une voiture : détails du terrible accident,Public,2021-01-13
Que va-t-il vous arriver en 2021 ? Découvrez votre thème astral de l’année…,Public,2021-01-13
«C'est dégueulasse » : Ibrahim Maalouf dénonce une campagne de désinformation à son égard,Figaro,2021-01-13
Couche-Tard: un poids-lourd mondial du commerce de proximité,Figaro,2021-01-13
"Marielle de Sarnez, la combattante du centre",Figaro,2021-01-13
"Janet Yellen auditionnée le 19 janvier au Sénat, pour sa confirmation au Trésor",Figaro,2021-01-13
Covid: l'Union africaine obtient 270 millions de vaccins pour le continent,Figaro,2021-01-13
Immense émotion dans le monde politique après le décès de Marielle de Sarnez,Figaro,2021-01-13
"USA : volé lors de l'intrusion au Capitole, le pupitre de Nancy Pelosi fait son retour",Figaro,2021-01-13
Impeachment : Donald Trump mis en accusation une deuxième fois après un vote historique au Congrès,Figaro,2021-01-13
Six défis économiques pour le 46e président des États-Unis,Figaro,2021-01-13
"La députée et ancienne ministre Marielle de Sarnez est morte, annonce François Bayrou",Figaro,2021-01-13
"Etats-unis : modeste amélioration de l'activité économique, situation très contrastée",Figaro,2021-01-13
"Le dollar reprend des forces, l'euro affaibli par l'Italie",Figaro,2021-01-13
La justice rejette un recours du Professeur Perronne contre l'AP-HP,Figaro,2021-01-13
Mali : trois Casques bleus tués par des djihadistes,Figaro,2021-01-13
Jura : six réfugiés afghans transis de froid découverts dans un camion,Figaro,2021-01-13
"Chicago: le maïs poursuit sa course, le blé et le soja reprennent leur souffle",Figaro,2021-01-13
Le pétrole fait une pause après sept séances de hausses,Figaro,2021-01-13
États-Unis : le chef des sénateurs républicains n'exclut pas de voter la destitution de Trump,Figaro,2021-01-13
"Les Américains pourront continuer d'investir dans les groupes chinois Alibaba, Tencent et Baidu",Figaro,2021-01-13
Un trafic d'armes «hors norme» impliquant des militaires démantelé en France,Figaro,2021-01-13
Affaire Duhamel: Louis Schweitzer élu président par intérim de la Fondation nationale des sciences politiques,Figaro,2021-01-13
Covid-19 : record en Espagne avec près de 39.000 nouveaux cas en 24 heures,Figaro,2021-01-13
"«Lettre à mon petit-fils: non, ce n’était pas mieux avant!»",Figaro,2021-01-13
"«Le football, la morale et le marché»",Figaro,2021-01-13
Les critiques pleuvent sur les livraisons de vaccins en Europe,Figaro,2021-01-13
Covid-19: des questions en suspens sur l’efficacité de la formule du vaccin d’AstraZeneca,Figaro,2021-01-13
Loi séparatismes : la Défenseure des droits pointe des «risques d'atteinte aux libertés»,Figaro,2021-01-13
Neige et verglas attendu dans le Nord-Est et les Alpes du Nord mercredi soir et jeudi,Figaro,2021-01-13
Comment les antivaccins gagnent du terrain,Figaro,2021-01-13
Donald Trump fait face à un deuxième «impeachment» historique,Figaro,2021-01-13
«L'État vous a laissé tomber»: l'Irlande s'excuse après le scandale des maisons pour mères célibataires,Figaro,2021-01-13
Covid-19 : l'exécutif souhaite prolonger l'état d'urgence sanitaire jusqu'au 1er juin 2021,Figaro,2021-01-13
Élections régionales: l’écologiste Julien Bayou est déterminé à poursuivre sa campagne en Île-de-France,Figaro,2021-01-13
Covid-19 : reconfinement général au Portugal à partir de vendredi,Figaro,2021-01-13
Macron veut sortir du bourbier du Covid,Figaro,2021-01-13
Le football français démuni face à Canal+,Figaro,2021-01-13
Transformation d'ammoniac: Maxam Tan en liquidation judiciaire,Figaro,2021-01-13
Le déficit budgétaire américain à un niveau record entre octobre et décembre,Figaro,2021-01-13
L’État s’oppose à un rachat de Carrefour par le canadien Couche-Tard,Figaro,2021-01-13
"Covid-19 : 23.852 nouveaux cas en 24 heures, plus de 247.000 personnes vaccinées en France",Figaro,2021-01-13
"Guillaume Tabard: «Attention, un scrutin peut en cacher deux autres»",Figaro,2021-01-13
Christian Estrosi: «La vaccination pour tout le monde le plus vite possible» ,Figaro,2021-01-13
Le «populisme sanitaire» des grands élus exaspère Emmanuel Macron,Figaro,2021-01-13
Puy-de-Dôme : le lycée visé par des menaces ne rouvrira pas avant lundi,Figaro,2021-01-13
Valérie Pécresse: «Nous sommes prêts à aider. Laissez-nous faire!»,Figaro,2021-01-13
Covid-19: couvre-feu à 18 heures... Voici les départements où l'épidémie s'aggrave,Figaro,2021-01-13
Christine Lagarde appelle à réguler le «spéculatif» bitcoin,Figaro,2021-01-13
Ce qu'attendent de Joe Biden les entrepreneurs français installés aux États-Unis,Figaro,2021-01-13
Luc Ferry: «La bureaucratie a bon dos!»,Figaro,2021-01-13
"Rattrapée par le Covid-19, la Chine réplique vite et fort",Figaro,2021-01-13
"Éric Zemmour: «Le cinéma, cette arme idéologique»",Figaro,2021-01-13
Charles Jaigu: «La dette n’est pas une potion magique»,Figaro,2021-01-13
"Selon le dernier indice Big Mac, le dollar est un peu moins fort qu'il y a six mois",Figaro,2021-01-13
Covid-19: le variant anglais devrait dominer en France dans deux à trois mois,Figaro,2021-01-13
La direction de «L’Équipe» justifie les suppressions de postes,Figaro,2021-01-13
Covid-19: le Danemark prolonge ses restrictions face à la hausse du variant anglais,Figaro,2021-01-13
La Cour de cassation ordonne un nouveau procès pour une femme condamnée pour avoir aidé sa famille à partir en Syrie,Figaro,2021-01-13
Le spectre d’un nouveau report des régionales,Figaro,2021-01-13
Covid-19: pourquoi les vaccins limitent à coup sûr la contagiosité,Figaro,2021-01-13
Éric Dupond-Moretti défendu par le bâtonnier de Paris,Figaro,2021-01-13
Confinement scolaire: un rapport alarmant,Figaro,2021-01-13
Bitcoin : il oublie son mot de passe et ne peut obtenir ses 220 millions de dollars,Figaro,2021-01-13
"Finkielkraut, «jeté en pâture», promet «d'attaquer» LCI",Figaro,2021-01-13
Un livreur de drogue ayant tué un cycliste demande sa remise en liberté,Figaro,2021-01-13
Clermont-Ferrand : un enfant de 14 mois meurt en chutant d'un appartement,Figaro,2021-01-13
Covid-19: deux à trois nouveaux vaccins attendus dans les prochains mois,Figaro,2021-01-13
"Hôtellerie : AccorInvest envisage 1900 suppressions d'emplois en Europe, dont près de 770 en France",Figaro,2021-01-13
"Gard : accusé à tort de consultation pornographique en classe, un professeur de collège se fait agresser",Figaro,2021-01-13
Les embouteillages ont chuté de 19% dans le monde en 2020,Figaro,2021-01-13
Darmanin : onze morts chez les policiers et gendarmes en 2020,Figaro,2021-01-13
"Enquête judiciaire pour «prise illégale d'intérêts» : «Je n'ai rien à craindre», estime Dupond-Moretti",Figaro,2021-01-13
Marché de l’art: le nouvel ordre moral des minorités militantes,Figaro,2021-01-13
"Laurent Nuñez: «Avec 170 sabotages perpétrés depuis mars 2020, l’ultragauche monte en  puissance»",Figaro,2021-01-13
Les rêves brisés des Syriaques de Turquie,Figaro,2021-01-13
"Le golf mondial tourne le dos à Donald Trump, un «tricheur notoire»",Figaro,2021-01-13
Transport routier: la digitalisation attire les investissements,Figaro,2021-01-13
Free Now mise sur l'électrique pour ses VTC,Figaro,2021-01-13
La sélection Figaro Live: les vidéos qu'il ne fallait pas rater,Figaro,2021-01-13
"Rues désertes, Capitole verrouillé... Washington sous haute tension",Figaro,2021-01-13
"The Good Lord Bird : Ethan Hawke et l’esclavage, la fureur des sentiments",Figaro,2021-01-13
Nantes: décès d'un lycéen de 15 ans après une fusillade,Figaro,2021-01-13
"Pourquoi l’équipe de France de handball, qui a tout gagné et ne gagne plus, aborde le Mondial sans certitudes",Figaro,2021-01-13
"CES 2021 : Blue, une machine pour fabriquer soi-même ses produits ménagers",Figaro,2021-01-13
"En Ouganda, duel entre le «dictateur merveilleux» et le «président du Ghetto»",Figaro,2021-01-13
Renzi retire son soutien au gouvernement italien,Figaro,2021-01-13
Covid-19 : pourra-t-on choisir son vaccin ?,Figaro,2021-01-13
Accident de car de Puisseguin: le parquet de Libourne relance l'affaire et demande des mises en examen,Figaro,2021-01-13
Joe Biden au chevet d’une Amérique en  récession prête à rebondir,Figaro,2021-01-13
Jeux vidéo : Disney confie sa saga Star Wars à Ubisoft,Figaro,2021-01-13
"En manque de puces électroniques, le site de Wolfsburg de Volkswagen en chômage partiel",Figaro,2021-01-13
L'UE «regrette profondément» l'exécution de Lisa Montgomery aux USA,Figaro,2021-01-13
Six montres qui n’arrondissent pas les angles,Figaro,2021-01-13
Tiktok prend des mesures pour protéger ses plus jeunes utilisateurs,Figaro,2021-01-13
Italie: début en Calabre du procès de centaines de mafieux,Figaro,2021-01-13
Ouïgours: Londres dénonce la «barbarie» de Pékin,Figaro,2021-01-13
"Procès en mai pour un policier ayant conduit, alcoolisé, une voiture de la préfecture d'Eure-et-Loir",Figaro,2021-01-13
Les romans d’avant d’Éric Neuhoff: comme le temps passe,Figaro,2021-01-13
"La baisse de salaires des footballeurs, un sujet (très) sensible",Figaro,2021-01-13
La Bourse de Londres marque une pause,Figaro,2021-01-13
"Wikipédia, bataille en ligne",Figaro,2021-01-13
Affaire Duhamel: Elisabeth Guigou renonce à sa mission sur l'inceste,Figaro,2021-01-13
Châteauroux : un détenu agresse trois surveillants de prison,Figaro,2021-01-13
Bombardier remporte le contrat du RER B,Figaro,2021-01-13
Covid-19 : les pays riches accaparent-ils les vaccins?,Figaro,2021-01-13
Refus de livraisons casher à Strasbourg: l'ambassadeur d'Israël dénonce une «manifestation de haine»,Figaro,2021-01-13
La SNCF lance son plan stratégique à dix ans «Tous SNCF»,Figaro,2021-01-13
Chine: un robot utilisé pour réaliser des tests Covid,Figaro,2021-01-13
"La Bourse de Paris gagne 0,21% à la clôture",Figaro,2021-01-13
Le Secours populaire des Alpes-Maritimes a reçu des dons records après la tempête d'octobre,Figaro,2021-01-13
Christian Jacob : «Pas question de retomber dans la spirale infernale qui a failli nous tuer»,Figaro,2021-01-13
"Auto électrique : le chinois Geely s'allie à Foxconn, le fabricant des iPhones",Figaro,2021-01-13
«L’accord commercial entre l’Union européenne et la Chine profitera d’abord à l’Allemagne»,Figaro,2021-01-13
Orange offre à l’Afrique de l’Ouest son premier câble international,Figaro,2021-01-13
"Poursuite de la grève à l'Équipe, des salariés manifestent",Figaro,2021-01-13
"Naval Group propulse un navire militaire avec une hélice fabriquée par impression 3D, une première mondiale",Figaro,2021-01-13
Agroalimentaire : InVivo est en négociations exclusives pour acquérir 100% de Soufflet,Figaro,2021-01-13
Apple va consacrer 100 millions de dollars à la lutte contre les inégalités raciales,Figaro,2021-01-13
Collection Gurlitt: Berlin a restitué 14 œuvres d'art volées par les nazis,Figaro,2021-01-13
Lancement d'une consultation citoyenne sur le «cannabis récréatif»,Figaro,2021-01-13
"Pour Anderson &amp; Sheppard, Fran Lebowitz est un homme comme les autres",Figaro,2021-01-13
Hervé Mariton: «Pour que la France et le Royaume-Uni deviennent des voisins intimes»,Figaro,2021-01-13
"Haute-Savoie : arrêté pour excès de vitesse, il finit escorté par les gendarmes",Figaro,2021-01-13
"Régionales: candidate UDI en Normandie, Nathalie Goulet invente le camembert de campagne",Figaro,2021-01-13
Rudy Ricciotti choisi pour offrir une nouvelle jeunesse au musée des Tissus de Lyon,Figaro,2021-01-13
