titre,journal,date
Les promesses de l’économie bleue,La Point,2021-02-18
HSBC a choisi son camp : la Chine,La Point,2021-02-18
TF1 retarde la diffusion du 13 heures à cause d’un problème technique,La Point,2021-02-18
Espagne: des dizaines d'arrestations après de nouvelles manifestations,La Point,2021-02-18
"Perte massive pour Air France-KLM après un choc du Covid-19 ""sans précédent""",La Point,2021-02-18
"« En reprenant une vie normale, on a l’impression d’être privilégiés »",La Point,2021-02-18
"Covid-19: pour tenir la ""digue"" sanitaire, l'isolement rallongé",La Point,2021-02-18
Martin Bouygues fait un nouveau pas vers la préparation de sa succession,La Point,2021-02-18
"Covid-19 : Air France-KLM a perdu 7,1 milliards en 2020, un choc « sans précédent »",La Point,2021-02-18
Larry King : bataille familiale autour de l’héritage,La Point,2021-02-18
« Je croyais qu’en déposant une plainte j’allais enfin être protégée »,La Point,2021-02-18
Covid-19 : un épidémiologiste n’entrevoit pas de sortie de crise avant l’été 2022,La Point,2021-02-18
Haïti crie pour la démocratie !,La Point,2021-02-18
Un polytechnicien français pense avoir résolu l'énigme du « Zodiac Killer »,La Point,2021-02-18
"Birmanie: à Rangoun, opération ""voitures en panne"" pour bloquer les militaires",La Point,2021-02-18
Marseille: deuxième jour de garde à vue pour un proche de Gaudin,La Point,2021-02-18
"Ouverture à Alger du procès Gourdel, le Français décapité en 2014",La Point,2021-02-18
A quoi sert un VPN ?,La Point,2021-02-18
"Au Maroc, les militants bien loin du ""moment d'euphorie"" de 2011",La Point,2021-02-18
"Bayrou: l'""islamo-gauchisme"" n'est ""pas le premier problème de l'université""",La Point,2021-02-18
OMC : ces dossiers qui attendent Ngozi Okonjo-Iweala,La Point,2021-02-18
"En horlogerie, le bleu est une couleur chaude",La Point,2021-02-18
Saint-Jean-de-Passy : le parquet réclame le dépaysement de l’affaire à Lille,La Point,2021-02-18
L'essentiel de l'affaire Georges Tron,La Point,2021-02-18
"Les soignants de l'hôpital de Dunkerque assiégés par la ""marée"" du variant anglais",La Point,2021-02-18
"Moto – BMW R18, un parfum d’Amérique",La Point,2021-02-18
Comment les sciences peuvent guider la philosophie politique,La Point,2021-02-18
Connaissez-vous le Take Away Challenge ?,La Point,2021-02-18
David Lisnard : « L'État obèse a généré l'impuissance de l'État »,La Point,2021-02-18
Livres – (Enfin) un prix pour les Goncourt !,La Point,2021-02-18
Livres – Les meilleures ventes de la Fnac,La Point,2021-02-18
JO de Tokyo : la ministre Seiko Hashimoto prend la présidence des Jeux,La Point,2021-02-18
La minute antique – Poséidon est de retour,La Point,2021-02-18
Des Indignés au gouvernement: l'ascension météorique d'Irene Montero,La Point,2021-02-18
"Le vaccin AstraZeneca ""n'est pas un vaccin de seconde zone"", assure Alain Fischer",La Point,2021-02-18
Cybersécurité: Macron présente la stratégie française,La Point,2021-02-18
Airbus dans le rouge en 2020 mais limite les dégâts du Covid-19,La Point,2021-02-18
"Bill Gates : « Le climat, une priorité absolue ! »",La Point,2021-02-18
"Covid-19 : Air France-KLM a perdu 7,1 milliards en 2020, un choc « sans précédent »",La Point,2021-02-18
"David Lisnard : « Macron-Le Pen, quel triste duel ! »",La Point,2021-02-18
"Nicolas Sarkozy, vacciné et agacé par Emmanuel Macron",La Point,2021-02-18
Brexit : les Britanniques globalement insatisfaits de la situation,La Point,2021-02-18
Méthodologie – Comment lire nos tableaux,La Point,2021-02-18
Palmarès - En route vers l’école du futur,La Point,2021-02-18
Bourse : « Il faut jouer les tendances structurelles »,La Point,2021-02-18
Violences sexuelles sur mineurs: étape à l'Assemblée pour un renforcement de la loi,La Point,2021-02-18
De la viande de jeune bovin dans l'assiette des écoliers: l'appel du ministre de l'Agriculture,La Point,2021-02-18
La Russie intercepte trois avions français au-dessus de la mer Noire,La Point,2021-02-18
États-Unis : le Congrès se penche sur la saga GameStop,La Point,2021-02-18
Coronavirus : BioNTech promet de fournir son vaccin à Taïwan,La Point,2021-02-18
Australie : Facebook défie le pays en bloquant les contenus d’actualité,La Point,2021-02-18
"Cotta – Loi séparatisme : Les Républicains, ces Insoumis qui s’ignorent",La Point,2021-02-18
En forme : Valérie Baudson (Amundi),La Point,2021-02-18
Les indiscrets – Quand le PS se prive d’un succès à l’Assemblée,La Point,2021-02-18
Comment Joe Biden bouscule l’Arabie saoudite,La Point,2021-02-18
"Étienne Gernelle – Trappes, la grande intimidation",La Point,2021-02-18
Facebook défie l'Australie en bloquant les contenus d'actualité,La Point,2021-02-18
"Atterrissage réussi pour Perseverance, la quête de vie ancienne sur Mars peut commencer",La Point,2021-02-18
Birmanie : la réponse de hackers face aux coupures d’Internet,La Point,2021-02-18
La météo de ce jeudi 18 février,La Point,2021-02-18
"Le commissariat de Bobigny inondé, les policiers en colère",La Point,2021-02-18
L'Iran au menu du premier échange - tardif - entre Biden et Netanyahu,La Point,2021-02-18
États-Unis : des pirates informatiques nord-coréens inculpés,La Point,2021-02-18
États-Unis : la promotion de femmes générales retardée à cause de Trump,La Point,2021-02-18
PHOTOS - Serge Lama marié en secret cinq ans après le décès de Michèle... retour en images sur leur histoire d’amour !,Public,2021-02-18
"Sophie Davant : sa fille veut prendre son indépendance et ""ne cherche pas à lui ressembler""",Public,2021-02-18
Dadju : cette célèbre chanteuse française à la carrière immense qu’il fait craquer !,Public,2021-02-18
"""Je n’ai jamais été blessé aussi profondément dans ma vie"" : Patrick Fiori gagné par une tristesse immense !",Public,2021-02-18
Maëva Ghennam : cette photo coquine avec Manon scandalise la Toile,Public,2021-02-18
Baptiste Giabiconi entièrement nu sur Instagram... La photo choc !,Public,2021-02-18
"""Mettez la en veilleuse !"" : Isabelle Balkany, trompée par son mari, recadre Cyril Hanouna et Benjamin Castaldi !",Public,2021-02-18
Problème technique sur TF1 : Julian Bugier se moque de Marie-Sophie Lacarrau puis s'excuse sur Twitter,Public,2021-02-18
Hélène Darroze (Top Chef) : Ses propos tenus dans l'émission qui exaspèrent au plus au point les internautes !,Public,2021-02-18
Horoscope du jour (jeudi 18 février 2021),Public,2021-02-18
"Laurent Delahousse rend un hommage très spécial à Diam's... qu'il ""kiffe"" (oui, oui) !",Public,2021-02-18
"Mort Andrzej Zulawski : son fils Vincent, qu'il a eu avec Sophie Marceau, savait ""qu’il allait foncer vers la mort""...",Public,2021-02-18
"« Pas de quéquette à l’air ici », Matt Pokora parle naturisme, cette réponse... inattendue à Sébastien Cauet en plein direct",Public,2021-02-18
Mort de Mouss Diouf : Ce proche qui pousse la veuve du comédien à refaire sa vie avec un autre homme,Public,2021-02-18
Famille royale du Maroc : ce mariage qui vient d'être célébré et qui réjouit tout le monde !,Public,2021-02-18
"Vous voulez des nouvelles de Sully de ""Docteur Quinn, femme médecin""... et bien le voici TOTALEMENT nu !",Public,2021-02-18
Serge Lama fait une révélation fracassante en pleine interview : cela fait près de 18 ans qu'il vit une histoire secrète avec...,Public,2021-02-18
Loana : Son ex Fred Cauvin bientôt père ? Retour sur les hommes de sa vie en photos...,Public,2021-02-18
Caroline Receveur dans le viseur du fisc français… Ça sent mauvais !,Public,2021-02-18
"Après son slam bouleversant qui a fait débat, Tarik de ""The Voice"" publie une nouvelle vidéo qui fait pleurer la Toile…",Public,2021-02-18
"Loana : cette photo de grossesse publiée par son ex, Fred Cauvin, qui va choquer tout le monde !",Public,2021-02-18
"Soldes 2021 : blazer, pull, jean, mules, robes... 15 pièces à moins de 40€ à shopper chez PrettyLittleThing !",Public,2021-02-18
Télé-réalité : Le programme TV de ce jeudi 18 février 2021,Public,2021-02-18
"[INRQ] : Instagram, beauté et confinement, Honeyshay fait son choix (Exclu)",Public,2021-02-18
Zapping : Une voiture folle défonce le mur d’une salle de sport et percute un coureur,Public,2021-02-18
"Fred Cauvin, l'ex de Loana bientôt papa : cette terrible photo de sexe qu'il lui a envoyé pour se venger...",Public,2021-02-18
Photos - Patrick Poivre d’Arvor accusé de viols : qui est sa victime présumée ?,Public,2021-02-18
PHOTOS - Kourtney Kardashian a un nouveau mec ! Retour en images sur tous les hommes de sa vie...,Public,2021-02-18
"Epuisée et dépassée, l'ex Miss France, Elodie Gossuin, lance un ""SOS"" sur Instagram...",Public,2021-02-18
PHOTO : Alizée : ce cliché qui fait le buzz sur Instagram !,Public,2021-02-18
« Jessica Thivenin est moins belle que Thibault » : Yamina atomise (encore) la Marseillaise,Public,2021-02-18
"Pascal Obispo : cette étape très difficile qu'il a dû surmonter et qui l'a fait ""beaucoup souffrir""",Public,2021-02-18
Marie-Sophie Lacarrau en détresse : Le JT de 13 heures de TF1 victime d'un énorme bug !,Public,2021-02-18
« À vomir » : Jazz choque les internautes en postant une photo de Cayden intubé,Public,2021-02-18
Acné : ce masque au charbon se vend toutes les 15 secondes à travers le monde,Public,2021-02-18
Magazine Public – Cette actrice française est folle amoureuse,Public,2021-02-18
Côte d'Ivoire: le premier ministre en France pour raisons de santé,Figaro,2021-02-18
"Géorgie : le premier ministre démissionne, l'opposition veut des élections",Figaro,2021-02-18
Nucléaire : Washington accepte de participer à des pourparlers avec l'Iran,Figaro,2021-02-18
"Entre résilience et exaspération, les Texans font face à une vague de froid historique",Figaro,2021-02-18
Vaccins : Biden promet 4 milliards de dollars pour le programme Covax,Figaro,2021-02-18
Wall Street termine dans le rouge après des indicateurs américains décevants,Figaro,2021-02-18
L'agence S&amp;P abaisse les notes de Total et de Shell,Figaro,2021-02-18
Le pétrole recule un peu après les stocks américains,Figaro,2021-02-18
Le rover de la Nasa Perseverance a atterri sur Mars,Figaro,2021-02-18
L'euro au plus bas depuis onze mois face à la livre,Figaro,2021-02-18
Chicago: le blé repart à la hausse avec le froid américain et la demande européenne,Figaro,2021-02-18
Covid-19 : Macron propose de transférer 3 à 5% des vaccins à l'Afrique,Figaro,2021-02-18
Florence Parly: «Le risque de conflits régionaux est réel en mer de Chine»,Figaro,2021-02-18
"Nucléaire: exsangue, l’Iran accroît la pression sur les États-Unis",Figaro,2021-02-18
Les acteurs de la saga GameStop nient toute tentative de manipulation,Figaro,2021-02-18
"Danone: un conseil d'administration s'est tenu, mais n'a pas évoqué la gouvernance",Figaro,2021-02-18
Le président algérien dissout le Parlement et appelle à des élections anticipées,Figaro,2021-02-18
"Qui vole un oeuf, mange du caviar: un chercheur américain accusé de détourner des esturgeons",Figaro,2021-02-18
"Au Texas, la vie quotidienne bouleversée par la vague de froid",Figaro,2021-02-18
Accord nucléaire iranien: «Fuite en avant»,Figaro,2021-02-18
Covid-19: cette piste surprenante pour expliquer la dangerosité du variant anglais ,Figaro,2021-02-18
Egypte: reprise des vols russes vers le Sinaï en mars après 5 ans d'interruption,Figaro,2021-02-18
Antisémitisme : enquête ouverte après les menaces ayant visé Yaël Braun-Pivet (LREM),Figaro,2021-02-18
Coronavirus: des chercheurs appellent à «un effort mondial» pour développer un vaccin universel,Figaro,2021-02-18
Locations illégales: Paris espère 9 millions d’amendes,Figaro,2021-02-18
"Dissous en France, le Collectif contre l'islamophobie (CCIF) se reconstitue en Belgique",Figaro,2021-02-18
Élections régionales 2021 : Sophie Cluzel nommée cheffe de file de LREM en Provence-Alpes-Côte d'Azur,Figaro,2021-02-18
"Reconnu coupable de «viol», Georges Tron se pourvoit en cassation",Figaro,2021-02-18
"Valeo perd 1,1 milliard d'euros en 2020, chiffre d'affaires en baisse de 16%",Figaro,2021-02-18
Certains antidépresseurs peuvent-ils protéger des formes graves de Covid ?,Figaro,2021-02-18
Ivan Rioufol: «Ces dingueries produites par le conformisme»,Figaro,2021-02-18
Procès Gourdel à Alger : le principal accusé djihadiste condamné à la peine de mort,Figaro,2021-02-18
Vidal et l’islamo-gauchisme: «la réponse du CNRS est plus politique que scientifique»,Figaro,2021-02-18
"Dans le 93, Gérald Darmanin sur le front de l’islam radical",Figaro,2021-02-18
"Centessa Pharmaceuticals, un nouvel ovni dans la santé",Figaro,2021-02-18
"À Lyon, les écologistes imposent le menu unique sans viande dans les cantines scolaires",Figaro,2021-02-18
Le froid sème le chaos aux États-Unis,Figaro,2021-02-18
L’exécutif a rebranché la machine à couacs,Figaro,2021-02-18
"En Afghanistan et au Mali, Américains et Français face aux mêmes dilemmes",Figaro,2021-02-18
Vote par anticipation : le Sénat rejette l'amendement polémique du gouvernement,Figaro,2021-02-18
"Le pigeon ramier, nouveau fléau francilien pour l’agriculture",Figaro,2021-02-18
Le chemin de croix de Barbara Pompili,Figaro,2021-02-18
"Stephen Smith: «Au Sahel, la France ne doit pas s’égarer et se tromper d’ennemi»",Figaro,2021-02-18
Reconfinement: le Conseil scientifique se fracture sur la stratégie à suivre,Figaro,2021-02-18
"Jean-Éric Schoettl: «Armée, frontières, renseignement... L’Union européenne renonce à protéger»",Figaro,2021-02-18
"Stéphane Séjourné: «Le retour en arrière et l’ultra-localisme punitif, c’est non»",Figaro,2021-02-18
Droits TV: la L1 acte un retour à la grille de répartition d'avant Mediapro,Figaro,2021-02-18
"À Lille, une audience pour le maintien d’Aubry à la mairie",Figaro,2021-02-18
Le Medef relance le débat pour faire évoluer le dialogue social,Figaro,2021-02-18
"Jacobelli soutient Vidal: «Oui, l’islamo-gauchisme est présent dans les facs»",Figaro,2021-02-18
Couples: le chômage accroît de moitié les risques de divorce,Figaro,2021-02-18
"Covid: à Wuhan, le virus circulait largement dès le mois de décembre 2019",Figaro,2021-02-18
Le retour des étudiants dans les universités est parfois laborieux,Figaro,2021-02-18
Jeune migrant décédé en foyer : la cour d'appel de Reims confirme le non-lieu du parquet,Figaro,2021-02-18
"Gecina: baisse limitée de l'activité en 2020, recul attendu en 2021",Figaro,2021-02-18
Violences sexuelles sur mineurs : vote unanime par l'Assemblée nationale d'un texte PS,Figaro,2021-02-18
La Banque mondiale accélère sur les vaccins,Figaro,2021-02-18
Carrefour repart à l’offensive,Figaro,2021-02-18
"Charles Trenet: d’Aix à Narbonne, une mémoire difficile à cultiver",Figaro,2021-02-18
Plastic Omnium et Valeo s’attendent à une reprise lente,Figaro,2021-02-18
L’Europe veut commercer plus «vert»,Figaro,2021-02-18
Ces dossiers qui coûtent cher au fisc,Figaro,2021-02-18
"Tarkett: la crise sanitaire a pesé sur 2020, perte nette de 19 millions d'euros",Figaro,2021-02-18
"En Australie, Google signe avec la presse, Facebook la bannit",Figaro,2021-02-18
Cybersécurité : Le Bureau des légendes aide le gouvernement à sensibiliser les Français,Figaro,2021-02-18
GTT: forte croissance en 2020 et carnet de commandes fourni,Figaro,2021-02-18
Affaire Maëlys: la justice a bouclé son enquête,Figaro,2021-02-18
"Risque de saturation des piscines nucléaires: EDF va investir 1,25 milliard d'euros",Figaro,2021-02-18
Covid-19 en France : 271 décès et 184.120 vaccinations en 24 heures,Figaro,2021-02-18
"À 30 ans, ils quittent Paris pour récupérer la ferme familiale",Figaro,2021-02-18
Procès Georges Tron: la perception fluctuante du consentement,Figaro,2021-02-18
"Sonde Perseverance: «Mars, ce rouge objet du désir»",Figaro,2021-02-18
Les Français sont de plus en plus nombreux à vouloir être vaccinés contre le Covid,Figaro,2021-02-18
La sélection Figaro Live: les vidéos qu'il ne fallait pas rater,Figaro,2021-02-18
Les festivals d'été autorisés avec 5000 personnes assises maximum,Figaro,2021-02-18
Covid-19 : la durée de l'isolement des personnes contaminées allongée à 10 jours dès lundi,Figaro,2021-02-18
Géorgie: une crise politique au parfum russe,Figaro,2021-02-18
Mines de charbon: 726 «gueules noires» indemnisées après huit ans de bataille judiciaire,Figaro,2021-02-18
Pharmacie: Eurofins rachète un spécialiste de la découverte de médicaments,Figaro,2021-02-18
Menaces sur le financement de la défense,Figaro,2021-02-18
Universités: «l’islamogauchisme? Une réalité depuis 20 ans» ,Figaro,2021-02-18
Une stratégie zéro Covid est-elle possible en France ?,Figaro,2021-02-18
Que reste-t-il de Charles Trenet?,Figaro,2021-02-18
Miliboo prend en main sa logistique,Figaro,2021-02-18
Le Nigeria sort plus tôt que prévu de récession,Figaro,2021-02-18
La France consacre 471 millions d'euros à ses futurs satellites de communication militaires,Figaro,2021-02-18
Danemark: 4 mois de prison pour avoir toussé sur des policiers en criant «Corona»,Figaro,2021-02-18
"Mayotte: l'État débloque 1,6 million d'euros pour l'aide alimentaire",Figaro,2021-02-18
Orpaillage illégal en Guyane : une commission d'enquête parlementaire pour «connaître la vérité»,Figaro,2021-02-18
"La Bourse de Paris perd 0,65% à la clôture, à 5.728,33 points",Figaro,2021-02-18
Covid-19 : 56% des Français craignent un conflit des générations,Figaro,2021-02-18
L'espérance de vie aux États-Unis a chuté d'un an au premier semestre 2020,Figaro,2021-02-18
Allemagne : la justice contraint Amazon à spécifier l'origine de ses fruits et légumes,Figaro,2021-02-18
"Bon plan: arbre à chat Mano Mano, Cdiscount les meilleures promos  ",Figaro,2021-02-18
"En Inde, la photo de Rihanna, seins nus et Ganesh autour du cou, ne passe pas",Figaro,2021-02-18
Patrick Hourcade plonge dans la nuit de Versailles,Figaro,2021-02-18
USA: forte chute des stocks de pétrole brut,Figaro,2021-02-18
Le patron de BlaBlaCar au conseil d'administration de Renault,Figaro,2021-02-18
"Alexandre Bompard: «L’histoire ne repasse pas les plats, nous avons tourné la page»",Figaro,2021-02-18
La justice suspend la réouverture du musée d'Issoudun,Figaro,2021-02-18
L'hommage de l'Académie Alphonse Allais à Jean-Claude Carrière «son frère grave mais jamais sérieux»,Figaro,2021-02-18
"Ille-et-Vilaine : une mère de famille portée disparue depuis une semaine, les enquêteurs dans le flou",Figaro,2021-02-18
Open d’Australie: Serena Williams face au miroir du temps,Figaro,2021-02-18
Coup d'État en Birmanie: Londres sanctionne trois généraux de la junte,Figaro,2021-02-18
Mahmoud Ahmadinejad au Figaro: «Il faut que Joe Biden déclare explicitement sa politique»,Figaro,2021-02-18
Lutte contre le racisme: cinq pays de l'UE rappelés à l'ordre par Bruxelles,Figaro,2021-02-18
Universités: «Les discours racialistes et identitaires deviennent institutionnels»,Figaro,2021-02-18
Baskets: le phénomène Kith arrive à Paris,Figaro,2021-02-18
Trésors de Roumanie,Figaro,2021-02-18
"Covid 19, diversité du genre... Comment les nouveaux émojis d'Apple reflètent leur époque",Figaro,2021-02-18
Le Covid-19 dope les transactions et le nombre de clients sur CDiscount,Figaro,2021-02-18
Barrick Gold double son bénéfice au quatrième trimestre,Figaro,2021-02-18
Les établissements financiers appelés à la prudence sur les dividendes et bonus,Figaro,2021-02-18
Charles Trenet: le jardin secret d’un enchanteur,Figaro,2021-02-18
La BCE n'exclut pas d'autres baisses de taux,Figaro,2021-02-18
"Morgane Soulier, la vie à pleines dents",Figaro,2021-02-18
États-Unis : les mises en chantier de logements neufs reculent en janvier,Figaro,2021-02-18
Un ex-ministre des Finances sénégalais va diriger une branche de la Banque mondiale,Figaro,2021-02-18
Walmart dope ses ventes au quatrième trimestre et augmente les salaires,Figaro,2021-02-18
États-Unis : le chômage enregistre une nouvelle hausse hebdomadaire,Figaro,2021-02-18
La fortune de Charles Trenet au cœur d’une bataille sans fin,Figaro,2021-02-18
Wall Street chute à l'ouverture après des inscriptions au chômage décevantes,Figaro,2021-02-18
Dieudonné condamné à 9000 euros d'amende en appel pour sa chanson sur la Shoah,Figaro,2021-02-18
"Covid-19, voyages non essentiels: la tension monte autour du caractère disproportionné de l'interdiction belge",Figaro,2021-02-18
Café Kitsuné ouvre son premier atelier de torréfaction à Paris,Figaro,2021-02-18
Pourquoi votre équipement de ski alpin n'est pas adapté au ski de randonnée,Figaro,2021-02-18
"«Plage, mojitos et vaccins» : le marché prometteur du tourisme vaccinal",Figaro,2021-02-18
"Affaire Jubillar : «Je suis triste de voir à quel point les gens peuvent parler sans savoir», déplore la mère de Cédric Jubillar",Figaro,2021-02-18
EuroMillions: jouez en ligne pour remporter 202 millions d’euros ,Figaro,2021-02-18
"Dave Grohl : «Après tout, je ne suis pas une statue»",Figaro,2021-02-18
Yannick Alléno: «Nos convives vont découvrir des sensations dont ils n’ont pas idée»,Figaro,2021-02-18
L'UFC-Que Choisir alerte sur les substances toxiques dans l'encre des tatouages,Figaro,2021-02-18
L'UE veut une réforme de l'OMC et verdir sa politique commerciale,Figaro,2021-02-18
"Avec la crise, les TPE-PME sont devenues des mauvais payeurs",Figaro,2021-02-18
"«Islamo-gauchisme» : Valls répond sèchement à Faure, qui «ne sait pas ce que veut dire» ce terme",Figaro,2021-02-18
Numérique : la France est loin derrière les États-Unis et la Chine,Figaro,2021-02-18
Covid-19 : un variant californien dans le Grand Est,Figaro,2021-02-18
TF1 : la diffusion du JT de 13h victime d'un problème technique et décalée à la dernière minute,Figaro,2021-02-18
Divorce: pourquoi ce sont les femmes qui rompent?,Figaro,2021-02-18
Le débat sur le «minimum jeunesse» tourne court à l'Assemblée,Figaro,2021-02-18
"Le blé repart, toujours un oeil sur la météo hivernale",Figaro,2021-02-18
"Coronavirus, ce qu'il faut savoir cette semaine : le pari du statu quo",Figaro,2021-02-18
Trappes: «Un maire ne devrait pas faire ça!» ,Figaro,2021-02-18
Affaire Yuriy : deux jeunes placés en détention provisoire,Figaro,2021-02-18
Mafia napolitaine : mort du «professeur» Raffaele Cutolo,Figaro,2021-02-18
"Des ONG appellent l'ONU à agir pour la princesse Latifa, «otage» à Dubaï",Figaro,2021-02-18
"Robespierre et Marat, fragile examen de santé sur France 5",Figaro,2021-02-18
Vaccins contre le Covid-19 : la réussite des Britanniques est-elle en trompe-l’œil ?,Figaro,2021-02-18
Riccardo Muti exhorte le gouvernement italien à rouvrir les salles de spectacles,Figaro,2021-02-18
"Mort de la star du cinéma soviétique Andreï Miagkov, héros truculent de L'Ironie du destin ",Figaro,2021-02-18
BCE: le dollar et les taux faibles font baisser le bénéfice en 2020,Figaro,2021-02-18
Affaire Jonathan Coulom : un pédocriminel allemand dénoncé par son codétenu,Figaro,2021-02-18
Êtes-vous inquiet par la montée des thèses islamo-gauchistes à l’université ?,Figaro,2021-02-18
Union européenne : les demandes d'asile ont chuté de 31% en raison de la pandémie,Figaro,2021-02-18
Zubin Mehta hospitalisé à Milan après un malaise lors d'une répétition à la Scala,Figaro,2021-02-18
Les enfants de Tonton David demandent de l'aide pour financer les funérailles de leur père,Figaro,2021-02-18
«Nose» ou la vie rêvée  du parfumeur de Dior en VOD,Figaro,2021-02-18
Le Medef veut ouvrir un dialogue avec les syndicats pour «repenser le rôle des partenaires sociaux»,Figaro,2021-02-18
"Phoebe Philo, Lisa de Blackpink... Le jury de l’Andam fait le buzz sur Twitter",Figaro,2021-02-18
L'euro au plus bas depuis onze mois face à la livre,Figaro,2021-02-18
Loïc Prigent filme les métiers de la mode sur YouTube,Figaro,2021-02-18
"Les visioconférences, c'est la fin des grandes gueules",Figaro,2021-02-18
«Islamo-gauchisme» à l'université : Mélenchon accuse Macron et Vidal de faire «la police des idées»,Figaro,2021-02-18
Comment la crise sanitaire a transformé nos pauses déjeuner,Figaro,2021-02-18
"Honda HR-V Hybride, sobriété et dynamisme",Figaro,2021-02-18
Statkraft: les bénéfices fondent avec la chute du prix de l'électricité,Figaro,2021-02-18
Procès Gourdel à Alger : peine de mort pour le principal accusé,Figaro,2021-02-18
Martin Bouygues désigne son fils comme dauphin,Figaro,2021-02-18
"Energie: Hydrogen Refueling Solutions a levé 97,3 millions d'euros lors de son entrée en Bourse",Figaro,2021-02-18
Les soignants de l'hôpital de Dunkerque assiégés par la «marée» du variant anglais,Figaro,2021-02-18
Covid-19 : qui sont les nouveaux membres du Conseil scientifique ?,Figaro,2021-02-18
Allemagne : opération contre le crime organisé à Berlin,Figaro,2021-02-18
Les «7 minutes de terreur» avant l'atterrissage de la mission Mars 2020,Figaro,2021-02-18
Nord : suicide d'un homme qui s'était retranché armé dans son véhicule,Figaro,2021-02-18
"Séisme de magnitude 5,4 dans le sud-ouest de l'Iran : des dizaines de blessés",Figaro,2021-02-18
"Prix, dangers, préparation... Les vacances dans l'espace, est-ce vraiment pour demain ?",Figaro,2021-02-18
Élus et syndicats appellent à «rouvrir tous les établissements culturels» en même temps,Figaro,2021-02-18
Faurecia va vendre ses activités dans l'acoustique,Figaro,2021-02-18
Vote par anticipation : qu'est-ce qui dérange ?,Figaro,2021-02-18
Bordeaux propose de tester un protocole de réouverture des musées,Figaro,2021-02-18
Minéraux: l'industriel Imerys voit son bénéfice net fondre en 2020,Figaro,2021-02-18
