titre,journal,date
Pourquoi les plus de 50 ans sont si actifs sur WhatsApp (et pourquoi c’est légèrement pénible),Figaro,2021-01-22
Le pétrole bat en retraite devant les nouveaux cas de Covid-19 en Chine,Figaro,2021-01-22
Les céréales poursuivent leur décrue,Figaro,2021-01-22
Les épiciers de quartier pris à la gorge par le couvre-feu à 18 heures,Figaro,2021-01-22
Ethan Zuckerman: «La censure favorisera les réseaux sociaux de droite»,Figaro,2021-01-22
«Hiver solidaire» : l'initiative des paroisses pour aider les sans-abris,Figaro,2021-01-22
Affaire Diary Sow : la réalité pas toujours simple des boursiers d'excellence étrangers en classe préparatoire,Figaro,2021-01-22
"Les saisies de faux billets d'euros au plus bas en 2020, selon la BCE",Figaro,2021-01-22
"Google abandonne Loon, son projet pour connecter par les airs les zones isolées",Figaro,2021-01-22
Suisse : l'initiative «antiburqa» part avec 63% d'avis favorables,Figaro,2021-01-22
"La livre recule, l'économie britannique souffre du confinement",Figaro,2021-01-22
Ouverture d'une enquête sur la mort d'une fillette italienne au «jeu du foulard» sur TikTok,Figaro,2021-01-22
La (triste) vie de Brian (Jones) sur Arte,Figaro,2021-01-22
Calvados : un homme écroué pour l'assassinat du compagnon de son ex,Figaro,2021-01-22
SNCF : un réseau de braqueurs de boutiques de gares démantelé,Figaro,2021-01-22
Joe Biden veut accroître l'aide alimentaire aux Américains frappés par la crise,Figaro,2021-01-22
"Même légué à l'État suisse, le château Rothschild reste privé",Figaro,2021-01-22
Marne : mise en examen d'un père après la mort de son bébé secoué,Figaro,2021-01-22
Losing Alice : une réalisatrice et sa muse au pays des mensonges sur Apple TV +,Figaro,2021-01-22
Royaume-Uni: rechute de l'activité privée en janvier avec le confinement (PMI),Figaro,2021-01-22
Pékin lance un dépistage massif après quelques cas de Covid,Figaro,2021-01-22
Approuvez-vous l’exigence d’un test covid pour les Européens entrant en France ?,Figaro,2021-01-22
Un homme retrouvé mort dans une avalanche en Savoie,Figaro,2021-01-22
Zone euro : la baisse d'activité du secteur privé s'accélère en janvier,Figaro,2021-01-22
Saint-Ouen : une cité va être détruite pour tenter d'éradiquer un trafic de drogue,Figaro,2021-01-22
Covid-19 : un reconfinement est-il urgent ?,Figaro,2021-01-22
L'édition 2021 du festival de Glastonbury annulé à cause la pandémie,Figaro,2021-01-22
Variants du Covid-19: le gouvernement demande désormais une distanciation physique de deux mètres,Figaro,2021-01-22
"Haute-Saône : une trentaine de chiens maltraités sauvés par la SPA, deux frères en garde à vue",Figaro,2021-01-22
Plantu confirme son départ du Monde qui n'a «rien à voir» avec la polémique Gorce,Figaro,2021-01-22
"Marie, chrétienne et esclave, vendue 13 fois par Daech",Figaro,2021-01-22
La Chine lancera en février son marché du carbone,Figaro,2021-01-22
Syrie: quatre civils tués par des missiles tirés par Israël,Figaro,2021-01-22
Assurance: les start-up surfent sur la crise,Figaro,2021-01-22
La Bourse de Londres sur la défensive face aux mesures de restriction,Figaro,2021-01-22
"Bretagne: un bus scolaire se couche dans un fossé, 8 blessés légers",Figaro,2021-01-22
PSG : Neymar va passer le mur du 100 avec un goût d'inachevé,Figaro,2021-01-22
"Le repli de l'activité du secteur privé en France s'accélère en janvier, selon IHS Markit",Figaro,2021-01-22
Trois mineurs tués par un coup de grisou en Sibérie,Figaro,2021-01-22
Vacances de février : les Français appelés à «la prudence» pour les déplacements inter-régions,Figaro,2021-01-22
Covid-19: les CCI d'outre-mer demandent un maintien des dispositifs d'urgence de l'Etat,Figaro,2021-01-22
Patrick Drahi va contrôler 92% du capital d'Altice Europe après son OPA,Figaro,2021-01-22
"Fin de purgatoire pour Toshiba, qui va réintégrer le 1er tableau de la Bourse de Tokyo",Figaro,2021-01-22
Vivendi investit dans l'espagnol PRISA,Figaro,2021-01-22
La Bourse de Francfort rattrapée par la pandémie,Figaro,2021-01-22
"La Bourse de Paris ouvre en baisse de 0,39%",Figaro,2021-01-22
Julien Bayou pense qu'Emmanuel Macron «a un problème avec la démocratie»,Figaro,2021-01-22
"Royaume-Uni: les ventes au détail en hausse, les finances publiques se détériorent",Figaro,2021-01-22
La Russie multiplie les arrestations d'opposants avant des manifestations pour Navalny,Figaro,2021-01-22
"Delphine Ernotte: «Pour soutenir la culture, France Télévisions lance début février une chaîne éphémère»",Figaro,2021-01-22
Iran: un compte Twitter de Khamenei appelle à venger Soleimani et menace Trump,Figaro,2021-01-22
"La Bourse de Tokyo finit en retrait, lestée par des prises de bénéfices",Figaro,2021-01-22
"Spiritueux: Rémy Cointreau voit ses ventes rebondir de 20,6% au 3ème trimestre",Figaro,2021-01-22
"Confinement, bac, tempête Hortense... Les 5 infos à connaître ce 22 janvier",Figaro,2021-01-22
"«Quelque chose clochait, mais impossible de savoir quoi»: l'école démunie face à l'inceste",Figaro,2021-01-22
Régionales : Jean-Michel Blanquer reconnaît qu'il ne se présentera sans doute pas en Île-de-France,Figaro,2021-01-22
Covid-19: le Danemark suspend les vols en provenance des Emirats,Figaro,2021-01-22
Les abus sexuels concernent-ils 20% des enfants?,Figaro,2021-01-22
Virus : plus de 50.000 morts en Allemagne depuis le début de la pandémie,Figaro,2021-01-22
Bientôt un préquel de Charlie et la Chocolaterie avec Tom Holland ou Timothée Chalamet,Figaro,2021-01-22
Mineurs coincés en Chine: au moins encore 15 jours pour les sortir,Figaro,2021-01-22
Covid-19 : un troisième confinement toujours possible en France,Figaro,2021-01-22
«Le gouvernement ne compte pas faire baisser la dette avant 2025… C’est beaucoup trop tard»,Figaro,2021-01-22
"Hollywood, le monde d’après",Figaro,2021-01-22
"Découvrez On a assassiné Napoléon!, la nouvelle inédite de Jean Tulard",Figaro,2021-01-22
L’éditorial du Figaro Magazine: «On ne lutte pas contre l’islamisme avec des périphrases»,Figaro,2021-01-22
"A. Lange &amp; Söhne Saxonia Thin, la finesse du détail",Figaro,2021-01-22
"Burger, croque-monsieur, breadmaki, bagel: nos pains quotidiens",Figaro,2021-01-22
"Nicola Sturgeon, l’écossais plutôt que l’uni",Figaro,2021-01-22
Connaissez-vous ces mots français empruntés à l’allemand? ,Figaro,2021-01-22
"Gustave Flaubert, la fureur d'écrire : voilà la vie parisienne!",Figaro,2021-01-22
"L'Europe en train : budget, pays, fonctionnement... Tout savoir sur le pass Interrail",Figaro,2021-01-22
La lettre du Figaro du 22 janvier 2021,Figaro,2021-01-22
Le Honduras renforce l'interdiction de l'avortement,Figaro,2021-01-22
Bruno Le Maire: «Nous ne souhaitons pas d’augmentation d’impôts»,Figaro,2021-01-22
«Nous risquons de nous faire imposer une ligne morale»: les caricaturistes en soutien de Xavier Gorce,Figaro,2021-01-22
Les jours heureux des seniors qui vivent en colocation,Figaro,2021-01-22
Christopher Caldwell: «Le gros problème de Trump n’a jamais été l’extrémisme mais l’incompétence»,Figaro,2021-01-22
"En Grèce, dans le Pélion, balade au pays des centaures",Figaro,2021-01-22
Le déjeuner du dimanche de… Stéphane De Groodt,Figaro,2021-01-22
"Dans les embruns de Cordouan, avec les derniers gardiens de phare",Figaro,2021-01-22
"Éric Woerth fait du Audiard, la jeune garde a de bons reflexes... Retrouvez les indiscrétions du Figaro Magazine ",Figaro,2021-01-22
"Éric Zemmour: «La discrimination positive, cette arme contre la promesse républicaine»",Figaro,2021-01-22
"Dette, impôts, bureaucratie... La face cachée de la crise",Figaro,2021-01-22
Un coup de pouce pour vous aider à faire baisser vos factures de chauffage,Figaro,2021-01-22
"Le cardigan, pas si gnangnan?",Figaro,2021-01-22
Le bilan (très) mitigé de l’évaluation par compétences à l’école,Figaro,2021-01-22
Sortez vos vieux pokédexs: un paquet de cartes Pokémon adjugé 400.000 dollars,Figaro,2021-01-22
«Les gens qui comptent au bureau» #42 : Le fin psychologue !,Figaro,2021-01-22
Mexique: record de décès et de contagions au Covid-19,Figaro,2021-01-22
Instacart se sépare de centaines de travailleurs,Figaro,2021-01-22
Google menace de bloquer son moteur de recherche en Australie,Figaro,2021-01-22
La sortie du prochain James Bond encore repoussée,Figaro,2021-01-22
Covid-19: la Guyane confinée les dimanches,Figaro,2021-01-22
Diary Sow dit faire «une pause» pour retrouver ses esprits,Figaro,2021-01-22
"Colombie: la violence contre les ex-combattants, principale menace à la paix",Figaro,2021-01-22
Cap-Vert: résidence surveillée pour un proche du président vénézuélien réclamé par Washington,Figaro,2021-01-22
Brésil: un fils de Bolsonaro condamné à indemniser une journaliste,Figaro,2021-01-22
"Rémy Julienne, l'as des as de la cascade, est mort du Covid-19 à 90 ans",Figaro,2021-01-22
Attentats de Bali: la justice militaire américaine inculpe 3 détenus de Guantanamo,Figaro,2021-01-22
L'EI revendique le double attentat suicide de Bagdad,Figaro,2021-01-22
Covid-19 : un test PCR négatif sera obligatoire pour tous les voyageurs européens arrivant en France,Figaro,2021-01-22
Covid-19 : la Colombie dépasse le seuil des 50.000 morts,Figaro,2021-01-22
Le Dr Fauci soulagé de ne plus avoir à contredire Trump,Figaro,2021-01-22
