titre,journal,date
Grandes écoles pour petits tortionnaires,Charlie Hebdo,2021-02-18
"Le Bitcoin, comme son nom l’indique",Charlie Hebdo,2021-02-18
(Presque) Lu pour vous : Vanessavirus,Charlie Hebdo,2021-02-18
Les pédopsychiatres sont-ils une espèce en voie de disparition ?,Libération,2021-02-18
"Bonifacio, la face de pierre de la Corse",Libération,2021-02-18
"Maires, aidez-nous à sortir les enfants pour leur bien-être et le nôtre",Libération,2021-02-18
"Attaques au mortier d’artifice : sur les réseaux sociaux, «une guerre de communication»",Libération,2021-02-18
"«Récits de la soif», l’addiction s’il vous plaît",Libération,2021-02-18
"Hervé Gourdel, un procès «contre l’obscurantisme» et un souvenir vivace",Libération,2021-02-18
Les 65-74 ans sont-ils les oubliés de la stratégie vaccinale ?,Libération,2021-02-18
"A Issoudun, seul musée ouvert de France : «On ne peut pas nous accuser de ne pas respecter les règles !»",Libération,2021-02-18
"#MeTooGay: après les mots, enfin des chiffres ?",Libération,2021-02-18
"Condamné pour viol, Georges Tron a passé sa première nuit en prison",Libération,2021-02-18
Vote anticipé : l’exécutif s’avance un peu trop,Libération,2021-02-18
Turquie : vent de colère après une action anti-PKK en Irak,Libération,2021-02-18
"La Nasa de retour sur Mars, Georges Tron condamné, lutte contre les cyberattaques... L’actu de ce jeudi matin",Libération,2021-02-18
"«Bluebird, Bluebird», dans la moiteur du bayou",Libération,2021-02-18
"Open d’Australie : écartée par Naomi Osaka, Serena Williams voit s’envoler son rêve de record",Libération,2021-02-18
Covid-19 : les festivals accueilleront cet été un maximum de 5000 spectateurs assis,Libération,2021-02-18
Secteurs multi-collèges à Paris : «La mixité a très fortement progressé»,Libération,2021-02-18
"Seiko Hashimoto, ex-athlète et ministre de l’Egalité des genres, prend la tête des Jeux de Tokyo",Libération,2021-02-18
"Le Crous Lorraine a-t-il diminué les portions, depuis l’instauration du repas à 1 euro pour les étudiants ?",Libération,2021-02-18
Le variant anglais est-il plus létal que les souches antérieures ?,Libération,2021-02-18
"Au Texas, une tempête de neige exceptionnelle prive de courant, de chauffage et d’eau des millions de foyers",Libération,2021-02-18
Les maires de gauche (aussi) s’activent pour la réouverture des musées,Libération,2021-02-18
"7,1 milliards d’euros de pertes : un «impact sans précédent» du Covid sur Air France-KLM",Libération,2021-02-18
"De Jaguar à Ford, les marques de voitures enclenchent le tout-électrique",Libération,2021-02-18
Bientôt un ticket Zemmour/Dupont-Aignan pour 2022 ?,Libération,2021-02-18
Comment LREM veut s’inspirer de la campagne de Joe Biden pour 2022,Libération,2021-02-18
Le rappeur Hasél met la fièvre à l’Espagne,Libération,2021-02-18
Dauphins victimes de la pêche : France Nature Environnement attaque le gouvernement français en justice,Libération,2021-02-18
"Supercam, l’œil du rover",Libération,2021-02-18
Explorer Mars : l’échec n’est pas une option,Libération,2021-02-18
"Betterave, l’âme rouge du borchtch",Libération,2021-02-18
«La police et la gendarmerie ne semblent pas vouloir réfléchir à réduire le nombre de décès dans leurs interventions»,Libération,2021-02-18
Mobilisation pour un prisonnier d’opinion aux Emirats arabes unis,Libération,2021-02-18
"Avec Angèle Consoli, la psychiatrie entre au Conseil scientifique",Libération,2021-02-18
"Mort de Rush Limbaugh, alter ego trip de Trump",Libération,2021-02-18
«Densité et maturité» : Macron reprend de la brioche,Libération,2021-02-18
Le rover Perseverance s’est posé sur Mars,Libération,2021-02-18
"Après de multiples attaques, l’Elysée annonce 1 milliard d’euros pour renforcer la cybersécurité",Libération,2021-02-18
"Opposants, cessez de gémir sur le «match imposé» Macron-Le Pen",Libération,2021-02-18
"«Framing Britney Spears» : sexisme, thème et variations",Libération,2021-02-18
Le RN veut une avenue Brigitte Bardot,Libération,2021-02-18
"«J’étais coincé là-bas» : le huis clos terrible de Méthode Sindayigaya, réduit en esclavage",Libération,2021-02-18
EDF n’a pas été épargné par la crise sanitaire,Libération,2021-02-18
La Grèce ouvre la porte à un flicage permanent des universités,Libération,2021-02-18
Turquie : Erdogan chahuté par le mouvement de l’université du Bosphore,Libération,2021-02-18
Scruter les étoiles pour changer le sens de la vie,Libération,2021-02-18
«Hold-up+» : que sait-on de la nouvelle version «augmentée» du documentaire ?,Libération,2021-02-18
"Françoise Cactus de Stereo Total : c’est la vie, c’est la mort",Libération,2021-02-18
Retard à l’allumage pour le 13 heures de TF1,Libération,2021-02-18
"Mort de l’artiste jamaïcain U-Roy, «deejay» de légende",Libération,2021-02-18
"Face au gouvernement australien, Facebook se fâche tout bleu",Libération,2021-02-18
Municipales à Lille : Martine Aubry devrait garder son fauteuil,Libération,2021-02-18
La réouverture du musée d’Issoudun suspendue par la justice,Libération,2021-02-18
"Dans le cabinet de maître Pierrat, des collaborateurs «essorés par le dénigrement et les invectives»",Libération,2021-02-18
Une enfant de 11 ans retenue durant huit jours à Orly,Libération,2021-02-18
Les trois quarts des encres de tatoueurs présenteraient un risque pour la santé,Libération,2021-02-18
"Durée d’isolement, part des variants... Ce qu’il faut retenir des déclarations d’Olivier Véran",Libération,2021-02-18
Printemps arabe : l’espoir fait revivre,Libération,2021-02-18
"En Allemagne, l’extrême droite refait surface",Libération,2021-02-18
Thomas Ruff : «J’adore les photos qui mentent»,Libération,2021-02-18
"Julia Cagé, d’actualité",Libération,2021-02-18
"Sur les réseaux sociaux, des arnaques à la photo porno à gogo",Libération,2021-02-18
"Durée d’isolement prolongée, protection des mineurs contre les violences sexuelles, la Nasa de retour sur Mars... l’actu de ce jeudi",Libération,2021-02-18
Feu d’artifice sur le box-office chinois,Libération,2021-02-18
Le Chili dans le trio de tête de la course à la vaccination,Libération,2021-02-18
"Patrick Poivre d’Arvor accusé de viols, une enquête ouverte",Libération,2021-02-18
Un ex-ministre faisait surveiller son adversaire par des barbouzes,Libération,2021-02-18
Les jeunes rebattent les cartes de l’ésotérisme,Libération,2021-02-18
Gauches : les optimistes sont de sorties,Libération,2021-02-18
Procès d’Aung San Suu Kyi : une première audience en catimini,Libération,2021-02-18
Les associations de consommateurs européennes s’attaquent à TikTok,Libération,2021-02-18
Violences sexuelles sur mineurs : l’Assemblée nationale vote unanimement un texte d’étape,Libération,2021-02-18
Cyberattaques : il faut blinder les ambulances,Libération,2021-02-18
"«La Petite Femelle», rien que sa vérité",Libération,2021-02-18
Cyberattaques : les collectivités locales cherchent la parade,Libération,2021-02-18
Les jeunes voient dans l’ésotérisme «une alternative face à une société dans l’impasse»,Libération,2021-02-18
"«Dans la tiédeur de la nuit», de vous à moite",Libération,2021-02-18
Covid-19 : Emmanuel Macron va proposer aux pays du G7 de transférer 3 % à 5 % de leurs doses de vaccins à l’Afrique,Le Monde,2021-02-18
"Dialoguer avec une personne en train de rêver, c’est possible",Le Monde,2021-02-18
Covid-19 : les règles de prise en charge des corps des défunts ont été assouplies,Le Monde,2021-02-18
Assassinat d’Hervé Gourdel : le principal accusé condamné à la peine de mort,Le Monde,2021-02-18
Les recalés du Beauvau de la sécurité cherchent à se faire entendre,Le Monde,2021-02-18
Présidentielle 2022 : fin de non-recevoir du Sénat pour la mise en place du vote par anticipation,Le Monde,2021-02-18
"Entre bons résultats et attentes des salariés, le grand écart de Carrefour",Le Monde,2021-02-18
Le président algérien dissout le Parlement et appelle à des élections anticipées,Le Monde,2021-02-18
Rwanda : Paul Rusesabagina face à la justice,Le Monde,2021-02-18
L’Assemblée unanime sur une proposition de loi renforçant la protection des mineurs contre les violences sexuelles,Le Monde,2021-02-18
Les députés s’emparent de la restitution des biens mal acquis aux populations spoliées,Le Monde,2021-02-18
Vidéo : suivez en direct l’arrivée du rover de la NASA sur Mars,Le Monde,2021-02-18
"A Hongkong, des figures du combat démocratique dans le box des accusés",Le Monde,2021-02-18
"Covid-19 : Aux Etats-Unis, l’espérance de vie a chuté d’un an au premier semestre 2020",Le Monde,2021-02-18
Patrick Poivre d’Arvor poursuivi dans le cadre d’une enquête pour viols,Le Monde,2021-02-18
"Ted Cruz, sénateur du Texas, profite du soleil mexicain tandis que le froid paralyse son Etat",Le Monde,2021-02-18
« Nous n’avons plus aucun revenu » : l’arrêt de la contrebande plombe l’économie du nord du Maroc,Le Monde,2021-02-18
"Marat, Robespierre et Descartes, « cold cases » de la médecine légale, sur France 5",Le Monde,2021-02-18
"« Scène de crime : La disparue du Cecil Hotel », sur Netflix : quand les limiers du Net mènent l’enquête",Le Monde,2021-02-18
En direct : le rover Perseverance s’est posé sur Mars,Le Monde,2021-02-18
« On détruit un outil qui a été l’un des plus performants du monde » : d’anciens hauts dirigeants d’EDF critiquent le plan « Hercule »,Le Monde,2021-02-18
"Les festivals de cet été se tiendront en configuration assise, avec une jauge de 5 000 spectateurs",Le Monde,2021-02-18
"A l’Assemblée nationale, la gestion tendue des niches parlementaires",Le Monde,2021-02-18
"Abidjan, nouvel horizon du rap français",Le Monde,2021-02-18
Covid-19 : les personnes testées positives devront s’isoler 10 jours à partir de lundi,Le Monde,2021-02-18
Les troupes suédoises sous haute protection hygiénique,Le Monde,2021-02-18
"Fort de l’augmentation continue de sa diffusion, « Libération » envisage l’avenir avec optimisme",Le Monde,2021-02-18
L’Etat lance un appel au mécénat pour acquérir le manuscrit autographe des « Cent Vingt Journées de Sodome » du marquis de Sade,Le Monde,2021-02-18
"De l’Ukraine à la Norvège, l’Europe à travers une fenêtre de train",Le Monde,2021-02-18
"« Brejnev. L’antihéros », d’Andreï Kozovoï : Leonid Brejnev, yeux grands fermés",Le Monde,2021-02-18
Des membres du conseil scientifique se disent favorables à un auto-isolement des plus âgés,Le Monde,2021-02-18
Municipales à Lille : le rapporteur public préconise le rejet des recours contre Martine Aubry,Le Monde,2021-02-18
Mondiaux de biathlon : les Français Julia Simon et Antonin Guigonnat sacrés en relais mixte,Le Monde,2021-02-18
Le travail de fourmi des clubs Cigales pour le développement durable de l’économie locale,Le Monde,2021-02-18
Mars 2020 : le rover Perseverance de la NASA s’est posé sur la Planète rouge après sept mois de périple,Le Monde,2021-02-18
Covid-19 : « La pandémie est le révélateur des fractures d’un système éducatif américain décentralisé et inégalitaire »,Le Monde,2021-02-18
« Paroles de lecteurs » - Pandémie : ne « psychiatrisons » pas davantage la société,Le Monde,2021-02-18
Airbnb : la justice valide le mode de régulation en vigueur à Paris pour les locations touristiques,Le Monde,2021-02-18
"Au Brésil, le non-carnaval s’achève dans la résignation",Le Monde,2021-02-18
"75 % des encres de tatouage contiennent des « produits cancérigènes, neurotoxiques ou hautement allergisants », alerte l’UFC-Que choisir",Le Monde,2021-02-18
"« Diplomaties européennes », de Laurence Badel : Vieux Continent, diplomaties renouvelées",Le Monde,2021-02-18
Cyberattaques : Emmanuel Macron promet un plan de 1 milliard d’euros après le piratage de deux hôpitaux,Le Monde,2021-02-18
La fermeture du zoo de Beauval fragilise l’insertion des jeunes de la région,Le Monde,2021-02-18
L’influenceuse Caroline Receveur visée par le fisc français,Le Monde,2021-02-18
Le JT de 13 heures de TF1 retardé de 40 minutes par un « énorme problème technique »,Le Monde,2021-02-18
Forme sévère de Covid-19 : des anomalies du globe oculaire détectées à l’IRM,Le Monde,2021-02-18
"Raffaele Cutolo, chef sanguinaire de la mafia napolitaine, est mort",Le Monde,2021-02-18
Covid-19 : « La stratégie coréenne offre un remarquable équilibre entre équité et efficacité en préservant les libertés du plus grand nombre »,Le Monde,2021-02-18
Climat : le gouvernement encadre-t-il vraiment l’extension des aéroports ?,Le Monde,2021-02-18
"« Un bon féministe », d’Ivan Repila : le feuilleton littéraire de Camille Laurens",Le Monde,2021-02-18
Nouvelle-Calédonie : une crise à hauts risques,Le Monde,2021-02-18
"En Espagne, le parti libéral Ciudadanos au bord de l’implosion",Le Monde,2021-02-18
"Dans les montagnes du Maroc, le tourisme « stoppé net » par la pandémie de Covid-19",Le Monde,2021-02-18
Tel-Aviv négocie la libération d’une Israélienne en Syrie,Le Monde,2021-02-18
"Estimant la vie d’Alexeï Navalny menacée, la CEDH demande sa libération",Le Monde,2021-02-18
Les malades du Covid long en quête de reconnaissance,Le Monde,2021-02-18
Les ventes de Carrefour ont progressé en France à la faveur de la crise sanitaire,Le Monde,2021-02-18
"JO de Tokyo : la ministre chargée des Jeux, Seiko Hashimoto, nommée à la tête du comité d’organisation",Le Monde,2021-02-18
Le conseil scientifique s’étoffe de nouvelles spécialités pour lutter contre la pandémie,Le Monde,2021-02-18
"En Italie, Mario Draghi pousse la Ligue à accepter l’« irréversibilité de l’euro »",Le Monde,2021-02-18
"« Paralysée par ses lourdeurs et ses insuffisances, l’Union européenne n’arrive plus à se regarder en face »",Le Monde,2021-02-18
Un ex-ministre burundais et sa femme jugés en appel pour traite d’être humain,Le Monde,2021-02-18
Le bénéfice net diminue fortement chez EDF,Le Monde,2021-02-18
"Crise du Covid-19 : la famille, valeur refuge du premier confinement",Le Monde,2021-02-18
Covid-19 : Airbus limite les dégâts sur ses comptes,Le Monde,2021-02-18
« Les pannes de courant au Texas touchent l’industrie au pire moment »,Le Monde,2021-02-18
« Islamo-gauchisme » : Frédérique Vidal suscite un tollé dans le monde universitaire et un malaise au sein de la majorité,Le Monde,2021-02-18
"Jean-Louis Comolli, Pierre François et Claire Lemercier, Ondjaki… Les brèves critiques du « Monde des livres »",Le Monde,2021-02-18
Le système suédois des retraites sous le feu des critiques,Le Monde,2021-02-18
"« Belladone », d’Hervé Bougel : de mémoire de petit garçon",Le Monde,2021-02-18
"A Paris, le collège au défi de la mixité sociale",Le Monde,2021-02-18
"Au Rwanda, l’ancien directeur de l’Hôtel des Mille Collines devant les juges",Le Monde,2021-02-18
"L’animateur de radio Rush Limbaugh, précurseur de la radicalisation du Parti républicain, est mort",Le Monde,2021-02-18
Le gouvernement fait pression pour des prix plus justes dans l’alimentaire,Le Monde,2021-02-18
Deux journalistes biélorusses condamnées à deux ans de prison pour leur couverture du mouvement de contestation,Le Monde,2021-02-18
Covid-19 : Emmanuel Macron juge « intolérable » la lenteur de la campagne de vaccination en Afrique,Le Monde,2021-02-18
"Covid-19 : 7,1 milliards d’euros de perte pour Air France-KLM",Le Monde,2021-02-18
La révolution végétale est en marche dans la gastronomie,Le Monde,2021-02-18
Trois recettes véganes pour réconcilier légumes et gourmandise,Le Monde,2021-02-18
"On a testé… le smartphone à deux écrans de Microsoft, le Surface Duo : un gros bosseur ?",Le Monde,2021-02-18
Les musiciens sud-africains veulent faire entendre leurs voix,Le Monde,2021-02-18
"Cdiscount, l’éternel numéro deux de l’e-commerce en France",Le Monde,2021-02-18
"Quand « Aïda », diffusé jeudi sur Arte, redonne vie à l’Opéra de Paris",Le Monde,2021-02-18
"Lille-Ajax : l’Argentin Lisandro Martinez, défenseur très engagé",Le Monde,2021-02-18
"Mondiaux de ski alpin : Tessa Worley, l’envie et le ski retrouvés",Le Monde,2021-02-18
Qui veut vraiment d’une diplomatie européenne ?,Le Monde,2021-02-18
"« Contre la pauvreté des jeunes, c’est l’ensemble de notre démocratie sociale qu’il faut mobiliser »",Le Monde,2021-02-18
"La méthode agile, tant vantée en management, est la risée des jeunes sur Facebook",Le Monde,2021-02-18
« L’impérieuse nécessité d’une action européenne commune et stratégique autour de la santé »,Le Monde,2021-02-18
Polémique après la déprogrammation d’un téléfilm avec Richard Berry sur France 3,Le Monde,2021-02-18
Open d’Australie : Naomi Osaka qualifiée pour sa deuxième finale en battant Serena Williams,Le Monde,2021-02-18
Covid-19 : « L’urgence est de tout faire pour éviter la fameuse “génération sacrifiée” »,Le Monde,2021-02-18
Succession : ne rien organiser quand on n’a pas d’enfants est une erreur,Le Monde,2021-02-18
"« Histoire de la Grande-Bretagne », le récit d’une île improbable jusqu’au Brexit",Le Monde,2021-02-18
"Europe : « Etablir pour les entreprises des indicateurs identiques sur l’environnement, le social et la gouvernance »",Le Monde,2021-02-18
Georges Tron condamné en appel à de la prison ferme pour viol et agressions sexuelles en réunion,Le Monde,2021-02-18
"Qui est vraiment Mario Draghi, l’ancien banquier central nommé chef du gouvernement italien ?",Le Monde,2021-02-18
"En Birmanie, des sites gouvernementaux ciblés par des hackeurs",Le Monde,2021-02-18
"Impatient face à l’administration Biden, l’Iran multiplie les entorses à l’accord sur son programme nucléaire",Le Monde,2021-02-18
"A Marseille, des pistes thérapeutiques pour les Covid longs",Le Monde,2021-02-18
Le Medef propose aux autres partenaires sociaux « un agenda social et économique autonome »,Le Monde,2021-02-18
Premier entretien entre Benyamin Nétanyahou et Joe Biden,Le Monde,2021-02-18
« Ne pas pouvoir rentrer dans son pays est inadmissible » : les expatriés français coincés à l’étranger se sentent « abandonnés »,Le Monde,2021-02-18
"Nouvelle-Calédonie : à Nouméa, les indépendantistes prennent le contrôle de l’exécutif mais ne parviennent pas à s’accorder sur un président",Le Monde,2021-02-18
« Nous avons la responsabilité de lancer une nouvelle reconstruction » : Mario Draghi obtient la confiance du Sénat en Italie,Le Monde,2021-02-18
"Dans les collèges et les lycées, les conséquences en cascade de la baisse des moyens",Le Monde,2021-02-18
"« Les élèves ne viennent plus au théâtre, alors le théâtre va à eux » : dans les écoles, le spectacle continue",Le Monde,2021-02-18
Quand des consultants du Boston Consulting Group pilotaient Renault,Le Monde,2021-02-18
"« D’Abraham Lincoln, premier président du Parti républicain moderne, à QAnon… Que s’est-il passé ? »",Le Monde,2021-02-18
Deux ans de prison avec sursis requis contre un ex-ministre burundais pour esclavage moderne en France,Le Monde,2021-02-18
La NASA annonce avoir découvert un variant martien,Nord Presse,2021-02-18
Les journalistes applaudissent les habits neufs du Président,Nord Presse,2021-02-18
Le JT de TF1 piraté par des HACKERS de la team JPP,Nord Presse,2021-02-18
Emmanuel Macron a pris du poids,Nord Presse,2021-02-18
"""Nous voilà!"": Macron salue l'atterrissage sur Mars",Science et Avenir,2021-02-18
Perseverance en bonne santé sur Mars,Science et Avenir,2021-02-18
Le rover américain Perseverance a atterri sur Mars,Science et Avenir,2021-02-18
Covid: Macron propose de transférer 3 à 5% des vaccins à l'Afrique,Science et Avenir,2021-02-18
"Arrivée de Perseverance, pharaon et lézard : l'actu des sciences en ultrabrèves",Science et Avenir,2021-02-18
"AstraZeneca, le vaccin mal-aimé d'une partie de l'Europe",Science et Avenir,2021-02-18
Moins de 30.000 médecins libéraux inscrits pour vacciner la semaine prochaine,Science et Avenir,2021-02-18
Des chercheurs découvrent une nouvelle illusion d'optique,Science et Avenir,2021-02-18
Existe-t-il plusieurs moyens d'atterrir sur Mars ?,Science et Avenir,2021-02-18
Animaux de ferme: Brigitte Bardot demande une aide financière au gouvernement,Science et Avenir,2021-02-18
Le plus ancien fossile de lézard à langue bleue découvert en Australie,Science et Avenir,2021-02-18
L'imagerie médicale confirme l’exécution d’un pharaon capturé sur un champ de bataille,Science et Avenir,2021-02-18
"Covid-19: pour tenir la ""digue"" sanitaire, l'isolement rallongé",Science et Avenir,2021-02-18
"En Tunisie, des fleurs comestibles s'invitent dans la gastronomie",Science et Avenir,2021-02-18
DIRECT. Suivez l'arrivée de Perseverance sur Mars,Science et Avenir,2021-02-18
"Le vaccin AstraZeneca ""n'est pas un vaccin de seconde zone"", assure Alain Fischer",Science et Avenir,2021-02-18
"La SuperCam va étudier Mars au laser, en son et lumière",Science et Avenir,2021-02-18
"L'atterrissage sur Mars de Perseverance en ""sept minutes de terreur""",Science et Avenir,2021-02-18
"Atterrissage réussi pour Perseverance, la quête de vie ancienne sur Mars peut commencer",Science et Avenir,2021-02-18
Les candidats à la vie dans le système solaire,Science et Avenir,2021-02-18
Caitlyn Jenner : qui sont ses six enfants ? ,Closer,2021-02-18
Véronique Jannot : qui était son grand amour Didier Pironi ?,Closer,2021-02-18
Jean-Marie Bigard : sa femme Lola Marois fait une petite confidence sur sa santé,Closer,2021-02-18
Vincent Bolloré donnera un Ted Talk sur le management le mois prochain à Pyongyang,Gorafi,2021-02-18
La Covid19 déjà vaccinée contre Nicolas Sarkozy,Gorafi,2021-02-18
"Il n'a jamais acheté de Bitcoin et n'a donc jamais, ni gagné, ni perdu d'argent, il raconte",Gorafi,2021-02-18
Covid-19 : plus d’un million de personnes pleinement vaccinées en France,La Point,2021-02-18
"Italie : Gianluigi Buffon, 5 000 euros pour un blasphème",La Point,2021-02-18
À la une ce vendredi 19 février...,La Point,2021-02-18
Le Texas paralysé par le froid? Son sénateur Ted Cruz file à Cancun,La Point,2021-02-18
Menaces antisémites envers Braun-Pivet (LREM): séance suspendue à l'Assemblée,La Point,2021-02-18
"Condamné en appel, Georges Tron va se pourvoir en cassation",La Point,2021-02-18
"Patrick Poivre d'Arvor accusé de viols, une enquête ouverte",La Point,2021-02-18
Japon : le parti au pouvoir invite des femmes silencieuses dans ses réunions,La Point,2021-02-18
"A Draveil, la chute de ""l'homme de pouvoir"" Georges Tron après sa condamnation",La Point,2021-02-18
Violences sexuelles sur mineurs: l'Assemblée unanime vote un texte d'étape pour durcir la loi,La Point,2021-02-18
Moins de 30.000 médecins libéraux inscrits pour vacciner la semaine prochaine,La Point,2021-02-18
Une enquête pour « viols » ouverte contre Patrick Poivre d’Arvor,La Point,2021-02-18
L’Afrique post-Covid-19 : une feuille de route s’impose,La Point,2021-02-18
Covid-19 : 5 000 personnes maximum pour les festivals d’été,La Point,2021-02-18
Dix députés LREM demandent la sortie de l’état d’urgence,La Point,2021-02-18
Mars 2020 : le rover « Perseverance » a atterri sur Mars !,La Point,2021-02-18
Covid-19 : l’isolement des personnes contaminées allongé à 10 jours,La Point,2021-02-18
Agression de Yuriy : deux nouveaux mineurs incarcérés,La Point,2021-02-18
"Le froid perturbe toujours les Etats-Unis, tempête dans le nord-est",La Point,2021-02-18
Italie : la pandémie accentue la baisse des mariages et des divorces,La Point,2021-02-18
Six montres à l’heure du MoMA,La Point,2021-02-18
Makhtar Diop prend la tête de la Société financière internationale,La Point,2021-02-18
Peter et Sloane : le succès ne sonne qu’une fois,La Point,2021-02-18
Animaux : Brigitte Bardot en appelle au gouvernement,La Point,2021-02-18
Les mises au point du patron d’EDF,La Point,2021-02-18
Ligue Europa : les Dogues craquent face à l’Ajax,La Point,2021-02-18
Covid : un an d’enfer pour le transport aérien,La Point,2021-02-18
SuperCam : le « couteau suisse » de « Perseverance »,La Point,2021-02-18
Cannes : huit suspects de vols à la tire sur des retraités interpellés,La Point,2021-02-18
Vaccinations anti-Covid : la remontada n’a (toujours) pas eu lieu,La Point,2021-02-18
Singapour: un hôtel sécurisé contre le Covid pour les voyageurs d'affaires,La Point,2021-02-18
Paris : une fonderie d’or clandestine découverte par la police,La Point,2021-02-18
Algérie : la montagne se souvient encore d’Hervé Gourdel,La Point,2021-02-18
TF1 retarde la diffusion du 13 heures à cause d'un problème technique,La Point,2021-02-18
Violences sexuelles sur mineurs: texte d'étape à l'Assemblée pour durcir la loi,La Point,2021-02-18
Dieudonné: condamnation à 9.000 euros d'amende confirmée en appel pour sa chanson sur la Shoah,La Point,2021-02-18
Voyagez avec les cartes de Jules Verne,La Point,2021-02-18
"Nicolas Sarkozy, vacciné et agacé par Emmanuel Macron",La Point,2021-02-18
"Nissan Qashqai : reconduite d’un succès, mais sans diesel",La Point,2021-02-18
Cyberattaques : Macron promet une riposte à un millard après le piratage des hôpitaux,La Point,2021-02-18
"Italie : « Don Raffaele », figure de la mafia napolitaine, est mort",La Point,2021-02-18
Covid-19 : la troisième vague déjà passée ?,La Point,2021-02-18
"Paris : le préfet fait fermer un café, le tribunal le rouvre",La Point,2021-02-18
"À Belfast, les effets bien visibles du Brexit",La Point,2021-02-18
