titre,journal,date
Twitter est-il vraiment pour la démocratie ?,Charlie Hebdo,2021-01-24
Le gouvernement déteste la jeunesse,Charlie Hebdo,2021-01-24
"Dans la presse, bientôt le temps d'un troisième confinement",Libération,2021-01-24
"Au barrage de Poutès, les travaux n'enterrent pas tout à fait la querelle du saumon",Libération,2021-01-24
"Hockey sur glace : à 20 ans, Charlotte Cagigos garde la cage de l'équipe masculine de Caen",Libération,2021-01-24
"A l'hôpital de Compiègne, «on est face à un puzzle dont on n’a pas toutes les pièces»",Libération,2021-01-24
Un réseau francophone dédié aux droits de la nature,Libération,2021-01-24
"Covid : à Montpellier, «l’état d’urgence culturel» rassemble",Libération,2021-01-24
"En réanimation, ce satané plateau haut du Covid qui met les soignants «sur les genoux»",Libération,2021-01-24
Tran To Nga : une vie avec l'agent orange devant la justice,Libération,2021-01-24
Castex avoue n'avoir «jamais été convaincu» par les «immenses régions»,Libération,2021-01-24
"Dans la Vienne, un village, un industriel et 1 200 taurillons",Libération,2021-01-24
"A l'hôpital d'Antibes, «on ne voit pas le bout» de la nouvelle vague épidémique",Libération,2021-01-24
"Covid-19 : dans les écoles, le système D comme déjeuner",Libération,2021-01-24
Fashion Week : à Coué bon,Libération,2021-01-24
"Moins cher, mais plus lent, le TER entre Lille et Paris vient concurrencer le tout-TGV",Libération,2021-01-24
L'absence de stratégie vaccinale du gouvernement pique au vif les soignants,Libération,2021-01-24
"A Versailles, les restaurateurs s'emparent du marché pour doper leur com",Libération,2021-01-24
Agression de Yuriy à Paris : les pistes multiples d'une enquête qui débute,Libération,2021-01-24
Les chiffres de l'épidémie en Israël signent-ils l'échec de la campagne de vaccination massive ?,Libération,2021-01-24
Dessins : des manchots sur les réseaux,Libération,2021-01-24
"Camélia Jordana : «Chez moi, on ne parlait pas politique»",Libération,2021-01-24
"Sur le Bosphore, enseignants et étudiants en lutte pour la liberté",Libération,2021-01-24
"Grégoire Akcelrod, l’enjoliveur",Libération,2021-01-24
Barbara Carlotti dans le labo bleu de Christophe,Libération,2021-01-24
"«Le Tigre blanc», Rastignac à l’indienne",Libération,2021-01-24
"Bernie partout, raison nulle part",Libération,2021-01-24
«Navalny se positionne désormais comme la deuxième personnalité politique de Russie»,Libération,2021-01-24
"Dans le XVIe arrondissement de Paris, des sans-abri investissent une école inoccupée",Libération,2021-01-24
Conseil d’Etat : Marc Guillaume bute sur la dernière marche,Libération,2021-01-24
"Guillaume, Mion, Duhamel : Sciences-Po, le pouvoir des trois",Libération,2021-01-24
Inceste : les auditions se poursuivent,Libération,2021-01-24
"Lens en silence, une histoire du foot à huis clos",Libération,2021-01-24
"Bernie partout, raison nulle part",Libération,2021-01-24
"Reconfinement envisagé, vaccination, vote au Portugal, répression en Russie... l’essentiel de l'actu du week-end",Libération,2021-01-24
Covid-19 : l’hôpital retient son souffle,Libération,2021-01-24
Epuisement,Libération,2021-01-24
«Durcir les mesures est inévitable si la pression devient trop forte»,Libération,2021-01-24
"En Russie, un long week-end de répression pour les pro-Navalny",Libération,2021-01-24
"Pour leur premier entretien téléphonique, Macron et Biden constatent « une grande convergence de vues »",Le Monde,2021-01-24
Israël ouvre une première ambassade aux Emirats arabes unis,Le Monde,2021-01-24
"Vaccins, manifestations en Russie, présidentielle au Portugal… les cinq infos à retenir du week-end",Le Monde,2021-01-24
"La violente agression de Yuriy, 15 ans, par une bande à Paris est devenue une polémique nationale",Le Monde,2021-01-24
"Contre l’inceste, Emmanuel Macron s’engage à « écouter » et à « adapter » le droit",Le Monde,2021-01-24
"Wonder Woman, super-héroïne d’un film d’action au féminisme de bon aloi",Le Monde,2021-01-24
La France qualifiée pour les quarts de finale du mondial de handball après une démonstration contre le Portugal,Le Monde,2021-01-24
"A Tarascon, l’espoir renaît pour les salariés de Fibre Excellence",Le Monde,2021-01-24
"Marcelo Rebelo de Sousa, président sortant du Portugal, largement réélu dès le premier tour",Le Monde,2021-01-24
« La protection du climat est une opportunité pour renforcer la cohésion européenne »,Le Monde,2021-01-24
Comment l’Allemagne s’est convertie à la politique industrielle,Le Monde,2021-01-24
La Deutsche Bank demande plus d’Etat,Le Monde,2021-01-24
"Anne-Laure Dalibard, dérivée volontaire dans un océan d’équations",Le Monde,2021-01-24
"Ligue 1 : Lille rejoint Paris en tête, Lyon s’accroche au podium",Le Monde,2021-01-24
"Au Brésil, la vaccination a commencé sur fond de confrontation politique",Le Monde,2021-01-24
La mort du médiéviste britannique Giles Constable,Le Monde,2021-01-24
"Le Kremlin, prisonnier d’Alexeï Navalny",Le Monde,2021-01-24
"Tse Chi Lop, soupçonné d’être un des plus grands et plus discrets narcotrafiquants au monde, arrêté aux Pays-Bas",Le Monde,2021-01-24
Richard Morgiève en clair-obscur,Le Monde,2021-01-24
"D’Isadora Duncan à Harry Potter, l’écharpe à tous les cous",Le Monde,2021-01-24
Notre sélection d’articles sur l’affaire Alexeï Navalny,Le Monde,2021-01-24
« J’ai vu la crise se répandre comme une pieuvre dans la région » : des villages au Mali rasés par la violence et la famine,Le Monde,2021-01-24
"Arlo Parks, chanteuse néosoul de haute sensibilité",Le Monde,2021-01-24
Biathlon : deux nouveaux podiums pour les Français à Antholz-Anterselva,Le Monde,2021-01-24
Une série télé tournée sur la gestion du coronavirus par Boris Johnson,Le Monde,2021-01-24
Le pilote français Sébastien Ogier s’offre une 8e victoire record à Monte-Carlo,Le Monde,2021-01-24
"3 300 arrestations lors des manifestations en soutien à Navalny, une femme en soins intensifs",Le Monde,2021-01-24
« C’est une année de perdue » : la frustration et les doutes des sportifs juniors,Le Monde,2021-01-24
Olivier Cohen : « Sans doute suis-je “old school”… »,Le Monde,2021-01-24
Suivez en direct l’émission « Questions politiques » avec Jean-Yves Le Drian,Le Monde,2021-01-24
"« En quatre jours, Joe Biden a installé un sentiment apaisant de routine »",Le Monde,2021-01-24
"Vaccin contre le Covid-19 : « A ce jour, aucun excès d’effets secondaires n’a été identifié »",Le Monde,2021-01-24
"Google Trends : un an après, les recherches des Français sur la pandémie et le confinement ont changé",Le Monde,2021-01-24
Le vin de jeune d’aujourd’hui est-il le vin de papa de demain ?,Le Monde,2021-01-24
"A Washington, des soldats assoupis dans le Capitole : c’est peut-être un détail pour vous…",Le Monde,2021-01-24
"Un Soulages ayant appartenu à Senghor vendu 1,5 million d’euros",Le Monde,2021-01-24
« La France doit construire un écosystème des technologies quantiques »,Le Monde,2021-01-24
Gérald Bronner : « L’avenir se joue dans nos cerveaux »,Le Monde,2021-01-24
Le courage des militants LGBT dans le monde arabe,Le Monde,2021-01-24
« Jusqu’où ira l’affaire éruptive de l’interdiction des autocollants vendéen ou breton sur les plaques d’immatriculation ? »,Le Monde,2021-01-24
"« Un levier de réussite pour les boursiers de prépa » : à Paris, l’internat de tous les possibles",Le Monde,2021-01-24
Covid-19 dans le monde : des heurts avec la police en marge de manifestations contre le couvre-feu aux Pays-Bas,Le Monde,2021-01-24
"Ligue 1 : diminués par le Covid-19, les Verts misent sur l’état d’esprit dans le derby contre Lyon",Le Monde,2021-01-24
Quel est l’intérêt de la tontine ?,Le Monde,2021-01-24
"« Marcelo », l’antithèse de Trump, brigue un second mandat à la tête du Portugal",Le Monde,2021-01-24
Le président du conseil scientifique plaide pour un reconfinement face aux variants du Covid-19,Le Monde,2021-01-24
"« Le label bio ne garantit pas la qualité du produit, mais le respect du cahier des charges »",Le Monde,2021-01-24
Présidentielle : la dernière chance de Marine Le Pen en 2022,Le Monde,2021-01-24
"Didier Sicard : « Pour ma propre mort, je demanderai une sédation douce »",Le Monde,2021-01-24
"Larry King, ancien intervieweur vedette et pionnier du mariage entre information et divertissement",Le Monde,2021-01-24
Boris Johnson et Joe Biden veulent « approfondir l’alliance » entre Londres et Washington,Le Monde,2021-01-24
"« Le judaïsme n’a pas inventé le dieu de la Bible, mais transformé un culte secret en religion officielle »",Le Monde,2021-01-24
"Parentologie : la chouquette, cette pâtisserie qui nous garde en enfance",Le Monde,2021-01-24
Cinq ruines qui font voyager à travers l’histoire de France,Le Monde,2021-01-24
Venezuela : Nicolas Maduro tend la main à Joe Biden et appelle à « tourner la page »,Le Monde,2021-01-24
La complicité des taxis et des fans jusqu’à Brighton : cinq choses que vous ne saviez peut-être pas sur FIP,Le Monde,2021-01-24
"INTERVIEW. ""L'homme préhistorique est aussi une femme""",Science et Avenir,2021-01-24
La signature d'une hypothétique particule de matière noire retrouvée dans un groupe d'étoiles ?,Science et Avenir,2021-01-24
"Virus: les frontières se ferment face aux variants, Moderna rassure",Science et Avenir,2021-01-24
Coronavirus: le point sur la pandémie,Science et Avenir,2021-01-24
Le secret des arbres à poison,Science et Avenir,2021-01-24
"Vaccins: l'UE demande de ""la transparence"" aux entreprises sur les retards",Science et Avenir,2021-01-24
"Covid-19: le séquençage, cet indispensable outil pour traquer le virus",Science et Avenir,2021-01-24
Verdict cette semaine sur les effets du couvre-feu,Science et Avenir,2021-01-24
Décès et vaccins Covid: pas de lien établi mais une surveillance stricte,Science et Avenir,2021-01-24
"""Legacy"", l'héritage du photographe écolo Yann Arthus-Bertrand sur M6",Science et Avenir,2021-01-24
Quelle place nos ancêtres accordaient-ils au plaisir ?,Science et Avenir,2021-01-24
Les Tchèques préparent les chiens pour combattre le Covid-19,Science et Avenir,2021-01-24
"Entre géopolitique et pauvreté, l'Ukraine privée de vaccin anti-Covid",Science et Avenir,2021-01-24
"Covid-19: face aux variants, l'hypothèse d'un reconfinement s'accroit",Science et Avenir,2021-01-24
Coronavirus: le point sur la pandémie,Science et Avenir,2021-01-24
Virus: des milliers de manifestants contre les restrictions à Madrid,Science et Avenir,2021-01-24
Un décor de la série « Peaky Blinders » se mue en centre de vaccination,La Point,2021-01-24
À la une cette semaine…,La Point,2021-01-24
Le coup de fil entre Macron et Biden a révélé « une grande convergence de vues »,La Point,2021-01-24
"Mondial de hand, Ligue 1, Ogier : ce qu’il faut retenir du week-end sportif !",La Point,2021-01-24
Présidentielle au Portugal : Marcelo Rebelo de Sousa réélu au premier tour,La Point,2021-01-24
Présidentielle 2022 : un sondage place Marine Le Pen en tête au premier tour,La Point,2021-01-24
"Covid-19 : face aux variants, Delfraissy prône un nouveau confinement",La Point,2021-01-24
SpaceX bat le record du plus grand nombre de satellites lancés en une mission,La Point,2021-01-24
"Un procès ""stupide"": des ténors républicains contre la destitution de Trump",La Point,2021-01-24
Israël va ouvrir une ambassade aux Émirats arabes unis,La Point,2021-01-24
Une brioche fourrée au cannabis suscite l’hilarité des gendarmes,La Point,2021-01-24
Paris : 300 migrants investissent une école du 16e arrondissement,La Point,2021-01-24
Harari : quand le monde n’est plus qu’une grande conspiration,La Point,2021-01-24
Des migrants occupent une école parisienne pour réclamer leur mise à l'abri,La Point,2021-01-24
"Brésil: face à la pandémie, l'extension du plus grand cimetière de Manaus",La Point,2021-01-24
Le « Jeune Homme tenant un médaillon » de Botticelli aux enchères,La Point,2021-01-24
Covid-19 : le variant britannique sème l'émoi à HEC,La Point,2021-01-24
Île-de-France : bataille juridique autour du burkini dans les bases de loisirs,La Point,2021-01-24
"Entre géopolitique et pauvreté, l'Ukraine privée de vaccin anti-Covid",La Point,2021-01-24
Présidentielle du 21 mars au Congo : Sassou Nguesso remet le couvert,La Point,2021-01-24
Covid-19 : pas de lien établi entre le vaccin et les décès,La Point,2021-01-24
Marc Lambron – Gauche caviar : défense de « l’esturgeon écarlate »,La Point,2021-01-24
Tabassage d’un adolescent à Paris : l’Élysée a contacté la mère de Yuriy,La Point,2021-01-24
#CancelCulture : Quand l’université de Leicester « décolonise » ses programmes,La Point,2021-01-24
Covid-19 : le variant britannique sème l’émoi à HEC,La Point,2021-01-24
"Manifestations pro-Navalny : la Russie minimise, l’Europe se scandalise",La Point,2021-01-24
L'affaire Duhamel a « tué » Marie-France Pisier pour Julien Kouchner,La Point,2021-01-24
"Être mère, ça s’apprend…",La Point,2021-01-24
L'atelier Junod: où la tradition de l'art mécanique suisse embrasse le futur,La Point,2021-01-24
"Virus: les frontières se ferment face aux variants, Moderna rassure",La Point,2021-01-24
Marlène Schiappa : « Ceux qui applaudissent Greta Thunberg devraient aussi applaudir Mila »,La Point,2021-01-24
Régionales : Jean-Yves Le Drian ne sera pas candidat en Bretagne,La Point,2021-01-24
L’homme Hermès joue des lignes,La Point,2021-01-24
Covid: le protocole en entreprise va être adapté sur les masques,La Point,2021-01-24
Des collages pour Loewe,La Point,2021-01-24
"""Legacy"", l'héritage du photographe écolo Yann Arthus-Bertrand sur M6",La Point,2021-01-24
Covid-19 : quels masques pourra-t-on porter en entreprise ?,La Point,2021-01-24
"Julien Fournié, le couturier qui s'amuse en temps de pandémie",La Point,2021-01-24
Australie : un homme retrouvé vivant après 18 jours dans le bush,La Point,2021-01-24
Larqué : « Domenech ? Le pied gauche ne lui sert qu’à monter dans la voiture… »,La Point,2021-01-24
Urvoas : séparer « drastiquement » la fonction de juge et de procureur,La Point,2021-01-24
"Baptême du feu pour Chuck Schumer, le nouveau chef du Sénat américain",La Point,2021-01-24
"L’affaire Duhamel a « tué » Marie-France Pisier, pour Julien Kouchner",La Point,2021-01-24
Paul Smith remixe ses hits,La Point,2021-01-24
"Sahara: le Polisario promet ""l'escalade"" avec le Maroc",La Point,2021-01-24
"Sahara : le Polisario bombarde une zone sous contrôle marocain, Rabat minimise",La Point,2021-01-24
Navalny: le Kremlin minimise la portée des manifestations et accuse Washington,La Point,2021-01-24
"Covid-19: le séquençage, cet indispensable outil pour traquer le virus",La Point,2021-01-24
Chine: considérable avancée des secours après le sauvetage de 11 mineurs,La Point,2021-01-24
Marlène Schiappa : « Ceux qui applaudissent Greta Thunberg devraient aussi applaudir Mila »,La Point,2021-01-24
"Les nouveaux territoires du vin, des pratiques en mouvement",La Point,2021-01-24
État Major – Lenovo France,La Point,2021-01-24
Covid-19 : pas de lien établi entre le vaccin et les décès,La Point,2021-01-24
"Pour protéger les primates, les scientifiques privés de selfies",La Point,2021-01-24
Covid-19 : un troisième confinement dès la semaine prochaine ?,La Point,2021-01-24
"Popularité: Macron en hausse, Castex stable",La Point,2021-01-24
"Stations de ski : « Le flou des annonces gouvernementales, c’est la double peine ! »",La Point,2021-01-24
Verdict la semaine prochaine sur les effets du couvre-feu en France,La Point,2021-01-24
"Yuriy, 15 ans, roué de coups et laissé pour mort en plein Paris",La Point,2021-01-24
Avec les médecins français au chevet de l’Arménie,La Point,2021-01-24
BHL – Du Capitole à l’Afghanistan,La Point,2021-01-24
Mathieu Laine : « L’infantilisation est de tous les partis »,La Point,2021-01-24
"Dans les Balkans, des îlots d'ordures font émerger la crise des déchets",La Point,2021-01-24
Tunisie : « game over » pour la génération révolution,La Point,2021-01-24
Gastronomie - Les militantes de la « world food »,La Point,2021-01-24
Covid-19 : un troisième confinement dès la semaine prochaine ?,La Point,2021-01-24
Marché de l’art – Rêver Chandigarh,La Point,2021-01-24
Évasion sportive #2 : le kayak,La Point,2021-01-24
"Reverso, le garde-temps pile et face",La Point,2021-01-24
"Mode - Loro Piana, au fil de l’innovation",La Point,2021-01-24
Cadeaux originaux pour nouveau-nés confinés,La Point,2021-01-24
Les Tchèques préparent les chiens pour combattre le Covid-19,La Point,2021-01-24
"Birmanie: ""la maison de Dieu"", un lopin de terre pour les déplacés fuyant la guerre",La Point,2021-01-24
"Après l’épisode Carrefour, Macron veut rassurer les grands patrons étrangers",La Point,2021-01-24
Des recettes vieilles de 200 ans recréées grâce à un précieux manuscrit,La Point,2021-01-24
Allemagne – Armin Laschet a-t-il l’étoffe d’un chancelier ?,La Point,2021-01-24
Aurélie Jean – États-Unis : la science est de retour !,La Point,2021-01-24
"Serigne Mbaye Thiam : « Les enseignants, ces héros oubliés de la pandémie »",La Point,2021-01-24
"Présidentielle au Portugal : « O Marcelo », favori diminué par la pandémie",La Point,2021-01-24
Michel Richard – La haute voltige présidentielle de Xavier Bertrand,La Point,2021-01-24
Les dangers des tests génétiques généalogiques,La Point,2021-01-24
La cote d'Emmanuel Macron monte de deux points,La Point,2021-01-24
Grande Muraille verte : « Créer le rêve et l’espoir sur le continent »,La Point,2021-01-24
"En pleine pandémie, les Portugais reconduisent leur président conservateur",La Point,2021-01-24
"Sahara: le Polisario bombarde une zone contrôlée par Rabat, menace d'une ""escalade""",La Point,2021-01-24
"Covid-19: face aux variants, l'hypothèse d'un reconfinement s'accroit",La Point,2021-01-24
Antarctique: fort séisme de magnitude 7 près d'une base chilienne,La Point,2021-01-24
Iris Mittenaere défigurée : la choquante photo de cette traumatisante expérience à Lille,Public,2021-01-24
"Norbert Tarayre : Le chef victime de violences, ses lourdes confidences...",Public,2021-01-24
Capucine Anav : l'incroyable anniversaire qu'elle a organisé à son chéri... les photos de la fête dévoilées,Public,2021-01-24
"Laurent Lenne : le ""faux prêtre"" de Secret Story au coeur d'un énorme scandale dans un crématorium",Public,2021-01-24
Julia Paredes enceinte et mariée : découvrez sa somptueuse robe de mariée !,Public,2021-01-24
Shym' : sa belle-mère a-t-elle fait une grosse boulette au sujet de son accouchement ? Ce post Instagram qui fait parler !,Public,2021-01-24
Télé-réalité : Le programme TV de ce dimanche 24 janvier 2021,Public,2021-01-24
"Camélia Jordana, blasée par les polémiques : ""Les réseaux sociaux déforment, critiquent, moquent... Je suis habituée""",Public,2021-01-24
Élie Semoun : L'humoriste pousse un nouveau coup de gueule après sa censure,Public,2021-01-24
"Carla Bruni : Ces ""prédateurs"" qu'elle a évités quand elle était mannequin...",Public,2021-01-24
Jade Hallyday à Los Angeles : son chéri Tristan s'éclate à Marrakech avec une jolie blonde,Public,2021-01-24
Kim Glow annonce la date du troisième confinement : la toile s'embrase,Public,2021-01-24
Pauline Tantot pose entièrement nue : ce cliché qui enflamme Instagram,Public,2021-01-24
"Kate Middleton et le prince William agrandissent la famille : découvrez leur nouvelle ""baby girl"" !",Public,2021-01-24
Horoscope du jour (dimanche 24 janvier 2021),Public,2021-01-24
"Kamila (Secret Story) : cette photo publiée sur Instagram 2 mois après son accouchement, choque la toile",Public,2021-01-24
"Ingrid Chauvin : Son fils la questionne sur sa soeur décédée, la comédienne raconte...",Public,2021-01-24
Colombie : la Farc enterre son nom de guerre et devient les «Communs»,Figaro,2021-01-24
Côtes-d’Armor : images «insoutenables» de cochons en putréfaction dans un élevage,Figaro,2021-01-24
"Christel Heydemann, militante de l’industrie",Figaro,2021-01-24
"L'ancien parlementaire Jean-Pierre Michel, un des initiateurs du Pacs, est mort",Figaro,2021-01-24
Toulon fait plier le Stade Français,Figaro,2021-01-24
Est-il insensé de se marier cette année?,Figaro,2021-01-24
Alain Van Groenendael: «Nos équipes doivent être aussi diverses que celles de nos clients»,Figaro,2021-01-24
Lyon s’offre le derby face à St-Etienne,Figaro,2021-01-24
"Masques, distanciation sociale, gestes barrières : le point sur les dernières recommandations",Figaro,2021-01-24
"Nicolas Baverez: «Rachat de Carrefour, le populisme étatiste»",Figaro,2021-01-24
"Cyclisme: Alaphilippe, Pinot, AG2R-Citroën... Les ambitions françaises à la loupe",Figaro,2021-01-24
Nord Stream 2 : le navire russe entame les travaux d'achèvement du gazoduc,Figaro,2021-01-24
Changement de sexe: quid du «consentement» des mineurs?,Figaro,2021-01-24
"France, Algérie : les présidents Macron et Tebboune s'engagent à retravailler bientôt ensemble",Figaro,2021-01-24
«Yuriy et notre jeunesse»,Figaro,2021-01-24
Covid-19 : la pression hospitalière continue de s'accroître,Figaro,2021-01-24
"Violences à Paris: l’émotion et les questions après le lynchage de Yuriy, 15 ans",Figaro,2021-01-24
Lynchage de Yuriy: «Beaucoup d’agresseurs ne connaissent que la loi du plus fort»,Figaro,2021-01-24
"Emploi, chômage... Les mots et les chiffres ne reflètent plus la réalité",Figaro,2021-01-24
Portugal : le président sortant réélu dès le premier tour,Figaro,2021-01-24
Mayotte : trois personnes tuées et des habitations détruites,Figaro,2021-01-24
Reconfinement: les écoles pourraient rester ouvertes,Figaro,2021-01-24
"Guillaume Tabard: «Macron, les Français et le reconfinement, les mots pour le dire»",Figaro,2021-01-24
Une fusée de SpaceX envoie un nombre record de satellites dans l'espace,Figaro,2021-01-24
Colombie : au moins quatre morts et trois blessés lors d'un nouveau massacre,Figaro,2021-01-24
Donald Trump divise le Parti républicain,Figaro,2021-01-24
Covid-19: l’exécutif prépare les esprits à un reconfinement,Figaro,2021-01-24
Élection présidentielle : Marine Le Pen devancerait Emmanuel Macron d'une courte tête au premier tour,Figaro,2021-01-24
Plus de 370 migrants secourus par l'Ocean Viking seront débarqués en Italie,Figaro,2021-01-24
Île-de-France: LREM cherche son candidat,Figaro,2021-01-24
"Face aux variants du Covid, le Pr Delfraissy plaide pour un reconfinement",Figaro,2021-01-24
Brexit: «L’Écosse appartient au Royaume-Uni tout en aimant l’Europe!»,Figaro,2021-01-24
«Le confinement des esprits nous guette aussi»,Figaro,2021-01-24
Covid-19: un flou persistant sur les chiffres des variants en France,Figaro,2021-01-24
"Lemaire, un vestiaire dans lequel il fait bon vivre",Figaro,2021-01-24
À quoi pourrait ressembler la guerre spatiale?,Figaro,2021-01-24
Israël «ferme son ciel» pour freiner la propagation du Covid-19,Figaro,2021-01-24
Pourquoi lisons-nous notre horoscope?,Figaro,2021-01-24
Gérard Larcher: «Un reconfinement total aurait des conséquences humaines très fortes»,Figaro,2021-01-24
Jean Castex critique le découpage des grandes régions,Figaro,2021-01-24
La mosquée de Lunel toujours sous étroite surveillance,Figaro,2021-01-24
Israël annonce l'ouverture d'une ambassade aux Émirats arabes unis,Figaro,2021-01-24
L’Investissement mondial en chute libre,Figaro,2021-01-24
Covid-19 : heurts avec la police en marge de manifestations anti-couvre-feu aux Pays-Bas,Figaro,2021-01-24
"«Marcelo», ce président si proche des Portugais",Figaro,2021-01-24
Lille domine Rennes,Figaro,2021-01-24
Un dealer sorti du CHU de Nantes par un commando,Figaro,2021-01-24
Un skieur de randonnée tué par une avalanche en Savoie,Figaro,2021-01-24
"Covid-19: plus contagieux, le virus anglais serait aussi plus mortel",Figaro,2021-01-24
Les détenus affluent à nouveau en prison,Figaro,2021-01-24
"Ski de randonnée dans les Pyrénées: de Font-Romeu à Hautacam, notre sélection d'itinéraires",Figaro,2021-01-24
Macron vante le plan de relance auprès des patrons étrangers,Figaro,2021-01-24
Le roi du liège Amorim en passe d’en finir avec le «goût de bouchon»,Figaro,2021-01-24
Le gouvernement a-t-il le droit à l’erreur?,Figaro,2021-01-24
Crédit mutuel: nouvelles empoignades avec Arkéa,Figaro,2021-01-24
Assurance-chômage: chronique d’une réforme ambitieuse qui s’est fracassée sur le mur de la crise,Figaro,2021-01-24
"Au Venezuela, le Covid exacerbe le dénuement et la répression",Figaro,2021-01-24
Metz s’impose face à Nantes,Figaro,2021-01-24
Dijon accroché par Strasbourg,Figaro,2021-01-24
Covid-19: les Etats-Unis dépassent la barre des 25 millions de cas recensés,Figaro,2021-01-24
Reims domine Brest,Figaro,2021-01-24
L’unité du Royaume-Uni se fissure de plus en plus,Figaro,2021-01-24
«Vous voulez que je me fasse opérer ?» : Johnny Flynn répond aux critiques sur son manque de ressemblance avec David Bowie,Figaro,2021-01-24
Droits TV: le Top 14 lance à son tour son appel d’offres,Figaro,2021-01-24
Mali : six soldats maliens tués et 18 blessés dans deux attaques «terroristes»,Figaro,2021-01-24
L'incroyable succès de Marmiton en 2020,Figaro,2021-01-24
Élisabeth Borne reprend la concertation sur l’Assurance-chômage,Figaro,2021-01-24
Citroën à l’assaut de la forteresse indienne,Figaro,2021-01-24
L’informaticien Razer se diversifie dans les services financiers,Figaro,2021-01-24
Des migrants occupent une école parisienne pour réclamer leur mise à l'abri,Figaro,2021-01-24
