titre,journal,date
Alain Peyrefitte : « Le JT se faisait dans le bureau du ministre »,La Point,2021-01-07
"Elon Musk, fondateur de Tesla, devient l'homme le plus riche du monde",La Point,2021-01-07
Covid-19 : ce qu'il faut retenir des annonces de Jean Castex,La Point,2021-01-07
Covid : la fin de l'exception nipponne,La Point,2021-01-07
Lille: opération escargot de grossistes en boissons pour réclamer des aides face au Covid,La Point,2021-01-07
"Trump condamne les violences, promet une transition ""sans accrocs""",La Point,2021-01-07
Portugal : plus de restrictions face à la hausse des contaminations,La Point,2021-01-07
Alain Delon : ses blessures d'enfance racontées par son demi-frère,La Point,2021-01-07
Jean-François Revel : « Les terroristes tuent faute de pouvoir convaincre »,La Point,2021-01-07
Le rachat de Tiffany par le géant du luxe LVMH finalisé,La Point,2021-01-07
M. Issoufou : « Pas d'institutions fortes en tripotant les Constitutions »,La Point,2021-01-07
Dix facteurs qui augmentent les risques d'Alzheimer,La Point,2021-01-07
"Grippe aviaire « hors de contrôle » dans le Sud-Ouest, 350 000 canards abattus",La Point,2021-01-07
Guerre Suez-Veolia : « Il est temps que les masques tombent »,La Point,2021-01-07
Covid-19 : l'épidémie est-elle en train de repartir ?,La Point,2021-01-07
Covid-19: nouvel état d'urgence dans le grand Tokyo,La Point,2021-01-07
Alain Delon : ses blessures d'enfance racontées par son demi-frère,La Point,2021-01-07
Erdogan veut contrôler la plus grande université d'Istanbul,La Point,2021-01-07
Explosion de la rue de Trévise: des victimes vont assigner GRDF pour être indemnisées,La Point,2021-01-07
"NextEra, le géant vert de l'énergie",La Point,2021-01-07
Affaire Duhamel : le directeur de Sciences Po admet avoir été alerté,La Point,2021-01-07
Chantage à la sextape : Karim Benzema renvoyé devant le tribunal correctionnel de Versailles,La Point,2021-01-07
Donald Trump face au Capitole : ce moment où tout a basculé,La Point,2021-01-07
Hommages sobres aux victimes des attentats de janvier 2015,La Point,2021-01-07
Le maire de Marseille veut élargir la vaccination prioritaire aux personnels des écoles,La Point,2021-01-07
L'homme qui a attaqué des militaires au Louvre en 2017 renvoyé aux assises,La Point,2021-01-07
Chantage à la sextape : Benzema renvoyé devant le tribunal correctionnel,La Point,2021-01-07
Couvre-feu à 18 heures : les départements qui pourraient basculer,La Point,2021-01-07
"Six ans après, hommages sobres et restreints aux victimes des attentats de janvier 2015",La Point,2021-01-07
"Couvre-feu, vaccination? Que va annoncer Jean Castex ?",La Point,2021-01-07
Covid-19 : l'OMS tire le signal d'alarme concernant le variant en Europe,La Point,2021-01-07
Chantage à la sextape: Karim Benzema renvoyé devant le tribunal correctionnel de Versailles,La Point,2021-01-07
Gérardmer : le film fantastique se met en ligne,La Point,2021-01-07
Il menace de décapiter un sociologue : quatre mois de prison avec sursis,La Point,2021-01-07
"En unité gériatrique, le vaccin contre le Covid-19 rime avec espoir",La Point,2021-01-07
"Les États-Unis ébranlés, les autocrates confortés",La Point,2021-01-07
"Algérie : 2021, année politique",La Point,2021-01-07
Rave party en Bretagne : quatre personnes en garde à vue,La Point,2021-01-07
Philippe Labro – États-Unis : « La guerre de Sécession n'est pas terminée »,La Point,2021-01-07
Covid-19 : Dakar réagit (mal) au couvre-feu,La Point,2021-01-07
Covid-19 : l'épidémie est-elle en train de repartir ?,La Point,2021-01-07
Philippe Labro - États-Unis : « La guerre de Sécession n'est pas terminée »,La Point,2021-01-07
Les dirigeants européens condamnent (presque) tous l'envahissement du Capitole,La Point,2021-01-07
Prix des services bancaires: les clients appelés plus que jamais à jouer la concurrence,La Point,2021-01-07
"Lancement d'un ""éco-score"" pour évaluer l'impact environnemental des produits alimentaires",La Point,2021-01-07
"Couvre-feu, vaccination… Que va annoncer Jean Castex ?",La Point,2021-01-07
"Fête sauvage en Bretagne: plusieurs interpellations, selon le parquet",La Point,2021-01-07
Covid-19 : Bayer va développer un vaccin avec CureVac,La Point,2021-01-07
Quel chronographe choisir ?,La Point,2021-01-07
Covid-19 : les grandes promesses du vaccin britannique,La Point,2021-01-07
Corée du Nord: Kim promet de renforcer les capacités militaires du pays,La Point,2021-01-07
Biden confirmé président d'une Amérique ébranlée par les violences des pro-Trump,La Point,2021-01-07
"« Je crains que 2021 ne soit, financièrement, une année encore plus violente »",La Point,2021-01-07
« Quel poste veux-tu ? » : les extraits du livre de Bruno Le Maire,La Point,2021-01-07
"En Arabie saoudite, des procès d'opposants tous azimuts avant l'ère Biden",La Point,2021-01-07
Tesla grimpe au firmament de la Bourse avec + 743 % en 2020,La Point,2021-01-07
Théâtre - Ouagadougou sur scène,La Point,2021-01-07
La Minute antique - Le sens de la fête,La Point,2021-01-07
Livres – Les meilleures ventes de la Fnac,La Point,2021-01-07
"Livre - Fabrice Amedeo, skipper et conteur",La Point,2021-01-07
Hongkong : la grande rafle de l'opposition,La Point,2021-01-07
État-major - Frans Bonhomme,La Point,2021-01-07
"Il y a 50 ans, Mademoiselle Chanel tire sa révérence",La Point,2021-01-07
"Insurgés au Capitole: Trump ""n'a pas mesuré la portée de ses propos"", selon Marine Le Pen",La Point,2021-01-07
Capitole envahi par des pro-Trump : « Ça peut tourner à la guerre civile »,La Point,2021-01-07
L’ultradroite prête à « allumer la mèche »,La Point,2021-01-07
États-Unis : le démocrate Ossoff revendique la victoire aux sénatoriales en Géorgie,La Point,2021-01-07
Covid-19: 200 artistes dont Arielle Dombasle et Daniel Auteuil appellent à se faire vacciner,La Point,2021-01-07
Corée du Nord: Kim promet de renforcer les capacités de défense,La Point,2021-01-07
"Vaccin : McKinsey, une prestation à 2 millions d'euros par mois",La Point,2021-01-07
Cachemire: tension accrue sur la ligne de cessez-le-feu entre l'Inde et le Pakistan,La Point,2021-01-07
Les remontées mécaniques ne rouvriront pas jeudi,La Point,2021-01-07
"Acheter à manger, l'autre raison qui pousse les Vénézuéliens vers Trinité-et-Tobago",La Point,2021-01-07
"« On a construit une campagne de vaccination pour ne pas effrayer les vaccino-sceptiques""",La Point,2021-01-07
Prescription : pourquoi la « grande loi de l'oubli » est de plus en plus contestée,La Point,2021-01-07
"En forme - Catherine MacGregor, nouvelle directrice générale d’Engie",La Point,2021-01-07
Médias publics et partis politiques en Italie : les liaisons dangereuses,La Point,2021-01-07
Gernelle – Vaccination : la malédiction de « l'absolutisme inefficace »,La Point,2021-01-07
Les indiscrets du « Point » – Quand les Premiers ministres cultivent leur jardin,La Point,2021-01-07
Plusieurs appels à destituer Trump au lendemain de la prise du Capitole,La Point,2021-01-07
Hong Kong: le vaste coup de filet suscite une avalanche de condamnations,La Point,2021-01-07
Japon: état d'urgence imminent face au Covid-19,La Point,2021-01-07
La femme abattue au Capitole a succombé à un tir de la police (officiel),La Point,2021-01-07
Pétrolier saisi: une délégation sud-coréenne en route pour l'Iran,La Point,2021-01-07
Chine: les nouveaux cas de Covid-19 au plus haut depuis six mois,La Point,2021-01-07
"Washington songe à bannir les groupes chinois Alibaba, Tencent de la cote",La Point,2021-01-07
"Violences à Washington: Macron appelle à ""ne rien céder"" face à ""la violence de quelques-uns"" contre les démocraties",La Point,2021-01-07
Twitter et Facebook suspendent Donald Trump après des violences à Washington,La Point,2021-01-07
"Covid-19 : Castex maintient toutes les restrictions, accélère la vaccination",La Point,2021-01-07
"Du discours de Trump à l'intrusion des manifestants au Congrès, le film des événements",La Point,2021-01-07
Les images incroyables des pro-Trump investissant le Capitole,La Point,2021-01-07
"Architecture – Cahors, des briques en clair-obscur",La Point,2021-01-07
Chaos et champ de bataille au Congrès américain,La Point,2021-01-07
"Les Marseillais saison 10 : Quels candidats, quelle destination et quels clashs pour cette année spéciale ? On vous dit tout",Public,2021-01-07
"""Ce n'était plus possible""... : Cette révélation ""horrible"" d'Iris Mittenaere sur le concours Miss France qui risque de mettre le feu aux poudres",Public,2021-01-07
"Stéphane Plaza prêt à ""abandonner"" son émission 'Recherche appartement ou maison' : il a déjà trouvé son remplaçant !",Public,2021-01-07
Télé-réalité : Le programme TV de ce jeudi 7 janvier 2021,Public,2021-01-07
"Meghan Markle : en 2020, elle a dépensé une fortune pour s'habiller (à ses frais) !",Public,2021-01-07
Kylian Mbappé pas content : Cette star du ballon rond vient de lui chiper un titre cher à ses yeux...,Public,2021-01-07
Vincent Queijo et Thibault Garcia accusés de racisme: cette vidéo CHOQUANTE et compromettante qui vient de refaire surface,Public,2021-01-07
Karine Ferri : cette protection contre la magie noire qu'elle vient d'afficher sur Instagram,Public,2021-01-07
Igor et Grichka Bogdanoff renvoyés en correctionnelle : le détail du butin qu'ils auraient escroqué à un millionnaire,Public,2021-01-07
Zapping : Lio dévoile sa poitrine dans les Reines du shopping (M6),Public,2021-01-07
Chute de cheveux : 3 produits à tester pour retrouver des cheveux sains et denses,Public,2021-01-07
"""Viens tout de suite, on va en bas de chez toi"" : ce jour où Cyril Hanouna a failli en venir aux mains avec Arthur",Public,2021-01-07
Horoscope du jour (jeudi 7 janvier 2021),Public,2021-01-07
Star Academy : Une ex-candidate traumatisée par l'émission ? Elle témoigne !,Public,2021-01-07
Lorie maman : Le jour où la chanteuse a quitté la France pour avoir un enfant,Public,2021-01-07
"""Demandez plutôt à ma femme..."" : Mélanie Thierry infidèle ? son compagnon Raphaël fait d'étranges révélations",Public,2021-01-07
Shy’m tiraillée… Cette décision difficile à prendre,Public,2021-01-07
Marie-Sophie Lacarrau sans maquillage et en petite tenue… Elle se la coule douce au soleil,Public,2021-01-07
Gad Elmaleh : L'humoriste interroge ses parents sur le vaccin et leur réponse est hilarante !,Public,2021-01-07
PHOTOS : Kim Kardashian en plein divorce avec Kanye West : retour sur les ex des femmes du clan Kardashian-Jenner,Public,2021-01-07
Affaire de la sextape : Karim Benzema à nouveau dans la tourmente…,Public,2021-01-07
"""Je suis à deux doigts de lui envoyer le grand frère"" : Cyril Hanouna recarde Jade Hallyday dans TPMP !",Public,2021-01-07
Les Reines du Shopping : Lio défile sur du Aya Nakamura et montre ses seins !,Public,2021-01-07
Camille Lacourt officialise la grossesse d’Alice Detollenaere sur Instagram !,Public,2021-01-07
Magazine Public – Rien ne va plus entre Albert et Charlène !,Public,2021-01-07
Pascal Praud (L'heure des pros) : cette blague sur la pédophilie qui scandalise...,Public,2021-01-07
"[INRQ] : Koh-Lanta, jeu vidéo et sport, Lola Labesse fait son choix (Exclu)",Public,2021-01-07
Crush mode : vous allez toutes craquer pour cette paire de sneakers !,Public,2021-01-07
"Amandine Petit : après Miss France, elle est déjà prête à tacler Karine Ferri !",Public,2021-01-07
Photos - Elon Musk devient l'homme le plus riche du monde : découvrez le top 4 !,Public,2021-01-07
"Sylvie Tellier dans TPMP : elle laisse un message à Jean-Pascal Lacoste, en douce !",Public,2021-01-07
"Koh Lanta les 4 Terres : une candidate agressée et ""impuissante"" face à son fils tabassé devant ses yeux... ""Ils vont payer !""",Public,2021-01-07
La Californie déploie 166 remorques frigorifiques pour les morts du Covid,Figaro,2021-01-07
"Les pays pauvres recevront des vaccins dans les semaines à venir, promet l'OMS",Figaro,2021-01-07
"À Washington, la chute de la maison Trump",Figaro,2021-01-07
Covid-19: le Brésil dépasse le seuil des 200.000 morts,Figaro,2021-01-07
Patrick Balkany placé en garde à vue dans le cadre d'une nouvelle affaire judiciaire,Figaro,2021-01-07
La grande peur des coupures hivernales d'électricité,Figaro,2021-01-07
Tout ce qu’il faut savoir sur la nouvelle Moonwatch d’Omega ,Figaro,2021-01-07
"Dow Jones, Nasdaq et S&amp;P 500 terminent sur des records à Wall Street",Figaro,2021-01-07
Crash des 737 Max : Boeing admet avoir trompé le régulateur américain,Figaro,2021-01-07
Vendée Globe : Pourquoi la gestion de la nourriture pourrait virer au casse-tête pour les marins,Figaro,2021-01-07
Séquestration et viol d'une jeune fille dans l'Oise: cinq personnes mises en examen,Figaro,2021-01-07
Grippe aviaire : doublement du nombre de foyers dans le Sud-Ouest,Figaro,2021-01-07
Assaut du Capitole: l'ONU dénonce une «incitation à la violence»,Figaro,2021-01-07
Le coût des catastrophes naturelles a bondi en 2020,Figaro,2021-01-07
"«Algues cuites-poissons volants» au menu, pêche miraculeuse et kilos envolés : quand les marins du Vendée Globe jouent les Robinson Crusoé",Figaro,2021-01-07
Il avait sorti son arme face à un détenu: un policier condamné à 10 mois avec sursis,Figaro,2021-01-07
Seine-Saint-Denis: quatre suspects mis en examen après un meurtre à Saint-Ouen,Figaro,2021-01-07
Jean Castex lance le quatrième programme d’investissements d’avenir,Figaro,2021-01-07
"Le dollar se reprend, les cambistes ignorent le chaos au Capitole",Figaro,2021-01-07
Israël: confinement prolongé après une hausse des cas,Figaro,2021-01-07
Le pétrole continue de progresser à de nouveaux plus hauts depuis février,Figaro,2021-01-07
Covid-19: tests obligatoires pour les vols de la Guyane aux Antilles,Figaro,2021-01-07
L'Etat prêt à un nouveau soutien financier pour une importante usine de pâte à papier,Figaro,2021-01-07
TechnipFMC se sépare de son activité française d’ingénierie,Figaro,2021-01-07
"Une ministre de Trump, Elaine Chao, annonce démissionner après les violences du Capitole",Figaro,2021-01-07
Covid-19: 21.703 nouveaux cas détectés et 277 décès en 24 heures,Figaro,2021-01-07
"Chicago: prises de profits et pluies font baisser blé, maïs et soja",Figaro,2021-01-07
États-Unis: «Recoller les morceaux»,Figaro,2021-01-07
"Avec Firestone, LafargeHolcim se diversifie dans les toitures",Figaro,2021-01-07
Comment la France accélère la cadence de la vaccination,Figaro,2021-01-07
Sciences Po secouée par l’affaire Duhamel,Figaro,2021-01-07
Capitole: démettre Trump est une «urgence de la plus haute importance» affirme Nancy Pelosi,Figaro,2021-01-07
La Turquie se dit prête à «normaliser» ses rapports avec la France,Figaro,2021-01-07
États-Unis: Joe Biden sur un volcan,Figaro,2021-01-07
Les républicains écartelés après l’attaque du Congrès,Figaro,2021-01-07
Les Gafa à l’assaut du pré carré des banques,Figaro,2021-01-07
Prolongation d'un mois des tests Covid obligatoires pour aller en Corse,Figaro,2021-01-07
Haïti: le pouvoir contesté annonce des élections et un référendum sur une nouvelle constitution,Figaro,2021-01-07
Covid-19: Jean Castex prépare les esprits à de nouvelles restrictions ,Figaro,2021-01-07
Tué par un mortier d'artifice: ouverture d'une information pour «homicide involontaire»,Figaro,2021-01-07
"Guillaume Perrault: «Violence et légalisme, une tension au coeur de la culture américaine»",Figaro,2021-01-07
Olivier Piton: «Les stigmates du 6 janvier vont peser longtemps sur le parti républicain»,Figaro,2021-01-07
Premier survol par Qatar Airways de l'Arabie saoudite depuis la crise,Figaro,2021-01-07
Guillaume Tabard: «Emmanuel Macron joue la carte du leadership de la démocratie»,Figaro,2021-01-07
Un syndicat dénonce la multiplication des plans sociaux dans les filiales de Transdev,Figaro,2021-01-07
Jean-Yves Camus: «Trump a choisi la pire stratégie possible»,Figaro,2021-01-07
Christian Jacob: «Ce fiasco est de la responsabilité directe du président» ,Figaro,2021-01-07
Capitole envahi: Biden accuse Trump d'avoir «déchaîné un assaut sans merci contre les institutions» démocratiques,Figaro,2021-01-07
Ivan Rioufol: «L’État doit entendre la révolte qui monte»,Figaro,2021-01-07
Hugues Renson: «L’épidémie ne doit pas interdire le débat» ,Figaro,2021-01-07
"Laurent Saint-Martin: «En 2021, nous passons de la défensive à l’offensive» ",Figaro,2021-01-07
"Olivier Véran, un ministre dans la tempête",Figaro,2021-01-07
Covid-19 : comment prendre rendez-vous pour se faire vacciner ?,Figaro,2021-01-07
"L’étendard démocratique, porté par l’Amérique, est flétri",Figaro,2021-01-07
Les vaccins attisent la convoitise des groupes criminels et des activistes,Figaro,2021-01-07
Colmar : un prêtre violenté à l'heure de la messe,Figaro,2021-01-07
OPA: Veolia met la pression sur Suez et sur son chevalier blanc Ardian,Figaro,2021-01-07
Conseil national des imams: Macron appelle les musulmans à «dépasser les divergences»,Figaro,2021-01-07
"En 2021, Arianespace vise un lancement par mois... au minimum",Figaro,2021-01-07
Un magistrat parisien mis en examen pour proxénétisme,Figaro,2021-01-07
Doubs: un ostéopathe mis en examen pour viol et agression sexuelle,Figaro,2021-01-07
"Services financiers: aux États-Unis, une offre déjà bien étoffée pour les Gafa",Figaro,2021-01-07
La sélection Figaro Live: les vidéos qu'il ne fallait pas rater,Figaro,2021-01-07
Vaccin contre le Covid-19: l’incompréhensible pénurie de supercongélateurs en passe d’être résolue,Figaro,2021-01-07
LVMH nomme une équipe de choc pour refaire briller les diamants Tiffany,Figaro,2021-01-07
Gérard Araud: «Trump n’est que le symptôme d’une crise plus profonde»,Figaro,2021-01-07
La presse régionale enclenche une nouvelle étape de sa mutation numérique,Figaro,2021-01-07
Covid-19: pourquoi le variant anglais risque de rendre l’épidémie incontrôlable en France,Figaro,2021-01-07
"Port de Nantes Saint-Nazaire : trafic en baisse de 8,8% en 2020",Figaro,2021-01-07
Le prix du bitcoin dépasse 40.000 dollars pour la première fois,Figaro,2021-01-07
Laïcité: «Un enseignant sur quatre se censure plusieurs fois par an»,Figaro,2021-01-07
Militaires renversés à Levallois en 2017: le parquet antiterroriste demande les assises pour le conducteur,Figaro,2021-01-07
"Vaccins : deux semaines de retard, est-ce vraiment 15 morts qui auraient pu être évitées ?",Figaro,2021-01-07
Taxe Gafa : les États-Unis suspendent leurs sanctions douanières contre la France,Figaro,2021-01-07
Virus: l'Espagne dépasse le seuil des 2 millions de cas confirmés,Figaro,2021-01-07
"Jack Angeli et Richard «Bigo», figures démonstratives de l’insurrection",Figaro,2021-01-07
"Covid-19 : vaccin, couvre-feu, virus variants, restaurants, ski... Ce qu'il faut retenir des annonces de Castex",Figaro,2021-01-07
"Vanessa Kirby, l'actrice de Pieces of a Woman apporte son soutien aux victimes de Shia LaBeouf",Figaro,2021-01-07
«On a vu des gens qui ne reculent devant rien»: les Français de Washington stupéfaits par l'envahissement du Capitole,Figaro,2021-01-07
Vaccination: pourquoi la 6e dose des flacons Pfizer n’est pas (encore) utilisée en France,Figaro,2021-01-07
Manifestation du 12 décembre: une dizaine d'interpellés portent plainte contre Lallement,Figaro,2021-01-07
Le mouvement perpétuel des sœurs Labèque,Figaro,2021-01-07
YouTube va sanctionner les chaînes niant les résultats de l'élection américaine,Figaro,2021-01-07
Mali: Bamako assure que des opérations sujettes à questions visaient des djihadistes,Figaro,2021-01-07
TechnipFMC relance son projet de scission en deux entités,Figaro,2021-01-07
Symptômes Covid ou cas contact : arrêt de travail «immédiat» accessible à partir du 10 janvier,Figaro,2021-01-07
Covid-19 : les plus de 75 ans pourront se faire vacciner à partir du 18 janvier,Figaro,2021-01-07
Marne: le tribunal administratif rejette la demande d'un handicapé à se faire vacciner sans attendre,Figaro,2021-01-07
"Dix départements supplémentaires pourraient faire l'objet d'un couvre-feu à 18 heures, décision vendredi",Figaro,2021-01-07
Comment le Capitole a été envahi par les partisans de Donald Trump,Figaro,2021-01-07
"Covid-19 : pas de réouverture des bars, restaurants et remontées mécaniques avant février",Figaro,2021-01-07
Football: Téléfoot pourrait diffuser la Ligue 1 au-delà du 31 janvier,Figaro,2021-01-07
"La Bourse de Londres progresse malgré le chaos au Capitole (+0,22%)",Figaro,2021-01-07
"Musées, cinémas, équipements sportifs resteront fermés jusqu'à la fin du mois, annonce Castex",Figaro,2021-01-07
"Un consortium implanté en Guinée prend le contrôle d'Alteo, leader de l'alumine",Figaro,2021-01-07
Faudra-t-il partager plus de données avec Facebook pour utiliser WhatsApp ?,Figaro,2021-01-07
La sage «trahison» du loyal Mike Pence,Figaro,2021-01-07
Invasion du Capitole: l’incompréhensible absence et l’amateurisme des forces de sécurité,Figaro,2021-01-07
LCI et Le Point lancent une nouvelle émission de débat d'idées vendredi,Figaro,2021-01-07
"Covid-19 et voyage : quelles destinations possibles pour les Français ? Notre carte, pays par pays",Figaro,2021-01-07
La nouvelle parka de Canada Goose est-elle un modèle de vertu?,Figaro,2021-01-07
ESL Sondage Lyon (ex-Sofres) en liquidation judiciaire,Figaro,2021-01-07
Fusillade mortelle à Bordeaux : 4 des 5 suspects déférés en vue de leur mise en examen,Figaro,2021-01-07
"Urs Fischer, un souffle punk sur Louis Vuitton",Figaro,2021-01-07
Gonzalo Quesada dévoile les secrets du retour au sommet du Stade Français,Figaro,2021-01-07
"Dix ans après, cette ombre qui plane toujours sur la mort de deux otages",Figaro,2021-01-07
Dispositif médical : Thuasne rachète l'américaine Knit-Rite,Figaro,2021-01-07
Le Portugal veut ressusciter l’accord controversé entre l’Union européenne et le Mercosur,Figaro,2021-01-07
Arnaud Benedetti: «Le retard de vaccination en France a l’effet d’une humiliation collective»,Figaro,2021-01-07
Disputes arabes autour de l’esplanade des Mosquées à Jérusalem,Figaro,2021-01-07
"La Bourse de Paris clôture en hausse de 0,70%",Figaro,2021-01-07
Le nouveau président de la BBC confronté à de nombreux défis,Figaro,2021-01-07
L’aéronautique espère une éclaircie en 2021 grâce aux vaccins,Figaro,2021-01-07
Le président ivoirien perd un procès en diffamation contre un journaliste en France,Figaro,2021-01-07
Strasbourg: enquête après l'octroi douteux de 30 millions d'euros de prêts par une agence bancaire,Figaro,2021-01-07
La Centrafrique impose un couvre-feu face à la rébellion,Figaro,2021-01-07
Pourquoi les hommes préfèrent les poches,Figaro,2021-01-07
Tesla et SpaceX propulsent Elon Musk au sommet des fortunes mondiales,Figaro,2021-01-07
Variant britannique du coronavirus: «deux clusters à risque» détectés en France,Figaro,2021-01-07
Arrêtés anti-pesticides: le Conseil d'Etat dit définitivement non,Figaro,2021-01-07
InfraVia se diversifie dans la technologie,Figaro,2021-01-07
Tunisie: manifestation pour réclamer des infrastructures dans le bassin minier,Figaro,2021-01-07
Le mouvement pro-Brexit Leave.EU migre son site internet vers l'UE pour conserver son adresse européenne,Figaro,2021-01-07
Brexit: Girardin rassure les pêcheurs normands inquiets pour les eaux de Jersey,Figaro,2021-01-07
Julien Maldonato: «L’objectif des Gafa est de placer le consommateur dans une bulle»,Figaro,2021-01-07
Fret SNCF continue sa cure de minceur pour ne pas disparaître,Figaro,2021-01-07
Les Chinois prisent les marques de voitures électriques locales,Figaro,2021-01-07
Assaut du Capitole: Bolsonaro soutient Trump jusqu'au bout,Figaro,2021-01-07
Une délégation américaine de haut rang en visite à Alger,Figaro,2021-01-07
"Après l'invasion du Capitole, Donald Trump pourrait-il être destitué?",Figaro,2021-01-07
"Non, le chanteur de Jamiroquai n'a pas envahi le Capitole mercredi",Figaro,2021-01-07
Atos effraie les investisseurs en visant DXC Technology,Figaro,2021-01-07
Le télétravail a-t-il fait grimper les prix de l'immobilier dans les villes moyennes ?,Figaro,2021-01-07
«La politique française meurt de ne plus avoir des hommes comme Philippe Séguin»,Figaro,2021-01-07
Bourse de Francfort : le Dax pour la première fois au-dessus des 14.000 points,Figaro,2021-01-07
Un magistrat pour diriger l’école du barreau de Paris,Figaro,2021-01-07
Taxes : les exportations de vins et spiritueux français aux États-Unis devraient chuter d'un milliard d'euros par an,Figaro,2021-01-07
Bitcoin contre euro numérique: «Une nouvelle guerre des monnaies se profile»,Figaro,2021-01-07
Covid-19 : les tests salivaires EasyCov désormais remboursés,Figaro,2021-01-07
Pourquoi Wall Street est au plus haut alors que Donald Trump enflamme Washington,Figaro,2021-01-07
RDC: «impossible dépolitisation» de la commission électorale avant 2023,Figaro,2021-01-07
Le déficit commercial du Canada recule en novembre grâce à l'or,Figaro,2021-01-07
"Sara Giraudeau, la force tranquille",Figaro,2021-01-07
Covid-19: aucun résultat positif détecté après un concert-test avec 463 personnes à Barcelone,Figaro,2021-01-07
"Aéronautique: 30.000 emplois supprimés en France, autant sauvés en 2020 , indique le Gifas",Figaro,2021-01-07
"Après Bob Dylan, Neil Young vend une partie de son catalogue",Figaro,2021-01-07
"Tiffany: le rachat par LVMH finalisé, le patron du joaillier va quitter le groupe",Figaro,2021-01-07
États-Unis: légère baisse des inscriptions au chômage pour la dernière semaine de 2020,Figaro,2021-01-07
Carrière : cultivez ces compétences qui font vraiment la différence,Figaro,2021-01-07
