titre,journal,date
Covid-19 : le diocèse de Vannes installe des distributeurs d'eau bénite,Figaro,2021-01-24
"Rick Owens, brutalement honnête",Figaro,2021-01-24
Le pas de côté des danseurs étoiles,Figaro,2021-01-24
Wales Bonner présente une collection entre Caraïbes et Angleterre,Figaro,2021-01-24
"Premier entretien téléphonique entre Macron et Biden : une «grande convergence de vues», selon l’Élysée",Figaro,2021-01-24
Seine-Saint-Denis : un homme tué de plusieurs coups de couteau,Figaro,2021-01-24
Les festivals de cinéma résistent en ligne,Figaro,2021-01-24
Les habitants de la Roya de nouveau victimes d'intempéries,Figaro,2021-01-24
"Emmené par un grand Hwang Ui-Jo, Bordeaux surclasse Angers",Figaro,2021-01-24
Régionales : Jean-Yves Le Drian ne sera pas candidat en Bretagne,Figaro,2021-01-24
"Covid-19 : pour Jean Rottner, «la décision du confinement est irrémédiable»",Figaro,2021-01-24
"La nouvelle collection Hermès, taillée pour aujourd'hui",Figaro,2021-01-24
"Avec «Les bureaux du cœur», ils ouvrent leurs entreprises à des SDF pendant la nuit",Figaro,2021-01-24
Danemark : nouveaux incidents lors d'une manifestation contre les restrictions,Figaro,2021-01-24
Annecy : un jeune homme de 18 ans soupçonné d'avoir tué le père de sa petite amie,Figaro,2021-01-24
"Théâtres, cinémas, concerts : l'exception culturelle espagnole en pleine pandémie",Figaro,2021-01-24
«Dieu seul le sait» N°23 : Les clés du labyrinthe de la charte des imams,Figaro,2021-01-24
Yvelines : un jeune de 23 ans meurt poignardé dans une cité,Figaro,2021-01-24
Covid : le protocole en entreprise va être adapté sur les masques,Figaro,2021-01-24
"Entre couvre-feu et restrictions, qu'écoutent les Français pour garder le moral ?",Figaro,2021-01-24
Pays- Bas : un homme soupçonné d'être le baron de la drogue en Asie arrêté,Figaro,2021-01-24
Australie : un homme retrouvé après avoir disparu dans le «bush» désertique et coupé du monde,Figaro,2021-01-24
Tesla accuse un ancien salarié du vol de 26.000 fichiers confidentiels,Figaro,2021-01-24
Mexique : 19 corps calcinés retrouvés près de la frontière avec les Etats-Unis,Figaro,2021-01-24
Covid-19 : êtes-vous favorable à un 3e confinement ?,Figaro,2021-01-24
Quelle nouvelle montre pour Arsène Lupin?,Figaro,2021-01-24
Le juge Edouard Durand prend la tête de la commission sur l'inceste,Figaro,2021-01-24
"Gustave Flaubert, la fureur d'écrire: le misanthrope",Figaro,2021-01-24
La Nouvelle-Zélande enregistre son premier cas local de Covid-19 en plus de deux mois,Figaro,2021-01-24
"Tony Curtis, itinéraire d’un enfant du Bronx sur Arte",Figaro,2021-01-24
Le squelette du nouveau plus grand dinosaure pourrait avoir été trouvé,Figaro,2021-01-24
Manifestation à Rennes pour défendre les «free parties»,Figaro,2021-01-24
"Covid-19 : en cas de reconfinement, les écoles pourraient rester ouvertes",Figaro,2021-01-24
Seul un amoureux de la cuisine française aura un 10/10 à ce test ,Figaro,2021-01-24
"À la frontière États-Unis-Mexique, les balançoires de Ronald Rael remportent le prix Beazley Design",Figaro,2021-01-24
"Au Pérou, une cité archéologique vieille de 5000 ans, défigurée par des baraquements",Figaro,2021-01-24
Antarctique : fort séisme près d'une base chilienne,Figaro,2021-01-24
La popularité d'Emmanuel Macron est en hausse,Figaro,2021-01-24
L'éphéméride du dimanche 24 janvier 2021,Figaro,2021-01-24
"Sur les flots de la Baltique, les archéologues font la chasse aux pillards d'épaves",Figaro,2021-01-24
