titre,journal,date
Extrême droite : des Zouaves devant la justice,Charlie Hebdo,2021-01-22
CNews : Donald Trump bientôt recruté,Charlie Hebdo,2021-01-22
Résolution 2021 : la vaccination ou sinon...,Charlie Hebdo,2021-01-22
"L'écologie, c'est aussi pour les oreilles",Charlie Hebdo,2021-01-22
"Annulation des épreuves de spécialité du bac, tests à l'arrivée sur le territoire... l'actu de ce vendredi",Libération,2021-01-22
"«Si l’on veut réensauvager les humains, il faut leur permettre de vivre à leurs rythmes, dans leurs territoires»",Libération,2021-01-22
"Face aux inquiétudes, Blanquer annule les épreuves de spécialité du bac prévues en mars",Libération,2021-01-22
"Face au Covid, Joe Biden promet un «effort de guerre»",Libération,2021-01-22
Qui lit-on sur Wattpad ?,Libération,2021-01-22
«Le Monde» : Plantu remballe ses crayons,Libération,2021-01-22
Nouvel effet collatéral de la pandémie : le retour du «man bun»,Libération,2021-01-22
"A la Fashion week, des messages plus ou moins sages",Libération,2021-01-22
"Silence on joue ! «Hitman 3», «Bridge Constructor»",Libération,2021-01-22
Olivier Véran s'emmêle les seringues sur l'objectif de vaccination,Libération,2021-01-22
Vaccination : «J’ai le sentiment d’une compétition entre les municipalités»,Libération,2021-01-22
L’innovation n’est pas un dogme,Libération,2021-01-22
"Rémy Julienne, le saut de la mort",Libération,2021-01-22
"Après Trump, il est urgent d'encadrer les géants du numérique",Libération,2021-01-22
Covid : des mois de convalescence et toujours pas d'odorat,Libération,2021-01-22
"Sébastien Lecornu, un ministre aux déclarations d’intérêts approximatives",Libération,2021-01-22
La vague MeToo atteint à son tour la communauté gay,Libération,2021-01-22
"Votre liseuse a changé, découvrez les nouvelles fonctionnalités",Libération,2021-01-22
Police : pour une remise en cause de la politique du chiffre,Libération,2021-01-22
"Annulation des épreuves de spécialités : «On n’est pas du tout plus sereins. A chaque seconde, c’est le bac»",Libération,2021-01-22
"Avenir lycéen : cette fois, le ministère saisit l'Inspection générale",Libération,2021-01-22
Rupture sans séparation: quand le groupe survit au couple,Libération,2021-01-22
Ne pas confondre : «Stairway to heaven» I,Libération,2021-01-22
La Rome antique de pire empire,Libération,2021-01-22
La Pochette de Chevalrex : «Il y a une ambiguïté dans cette image»,Libération,2021-01-22
Le pastis met l’eau au bush,Libération,2021-01-22
"Gulbahar Haitiwaji, contre leurs camps",Libération,2021-01-22
Hellène et les heures sombres,Libération,2021-01-22
Scorsese fan de Fran,Libération,2021-01-22
"«America», quatre ans et puis s’en va",Libération,2021-01-22
Le râleur à la Rolls : retrouver Thomas Bernhard,Libération,2021-01-22
"Musique : sur les albums, le nom le plus long",Libération,2021-01-22
"Bicep, la possibilité d’un «Isles»",Libération,2021-01-22
Andrea Laszlo De Simone invite à un slow avec la Terre,Libération,2021-01-22
"Sandro Veronesi: «Ne pas bouger, comme un colibri, c’est l’anti-mythe de ma vie»",Libération,2021-01-22
La vie en doses,Libération,2021-01-22
Usine et out,Libération,2021-01-22
La guerre intérieure d’UssaR,Libération,2021-01-22
"Geoffroy Monde, le mythe l’habite",Libération,2021-01-22
Frederik Peeters : «Le plaisir de dessiner tient à une forme de transe»,Libération,2021-01-22
Marc Toesca : «L’auto-tune me met en rage»,Libération,2021-01-22
Playlist,Libération,2021-01-22
Erudit rap,Libération,2021-01-22
Xavier Gorce et «le Monde» : il est permis de polémiquer contre les polémistes,Libération,2021-01-22
Classement datalib des meilleures ventes de livres (semaine  du 15 au 21/01/2021),Libération,2021-01-22
Institut de vandalisme comparé,Libération,2021-01-22
Comment déloger l’ombre de sa mère,Libération,2021-01-22
Etre dans son genre,Libération,2021-01-22
Le complot aux roses,Libération,2021-01-22
"Diary Sow, la fin du mystère ?",Libération,2021-01-22
"Patrick Chappatte : «Si on ne veut plus d’aspérités, oublions le dessin de presse»",Libération,2021-01-22
"Russie : les partisans de Navalny se mobilisent en masse, les autorités sortent les griffes",Libération,2021-01-22
«On sent un redémarrage fort» : les Alpes-Maritimes en proie à une flambée épidémique,Libération,2021-01-22
Chantier de Notre-Dame : du renfort pour les voûtes,Libération,2021-01-22
«L’Equipe» : les salariés sifflent la suspension de la grève,Libération,2021-01-22
"Titanosaures : la Patagonie patrie du gigantisme, l'Europe du nanisme",Libération,2021-01-22
"Japon: aux toilettes, en entreprise, à l’école, les photos volées omniprésentes",Libération,2021-01-22
Sexisme : les athlètes japonaises aimeraient qu’on leur lâche les baskets,Libération,2021-01-22
"Covid-19 : Pourquoi Véran a-t-il parlé de 15 millions de vaccinés d'ici fin juin, puis de 43 millions quelques heures plus tard ?",Libération,2021-01-22
Billet Chasse aux lascars,Libération,2021-01-22
"Le vélo-cargo, très porteur",Libération,2021-01-22
"Fashion Week, l’homme au calme",Libération,2021-01-22
Carnet d’échecs,Libération,2021-01-22
"Le variant britannique plus mortel selon Boris Johnson, Plantu prend sa retraite, #MeTooGay : l'essentiel de l'actualité de ce vendredi",Libération,2021-01-22
Alexeï Navalny : une mobilisation promise à la répression,Libération,2021-01-22
Respirations,Libération,2021-01-22
Vendée Globe : sprint final et suspense à tous les étages,Libération,2021-01-22
Vaccin : une bonne dose de confusion,Libération,2021-01-22
"Olivier Véran, un ministre au rythme du Covid",Libération,2021-01-22
Ligue 1 : le PSG écrase un Montpellier réduit à 10 et prend seul la tête du classement,Le Monde,2021-01-22
L’Italie bloque l’accès à TikTok pour quiconque n’est pas en mesure de justifier de l’âge minimal requis,Le Monde,2021-01-22
"Covid-19 : le variant britannique pourrait être plus létal, prévient Londres",Le Monde,2021-01-22
« Les mémoires de la guerre d’Algérie ont été prises en otage par les acharnés de l’identité »,Le Monde,2021-01-22
Le Sri Lanka va enquêter sur des accusations de crimes de guerre,Le Monde,2021-01-22
Mondial de handball : la France vient à bout de l’Islande et se rapproche des quarts de finale,Le Monde,2021-01-22
Les eurodéputés restent sceptiques sur le traité entre l’Union européenne et la Chine,Le Monde,2021-01-22
"En Algérie, un enseignement exaltant « l’héroïsme du peuple »",Le Monde,2021-01-22
"« La Sirène d’Isé », d’Hubert Haddad : le garçon tellurique et la fille-océan",Le Monde,2021-01-22
Soutiens à Alexeï Navalny : la Russie se félicite d’avoir obtenu la suppression de « messages illégaux »,Le Monde,2021-01-22
Un Islandais greffé des deux bras par une équipe lyonnaise,Le Monde,2021-01-22
« La Vie de Brian Jones » sur Arte : la mauvaise conscience des Rolling Stones,Le Monde,2021-01-22
Le magnat franco-israélien Beny Steinmetz condamné à cinq ans de prison ferme en Suisse,Le Monde,2021-01-22
"La « place de la Perle », enjeu d’une bataille mémorielle à Bahrein",Le Monde,2021-01-22
Crise sanitaire : les étudiants en médecine volontaires dans les hôpitaux moins touchés par l’anxiété,Le Monde,2021-01-22
"En France, la colonisation algérienne peine à se faire une place dans les programmes scolaires",Le Monde,2021-01-22
"Zizi Jeanmaire, l’autre femme Saint Laurent",Le Monde,2021-01-22
Amiante : une décision de justice surprise ravive l’espoir d’un procès au pénal,Le Monde,2021-01-22
Déchets nucléaires : l’Autorité environnementale livre son avis sur le projet de stockage à Bure,Le Monde,2021-01-22
La nouvelle décoration du bureau Ovale met à l’épreuve la « special relationship » existant entre Washington et Londres,Le Monde,2021-01-22
Etats-Unis : l’ancien général afro-américain Lloyd Austin prend la tête du Pentagone,Le Monde,2021-01-22
Livraison des achats en ligne : quels sont vos droits ?,Le Monde,2021-01-22
"Salaires : en 2021, certains cadres échapperont à l’austérité",Le Monde,2021-01-22
Les mauvais calculs d’une vidéo qui prétend que le Covid-19 serait « moins mortel que la grippe en 2017 »,Le Monde,2021-01-22
« Le Tigre blanc » : l’Inde entre prédateurs sauvages et poulets soumis,Le Monde,2021-01-22
"« Organiser le monde », de Sandrine Kott : constructive guerre froide",Le Monde,2021-01-22
Covid-19 : pourquoi il est difficile de mesurer l’impact du couvre-feu à 18 heures,Le Monde,2021-01-22
Covid-19 : un organisateur de soirées clandestines en discothèque condamné à un an de prison ferme,Le Monde,2021-01-22
Affaire du camion charnier : quatre responsables condamnés en Grande-Bretagne,Le Monde,2021-01-22
"Non, on ne peut pas affirmer que le Covid-19 a causé « zéro mort de moins de 44 ans »",Le Monde,2021-01-22
Achats en ligne : quand la livraison tourne au cauchemar,Le Monde,2021-01-22
Et au milieu de Paris recoulera peut-être la Bièvre,Le Monde,2021-01-22
Sur le sentier du Grand Paris,Le Monde,2021-01-22
Le journal « L’Equipe » retrouve le chemin des kiosques après quatorze jours de grève,Le Monde,2021-01-22
Plantu prendra sa retraite du « Monde » le 31 mars,Le Monde,2021-01-22
"Cinq nouvelles mises en examen après la free party de Lieuron, le détenu libéré",Le Monde,2021-01-22
"Le chanteur Ariel Pink, nouvelle idole des trumpistes",Le Monde,2021-01-22
"Léona Delcourt, la femme qui inspira Nadja à André Breton",Le Monde,2021-01-22
"« Par rapport à celui de Laure Adler, le livre de Pivot, il dit les choses » : les vieux qui lisent des vieux",Le Monde,2021-01-22
« L’histoire nous enseigne qu’une dérive conduit vite du souci légitime de l’identité ou de la justice sociale à l’extrémisme »,Le Monde,2021-01-22
La guerre entre Thermomix et son concurrent Lidl devant la justice,Le Monde,2021-01-22
Un couteau suisse sanitaire pour voyager au temps du covid-19,Le Monde,2021-01-22
« Pretend It’s a City » : Scorsese fait parler New York à travers Fran Lebowitz,Le Monde,2021-01-22
« Renault 5 » : la première fois que « Le Monde » l’a écrit,Le Monde,2021-01-22
Chiffres de l’immigration en 2020 : demandes d’asile et mesures d’éloignement en baisse,Le Monde,2021-01-22
Le gouvernement appelle les préfets à faciliter les « évacuations forcées » de logements squattés,Le Monde,2021-01-22
Biathlon : Quentin Fillon Maillet s’offre un podium à l’arraché à Antholz-Anterselva,Le Monde,2021-01-22
Un apéro avec Guy Delisle : « J’ai pu mesurer ce qu’était le job de femme au foyer »,Le Monde,2021-01-22
"Ecouteurs sans fil et prothèses auditives, de vrais bijoux de technologie",Le Monde,2021-01-22
Bombe atomique : sommes-nous à l’abri d’une catastrophe nucléaire ?,Le Monde,2021-01-22
"Le lycée d’excellence où a été scolarisée Diary Sow, une fabrique d’élites pour le Sénégal",Le Monde,2021-01-22
Le gouvernement sommé de fixer une date pour donner l’accès à tous aux décisions de justice,Le Monde,2021-01-22
Paris Fashion Week : « Les grandes maisons engrangent des centaines de millions de vues »,Le Monde,2021-01-22
"Pause séries : « American Gods » et « The Stand », overdose d’apocalypse",Le Monde,2021-01-22
"Dans sa conquête spatiale, « la Chine veut consolider ses capacités militaires »",Le Monde,2021-01-22
Londres annonce le déboulonnage de deux statues liées à l’esclavagisme,Le Monde,2021-01-22
« L’Algérie s’est enfermée depuis 1962 dans une mémoire nationaliste »,Le Monde,2021-01-22
"Le Covid-19, ombre persistante sur les élections régionales et départementales",Le Monde,2021-01-22
Première passe d’armes entre la Chine et le président américain Joe Biden,Le Monde,2021-01-22
"Pour les jeunes créateurs, une plongée pas comme les autres dans le grand bain de la fashion week",Le Monde,2021-01-22
"En Azerbaïdjan, l’autocrate Ilham Aliev rendu populaire par la guerre",Le Monde,2021-01-22
"Disparition de Diary Sow : « Elle est partie de son plein gré, il n’y a rien d’autre à ajouter »",Le Monde,2021-01-22
"Plus de deux millions de personnes déplacées dans le Sahel en 2020, « un triste record »",Le Monde,2021-01-22
George Soros : « Les obligations perpétuelles pourraient se révéler très utiles pour l’Europe »,Le Monde,2021-01-22
"Dette européenne : « Comme un marronnier, la tentation du défaut de paiement volontaire revient régulièrement »",Le Monde,2021-01-22
« Le débat sur la dette doit provoquer une réflexion publique sur les gagnants et les perdants du Covid-19 »,Le Monde,2021-01-22
« La monnaie hélicoptère permettrait à la politique monétaire de retrouver un impact direct sur l’économie réelle »,Le Monde,2021-01-22
« Les investisseurs de la zone Asie-Pacifique vont déserter le Vieux Continent »,Le Monde,2021-01-22
« Le principe de droit selon lequel un Etat doit respecter les obligations qu’il a contractées n’est pas absolu »,Le Monde,2021-01-22
Les navires de l'antique port de Rome remis virtuellement à flot,Le Monde,2021-01-22
Nouveaux bombardements israéliens contre des positions militaires en Syrie,Le Monde,2021-01-22
Londres refuse le statut d’ambassadeur à l’émissaire de l’UE au Royaume-Uni,Le Monde,2021-01-22
"« La crise liée au Covid-19 a désinhibé les patrons » : putschs et coups fourrés, le capitalisme français sent la poudre",Le Monde,2021-01-22
« Losing Alice » : duo de femmes pour un thriller oppressant et virtuose,Le Monde,2021-01-22
"Prune Nourry : « Manger, c’est l’acte le plus intime qui soit »",Le Monde,2021-01-22
Le clafourtout : la recette de Prune Nourry,Le Monde,2021-01-22
Des yeux verts et un sourire immense : la comédienne Nathalie Delon est morte,Le Monde,2021-01-22
"Face au défi du contrôle des armements nucléaires, Joe Biden prolonge le traité New Start",Le Monde,2021-01-22
Climat : Washington devra refaire ses preuves,Le Monde,2021-01-22
Traité New Start : « Nous sommes sur la voie d’une modernisation des forces nucléaires »,Le Monde,2021-01-22
"« Aux Etats-Unis, l’inquiétude est que les tensions ne baissent pas sur la question identitaire, les races et les genres »",Le Monde,2021-01-22
Un élu communiste à la Mairie de Paris accusé de viol,Le Monde,2021-01-22
"« Variant anglais » ou « VoC 202012/01 », le casse-tête de la dénomination des mutations du Covid-19",Le Monde,2021-01-22
Réunification de la Bretagne : des élus et des militants réclament un référendum,Le Monde,2021-01-22
"Covid-19 : vaccins et nouveaux variants, quel impact ?",Le Monde,2021-01-22
"De nouveaux proches de l’opposant russe Alexeï Navalny arrêtés, à la veille d’appels à manifester pour sa libération",Le Monde,2021-01-22
Ce que l’on sait de l’efficacité des vaccins et des anticorps sur les variants du Covid-19,Le Monde,2021-01-22
Vente aux enchères : ce tableau de Soulages qui fit « vaciller » Léopold Sédar Senghor,Le Monde,2021-01-22
"Démission de Julie Payette, la représentante de la reine Elizabeth II au Canada",Le Monde,2021-01-22
"La Hongrie, tête de pont de la Chine en Europe",Le Monde,2021-01-22
"A l’arrivée à Roissy, « personne ne m’a demandé mon attestation sur l’honneur »",Le Monde,2021-01-22
"Commissions d’harmonisation, sujets communs… les contours d’un bac au contrôle continu",Le Monde,2021-01-22
Normes CO2 : « Les politiques européens ont précipité violemment leur industrie automobile dans la plus grande mutation de son histoire »,Le Monde,2021-01-22
"A Bercy, une cellule d’informaticiens pour aider l’Etat à réguler les GAFA",Le Monde,2021-01-22
Le gendarme du nucléaire français appelle à « prendre des décisions » concernant la gestion des déchets radioactifs,Le Monde,2021-01-22
Etudiants : comment se déroulent vos cours à distance ? Témoignez,Le Monde,2021-01-22
"« L’Evangile des anguilles », de Patrik Svensson : les joies de la pêche à l’anguille",Le Monde,2021-01-22
Un prêtre retrouvé mort dans le sud-ouest du Burkina Faso,Le Monde,2021-01-22
"Début d’un nouveau cycle de discussions avec les partenaires sociaux, en pleine crise sanitaire",Le Monde,2021-01-22
Macron défend sa gestion de crise face à « une nation de 66 millions de procureurs »,Le Monde,2021-01-22
Covid-19 : la Banque centrale européenne s’engage à maintenir un « ample stimulus monétaire »,Le Monde,2021-01-22
"Dans les outre-mer, la crise du Covid-19 aggrave les fragilités structurelles",Le Monde,2021-01-22
"Etat d’urgence en République centrafricaine, où l’émissaire de l’ONU veut une hausse « substantielle » des casques bleus",Le Monde,2021-01-22
"Wael Ghonim, l’étoile déchue de la place Tahrir",Le Monde,2021-01-22
"« Les Deux Cultures », de Charles Percy Snow : la chronique « essai » de Roger-Pol Droit",Le Monde,2021-01-22
Le Vercors en pentes douces,Le Monde,2021-01-22
Le cascadeur Rémy Julienne est mort à l’âge de 90 ans des suites du Covid-19,Le Monde,2021-01-22
"« Nègre », ce mot lourd du racisme et des crimes qui l’ont forgé",Le Monde,2021-01-22
"« Le Dernier Jour du jeûne » sur France 5 : Simon Abkarian, truculent et féministe",Le Monde,2021-01-22
"Dans « Mémoires d’un juge trop indépendant », le juge Van Ruymbeke revient sur les affaires qui ont marqué sa carrière",Le Monde,2021-01-22
"Après le Brexit, une défense européenne affaiblie ou libérée ?",Le Monde,2021-01-22
"Procès de l’affaire de Karachi : François Léotard, l’amnésique de la République",Le Monde,2021-01-22
La Belgique interdit les voyages non essentiels à l’étranger pour le mois de février,Le Monde,2021-01-22
"Entre Vladimir Poutine et l’opposant Alexeï Navalny, un duel sans merci",Le Monde,2021-01-22
"Des accusations de violences sexuelles au suicide de Taku Sekine, retour sur l’affaire qui a bouleversé le monde de la gastronomie",Le Monde,2021-01-22
"Le « parler petit nègre », une invention coloniale",Le Monde,2021-01-22
"La revue « Sensibilités » s’interroge sur la mort, un sujet redevenu majeur",Le Monde,2021-01-22
Immobilier : qui peut bénéficier des aides pour réaliser la rénovation énergétique de son logement ?,Le Monde,2021-01-22
Laetitia Dosch : « J’adore être sur scène et sentir que les gens sont bousculés »,Le Monde,2021-01-22
Lionel Babicz : « L’Algérie française et la Corée japonaise étaient bien plus que de simples colonies »,Le Monde,2021-01-22
« L’annulation de la dette est une manœuvre opportuniste et dangereuse »,Le Monde,2021-01-22
« Il est urgent de sortir des préjugés sur les classes préparatoires »,Le Monde,2021-01-22
"L’irruption des variants à travers le monde, sujet d’étude et d’inquiétude",Le Monde,2021-01-22
"Face aux variants du Covid-19, l’UE s’engage vers des restrictions à l’intérieur de ses frontières",Le Monde,2021-01-22
Google menace de bloquer son moteur de recherche en Australie,Le Monde,2021-01-22
Etats-Unis : Joe Biden détaille une stratégie « fondée sur la science » contre le Covid-19,Le Monde,2021-01-22
Le projet de loi « séparatismes » « inspire une certaine tristesse et un sentiment d’inconfort »,Le Monde,2021-01-22
Le Honduras grave dans le marbre l’interdiction totale de l’IVG et du mariage homosexuel,Le Monde,2021-01-22
Crimes sexuels sur mineurs : le Sénat vote la création d’une infraction spécifique,Le Monde,2021-01-22
"Guillaume Rozier, prodige des data sur la piste du Covid-19",Le Monde,2021-01-22
"En Algérie, trois jeunes militants, dont « le poète du Hirak », condamnés",Le Monde,2021-01-22
Nucléaire : « L’état du parc français est préoccupant »,Le Monde,2021-01-22
La majorité s’inquiète face au risque d’un printemps social,Le Monde,2021-01-22
"Drones, la tentation sécuritaire",Le Monde,2021-01-22
Une plainte de 2006 pour empoisonnement au chlordécone aux Antilles pourrait être prescrite,Le Monde,2021-01-22
Pourquoi la sortie de crise s’annonce délicate pour les entreprises françaises,Le Monde,2021-01-22
"Diary Sow, l’étudiante sénégalaise disparue en France depuis des semaines, va bien",Le Monde,2021-01-22
"L’autel de la cathédrale Notre-Dame, un symbole très politique",Le Monde,2021-01-22
Les fantômes du passé reviennent hanter la Flandre moderne,Le Monde,2021-01-22
"Camille Aumont Carnel, l’influenceuse qui « s’en bat le clito »",Le Monde,2021-01-22
"Avec le deuxième confinement, la France entière s’est convertie au vin chaud",Le Monde,2021-01-22
"Le gouvernement n’a pas à limiter les regroupements familiaux pour cause de Covid-19, juge le Conseil d’Etat",Le Monde,2021-01-22
Etats-Unis et Russie vers une prolongation du traité de désarmement nucléaire New Start,Le Monde,2021-01-22
Nouvelles mesures : masque à la maison et journal de 20h avancé à 18h,Nord Presse,2021-01-22
« Péter sera dorénavant interdit dans les transports en commun » annonce le premier ministre,Nord Presse,2021-01-22
Un monde nouveau sans files d’attente,Nord Presse,2021-01-22
"Covid-19 : les masques en tissu toujours aussi efficaces, selon l'OMS",Science et Avenir,2021-01-22
"Covid: les réactions allergiques graves au vaccin Moderna sont rares, selon les autorités de santé américaines",Science et Avenir,2021-01-22
"Covid-19 : qui gagnera la course, le virus ou le vaccin ?",Science et Avenir,2021-01-22
"La vétusté des barrages fluviaux est un ""risque émergent"", estime l'ONU",Science et Avenir,2021-01-22
Boeing promet des avions pouvant voler avec un carburant sans pétrole d'ici 2030,Science et Avenir,2021-01-22
Les quatre piliers de la révolution quantique,Science et Avenir,2021-01-22
"Loups: des signes de ""dégradation de la dynamique de population"", selon une note",Science et Avenir,2021-01-22
Accord Pfizer-BioNTech et OMS pour apporter 40 millions de doses de vaccins au système Covax,Science et Avenir,2021-01-22
"Théories du complot, Chang'e 6 et oiseaux mazoutés : l'actu des sciences",Science et Avenir,2021-01-22
1000 ans de cycles solaires dans les cernes des arbres,Science et Avenir,2021-01-22
Brésil: des jeunes de Manaus se mobilisent contre le Covid-19,Science et Avenir,2021-01-22
Covid-19 : le variant britannique affole les prévisions,Science et Avenir,2021-01-22
L’Allemagne impose le masque médical dans les lieux publics clos,Science et Avenir,2021-01-22
Coronavirus: le point sur la pandémie,Science et Avenir,2021-01-22
"Covid-19: pour la France, dernier arrêt avant reconfinement?",Science et Avenir,2021-01-22
Une même propagation pour les virus et les théories du complot ?,Science et Avenir,2021-01-22
"En Espagne, les hôpitaux paient cher les fêtes de Noël",Science et Avenir,2021-01-22
"Covid-19: au Royaume-Uni, des musulmans mobilisés contre la désinformation anti-vaccin",Science et Avenir,2021-01-22
Trimestriel La Recherche : l'origine du vivant,Science et Avenir,2021-01-22
"Chaleur, îles lointaines: en Asie, acheminer les vaccins est un vrai défi",Science et Avenir,2021-01-22
"En Asie, acheminer les vaccins est un vrai défi",Science et Avenir,2021-01-22
"TRIBUNE. 22 janvier 2021, une étape décisive vers un monde dénucléarisé",Science et Avenir,2021-01-22
"Vaccination Covid-19: 9 décès en France de personnes âgées et malades, pas de lien établi avec le vaccin",Science et Avenir,2021-01-22
Est-il possible pour un pays d'atteindre la neutralité carbone ?,Science et Avenir,2021-01-22
Google menace de bloquer son moteur de recherche en Australie,Science et Avenir,2021-01-22
"Dans les Balkans, des îlots d'ordures font émerger la crise des déchets",Science et Avenir,2021-01-22
"Virus: en Amazonie brésilienne, des hôpitaux débordés",Science et Avenir,2021-01-22
Covid-19 : augmentation des suicides en 2020,Science et Avenir,2021-01-22
Thaïlande: des filets de pêche recyclés pour lutter contre le covid-19,Science et Avenir,2021-01-22
Gorafi Magazine : Les plus belles recettes de repas à 1 euro,Gorafi,2021-01-22
À la une ce samedi 23 janvier…,La Point,2021-01-22
Séparatisme : Darmanin ironise sur « les 50 nuances de LR »,La Point,2021-01-22
"""Séparatisme"": Darmanin ironise sur ""les 50 nuances de LR""",La Point,2021-01-22
Accord Pfizer-BioNTech et OMS pour apporter 40 millions de doses de vaccins au système Covax,La Point,2021-01-22
Vaccins : Pfizer doit « honorer ses engagements » de livraisons,La Point,2021-01-22
"Le Point des idées #3 : affaire Mila, une défaite française ?",La Point,2021-01-22
Biden estime que le Covid-19 fera plus de 600.000 morts aux Etats-Unis,La Point,2021-01-22
Covid-19 : le cap des 3 millions de cas dépassé en France,La Point,2021-01-22
"Un séisme de magnitude 3,4 ressenti près de Strasbourg",La Point,2021-01-22
"La boulangerie, nouvel eldorado de l’emploi ?",La Point,2021-01-22
"Peintures, statues… Ce que contient le « nouveau » Bureau ovale",La Point,2021-01-22
Covid-19 : la Belgique va interdire les voyages non essentiels à l’étranger,La Point,2021-01-22
Le Sri Lanka va enquêter sur des accusations de crimes de guerre,La Point,2021-01-22
Mila : Darmanin et Le Pen s’écharpent au sujet de la protection de l’adolescente,La Point,2021-01-22
"Covid-19 : le variant britannique plus contagieux, et peut-être plus létal",La Point,2021-01-22
L’exoplanète « barbe à papa » qui défie les scientifiques,La Point,2021-01-22
Vin – Giscours gagné et Du Tertre vendu,La Point,2021-01-22
La Hongrie d’Orban se reporte sur le vaccin russe,La Point,2021-01-22
"Covid-19: pour la France, dernier arrêt avant reconfinement?",La Point,2021-01-22
RCA : « La situation sécuritaire a plus de conséquences que le Covid-19 »,La Point,2021-01-22
