titre,journal,date
La démocratie passera-t-elle l'hiver ?,Charlie Hebdo,2021-01-13
Pologne : des militantes LGBT devant la justice pour blasphème,Charlie Hebdo,2021-01-13
États-Unis : les plus grands donneurs de leçons,Charlie Hebdo,2021-01-13
Covid : le milieu scolaire en question,Charlie Hebdo,2021-01-13
Islamisme : pourquoi le djihad ne sera pas le genre humain,Charlie Hebdo,2021-01-13
Opération Mauricette,Charlie Hebdo,2021-01-13
Le chroniqueur a froid,Charlie Hebdo,2021-01-13
Les oies noires du Capitole,Charlie Hebdo,2021-01-13
Sels nitrités : bataille rangée entre l'industrie de la charcuterie et les députés,Libération,2021-01-13
"Gorilles, tigres, visons… Ces animaux infectés (ou sensibles) au Sars-CoV-2",Libération,2021-01-13
"Sarkozy blanchi, Macron empêtré, primaires évitées… 2021, aux bons vœux de la droite",Libération,2021-01-13
Droits télé du foot : le coup de tonnerre de Canal+,Libération,2021-01-13
"Au pied du mur, Donald Trump droit dans ses bottes",Libération,2021-01-13
"Conseil de défense sanitaire, réformes remises sur la table, procédure de destitution de Donald Trump... l'actu ce mercredi matin",Libération,2021-01-13
"Etats-Unis : Lisa Montgomery, première femme exécutée au niveau fédéral depuis 1953",Libération,2021-01-13
Covid-19 : Delfraissy met (une fois de plus) la pression sur l'exécutif,Libération,2021-01-13
"Lecornu, étoile montante de la macronie, soupçonné de prise illégale d'intérêts",Libération,2021-01-13
Macron et les vulnérables,Libération,2021-01-13
Quand le docteur Machin se fait vacciner sur Twitter,Libération,2021-01-13
"Lisa Montgomery, l'exécution de la honte",Libération,2021-01-13
"Qui est John Sullivan, militant anti-raciste accusé par les trumpistes d'avoir infiltré l'assaut du Capitole ?",Libération,2021-01-13
Affaire Duhamel : Marc Guillaume prend ses distances mais reste préfet d'Ile-de-France,Libération,2021-01-13
"Arnaud Montebourg, chantre du made in France, se fournit en Italie",Libération,2021-01-13
L’accord qu’il ne faut pas accepter entre la Chine et l'Union européenne,Libération,2021-01-13
"En 2020, 4 761 chrétiens ont été assassinés en raison de leur foi, d’après une organisation évangélique",Libération,2021-01-13
Carrefour sur la liste de courses du canadien Couche-Tard,Libération,2021-01-13
"A bord avec Jean Le Cam : «Depuis l'océan Indien, je n'avais pas vu de bateau»",Libération,2021-01-13
Un ex-champion olympique de natation parmi les assaillants du Capitole,Libération,2021-01-13
Droits de l'homme : «Joe Biden va devoir restaurer la crédibilité des Etats-Unis»,Libération,2021-01-13
"Les communs, une idée essentielle",Libération,2021-01-13
"A Rambouillet, des militants dénoncent la mort «horrible» d'un cerf pendant une chasse à courre",Libération,2021-01-13
"Ours, qui n'en a jamais assez",Libération,2021-01-13
Le variant sud-africain «plus toxique» que le variant anglais,Libération,2021-01-13
Russie : Alexeï Navalny annonce son retour au pays,Libération,2021-01-13
"En Israël, une première éclaircie sur le front vaccinal",Libération,2021-01-13
L’odyssée des écritures,Libération,2021-01-13
Arrêtons de parler de «populisme»,Libération,2021-01-13
Capitole : la possibilité d’un fascisme ?,Libération,2021-01-13
Bertrand Badie : «Le virus trumpien a muté»,Libération,2021-01-13
"Affaire Duhamel : «Nous, étudiantes et étudiants, demandons la démission du directeur de Sciences-Po Frédéric Mion»",Libération,2021-01-13
Le WWF s’alarme de la multiplication des «fronts» de la déforestation,Libération,2021-01-13
Enquête ouverte contre Eric Dupond-Moretti : le bâtonnier de Paris et un ex-conseiller de Sarkozy pour sa défense,Libération,2021-01-13
"Au Yémen, la désignation des Houthis comme organisation terroriste alarme les ONG",Libération,2021-01-13
Génération identitaire mouillé dans le procès du groupe d’ultradroite Zouaves Paris,Libération,2021-01-13
"En Estonie, la fin de la coalition entre conservateurs et extrême droite",Libération,2021-01-13
"Art et sciences, une histoire de vases communicants",Libération,2021-01-13
"V.S. Naipaul, «Chagrin» à perte de vue",Libération,2021-01-13
"«Les Rythmes du labeur», lente évolution industrielle",Libération,2021-01-13
Opéra de Bordeaux : Minkowski prend ses distances,Libération,2021-01-13
«Злорадство» : quand le malheur des uns fait le bonheur des Russes,Libération,2021-01-13
"Rugby, F1, basket... La saison sportive à nouveau menacée par le Covid",Libération,2021-01-13
Régionales : les sortants ne veulent pas d’un report,Libération,2021-01-13
Anne Hidalgo parle aux Parisiens mais regarde plus loin,Libération,2021-01-13
"Quand Cécilia Attias, ex-épouse de Sarkozy, était embauchée à l'Assemblée nationale",Libération,2021-01-13
"Face à la crise sanitaire, la santé mentale des étudiants dégringole",Libération,2021-01-13
Italie : les restaurateurs appellent à remettre le couvert,Libération,2021-01-13
"Les étudiants confinés, sacrifiés",Libération,2021-01-13
Affaire Olivier Duhamel : Elisabeth Guigou renonce à sa mission sur l'inceste,Libération,2021-01-13
Centrafrique : une attaque des rebelles repoussée à Bangui,Libération,2021-01-13
Variant anglais détecté à Cholet : «Il est vraisemblable que l'ensemble du foyer ait été porteur»,Libération,2021-01-13
Grand oral du bac : «Il ne faut pas que cette épreuve soit un concours d’art oratoire»,Libération,2021-01-13
Grand oral du bac : d’abord passer les cris,Libération,2021-01-13
"Les secousses de l'affaire Duhamel, Lecornu soupçonné de prise illégale d'intérêts, Couche-Tard qui lorgne Carrefour… L'actu de ce mercredi",Libération,2021-01-13
"Affaire Olivier Duhamel : des démissions en série, mais pourquoi donc ?",Libération,2021-01-13
Réparation de vélo : les roues de la fortune,Libération,2021-01-13
"A «l’Equipe», une grève partie pour durer",Libération,2021-01-13
«Il est possible que le virus continue à muter et pose problème avec le vaccin»,Libération,2021-01-13
"Droits télévisés : face à la Ligue 1, Canal + joue le match retour",Libération,2021-01-13
"Julia Minkowski, avocate et associées",Libération,2021-01-13
Régionales : la macronie a peur de perdre sa région phare,Libération,2021-01-13
"Sébastien Lecornu : pour Macron, un ambitieux utile",Libération,2021-01-13
Retour de flamme électrique pour la 4L,Libération,2021-01-13
"«La voiture ancienne, une image d’insouciance»",Libération,2021-01-13
Variant anglais : un séquençage pas en cadence ?,Libération,2021-01-13
"Covid : anglaise ou brésilienne, des mutations en chaîne",Libération,2021-01-13
Retard,Libération,2021-01-13
Le Royaume-Uni submergé par son variant,Libération,2021-01-13
"Pour Donald Trump, l'opprobre d'un second «impeachment» historique",Libération,2021-01-13
"Matteo Renzi retire son soutien au gouvernement Conte, désormais sans majorité",Libération,2021-01-13
"La classe politique rend hommage à Marielle de Sarnez, une femme «courageuse» et «engagée»",Libération,2021-01-13
"Mort de Marielle de Sarnez, stratège de François Bayrou",Libération,2021-01-13
"Après un vote historique au Congrès, Donald Trump devient le premier président américain à faire deux fois l’objet d’une procédure de destitution",Le Monde,2021-01-13
"Marielle de Sarnez, figure incontournable du courant centriste, est morte à l’âge de 69 ans",Le Monde,2021-01-13
Etats-Unis : Google suspend les publicités politiques en raison des risques de violences,Le Monde,2021-01-13
Agroalimentaire : InVivo veut acquérir le céréalier Soufflet,Le Monde,2021-01-13
"En Belgique, un élu nationaliste condamné à huit ans de prison pour trafic de visas humanitaires",Le Monde,2021-01-13
Comment Facebook veut rentabiliser WhatsApp en changeant sa politique de données personnelles,Le Monde,2021-01-13
Un ex-entraîneur de tennis  condamné en appel à 18 ans de prison pour des viols sur mineures,Le Monde,2021-01-13
"Liz Cheney, figure de la rupture entre Donald Trump et une partie des républicains américains",Le Monde,2021-01-13
"Les premières épreuves du bac 2021 arrivent en mars, mais restent suspendues à la situation sanitaire",Le Monde,2021-01-13
Trois policiers sanctionnés pour violences et racisme au dépôt du tribunal de Paris,Le Monde,2021-01-13
"« Décolonisations, du sang et des larmes » : la souffrance et l’amertume en héritage",Le Monde,2021-01-13
"« Rien n’indiquait que quelque chose n’allait pas » : au Sénégal, l’angoisse des proches de Diary Sow",Le Monde,2021-01-13
« Nuremberg : des images pour l’Histoire » : l’enquête des frères Schulberg,Le Monde,2021-01-13
"Des sangliers des Célèbes sur la plus ancienne fresque figurative au monde, datée d’au moins 45 500 ans",Le Monde,2021-01-13
Assaut contre le Capitole : l’émeutier qui portait un tee-shirt faisant mention de l’inscription « Auschwitz » a été arrêté,Le Monde,2021-01-13
Comment le géant du diagnostic médical Abbott a inondé le marché de machines défectueuses,Le Monde,2021-01-13
Ubisoft va développer un jeu vidéo en monde ouvert dans l’univers de « Star Wars »,Le Monde,2021-01-13
L’Irlande demande pardon pour les victimes de ses « maisons pour mères et bébés »,Le Monde,2021-01-13
"Avec le Covid-19, le retour des préretraites dans les grandes entreprises",Le Monde,2021-01-13
"Fragilisée par l’affaire Olivier Duhamel, Elisabeth Guigou démissionne de la commission sur l’inceste",Le Monde,2021-01-13
"Amour, drague et sensualité : la sélection musicale du « Monde Afrique » #36",Le Monde,2021-01-13
Attentat déjoué de Villepinte : l’Iran mobilisé pour qu’un diplomate échappe à la prison,Le Monde,2021-01-13
Le Salon des masters du « Monde » aura lieu le 30 janvier dans un format virtuel,Le Monde,2021-01-13
Affaire Duhamel : Elisabeth Guigou renonce à sa mission sur l’inceste,Le Monde,2021-01-13
AccorInvest compte supprimer plus de 700 postes en France,Le Monde,2021-01-13
Judo : le retour gagnant de Teddy Riner à Doha,Le Monde,2021-01-13
Suspension de comptes de Donald Trump : « Les réseaux sociaux n’opèrent pas au-dessus des lois »,Le Monde,2021-01-13
"« Le pays est à sec » : en Centrafrique, le regain de violences fait craindre des pénuries à Bangui",Le Monde,2021-01-13
Besoin d’iode ? Cinq recettes de la mer faciles à réaliser,Le Monde,2021-01-13
Nouvelle attaque meurtrière dans l’ouest de l’Ethiopie,Le Monde,2021-01-13
Agroalimentaire : InVivo pourrait croquer le groupe céréalier Soufflet,Le Monde,2021-01-13
"Libourne, une ville à taille humaine à la reconquête de son identité",Le Monde,2021-01-13
"A Paris, les squatteurs du Petit Cambodge évacués",Le Monde,2021-01-13
Quand les vagues faites par la fécule de maïs bouleversent la mécanique des fluides,Le Monde,2021-01-13
"« Un bref instant de splendeur », d’Ocean Vuong : le bouleversant récit de formation d’un jeune Vietnamo-Américain",Le Monde,2021-01-13
Des raids israéliens dans l’est de la Syrie font au moins 57 morts,Le Monde,2021-01-13
"Le 3919, destiné aux femmes victimes de violences, va-t-il changer de numéro ?",Le Monde,2021-01-13
"La France, critiquée pour des retours au compte-gouttes, rapatrie sept enfants de djihadistes de Syrie",Le Monde,2021-01-13
Les applications mobiles ont tiré profit de la crise sanitaire en 2020,Le Monde,2021-01-13
"Roi des casinos, donateur de la droite américaine : Sheldon Adelson, le magnat des jeux passé de la rue à la fortune",Le Monde,2021-01-13
"Arié Alimi, nouvel avocat de Jean-Luc Mélenchon et figure émergente de la gauche de la gauche",Le Monde,2021-01-13
"La culture, force du projet urbain à Libourne",Le Monde,2021-01-13
"L’attaque rebelle sur Bangui, cruel révélateur de la fragilité du pouvoir centrafricain",Le Monde,2021-01-13
Grippe aviaire : « L’industrie agricole a créé un nid douillet pour les pathogènes »,Le Monde,2021-01-13
Attention à cette citation décontextualisée du professeur Caumes sur les effets indésirables des vaccins,Le Monde,2021-01-13
Le Festival « off » d’Avignon change de patron et prépare une édition « sous contraintes sanitaires »,Le Monde,2021-01-13
Le musicien américain de jazz Howard Johnson est mort,Le Monde,2021-01-13
« Il y a une part d’hypocrisie dans les critiques contre la suspension de Donald Trump des réseaux sociaux »,Le Monde,2021-01-13
Les étudiants de HEC veulent un patron « vert » pour leur école,Le Monde,2021-01-13
Ricardo Serrao Mendes jongle avec son corps,Le Monde,2021-01-13
Cela fait désormais un siècle que des gens se font couper en deux… pour les besoins de la magie,Le Monde,2021-01-13
Covid-19 : le badge de contrôle des déplacements des salariés chez Essity fait polémique,Le Monde,2021-01-13
YouTube limite à son tour le compte de Donald Trump,Le Monde,2021-01-13
"Le préfet Marc Guillaume, qui se dit « trahi », quitte toutes les fonctions où il a travaillé avec Olivier Duhamel",Le Monde,2021-01-13
Comment établir ou écarter le lien entre le vaccin contre le Covid-19 et un décès ?,Le Monde,2021-01-13
"Algérie : à Tizi-Ouzou, un pharaon égyptien s’invite au Nouvel An kabyle",Le Monde,2021-01-13
Le ministre Sébastien Lecornu visé par une enquête pour « prise illégale d’intérêts »,Le Monde,2021-01-13
Assaut du Capitole : « Cette crise montre à quel point Trump est parvenu à détourner le Parti républicain de ses principes »,Le Monde,2021-01-13
Le personnel de « L’Equipe » entre dans son cinquième jour de grève,Le Monde,2021-01-13
Une glace pour chien signée Ben & Jerry’s,Le Monde,2021-01-13
"« Le 6 janvier, la vulnérabilité de la démocratie américaine a donné le vertige aux Européens »",Le Monde,2021-01-13
"Au Cambodge, le combat des opposants pour assister à leur propre procès",Le Monde,2021-01-13
"En Chine, les technologies de surveillance timidement remises en cause",Le Monde,2021-01-13
"Après huit ans d’intervention au Mali, le bilan mitigé de « Barkhane »",Le Monde,2021-01-13
"Malgré la persistance de la crise, Bercy tente de dessiner la relance",Le Monde,2021-01-13
Le revirement de la Cour nationale du droit d’asile à propos des Afghans critiqué,Le Monde,2021-01-13
Nouvelle bavure lors d’une frappe aérienne en Afghanistan,Le Monde,2021-01-13
Un variant brésilien du Covid-19 inquiète le Japon,Le Monde,2021-01-13
"Nio, un champion chinois des véhicules électriques sauvé par le soutien public",Le Monde,2021-01-13
Hockey sur glace : le pari risqué de la reprise de la Ligue nord-américaine,Le Monde,2021-01-13
"En Chine, l’incroyable essor de la santé en ligne",Le Monde,2021-01-13
"Cécilia Attias, ex-femme de Nicolas Sarkozy, a été rémunérée par l’Assemblée nationale en 2002-2003",Le Monde,2021-01-13
Eric Dupond-Moretti visé par une enquête de la Cour de justice de la République pour « prises illégales d’intérêts »,Le Monde,2021-01-13
"Face à la Ligue, « Canal+ tient sa revanche » sur les droits de diffusion du football",Le Monde,2021-01-13
« Je ne sais pas ce qui m’a pris » : l’ex-commissaire qui filmait sous les jupes d’inconnues reconnu coupable,Le Monde,2021-01-13
Un volcan allemand est-il en train de se réveiller ?,Le Monde,2021-01-13
"« C’est de l’ouverture sous surveillance » : fermer les écoles en France n’est pas nécessaire, selon le président du conseil scientifique",Le Monde,2021-01-13
La France face au bourbier malien,Le Monde,2021-01-13
"Auditionné par les parlementaires, Olivier Véran défend la stratégie vaccinale du gouvernement",Le Monde,2021-01-13
"En Ouganda, sixième mandat en vue pour le président Yoweri Museveni",Le Monde,2021-01-13
La présidence portugaise de l’Union européenne veut relancer « l’Europe sociale »,Le Monde,2021-01-13
"Malgré l’incertitude, la Banque de France projette une croissance de 5 % pour 2021",Le Monde,2021-01-13
"Deux attaques rebelles repoussées à l’entrée de Bangui, capitale de la Centrafrique",Le Monde,2021-01-13
Le cercle de réflexion Terra Nova s’attaque au « dogme » de la décentralisation,Le Monde,2021-01-13
Alexeï Navalny annonce qu’il rentrera en Russie le 17 janvier,Le Monde,2021-01-13
"En Tunisie, un confinement de quatre jours pour limiter la propagation record du coronavirus",Le Monde,2021-01-13
« Les penseurs de l’intime » : notre série en dix épisodes,Le Monde,2021-01-13
Un nombre record d’exécutions fédérales aux Etats-Unis pendant la fin du mandat de Donald Trump,Le Monde,2021-01-13
Aide à l’orientation des jeunes : des disparités selon les territoires,Le Monde,2021-01-13
"Coup d’envoi du « maxi-procès » contre la ’Ndrangheta, la puissante mafia calabraise",Le Monde,2021-01-13
Des parlementaires plaident pour l’interdiction totale des nitrites dans la charcuterie d’ici à 2025,Le Monde,2021-01-13
La première exécution fédérale d’une femme en près de 70 ans a eu lieu aux Etats-Unis,Le Monde,2021-01-13
"Donald Trump, un tweet et puis s’en va",Le Monde,2021-01-13
Les entreprises pourront vacciner au plus tôt au printemps,Le Monde,2021-01-13
"Le prêt de salariés entre les entreprises, un dispositif qui peine à s’imposer",Le Monde,2021-01-13
"Eric Génovèse, de la Comédie-Française : « Lire Proust, c’est courir un marathon »",Le Monde,2021-01-13
La justice indienne s’immisce dans la crise agricole,Le Monde,2021-01-13
Quel accident du travail pour le salarié en télétravail ?,Le Monde,2021-01-13
« Sommes-nous à l’aube d’un changement pour le développement de l’intelligence artificielle ? »,Le Monde,2021-01-13
Tentative « amicale » de rapprochement entre Carrefour et le groupe canadien Alimentation Couche-Tard,Le Monde,2021-01-13
"Divorces, ruptures de pacs : la fiscalité a été allégée",Le Monde,2021-01-13
Anne Deysine : « C’est le moment de vérité pour l’aile “légitimiste” du Parti républicain »,Le Monde,2021-01-13
Handball : des Bleus sans certitudes au Mondial,Le Monde,2021-01-13
« Le Pouvoir de la destruction créatrice » : le capitalisme en pleine crise d’identité,Le Monde,2021-01-13
Stanislas Guerini : « Nous ne devons pas laisser la seule régulation aux plates-formes numériques »,Le Monde,2021-01-13
Le règne sans partage d’Hassan Moustafa sur le handball mondial,Le Monde,2021-01-13
"La « pulsion de mort » a cent ans et, pendant la pandémie de Covid-19, elle se porte bien…",Le Monde,2021-01-13
"« Ces temps-ci, la société à l’épreuve des affaires de mœurs » : quand la honte change de camp",Le Monde,2021-01-13
« La pandémie a mis en évidence le lien entre destruction de la nature et menace sur la santé humaine »,Le Monde,2021-01-13
Donald Trump nie toute responsabilité dans les violences au Capitole,Le Monde,2021-01-13
"« Wall Street, Donald Trump et la “populace” »",Le Monde,2021-01-13
Les hommes et les femmes qui vont gouverner avec Joe Biden,Le Monde,2021-01-13
"Conquête spatiale, supercalculateur... la Chine, un géant scientifique lancé à pleine vitesse",Le Monde,2021-01-13
Grande distribution : Carrefour dans le viseur de son concurrent canadien Alimentation Couche-Tard,Le Monde,2021-01-13
Dix jours de confinement intégral dans un Liban aux abois,Le Monde,2021-01-13
"Couvre-feu à 18 heures généralisé, troisième confinement ou statu quo : le gouvernement à l’heure des choix",Le Monde,2021-01-13
Est-il dangereux de se faire vacciner lorsqu’on a déjà eu le Covid-19 ou quand on est enceinte ? Nos réponses sur les contre-indications,Le Monde,2021-01-13
"« La dernière fois où l’Amérique s’est trouvée à ce point divisée, la guerre de Sécession en a résulté »",Le Monde,2021-01-13
Les fronts de la déforestation se multiplient sur la planète,Le Monde,2021-01-13
"Covid-19 dans le monde : en Russie, Vladimir Poutine ordonne une vaccination de masse",Le Monde,2021-01-13
"Des fraudes au logement social peu nombreuses, mais de plus en plus choquantes",Le Monde,2021-01-13
Anne Hidalgo s’explique avec ses alliés écolos à la Mairie de Paris,Le Monde,2021-01-13
Comment se préparer pour un stage ?,Nord Presse,2021-01-13
Des Ouïghours enfin relâchés dans les Pyrénées,Nord Presse,2021-01-13
Une clinique de Seine-Saint-Denis vaccine à tour de bras ses patients dialysés,Science et Avenir,2021-01-13
"USA: Recrudescence des signes avant-coureurs de violences politiques, selon Facebook",Science et Avenir,2021-01-13
"La mort du ""loup sinistre"", ou l'histoire d'une extinction totale",Science et Avenir,2021-01-13
La rotation de la Terre a accéléré en 2020,Science et Avenir,2021-01-13
Chine: un robot utilisé pour réaliser des tests Covid,Science et Avenir,2021-01-13
"Mémoire immunitaire, déforestation et spermatozoïdes : l’actu des sciences",Science et Avenir,2021-01-13
L'ADN des loups terribles révèle les secrets de leur évolution,Science et Avenir,2021-01-13
Dépistage massif du Covid: les Stéphanois au rendez-vous,Science et Avenir,2021-01-13
"A Madrid, un bidonville sans électricité en pleine vague de froid",Science et Avenir,2021-01-13
Covid-19 : jusqu'à 8 mois de mémoire immunitaire,Science et Avenir,2021-01-13
Cinq obstacles à la campagne de vaccination contre le Covid-19,Science et Avenir,2021-01-13
Les frontières de la déforestation,Science et Avenir,2021-01-13
Coronavirus: le point sur la pandémie,Science et Avenir,2021-01-13
"BlackRock a encore 85 milliards de dollars investis dans le charbon, dénonce une ONG",Science et Avenir,2021-01-13
Langage : pourquoi les mêmes mots émergent dans toutes les cultures,Science et Avenir,2021-01-13
"Après l'attaque du Capitole, la reconnaissance faciale en force",Science et Avenir,2021-01-13
Jambon : les nitrites indésirables selon un rapport,Science et Avenir,2021-01-13
"Covid-19: les variants essaiment, le virus menace toujours plus",Science et Avenir,2021-01-13
Début de la vaccination des plus de 75 ans à Nancy,Science et Avenir,2021-01-13
"En Israël, le réseau sanitaire de proximité au coeur de l'ambitieuse campagne de vaccination",Science et Avenir,2021-01-13
"Il y a 50 ans, le Haut barrage d'Assouan domptait les eaux du Nil",Science et Avenir,2021-01-13
"Egypte: 50 ans après, le barrage d'Assouan est toujours contesté",Science et Avenir,2021-01-13
Des spermatozoïdes qui nagent en rond : une nouvelle cause d'infertilité ?,Science et Avenir,2021-01-13
"Filets anti-requins: des ""mailles de la mort"" pour protéger les Sud-Africains",Science et Avenir,2021-01-13
YouTube suspend la chaîne de Trump pour violation de sa réglementation,Science et Avenir,2021-01-13
"Covid-19 : E484K, la mutation qui pose question pour les vaccins",Science et Avenir,2021-01-13
Covid-19: le Japon étend l'état d'urgence et renforce les restrictions d'entrée,Science et Avenir,2021-01-13
"En Californie, un hôpital rural ploie sous le fardeau du Covid-19",Science et Avenir,2021-01-13
"Aux portes de la Russie, une province chinoise en ""état d'urgence"" Covid",Science et Avenir,2021-01-13
"Covid-19: nouvelles décisions attendues en France, dans une ""course de vitesse"" contre le virus",Science et Avenir,2021-01-13
"Déforestation: 43 millions d'hectares perdus sur les principaux ""fronts"", selon le WWF",Science et Avenir,2021-01-13
Dans la chambre des stars. Angelina Jolie et le lancer de couteau : sa curieuse habitude sexuelle,Closer,2021-01-13
Les Marseillais à Dubaï : quels candidats participent à l'aventure ?,Closer,2021-01-13
Il trouve une bouteille à la mer avec une bague sertie d'un diamant et d'une lettre manuscrite,Closer,2021-01-13
"Romy Schneider : ce qui dérange sa fille, Sarah Biasini, lorsqu'elle entend son nom",Closer,2021-01-13
“Les candidats de télé-réalité sont stigmatisés” : le coup de gueule de Raphaël Pépin dans TPMP,Closer,2021-01-13
Un intermittent jette un de ses reins dans une fontaine à vœux,Gorafi,2021-01-13
"Lors d’une randonnée en solitaire, Pascal Praud réussit à ne se couper que 10 fois la parole",Gorafi,2021-01-13
À la une ce jeudi 14 janvier…,La Point,2021-01-13
"Solennité et tensions au Capitole pour l'""impeachment"" historique de Trump",La Point,2021-01-13
Affaire Duhamel : Camille Kouchner ne « pardonne pas » à son beau-père,La Point,2021-01-13
Immense émotion dans le monde politique après le décès de Marielle de Sarnez,La Point,2021-01-13
Le parcours politique de Marielle de Sarnez,La Point,2021-01-13
États-Unis : un second « impeachment » historique de Donald Trump,La Point,2021-01-13
"Marielle de Sarnez, bras droit et boussole de François Bayrou",La Point,2021-01-13
La députée et ancienne ministre Marielle de Sarnez est décédée,La Point,2021-01-13
"Trafic d'armes: dix personnes, dont deux militaires, interpellées en France",La Point,2021-01-13
Le Portugal se résout à un deuxième confinement général,La Point,2021-01-13
Centrafrique: premières attaques rebelles aux abords de Bangui,La Point,2021-01-13
Covid-19 : plus de 247 000 personnes vaccinées en France,La Point,2021-01-13
"En Suède, un timbre à l’effigie de Greta Thunberg fait son apparition",La Point,2021-01-13
Un nouveau type d’étoile découvert dans la constellation de Cassiopée,La Point,2021-01-13
"Affaire Duhamel: Louis Schweitzer élu président par intérim de la FNSP, au milieu de nouveaux remous",La Point,2021-01-13
18 ans ferme pour un ex-entraîneur de tennis accusé de viols,La Point,2021-01-13
Covid-19 : la campagne de vaccination menacée par le manque de fioles ?,La Point,2021-01-13
Conflits d'intérêts: Dupond-Moretti formellement visé par une enquête judiciaire,La Point,2021-01-13
Conflits d'intérêts: Dupond-Moretti visé par une enquête judiciaire,La Point,2021-01-13
