titre,journal,date
Les balles et les vertèbres,Charlie Hebdo,2021-02-10
Séparatisme dur : la proposition de loi du RN,Charlie Hebdo,2021-02-10
Peut-on rire de la gauche ?,Charlie Hebdo,2021-02-10
Ces barrages qui tuent l'eau,Charlie Hebdo,2021-02-10
Visitez le musée de la pandémie,Charlie Hebdo,2021-02-10
Tous pareils,Charlie Hebdo,2021-02-10
"Thérèse, les huîtres et LaCineTek",Charlie Hebdo,2021-02-10
"Projet de loi climat : Mercedes Erra, la VRP de la publicité",Libération,2021-02-10
Climat : les citoyens sont-ils un lobby comme les autres ?,Libération,2021-02-10
Affaire Julie : l’emblème d’une «justice au service des dominants» devant la Cour de cassation,Libération,2021-02-10
Violences sexuelles sur mineurs : l’heure de la tolérance zéro a sonné,Libération,2021-02-10
Covid et individus fragiles : «Nous sommes ce que vous ne voulez pas voir»,Libération,2021-02-10
Birmanie : le coup d’Etat qui ne fait pas forcément les affaires de Pékin,Libération,2021-02-10
La dernière radio indépendante hongroise perd sa fréquence,Libération,2021-02-10
"Projet de loi climat, consentement, grand froid… L’actu de ce mercredi matin",Libération,2021-02-10
"Appel à la grève des sages-femmes : «On nous rajoute des tas de compétences, mais il faut passer à la caisse»",Libération,2021-02-10
Loi climat : une bataille entre 150 petits David et une douzaine de Goliath,Libération,2021-02-10
"Second procès en destitution de Trump, jour 1 : une vidéo choc, et un vote",Libération,2021-02-10
"Face aux nouveaux variants, la traque plutôt que le reconfinement ?",Libération,2021-02-10
Jean-Marc Furlan : «Le football peut devenir fou»,Libération,2021-02-10
"Auprès des migrants de Calais : «Le ressenti de -10°C en journée, c’est aussi dangereux que la nuit»",Libération,2021-02-10
"Contre le Covid-19, les autorités sanitaires américaines recommandent le port de «deux masques superposés»",Libération,2021-02-10
Une héroïne kawaï pour utiliser la langue des signes avec son bébé,Libération,2021-02-10
"En Casamance, les indépendantistes un peu plus affaiblis par l’armée sénégalaise",Libération,2021-02-10
"Dominique Boutonnat, patron du CNC, en garde à vue pour soupçons d’agression sexuelle sur son filleul",Libération,2021-02-10
Bouffons la vie contre le Covid : des coquillettes et du jambon façon risotto,Libération,2021-02-10
Fermeture des frontières algériennes : un déchirement pour la diaspora,Libération,2021-02-10
"Dans le milieu du vin, «dès qu’on est étiquetée féministe, on est d’office une emmerdeuse»",Libération,2021-02-10
"«Avec Œnologouine, on découvre le monde du vin sans sexisme, ni paternalisme»",Libération,2021-02-10
Marine Le Pen compte sur l’abstention (de gauche) pour battre Emmanuel Macron,Libération,2021-02-10
"Edouard Durand, copilote de la commission sur l’inceste : «Un moment extrêmement important, historique»",Libération,2021-02-10
Devant Sciences-Po Paris : «Un président dont personne ne veut n’a aucune crédibilité»,Libération,2021-02-10
"Les césars 2021, entre refonte et nouveau malaise",Libération,2021-02-10
"Contre la pauvreté, LR dégaine ses emplois aidés",Libération,2021-02-10
"A Nanterre, vive émotion sur le campus après le suicide d’un étudiant",Libération,2021-02-10
"A Vienne, les cafés rouvrent leurs portes pour les étudiants confinés",Libération,2021-02-10
«Top Chef» avec une saveur particulière,Libération,2021-02-10
Comment faire de l’alimentation végétale un nouvel art de vivre ?,Libération,2021-02-10
"Pierre Mathiot : «Contre les violences sexuelles dans les IEP, nous n’avons pas suffisamment développé nos systèmes d’accompagnement»",Libération,2021-02-10
«Мат» : les obscènes jurons russes,Libération,2021-02-10
"Régionales : en Ile-de-France, les gauches rassemblées, mais chacune de son côté",Libération,2021-02-10
"D’après un témoin clé à Tokyo, Carlos Ghosn «s’est couvert de honte»",Libération,2021-02-10
"Ghédalia Tazartès, une voix s’en va",Libération,2021-02-10
Ventes aux enchères : les antiquités précolombiennes ont la cote,Libération,2021-02-10
Startuppeur et exténué,Libération,2021-02-10
"Le remdésivir a-t-il joué un rôle dans l’apparition de certains variants, comme l’a suggéré Didier Raoult ?",Libération,2021-02-10
"Protocole «sauvage» contre le Covid, «Hold-Up» : l’Ordre des médecins part en guerre contre certains professionnels",Libération,2021-02-10
"En Tunisie, le puissant syndicat UGTT cherche son nouveau souffle",Libération,2021-02-10
Mars accostée par la Chine et les Emirats arabes unis,Libération,2021-02-10
L’imprescriptibilité créerait plus de désillusions auprès des victimes,Libération,2021-02-10
"«La Mission», Tom a la flemme",Libération,2021-02-10
"En Pologne, vingt-quatre heures sans médias indépendants",Libération,2021-02-10
Vague polaire : «C’est presque pire de rester dans le froid la journée que la nuit»,Libération,2021-02-10
"Benalla : demande de renvoi en correctionnelle, mais non-lieu requis pour le brassard police",Libération,2021-02-10
"Raymond Domenech viré de Nantes, après moins de deux mois de mandat",Libération,2021-02-10
Une retraitée adopte deux migrants : «Ils m’ont rendue meilleure»,Libération,2021-02-10
Pour ou contre l’imprescriptibilité des crimes sexuels,Libération,2021-02-10
Les femmes ne s’intéressent pas aux sciences ? Vraiment ?,Libération,2021-02-10
Renaud Muselier signe un chèque en blanc à la culture,Libération,2021-02-10
"Onde de choc à Sciences Po, loi climat, la planète Mars accostée par la Chine... L’actu de ce mercredi",Libération,2021-02-10
"Lous and the Yakuza, soleil levant",Libération,2021-02-10
"Ethiopie : au Tigré, une guerre invisible",Libération,2021-02-10
Jean-Luc Mélenchon : «Je pars en exil politique chez Hanouna»,Libération,2021-02-10
Les profs entre plaisir et burn-out,Libération,2021-02-10
La militante saoudienne Loujain al-Hathloul libérée,Libération,2021-02-10
"Duralex, en verre et contre tous",Libération,2021-02-10
Florence Aubenas face au «Petit Criminel»,Libération,2021-02-10
Sciences-Po : la fabrique des élites se délite,Libération,2021-02-10
"Birmanie : Biden annonce des sanctions contre la junte, la mobilisation se poursuit",Libération,2021-02-10
"Le président du CNC, Dominique Boutonnat, visé par une plainte pour agression sexuelle et tentative de viol",Le Monde,2021-02-10
Emmanuel Macron veut faire émerger de nouveaux « talents » dans la haute fonction publique,Le Monde,2021-02-10
Photos d’exactions de l’EI sur Twitter : Marine Le Pen défend sa « liberté d’expression »,Le Monde,2021-02-10
"« Alvar Aalto, architecte avec un grand A », sur Arte : portrait d’un chantre d’un fonctionnalisme chaleureux et aéré",Le Monde,2021-02-10
"On a testé… les Airpods Max, le casque audio d’Apple : le silence à prix d’or",Le Monde,2021-02-10
Projet « Hercule » : le patron d’EDF défend sa réforme sur fond de grève,Le Monde,2021-02-10
Etats-Unis : une enquête ouverte sur les pressions postélectorales de Trump en Géorgie,Le Monde,2021-02-10
Covid-19 : l’Allemagne prolonge ses restrictions jusqu’au 7 mars,Le Monde,2021-02-10
Arrestation d’un groupe cybercriminel soupçonné d’avoir volé plus de 82 millions d’euros de cryptomonnaies,Le Monde,2021-02-10
Vaccins contre le Covid-19 : comment Ursula von der Leyen veut corriger les ratés de la stratégie de l’UE,Le Monde,2021-02-10
"Deux policiers mis en examen pour violences envers des « gilets jaunes », dont Jérôme Rodrigues, qui a perdu son œil",Le Monde,2021-02-10
"La militante féministe Loujain Al-Hathloul, emprisonnée depuis près de trois ans en Arabie saoudite, a été libérée",Le Monde,2021-02-10
"En Afrique, la lutte contre les maladies tropicales négligées mise à mal par le Covid-19",Le Monde,2021-02-10
"Pourquoi une vague de froid, comme celle qui traverse la France cette semaine, ne remet pas en cause le réchauffement climatique",Le Monde,2021-02-10
L’électricité fait son cinéma climatique,Le Monde,2021-02-10
"En Seine-Saint-Denis, les étudiants privés d’aide psychologique universitaire",Le Monde,2021-02-10
Pneumonie Covid-19 : une inflammation qui tourne en boucle,Le Monde,2021-02-10
"« La Vie scolaire », sur OCS : l’humour, plutôt qu’un discours, pour raconter la vie d’un collège de cité sensible",Le Monde,2021-02-10
"Bubblegum, highlife et guitare psychédélique : la sélection musicale du « Monde Afrique » #40",Le Monde,2021-02-10
"Qu’est-ce que « The Great Reset », un livre devenu théorie du complot ?",Le Monde,2021-02-10
Une éditrice chinoise condamnée à trois ans de prison,Le Monde,2021-02-10
"80 % de la province du Tigré, où l’Ethiopie mène une opération militaire, est « inaccessible » pour l’aide humanitaire, selon la Croix-Rouge locale",Le Monde,2021-02-10
Mensonges et témoignages accablants : le rapport qui a poussé Frédéric Mion à démissionner de Sciences Po,Le Monde,2021-02-10
Dix mois ferme pour un manifestant qui avait frappé des policiers lors d’une manifestation contre la loi « sécurité globale »,Le Monde,2021-02-10
"Fragilisé par la pandémie, Heineken va supprimer 8 000 emplois",Le Monde,2021-02-10
Le PDG du studio de jeux vidéo Riot Games attaqué pour harcèlement sexuel par une ancienne employée,Le Monde,2021-02-10
"« Les Hypothèses infinies. Journal 1936-1962 » : Albert Memmi, ou les contradictions du XXe siècle",Le Monde,2021-02-10
"Albert Memmi, précurseur mal aimé du mouvement postcolonial",Le Monde,2021-02-10
Mise en orbite réussie autour de Mars pour la sonde chinoise Tianwen-1,Le Monde,2021-02-10
L’armée sénégalaise annonce avoir pris le contrôle de trois bases rebelles en Casamance,Le Monde,2021-02-10
L’avenir de la filière aurifère en Guyane en question,Le Monde,2021-02-10
"La mort de Jay G. Blumler, professeur de science de la communication",Le Monde,2021-02-10
"La mort d’Elisabeth du Réau, historienne des relations internationales",Le Monde,2021-02-10
Huit policiers de la Seine-Saint-Denis en garde à vue pour « violences » et « détention de stupéfiants »,Le Monde,2021-02-10
Le directeur de la photo italien Giuseppe Rotunno est mort,Le Monde,2021-02-10
Une vingtaine de casques bleus blessés dans l’attaque d’une base au Mali,Le Monde,2021-02-10
Des taux de crédit immobilier historiquement bas,Le Monde,2021-02-10
"Que sont devenues les propositions de la convention pour le climat, qu’Emmanuel Macron s’était engagé à reprendre « sans filtre » ?",Le Monde,2021-02-10
Des actionnaires des supermarchés Tesco s’érigent contre la malbouffe,Le Monde,2021-02-10
Projet de loi climat : passer des promesses aux actes,Le Monde,2021-02-10
Mayotte : « Les familles délogées n’ont d’autre choix à présent que d’aller déboiser un nouveau bout de forêt »,Le Monde,2021-02-10
"Loi climat : transports, logement, cantines… des mesures pour peser sur le quotidien",Le Monde,2021-02-10
"Négocier avec les djihadistes ? Au Burkina Faso, une option de moins en moins taboue",Le Monde,2021-02-10
"Malgré le Brexit, la coopération judiciaire entre Londres, Paris et Bruxelles devrait continuer",Le Monde,2021-02-10
Vaccins contre le Covid-19 : Ursula von der Leyen admet des défaillances de l’UE,Le Monde,2021-02-10
Les salaires des membres du Conseil constitutionnel font débat,Le Monde,2021-02-10
« Le bitcoin et l’action Tesla semblent emportés dans un même mouvement d’exubérance irrationnelle »,Le Monde,2021-02-10
La reconnaissance au rabais de l’écocide dans le projet de loi climat,Le Monde,2021-02-10
Des images de l’« Estonia » relancent l’enquête sur le naufrage qui a fait 852 morts en 1994,Le Monde,2021-02-10
La publicité se vend en acteur crédible de la transition écologique,Le Monde,2021-02-10
"En Pologne, la bataille mémorielle sur la Shoah se joue aussi devant les tribunaux",Le Monde,2021-02-10
"Nominations aux Césars : Emmanuel Mouret, François Ozon et Albert Dupontel en trio de tête",Le Monde,2021-02-10
La ligne de crête du candidat écologiste Yannick Jadot,Le Monde,2021-02-10
Haïti s’enfonce dans la crise institutionnelle,Le Monde,2021-02-10
"En Palestine, Hamas et Fatah s’entendent sur l’organisation des élections",Le Monde,2021-02-10
Dérèglement climatique : « Seule une initiative mobilisant massivement la population peut produire les effets nécessaires à toute victoire »,Le Monde,2021-02-10
"En dépit de la crise, un RSA élargi aux jeunes soulève toujours les réticences",Le Monde,2021-02-10
Le Front Polisario affirme avoir tué trois militaires marocains,Le Monde,2021-02-10
"La Chine, grande gagnante de la mission d’enquête de l’OMS sur les origines du Covid-19",Le Monde,2021-02-10
"Sur le nucléaire iranien, la voie étroite des négociations pour les Etats-Unis",Le Monde,2021-02-10
"Les destins d’Europe 1, de « Paris Match » et du « JDD » et les tractations entre Lagardère, Arnault et Bolloré",Le Monde,2021-02-10
Banque : le groupe BPCE veut retirer sa filiale Natixis de la cote,Le Monde,2021-02-10
"Sur les réseaux sociaux ou au pied des immeubles, repérer et accompagner les jeunes « invisibles »",Le Monde,2021-02-10
Une union de la gauche pour l’élection présidentielle de 2022 ? La partie d’échecs continu,Le Monde,2021-02-10
"Dans l’industrie automobile, la longue marche vers la fin du moteur à combustion a commencé",Le Monde,2021-02-10
Le jeune homme à l’origine du #metoogay retrouvé pendu dans sa chambre d’étudiant,Le Monde,2021-02-10
"Tout comprendre à Clubhouse, la dernière étoile montante des réseaux sociaux",Le Monde,2021-02-10
"« Total veut faire l’emploi sans l’écologie, nous, on veut faire les deux » : la CGT et les défenseurs de l’environnement unis pour la raffinerie de Grandpuits",Le Monde,2021-02-10
Covid-19 en France : Bruno Le Maire annonce la prolongation du fonds de solidarité,Le Monde,2021-02-10
Les députés LR se penchent sur la pauvreté,Le Monde,2021-02-10
Le SARS-CoV-2 circulait sans doute en France dès novembre 2019,Le Monde,2021-02-10
L’hôpital de Dax en partie paralysé par une attaque informatique,Le Monde,2021-02-10
Football : un nouveau format pour la Ligue des champions à partir de 2024,Le Monde,2021-02-10
Le sommet de l’Etat se veut optimiste et mise sur une amélioration de la situation sanitaire en France,Le Monde,2021-02-10
La Corée du Nord a dérobé 300 millions de dollars de cryptomonnaies en quelques mois,Le Monde,2021-02-10
Un membre supposé d’une bande d’Ajaccio tué par des policiers,Le Monde,2021-02-10
"« C’est injuste de voir un tel gaspillage » : en Libye, l’économie dévastée par dix ans de guerre",Le Monde,2021-02-10
"A Perpignan, Louis Aliot a rouvert quatre musées municipaux",Le Monde,2021-02-10
EDF : « L’acte final d’un long démantèlement du service public de l’énergie en faveur du privé »,Le Monde,2021-02-10
"Au Ghana, le Parlement ferme pour cause de coronavirus",Le Monde,2021-02-10
"Mary Wilson, une des trois Supremes historiques, est morte",Le Monde,2021-02-10
Les créatrices de design à suivre en 2021 (1/10) : Margaux Keller,Le Monde,2021-02-10
"Gianni Pettena, l’« anarchitecte » aux constructions éphémères",Le Monde,2021-02-10
Des températures glaciales prévues pour les prochains jours dans le Nord-Est,Le Monde,2021-02-10
« J’ai du mal à trouver du sens à mon métier tous les jours » : les entreprises confrontées à leurs salariés démotivés,Le Monde,2021-02-10
"Charleroi, vue par Nicolas Portnoï : « Sa vision n’est pas négative, il a évité le côté safari de la misère, un sujet si rebattu, si facile »",Le Monde,2021-02-10
"L’OMS recommande le vaccin d’AstraZeneca pour les plus 65 ans, contrairement à plusieurs pays, dont la France",Le Monde,2021-02-10
Drame de Valence: pas de « prête-nom » pour le DRH,Le Monde,2021-02-10
"Napoléon Ier, les vaccins et la propriété privée : « Si ce remède [produit] des effets utiles à l’humanité, le secret sera publié sans délai »",Le Monde,2021-02-10
« Le goût influence les jugements moraux et vice versa »,Le Monde,2021-02-10
« Les effets pervers du secret commercial en situation d’urgence sanitaire »,Le Monde,2021-02-10
"Destitution de Donald Trump : au premier jour du procès, l’accusation joue l’émotion face à une défense décousue et agressive",Le Monde,2021-02-10
"« Puissante et fragile, l’entreprise en démocratie » : entreprise et projet politique en questions",Le Monde,2021-02-10
OpenLux : « L’harmonisation fiscale est le grand impensé de la construction européenne »,Le Monde,2021-02-10
Gaëlle Krikorian : « L’OMC pourrait décider que la propriété intellectuelle ne s’applique pas aux produits Covid-19 »,Le Monde,2021-02-10
« Les vaccins contre le SARS-CoV-2 doivent être considérés comme des biens publics mondiaux »,Le Monde,2021-02-10
"Argent et famille, un cocktail explosif",Le Monde,2021-02-10
OpenLux : Xavier Niel fait escale au Luxembourg pour contrôler un opérateur télécoms suisse,Le Monde,2021-02-10
"Projet de loi climat : des mesures nombreuses, mais pas à la hauteur des ambitions",Le Monde,2021-02-10
"En Birmanie, la mobilisation se poursuit et la répression s’amplifie",Le Monde,2021-02-10
Dette de la BCE : « Aucun traité n’interdit à un créancier de renoncer à ses créances »,Le Monde,2021-02-10
"Min Aung Hlaing, le nouvel homme fort de la Birmanie : un général sans charisme et juriste pointilleux",Le Monde,2021-02-10
« J’ai vu naître le monstre » ou la chronique d’une addiction à Twitter,Le Monde,2021-02-10
"« Au royaume de la CGT. La résistible ascension de Philippe Martinez », le roman noir de la CGT",Le Monde,2021-02-10
"Aucune visite, uniquement des arrivées en ambulance : un « hôpital des pandémies » à Madrid pour les malades du Covid-19",Le Monde,2021-02-10
"Au Royaume-Uni, le prestigieux collège de Winchester va s’ouvrir aux filles",Le Monde,2021-02-10
"« Ma crainte, c’est de trouver des gens morts dans leurs tentes » : à Lille, la maraude des associations d’aide aux sans-abri menacés par la vague de froid",Le Monde,2021-02-10
"OpenLux : le Luxembourg, un aimant pour les grandes fortunes françaises",Le Monde,2021-02-10
Violences sexuelles sur mineurs : le gouvernement s’engage sur un seuil d’âge à 15 ans,Le Monde,2021-02-10
"Le Siècle, club de l’élite, aimerait continuer à dîner en paix malgré l’affaire Olivier Duhamel",Le Monde,2021-02-10
"Oscars 2021 : « Deux », qui représente la France, fait partie de la présélection",Le Monde,2021-02-10
"« Parfois, je ne mange pas pendant 36 heures parce que je n’ai pas le temps » : avec des étudiants sur le fil de la précarité à Montpellier",Le Monde,2021-02-10
Cécile Duflot : « Une victoire de Marine Le Pen est comme un impensé dans la tête des dirigeants de gauche »,Le Monde,2021-02-10
"« A l’appui de sa stratégie d’influence en Europe, Pékin dispose d’une arme redoutable : les vaccins anti-Covid-19 »",Le Monde,2021-02-10
Athlétisme : l’Ethiopienne Gudaf Tsegay bat le record du monde du 1 500 m en salle,Le Monde,2021-02-10
"Covid-19 : les musées, premiers à rouvrir en cas de recul de l’épidémie",Le Monde,2021-02-10
"« Genre », un tic de langage dont la signification glisse à mesure que sa popularité augmente",Le Monde,2021-02-10
Une douzième édition de « Top Chef » malgré l’épidémie de Covid-19,Le Monde,2021-02-10
"Encouragés par le gouvernement, les réseaux sociaux d’extrême droite se multiplient en Pologne",Le Monde,2021-02-10
Les élections régionales et départementales se tiendront les 13 et 20 juin,Le Monde,2021-02-10
Hauts-de-France : les départements où l’on compte le plus de chats par foyers,Nord Presse,2021-02-10
Une conque de 18.000 ans fait encore entendre sa musique,Science et Avenir,2021-02-10
Séisme dans le Pacifique: fin de l'alerte au tsunami,Science et Avenir,2021-02-10
"18.000 ans, la plus vieille mélodie du monde ?",Science et Avenir,2021-02-10
Covid-19 - Efficacité des vaccins: de quoi parle-t-on?,Science et Avenir,2021-02-10
"Moscou se prépare à une ""apocalypse"" de neige",Science et Avenir,2021-02-10
"Vaccins: l'OMS au secours d'AstraZeneca, l'UE veut des preuves d'efficacité contre les variants",Science et Avenir,2021-02-10
"Landes: l'hôpital de Dax perturbé par une attaque informatique d'""ampleur""",Science et Avenir,2021-02-10
"Sonde chinoise en orbite martienne, reliques anciennes, plaques tectoniques : l'actu des sciences",Science et Avenir,2021-02-10
"Covid-19 : le syndrome du ""cœur brisé"" explose avec le stress",Science et Avenir,2021-02-10
Le stress des pères impacte le cerveau de leurs bébés,Science et Avenir,2021-02-10
Le Trésor des Guelfes a-t-il été acquis pas spoliation ?,Science et Avenir,2021-02-10
"Dans le sud du Portugal, la ""Portimao Arena"" transformée en hôpital de campagne",Science et Avenir,2021-02-10
"En Bretagne, les routiers bloqués par la neige tempêtent",Science et Avenir,2021-02-10
Séisme dans le Pacifique: alerte au tsunami en Nouvelle-Zélande et Australie,Science et Avenir,2021-02-10
"Covid: ""un chemin"" toujours possible pour éviter le reconfinement, affirme Attal",Science et Avenir,2021-02-10
Cette vidéo retrace 1 milliard d'années de mouvements des plaques tectoniques,Science et Avenir,2021-02-10
Protection des insectes : l'Allemagne restreint l'usage des pesticides,Science et Avenir,2021-02-10
EN COURBES. Covid-19 : les taux de vaccination par région,Science et Avenir,2021-02-10
Mission de l'OMS en Chine: cinq questions sur la pandémie restées sans réponse,Science et Avenir,2021-02-10
Coronavirus: le point sur la pandémie,Science et Avenir,2021-02-10
"Le centre hospitalier de Dax perturbé par une attaque informatique d'""ampleur""",Science et Avenir,2021-02-10
"Covid-19: un hiver sans confinement, objectif sérieux ou mirage ?",Science et Avenir,2021-02-10
"Dix hackers arrêtés pour le vol de 100 millions de dollars en cryptomonnaies, annonce Europol",Science et Avenir,2021-02-10
Toyota se dit pas concerné par la pénurie mondiale de puces,Science et Avenir,2021-02-10
Débris spatiaux : l'épée de Damoclès,Science et Avenir,2021-02-10
"Vaccins: l'Afrique du Sud choisit Johnson & Johnson, prête à revendre ses doses d'AstraZeneca",Science et Avenir,2021-02-10
La sonde chinoise Tianwen-1 est entrée en orbite martienne,Science et Avenir,2021-02-10
Rupture d'un glacier en Inde: colère et désespoir des proches des disparus,Science et Avenir,2021-02-10
Année du boeuf: l'époque des vaches maigres pour les bovins sauvages hongkongais,Science et Avenir,2021-02-10
L'Estonie teste des passeports de vaccination pour le monde entier,Science et Avenir,2021-02-10
L'Allemagne va restreindre les pesticides malgré la bronca des agriculteurs,Science et Avenir,2021-02-10
Coronavirus: le point sur la pandémie,Science et Avenir,2021-02-10
"Pandémie: l'OMS doute des renseignements américains, l'UE veut muscler la production de vaccins",Science et Avenir,2021-02-10
Le gouvernement sort le très attendu projet de loi Climat,Science et Avenir,2021-02-10
Loana : pourquoi elle a des problèmes de mâchoire,Closer,2021-02-10
Delphine Jubillar : son portable s'est réactivé durant plusieurs heures mardi soir,Closer,2021-02-10
"Loana métamorphosée : mieux dans sa peau, elle dévoile sa nouvelle silhouette dans TPMP",Closer,2021-02-10
"Loana émue aux larmes dans TPMP : elle évoque les violences conjugales dont elle a été victime : ""Il m'a fait 30 hématomes en 4 heures""",Closer,2021-02-10
Un marginal tape encore « www. » dans sa barre de recherche pour surfer sur internet,Gorafi,2021-02-10
Olivier Véran : « Les filles qui se feront vacciner en discothèque auront droit à une conso gratuite »,Gorafi,2021-02-10
"Biden veut une nouvelle stratégie ""ferme"" face à la Chine",La Point,2021-02-10
"Coupe de France : victoire du PSG, échec de Nantes, et un peu d'air pour l'OM",La Point,2021-02-10
Procès en destitution : les procureurs démocrates étrillent Donald Trump,La Point,2021-02-10
Loi séparatisme : l’article « Samuel Paty » adopté par les députés,La Point,2021-02-10
Comment Emmanuel Macron espère « redémarrer l’ascenseur social »,La Point,2021-02-10
Covid-19 : les chiffres des hospitalisations en légère baisse,La Point,2021-02-10
Indre-et-Loire : la décision qui va rendre fous les anti-chasse,La Point,2021-02-10
"Eborgné, le ""gilet jaune"" Jérôme Rodrigues obtient la mise en examen du policier",La Point,2021-02-10
Biden pas pressé de courtiser Netanyahu et de s'embourber dans le dossier israélo-palestinien,La Point,2021-02-10
"Condamnée à l'inéligibilité, la maire de Montauban dénonce ""un piège politique""",La Point,2021-02-10
"Artistes au travail – Théo Mercier : histoires d’hommes, histoires d’objets",La Point,2021-02-10
L’invraisemblable sauvetage de trois Cubains coincés sur une île déserte,La Point,2021-02-10
La militante saoudienne Loujain al-Hathloul libérée,La Point,2021-02-10
Éborgnement de Jérôme Rodrigues : deux policiers mis en examen,La Point,2021-02-10
Présidentielle au Bénin : l’ONU prend le pouls,La Point,2021-02-10
"Extrême droite, islam… Cécile Duflot attaque les dirigeants de la gauche",La Point,2021-02-10
Atteintes sexuelles sur mineurs: les députés adoptent un texte en commission,La Point,2021-02-10
"Un ambassadeur français accusé de viols, l’enquête classée sans suite",La Point,2021-02-10
Vaccination : la France passe de la 35e à la… 34e position,La Point,2021-02-10
