titre,journal,date
Anne Hidalgo : « Je n'ai qu'une boussole : l'universalisme »,Charlie Hebdo,2021-01-07
États-Unis : tous égaux devant la loi,Charlie Hebdo,2021-01-07
"« Trump peut disparaître de la vie politique, pas ses électeurs »",Charlie Hebdo,2021-01-07
Ministère de l'Environnement : cinquante ans et plus une dent,Charlie Hebdo,2021-01-07
Anne Hidalgo : « Je n'ai qu'une boussole : l'universalisme »,Charlie Hebdo,2021-01-07
"«The Good Lord Bird», que l’illuminé soit !",Libération,2021-01-07
"La victoire de Biden validée par le Congrès, Trump promet une «transition ordonnée»",Libération,2021-01-07
"Chaos à Washington, purge à Hongkong, le gouvernement s'exprime sur la crise sanitaire : l'essentiel de l'actualité de ce jeudi matin",Libération,2021-01-07
Invasion du Capitole : Trump et l’ultime coup «sauvage» de l’incendiaire du chaos,Libération,2021-01-07
Vigilance,Libération,2021-01-07
"A Haguenau, avec les «frères d’armes» des soldats tués au Mali",Libération,2021-01-07
"Dans nos sociétés capitalistes, la solidarité est devenue improductive",Libération,2021-01-07
JO 2024 : la justice saisie contre la vente d’une partie du parc de La Courneuve,Libération,2021-01-07
"«Je suis passé de l'autre côté de la seringue» : à Nancy, les soignants se vaccinent pour l'exemple",Libération,2021-01-07
"Le recours au 25e amendement, qui permettrait de démettre Trump, est-il possible ?",Libération,2021-01-07
"Après quatre ans d'impunité, Trump banni de Facebook pour au moins deux semaines",Libération,2021-01-07
«John ZiziMan» rend le Danemark un peu zinzin,Libération,2021-01-07
Invasion du Capitole : l’Europe centrale entre gêne et condamnation,Libération,2021-01-07
«Insurrection» au Capitole : les critiques des politiques dépassent les rangs démocrates,Libération,2021-01-07
"Capitole envahi : de New York à Rome, la presse entre condamnation et sidération",Libération,2021-01-07
Capitole envahi : démocraties à bout de souffle ?,Libération,2021-01-07
Un début d'union de la gauche découvert dans le Grand Est,Libération,2021-01-07
La nomination d'Agnès Buzyn à l'OMS lui donne-t-elle une immunité contre les poursuites judiciaires ?,Libération,2021-01-07
Vaccination : le ministère de la Santé a fait appel à trois cabinets de conseil en plus de McKinsey,Libération,2021-01-07
"Contaminations, nouveau variant, vaccin Moderna... Où en est l'épidémie de Covid-19 en France ?",Libération,2021-01-07
"En 2020, «les clients ont fait preuve d’amour, de fidélité, avec les librairies indépendantes»",Libération,2021-01-07
"Covid-19 : les résidents en Ehpad ont-ils reçu 58 pages à lire avant de se faire vacciner, comme l'affirme Gérard Larcher ?",Libération,2021-01-07
Vaccination contre le Covid : la France toujours dans le peloton de queue,Libération,2021-01-07
La justice française ouvre la voie à l'extradition de l'ex-chef d'ETA Josu Ternera,Libération,2021-01-07
"Pour John Harvey, Franck Elder des ders",Libération,2021-01-07
Affaire Duhamel : des étudiants de Sciences-Po demandent la démission de leur directeur,Libération,2021-01-07
"«Ici, c’est chez nous» : une tentative de coup d’Etat qui s'inscrit dans une guerre raciale",Libération,2021-01-07
Veolia dévoile les conditions de son OPA pour tenter d'en finir avec Suez,Libération,2021-01-07
Ironie et satisfaction chez les amis et les ennemis de Trump,Libération,2021-01-07
De ma démocratie en Amérique,Libération,2021-01-07
"Imbroglio procédural au procès de Nadjélika, renvoyé au 3 mars",Libération,2021-01-07
La généralisation de la «garantie jeunes» aux 16-25 ans les plus précaires sur la table du gouvernement,Libération,2021-01-07
"A Washington, les ratages de la police en question",Libération,2021-01-07
"Au lendemain du chaos, le difficile «après-Trump» du Parti républicain",Libération,2021-01-07
Covid-19 : faut-il se faire tester avant d'être vacciné ?,Libération,2021-01-07
Crise du Covid : «Les élites surinvestissent la stratégie mais se désintéressent de la mise en œuvre»,Libération,2021-01-07
"A Paris, les «cantinières en colère» du XVe arrondissement",Libération,2021-01-07
"Yassin al-Haj Saleh, déchiffreur du totalitarisme syrien",Libération,2021-01-07
"Femme tuée au Capitole: Ashli Babbitt, mort d'une trumpiste jusqu'au-boutiste",Libération,2021-01-07
"A Paris, trois migrants afghans en virée dans leur rêve",Libération,2021-01-07
"«Les établissements fermés le resteront», annonce Jean Castex",Libération,2021-01-07
"A la Sorbonne, des violences policières émaillent les mobilisations étudiantes",Libération,2021-01-07
"Mort de Bobby Few, pianiste sans chapelle",Libération,2021-01-07
La neutralité des banques centrales face à la crise climatique est un leurre,Libération,2021-01-07
Appel de 200 artistes pour la vaccination : «C’est le seul moyen de sortir de ce bordel»,Libération,2021-01-07
Chantage à la sextape: Benzema renvoyé devant le tribunal correctionnel,Libération,2021-01-07
"Quakers, hip-hop cathartique",Libération,2021-01-07
"La tarentelle, des Italiennes piquées au vif",Libération,2021-01-07
"Aude Goeminne, les teintes retrouvées",Libération,2021-01-07
Les harmonies chamaniques d’Ignacio Maria Gomez,Libération,2021-01-07
Le basket américain relève le poing après l'invasion du Capitole,Libération,2021-01-07
"David Hallyday, ét(r)eindre le feu",Libération,2021-01-07
"Politique migratoire, l’impensé du Brexit",Libération,2021-01-07
Mauricette et les punks à chiens,Libération,2021-01-07
Préparez-vous pour la «Brexéternité»,Libération,2021-01-07
"«Chez Mauricette», la salle des fêtes devenue centre de vaccination à Poissy",Libération,2021-01-07
"Annonces de Castex, Biden confirmé président malgré le chaos au Capitole, affaire Duhamel... L'actu de ce jeudi",Libération,2021-01-07
Vaccination : le gouvernement accélère (encore),Libération,2021-01-07
Les stations de ski redoutent «une saison blanche» aux conséquences «sans précédent»,Libération,2021-01-07
Macron fait le coup de Jarnac,Libération,2021-01-07
Pap Ndiaye : «Les institutions américaines ont encore de solides appuis»,Libération,2021-01-07
«C’est une attaque en plein cœur de la démocratie»,Libération,2021-01-07
Le Président vante ses zests sociaux,Libération,2021-01-07
Covid : «Nous ne sommes toujours pas sortis d’affaire»,Libération,2021-01-07
Soupçons croissants de bavure autour d'une frappe de «Barkhane» au Mali,Libération,2021-01-07
Les ennemis des Etats-Unis se délectent du spectacle,Libération,2021-01-07
Qui sont les insurgés pro-Trump qui ont envahi le Capitole ?,Libération,2021-01-07
Ce qui est arrivé est profondément américain,Libération,2021-01-07
"Joe Biden, président élu, certifié et éprouvé",Libération,2021-01-07
Etats-Unis : les treize jours les plus longs,Libération,2021-01-07
"Pour Trump, le résultat de quatre ans à souffler sur les brèches",Libération,2021-01-07
"Complotistes, néonazis, pro-armes : le pire du trumpisme en action",Libération,2021-01-07
"Du 18 brumaire au Capitole, ces parlements symboles d’un pouvoir à renverser",Libération,2021-01-07
Convention citoyenne : le projet de loi prend son temps,Libération,2021-01-07
"Aux Etats-Unis, les républicains au bord de l'implosion",Libération,2021-01-07
Réouverture repoussée : «On est en train de créer une machine à broyer la restauration»,Libération,2021-01-07
"Outrées par le chaos du Capitole, les ministres des Transports et de l'Education de Trump démissionnent",Libération,2021-01-07
La peintre Apolonia Sokol ouvre grand ses toiles au théâtre de l’intimité,Le Monde,2021-01-07
"« 1984 » entre dans le domaine public, quatre adaptations en bande dessinée disponibles en librairie au mois de janvier",Le Monde,2021-01-07
"Crash des 737 MAX : accusé de fraude officiellement, Boeing va payer 2,5 milliards de dollars",Le Monde,2021-01-07
Covid-19 : tests obligatoires pour les vols de la Guyane aux Antilles,Le Monde,2021-01-07
"Restrictions, vaccination, dépistages…, les principales annonces de la conférence de Jean Castex",Le Monde,2021-01-07
Un magistrat du tribunal judiciaire de Paris mis en examen pour proxénétisme,Le Monde,2021-01-07
Taxes GAFA : Washington suspend les représailles douanières prises à l’encontre de Paris,Le Monde,2021-01-07
Comment des dizaines de manifestants pro-Trump ont accédé au cœur du Capitole,Le Monde,2021-01-07
"« Mystery Road », sur Arte : un polar sombre et sanglant dans l’« outback » australien",Le Monde,2021-01-07
Une dizaine de manifestants interpellés le 12 décembre à Paris portent plainte contre le préfet de police,Le Monde,2021-01-07
"Au Ghana aussi, on s’affole au Capitole",Le Monde,2021-01-07
WhatsApp revoit ses conditions d’utilisation sur le partage des données utilisateurs avec Facebook,Le Monde,2021-01-07
"Après l’annonce du confinement local à Nice, le point sur ce qui est autorisé, restreint ou interdit à cause du Covid-19 en France",Le Monde,2021-01-07
"Grippe aviaire : doublement du nombre de foyers dans le Sud-Ouest, plus de 350 000 canards abattus",Le Monde,2021-01-07
« The Social Network » sur TCM Cinéma : la success-story de Facebook filmée comme un jeu de massacre,Le Monde,2021-01-07
« Paroles de lecteurs » - L’impossible art de la nuance et de la pensée complexe,Le Monde,2021-01-07
"Chez les militants radicaux pro-Trump : colère, incompréhension et théorie d’un « complot antifa » après l’envahissement du Capitole",Le Monde,2021-01-07
Affaire de la « sextape » : Karim Benzema renvoyé devant le tribunal correctionnel de Versailles,Le Monde,2021-01-07
Le Conseil d’Etat dit définitivement non aux arrêtés contre les pesticides pris par des maires,Le Monde,2021-01-07
Fusillade à Bordeaux : quatre suspects déférés en vue de mises en examen pour meurtre,Le Monde,2021-01-07
Inventaire de mutations d’une région cruciale du SARS-CoV-2 influant sur la réponse en anticorps,Le Monde,2021-01-07
"Que prévoit le 25e amendement de la Constitution américaine, évoqué pour une possible destitution de Donald Trump ?",Le Monde,2021-01-07
"L’historien Norman Golb, pionnier d’une histoire juive alternative, est mort",Le Monde,2021-01-07
"Au Nigeria, le difficile chemin vers l’autosuffisance en riz",Le Monde,2021-01-07
« Montrer son bébé mort sur Instagram permet d’éviter le déni d’autrui »,Le Monde,2021-01-07
"Entre moqueries, esprit de revanche et inquiétudes : le chaos au Capitole vu d’Afrique",Le Monde,2021-01-07
« Donald Trump doit être tenu pour responsable » : la majorité de la presse américaine condamne le président sortant,Le Monde,2021-01-07
Etats-Unis : Donald Trump se dit « scandalisé » par la violence au Capitole et promet une transition « sans accroc »,Le Monde,2021-01-07
L’année 2020 par Plantu,Le Monde,2021-01-07
Un groupe guinéen reprend l’usine d’alumine d’Alteo,Le Monde,2021-01-07
"« Mort-né, mais né quand même » : sur Instagram, des photos de bébés morts pour briser le silence du deuil périnatal",Le Monde,2021-01-07
Hongkong : arrestation massive des opposants pro-démocratie,Le Monde,2021-01-07
"Couvre-feu prolongé jusqu’au 20 janvier, accélération de la campagne vaccinale : Jean Castex défend la stratégie sanitaire de l’exécutif",Le Monde,2021-01-07
Irruption de partisans de Donald Trump au sein du Capitole : « C’est un énorme échec des forces de police américaines »,Le Monde,2021-01-07
"QAnon, « Stop the steal »… d’où viennent les symboles et slogans brandis par les émeutiers du Capitole ?",Le Monde,2021-01-07
« Mélange » de vaccins et délai entre deux injections : le pari du Royaume-Uni contre le Covid-19,Le Monde,2021-01-07
"« Quand je n’aurai plus d’ombre », d’Adriaan van Dis : sarabande pour une mère mourante",Le Monde,2021-01-07
"« La Part rêvée », de Bernard Lahire : le rêve aux portes de la sociologie",Le Monde,2021-01-07
« La Canine de George » : Sigolène Vinson n’a de dent envers quiconque,Le Monde,2021-01-07
"LVMH finalise le rachat de Tiffany, le patron du joaillier va quitter le groupe",Le Monde,2021-01-07
Veolia adresse sa proposition de rachat aux actionnaires de Suez,Le Monde,2021-01-07
"Précurseur en Amérique latine, le Mexique bannit le maïs génétiquement modifié et le glyphosate",Le Monde,2021-01-07
"« Trump n’a eu de cesse de vouloir détruire la démocratie depuis quatre ans, celle-ci ne s’est pas laissé faire »",Le Monde,2021-01-07
"A Dakar, le deuxième couvre-feu ne passe pas",Le Monde,2021-01-07
"2020, un très bon millésime pour les fusions-acquisitions",Le Monde,2021-01-07
"Complotistes, néonazis, négationnistes… qui sont les insurgés du Capitole ?",Le Monde,2021-01-07
"L’artiste Marina Richterová et Michel Rocard, dans « L’Echo de la timbrologie »",Le Monde,2021-01-07
"Une nouvelle chance pour l’« eurocroissance », l’assurance-vie du troisième type",Le Monde,2021-01-07
Karim Benzema renvoyé devant le tribunal correctionnel dans l’affaire de la « sextape » de Mathieu Valbuena,Le Monde,2021-01-07
Barouf d’honneur,Le Monde,2021-01-07
"Covid-19 dans le monde : l’Europe dans « une situation alarmante », état d’urgence à Tokyo",Le Monde,2021-01-07
"« Trop, c’est trop » : l’heure de vérité pour Twitter, Facebook et YouTube face aux comptes de Donald Trump",Le Monde,2021-01-07
"Le gouvernement promet « plus de visibilité » sur la gestion de la crise sanitaire, Jean Castex s’exprime à 18 heures",Le Monde,2021-01-07
"Récit en BD – « Après le Covid-19, c’est encore le Covid-19 »",Le Monde,2021-01-07
Laïcité : « Un adolescent peut se sentir coincé dans un conflit de valeurs »,Le Monde,2021-01-07
"« Nœuds de vie », de Julien Gracq : le feuilleton littéraire de Camille Laurens",Le Monde,2021-01-07
Nouvelles interpellations après la free party du Nouvel An en Bretagne,Le Monde,2021-01-07
« La partie n’est pas jouée pour le bitcoin »,Le Monde,2021-01-07
"Raphael Warnock, premier sénateur noir de Géorgie",Le Monde,2021-01-07
Le Soudan accepte de normaliser ses relations avec Israël en échange d’une aide financière américaine,Le Monde,2021-01-07
"« L’Europe, puissance ou tigre de papier ? »",Le Monde,2021-01-07
Hongkong : avalanche de condamnations après l’interpellation de militants prodémocratie,Le Monde,2021-01-07
La Chine bloque l’enquête de l’OMS sur les origines du SARS-CoV-2,Le Monde,2021-01-07
Joe Biden choisit Merrick Garland pour restaurer l’image de la justice,Le Monde,2021-01-07
"Sur le départ, le président du Niger appelle à ne pas « tripoter » les Constitutions",Le Monde,2021-01-07
Stabilité financière : la Banque de France s’inquiète d’une dégradation de la santé des entreprises,Le Monde,2021-01-07
"Chaos à Washington : le monde stupéfait, partagé entre solidarité et sarcasmes",Le Monde,2021-01-07
"Effondrement du transport et tourisme à l’arrêt : avec le Covid-19, la Corse redécouvre qu’elle est une île",Le Monde,2021-01-07
L’élection de Joe Biden à la présidence des Etats-Unis confirmée après une journée de chaos au Capitole,Le Monde,2021-01-07
La France se prépare à l’arrivée du vaccin de Moderna,Le Monde,2021-01-07
"Tedros Adhanom Ghebreyesus, directeur de l’OMS : « Il n’y a pas de vaccin contre la pauvreté, la faim, le changement climatique ou l’inégalité »",Le Monde,2021-01-07
Violences au Capitole : jour de honte aux Etats-Unis,Le Monde,2021-01-07
Le football français pris dans un affrontement entre l’Elysée et Canal+,Le Monde,2021-01-07
"Nigeria : à Lagos, le coronavirus fait basculer dans l’extrême pauvreté",Le Monde,2021-01-07
Laïcité : émotion après un incident dans un collège lyonnais,Le Monde,2021-01-07
« On assiste à une nouvelle étape dans la privatisation de l’action publique »,Le Monde,2021-01-07
"« Aujourd’hui », de Dominique Fabre : tout peut arriver à Bécon-les-Bruyères",Le Monde,2021-01-07
"Thomas Clerc, Madeline Roth… Les brèves critiques du « Monde des livres »",Le Monde,2021-01-07
Vaccination contre le Covid-19 : le gouvernement a fait appel à quatre cabinets de conseil,Le Monde,2021-01-07
Réforme de la justice des mineurs : Eric Dupond-Moretti veut aller plus vite que le Parlement,Le Monde,2021-01-07
Les derniers saccages de Donald Trump,Le Monde,2021-01-07
« On n’a jamais autant parlé des librairies » : le livre ne connaît pas la crise,Le Monde,2021-01-07
Antitrust et régulation : le marathon judiciaire et politique des GAFA,Le Monde,2021-01-07
"En Espagne, le cimetière des night-clubs",Le Monde,2021-01-07
La plasticienne Kubra Khademi utilise l’art pour dénoncer les abus de toutes sortes,Le Monde,2021-01-07
"Après le Brexit, « la relation franco-britannique sera demain ce que nous choisirons d’en faire »",Le Monde,2021-01-07
« A quoi sert la mise au ban de Maurras par la justice si l’amnésie vient la recouvrir ? »,Le Monde,2021-01-07
"Ashli Babbitt, la femme abattue au Capitole, a succombé à un tir de la police",Le Monde,2021-01-07
"Le Sénat ayant basculé dans le camp démocrate, Joe Biden se retrouve les mains libres",Le Monde,2021-01-07
"2021, année de tous les dangers pour Erdogan",Le Monde,2021-01-07
En images : les Etats-Unis au bord de l’« insurrection »,Le Monde,2021-01-07
"« Steve Bannon, l’homme qui voulait le chaos » : un livre retrace le parcours de l’ex-conseiller de Trump",Le Monde,2021-01-07
"Sur Internet, le retour du payant contre le tout-gratuit",Le Monde,2021-01-07
"« Le féminisme permet de renforcer les deux piliers, libéral et démocratique, de nos sociétés »",Le Monde,2021-01-07
Assurance-vie : qui facture le moins de frais ?,Le Monde,2021-01-07
Euthanasie : les malades demandent à avoir le choix,Le Monde,2021-01-07
Facebook suspend jusqu’à nouvel ordre les comptes de Donald Trump,Le Monde,2021-01-07
"« Trump reste le président du chaos, celui qui a prospéré sur la violence, les clivages, les divisions »",Le Monde,2021-01-07
"Chez Michelin, après le choc des 2 300 suppressions de postes, la négociation commence",Le Monde,2021-01-07
"Dans l’Union européenne, des campagnes de vaccination à tâtons",Le Monde,2021-01-07
"« Notre droit n’est plus en mesure de sauver des vies » : la bureaucratie française, coupable idéale des ratés de la vaccination",Le Monde,2021-01-07
"Kamel Daoudi, suspect à perpétuité",Le Monde,2021-01-07
L’Ile-de-France paie la crise au prix fort,Le Monde,2021-01-07
"« Si je crois en rien, est-ce que je ne suis rien ? » : dans les cours de récréation, la question des religions à hauteur d’enfant",Le Monde,2021-01-07
« La loi “séparatisme” pourrait s’avérer pire pour les journalistes que la loi “sécurité globale” »,Le Monde,2021-01-07
"Donald Trump, le président insurrectionnel",Le Monde,2021-01-07
"Erdogan veut mettre au pas l’université du Bosphore, à Istanbul",Le Monde,2021-01-07
"« Tout cela, c’est de la fraude, on va se faire baiser » : le jour où des partisans de Donald Trump ont semé le chaos au Capitole",Le Monde,2021-01-07
Ca va être tout blanc,Nord Presse,2021-01-07
Les Teufeurs Bretons ont poussé la teuf un peu trop loin ce soir.,Nord Presse,2021-01-07
Le nouveau président américain a pris le pouvoir en renversant le Sénat,Nord Presse,2021-01-07
La Californie déploie des dizaines de remorques frigorifiques pour les morts du Covid,Science et Avenir,2021-01-07
"Un paléo-tsunami a frappé la côte israélienne, il y a 10.000 ans",Science et Avenir,2021-01-07
Covid-19 : les nouvelles mesures annoncées par Jean Castex,Science et Avenir,2021-01-07
Confinement et couvre-feu: la Colombie renforce les restrictions face au Covid-19,Science et Avenir,2021-01-07
Madrid et une partie de l'Espagne sous la neige,Science et Avenir,2021-01-07
"Après Pluton et Arrokoth, New Horizons à la recherche d'une prochaine cible",Science et Avenir,2021-01-07
"Les vrais jumeaux ne sont pas si identiques qu'on le pense, montre une étude",Science et Avenir,2021-01-07
"Girafes, Covid et mortalité maternelle : l'actu des sciences",Science et Avenir,2021-01-07
Vaccins anti-Covid : négociations secrètes entre les labos et l'UE,Science et Avenir,2021-01-07
Arrêtés anti-pesticides: le Conseil d'Etat dit définitivement non,Science et Avenir,2021-01-07
Covid-19 : 50% des infections dues aux asymptomatiques,Science et Avenir,2021-01-07
Mortalité maternelle en France : maladies cardiovasculaires et suicides en tête,Science et Avenir,2021-01-07
Une vente aux enchères d'objets nazis à Soissons annulée,Science et Avenir,2021-01-07
"Abattages renforcés contre une grippe aviaire ""hors de contrôle"" dans le Sud-Ouest",Science et Avenir,2021-01-07
Des scientifiques décrivent pour la première fois des girafes naines,Science et Avenir,2021-01-07
Les actionnaires d'Altice Europe approuvent le rachat par Patrick Drahi,Science et Avenir,2021-01-07
"En unité gériatrique, le vaccin contre le Covid-19 rime avec espoir",Science et Avenir,2021-01-07
Atos confirme son intérêt pour DXC Technology,Science et Avenir,2021-01-07
15% des paires de vrais jumeaux montrent des différences génétiques,Science et Avenir,2021-01-07
EN COURBES. Covid-19 : la situation en réanimation,Science et Avenir,2021-01-07
L’ADN révèle 7 millions d’années d’histoire de l’humanité,Science et Avenir,2021-01-07
Covid-19: état d'urgence dans le grand Tokyo,Science et Avenir,2021-01-07
Cas rarissime d'un homme mort de la rage après avoir été mordu ou griffé par une chauve-souris,Science et Avenir,2021-01-07
"Lancement d'un ""éco-score"" pour évaluer l'impact environnemental des produits alimentaires",Science et Avenir,2021-01-07
Twitter et Facebook bloquent temporairement Trump,Science et Avenir,2021-01-07
"Pékin grelotte par -19, au plus froid depuis 50 ans",Science et Avenir,2021-01-07
Les USA envisagent d'ajouter Alibaba et Tencent à leur liste noire des entreprises chinoises,Science et Avenir,2021-01-07
Twitter et Facebook gèlent les publications de Donald Trump,Science et Avenir,2021-01-07
Le Mexique bannit le maïs OGM et le glyphosate,Science et Avenir,2021-01-07
Japon: état d'urgence imminent face au Covid-19,Science et Avenir,2021-01-07
"Covid-19 : Castex maintient toutes les restrictions, accélère la vaccination",Science et Avenir,2021-01-07
Chine: les nouveaux cas de Covid-19 au plus haut depuis six mois,Science et Avenir,2021-01-07
Une personne sur 100.000 a fait un choc allergique au vaccin Pfizer,Science et Avenir,2021-01-07
Les causes de la mort du top Stella Tennant révélées par la famille,Closer,2021-01-07
"Disparition de Delphine Jubillar : son mari, Cédric, est ""acculé""",Closer,2021-01-07
Camille Kouchner : cette terrible déclaration de sa mère juste avant sa mort,Closer,2021-01-07
Anne-Elisabeth Lemoine : cette confidence intime sur son lien avec Calogero,Closer,2021-01-07
Une immense rave-party réunit plus de quarante chèvres en Lozère,Gorafi,2021-01-07
Un énième pays du tiers-monde expérimente avec difficulté la démocratie,Gorafi,2021-01-07
À la une ce vendredi 8 janvier…,La Point,2021-01-07
"Hollande: ""sans leader"", appeler au rassemblement de la gauche est une ""démarche vaine""",La Point,2021-01-07
La Turquie affirme être prête à « normaliser » sa relation avec la France,La Point,2021-01-07
La sécurité à Washington en question à deux semaines de l'investiture de Biden,La Point,2021-01-07
"Complotistes, pro-armes, néonazis, qui sont les émeutiers du Capitole?",La Point,2021-01-07
Marine Le Pen concentre les critiques après le chaos à Washington,La Point,2021-01-07
Capitole envahi : Donald Trump se dit « scandalisé par la violence »,La Point,2021-01-07
Trump banni des réseaux sociaux : « Un discours interdit devient sacré  »,La Point,2021-01-07
"Abattages renforcés contre une grippe aviaire ""hors de contrôle"" dans le Sud-Ouest",La Point,2021-01-07
"Elon Musk, le patron de Tesla, devient officiellement l'homme le plus riche du monde",La Point,2021-01-07
"À Marseille, une circulation alarmante du Covid-19 dans les eaux usées",La Point,2021-01-07
Merrick Garland devra incarner une justice américaine sans influence,La Point,2021-01-07
"Vin – Collioure, 50 ans et beaucoup de projets",La Point,2021-01-07
Covid-19 : la conférence de presse de Jean Castex,La Point,2021-01-07
Deuxième hommage de la semaine pour des soldats français morts au Mali,La Point,2021-01-07
Washington suspend les droits de douane sur des produits français,La Point,2021-01-07
"Couvre-feu, vaccins, restaurants : les annonces de Jean Castex",La Point,2021-01-07
« Lupin » sur Netflix : plutôt Arsène Loupé !,La Point,2021-01-07
Virus : l'Espagne dépasse le seuil des 2 millions de cas confirmés,La Point,2021-01-07
Covid : la France et l'Allemagne ont-elles joué avec les vaccins ?,La Point,2021-01-07
Fusillade mortelle à Bordeaux : 4 des 5 suspects déférés,La Point,2021-01-07
Le chef démocrate au Sénat appelle à démettre Trump de ses fonctions,La Point,2021-01-07
"Affaire Duhamel: appels à la démission du directeur de Sciences Po, informé de soupçons depuis 2019",La Point,2021-01-07
Réponse économique au Covid : comment se situe la France en Europe ?,La Point,2021-01-07
Facebook bloque le compte de Trump pour une durée indéterminée,La Point,2021-01-07
Chantage à la sextape: procès en vue pour Benzema,La Point,2021-01-07
Martinique : terre de sports et d'aventures #1 - La plongée sous-marine,La Point,2021-01-07
Arrêtés anti-pesticides: le Conseil d'Etat dit définitivement non,La Point,2021-01-07
"Elon Musk, le fondateur de Tesla, devient l'homme le plus riche du monde (Bloomberg)",La Point,2021-01-07
