titre,journal,date
Lettre des animaux aux humains : la charolaise,Charlie Hebdo,2021-01-26
Aéroports de Paris : la baisse de salaire ou la porte,Charlie Hebdo,2021-01-26
Nouvelle nuit de violences au Pays-Bas contre le couvre-feu,Libération,2021-01-26
"Anthony Fauci, l'infectiologue star, raconte son année cauchemar avec Trump",Libération,2021-01-26
"Au Japon, addiction démoniaque à un jeu de séduction",Libération,2021-01-26
"Grève dans l'Education nationale, deuxième nuit d'émeutes aux Pays-Bas, loi contre la maltraitance animale... L'actu ce mardi matin",Libération,2021-01-26
Italie : Guiseppe Conte s'apprête à présenter sa démission,Libération,2021-01-26
Régionales : un report qui en cache un autre ?,Libération,2021-01-26
Peut-on parler des hommes qui violent sur Twitter ?,Libération,2021-01-26
Mediator : des experts au CV bien chargé,Libération,2021-01-26
"Pour les sages-femmes, le plafond de verre continue à l'université",Libération,2021-01-26
Et si on s’inspirait d’Ecotopia ?,Libération,2021-01-26
Le variant sud-africain entraîne-t-il vraiment «une diminution de l’efficacité du vaccin d’environ 40%» ?,Libération,2021-01-26
La réforme de la justice pénale des mineurs arrive au Sénat,Libération,2021-01-26
"Moreno, ministre déléguée à l’Egalité femmes-hommes, dénonce le «club de mecs» qu’est le CAC 40",Libération,2021-01-26
Concours 2021 sur le thème du voyage: on redémarre!,Libération,2021-01-26
Haute couture : toujours plus «bigger than life»,Libération,2021-01-26
L'acte d'accusation de Trump déposé dans un Capitole encore meurtri par les violences,Libération,2021-01-26
"Louis Burton, McGyver du Vendée Globe",Libération,2021-01-26
"François Léotard face à ses juges : «Moi, ces questions d’argent ne m’intéressent pas»",Libération,2021-01-26
#MeTooGay : «Que ces agressions sexuelles se déroulent entre hommes renforce la honte»,Libération,2021-01-26
Que sait-on de la progression des variants anglais et sud-africain en France ?,Libération,2021-01-26
Le vaccin AstraZeneca est-il dénué d’efficacité chez les plus de 65 ans ?,Libération,2021-01-26
"Derrière les insurgés du Capitole, une nébuleuse d'extrême droite sinistre et très préparée",Libération,2021-01-26
Covid-19 : les extrêmes droites européennes draguent les complotistes,Libération,2021-01-26
"Livraison : à Paris, des restaurateurs à bout de course",Libération,2021-01-26
Procès en destitution : «Les électeurs démocrates veulent la peau de Donald Trump»,Libération,2021-01-26
"Alexandre Mazzia, bien dans ses baskets",Libération,2021-01-26
"«Ham on Rye», à la faveur de l’ennui",Libération,2021-01-26
Les années de plomb passées à l’argentique,Libération,2021-01-26
"«Pelléas et Mélisande», rien que pour ses cheveux",Libération,2021-01-26
Colombie : le ministre de la Défense est mort du Covid-19,Libération,2021-01-26
Accusation d’inceste : «Victor» Kouchner a porté plainte contre son beau-père Olivier Duhamel,Libération,2021-01-26
Extrême droite : Darmanin veut la dissolution de Génération identitaire,Libération,2021-01-26
Pourquoi l'AP-HP a-t-elle vacciné au-delà des publics prioritaires ?,Libération,2021-01-26
Nucléaire : pour parer la cata EDF s’échauffe,Libération,2021-01-26
Travail dissimulé : des femmes de ménage ukrainiennes exploitées et sous emprise,Libération,2021-01-26
Le Haut Conseil à l'égalité appelle à étendre la loi sur la parité en entreprise,Libération,2021-01-26
Une déco dans l’hier du temps,Libération,2021-01-26
"Interdiction de la chasse à courre : les députés renâclent, les Verts se rebiffent",Libération,2021-01-26
Crise du Covid-19 : Macron n’est pas en odeur de santé,Libération,2021-01-26
Assurance chômage : le ministère du Travail revoit sa copie pour relancer sa réforme,Libération,2021-01-26
"Plainte dans l'affaire Duhamel, démission du gouvernement italien, cause animale... L'actu de ce mardi",Libération,2021-01-26
Crise politique à Rome : l’Italie peut-elle encore compter sur Conte ?,Libération,2021-01-26
"Charnier Paris-Descartes : «A mon époque, les corps ne pourrissaient pas»",Libération,2021-01-26
Inceste : «Victor» Kouchner a porté plainte,Libération,2021-01-26
Mediator : des experts au CV bien chargé,Libération,2021-01-26
Qui est à l'origine du hashtag viral #JeNeMeConfineraiPas ?,Libération,2021-01-26
La Rue de Valois en petite réforme,Libération,2021-01-26
Couvre-feu : les Pays-Bas se préparent à une nouvelle nuit d'émeutes,Libération,2021-01-26
Cannabis médical : dis-moi weed,Libération,2021-01-26
Cannabis médical : la vague verte atteint la blanche Colombie,Libération,2021-01-26
"Cannabis thérapeutique : «On vante la ""start-up nation"", mais là on est plutôt à l’époque des dinosaures»",Libération,2021-01-26
Manif du monde de l'éducation : «Ça devient de plus en plus dur de faire tenir la baraque»,Libération,2021-01-26
"Alberto Grimaldi, la dernière poignée de dollars",Libération,2021-01-26
Cafouillage,Libération,2021-01-26
"Roselyne, 69 ans retraitée à Lattes (Hérault) «Nos dirigeants n’en savent pas plus que nous»",Libération,2021-01-26
"Tomas, 20 ans étudiant à Lille et syndiqué à Solidaires «Le reconfinement, c’est un poids au-dessus de nos têtes»",Libération,2021-01-26
"Sophie 35 ans hôtesse d’accueil et mère de famille «Pas besoin, en plus, de désocialiser les enfants»",Libération,2021-01-26
Vaccins : Véran tente de mettre les doses à plat,Libération,2021-01-26
"Le reconfinement, c’est pour aujourd’hui ou pour demain ?",Libération,2021-01-26
Affaire Duhamel : les ratés d’une première enquête en 2011,Libération,2021-01-26
"La sorcière, de créature maléfique à icône féministe",Le Monde,2021-01-26
"Sept films, sept facettes de Jean-Pierre Bacri",Le Monde,2021-01-26
Premier entretien entre Joe Biden et Vladimir Poutine,Le Monde,2021-01-26
"En Ile-de-France, la bataille des régionales démarre",Le Monde,2021-01-26
Le Parti socialiste procède à un nouveau plan social,Le Monde,2021-01-26
Le MoDem engage le bras de fer dans la majorité pour la proportionnelle,Le Monde,2021-01-26
Les pays du G7 condamnent la détention « politique » d’Alexeï Navalny,Le Monde,2021-01-26
Elections régionales 2021 : le Sénat donne son accord pour un report « au plus tard le 20 juin »,Le Monde,2021-01-26
Audrey Pulvar officialise sa candidature aux élections régionales en Ile-de-France,Le Monde,2021-01-26
Pas de report de la deuxième injection pour le vaccin de Pfizer-BioNTech,Le Monde,2021-01-26
Comment sont calculés les taux de grévistes dans l’éducation nationale,Le Monde,2021-01-26
"Haythem El-Mekki, blogueur de la révolution tunisienne et chroniqueur acéré de la vie politique",Le Monde,2021-01-26
Football : l’ancien entraîneur du PSG Thomas Tuchel nommé à Chelsea,Le Monde,2021-01-26
"« Enseignants et étudiants, on est déjà tous en burn-out » : le monde de l’éducation en plein désarroi face à la gestion de la crise sanitaire",Le Monde,2021-01-26
"« Charlie, le journal qui ne voulait pas mourir » : comme un doigt d’honneur à la mort",Le Monde,2021-01-26
Il est urgent de garantir la liberté citoyenne d’informer et être informé,Le Monde,2021-01-26
"« Legacy » sur M6 : face à l’urgence climatique, Yann Arthus-Bertrand convoque pédagogie et belles images",Le Monde,2021-01-26
"Massu, Aussaresses, Le Pen : quand « Le Monde » réveillait les mémoires sur la guerre d’Algérie",Le Monde,2021-01-26
Comment des utilisateurs de Reddit ont manipulé la Bourse et fait perdre de l’argent à un grand fonds d’investissements,Le Monde,2021-01-26
Du tritium à un niveau élevé dans une centrale relance le débat sur le nucléaire en Corée du Sud,Le Monde,2021-01-26
Gérald Darmanin menace de dissoudre Génération identitaire,Le Monde,2021-01-26
Le Covid-19 a tué plus de 100 000 personnes au Royaume-Uni : pourquoi un tel bilan ?,Le Monde,2021-01-26
"Au Burkina Faso, la lutte sécuritaire met sous pression journalistes et militants",Le Monde,2021-01-26
"Les revenus du « Monde », des sources diversifiées",Le Monde,2021-01-26
Voyage immobile à Monaco,Le Monde,2021-01-26
Le peloton cycliste et le casse-tête d’un calendrier menacé par le Covid-19,Le Monde,2021-01-26
Israël rouvre une mission diplomatique au Maroc,Le Monde,2021-01-26
La justice américaine approuve un accord pour l’indemnisation de 37 victimes présumées de Harvey Weinstein,Le Monde,2021-01-26
"« Accroche-toi aux branches, ça va secouer » : le jour où vous avez pris conscience de l’ampleur de la pandémie de Covid-19",Le Monde,2021-01-26
"Inceste, #metoogay, 3919 : lors de ses vœux, la ministre Elisabeth Moreno réagit aux polémiques sur les violences sexuelles",Le Monde,2021-01-26
Paris vaut bien trois albums jeunesse,Le Monde,2021-01-26
Affaire Olivier Duhamel : « Victor » Kouchner a porté plainte contre son beau-père,Le Monde,2021-01-26
"Chantal Akerman, l’énergie du désespoir",Le Monde,2021-01-26
"Avec son projet de rénovation des casernes militaires, Libourne se rêve en capitale de l’œnotourisme",Le Monde,2021-01-26
Chanel : dans les coulisses du défilé haute couture,Le Monde,2021-01-26
Coupe du monde de ski alpin : la Française Tessa Worley s’impose sur le géant de Kronplatz,Le Monde,2021-01-26
Les aimants de l’iPhone 12 peuvent désactiver un pacemaker,Le Monde,2021-01-26
« Les quotas de femmes dans les conseils d’administration ont transformé la gouvernance des entreprises »,Le Monde,2021-01-26
Les Etats-Unis prévoient « assez de doses pour vacciner totalement 300 millions d’Américains d’ici la fin de l’été »,Le Monde,2021-01-26
Restrictions,Le Monde,2021-01-26
"Un an après le début de la crise du Covid-19, le FMI entrevoit le bout du tunnel",Le Monde,2021-01-26
"« Le Monde », un travail d’équipes",Le Monde,2021-01-26
Métropole de Lyon : les écologistes assument le recours à l’emprunt pour faire face à la crise et concrétiser leurs projets,Le Monde,2021-01-26
"« Après le Brexit, le statut de citoyen britannique en Europe est équivalent à celui du touriste chinois »",Le Monde,2021-01-26
"Pots-de-vin, pèlerinage et arbitrage : les coulisses agitées de la campagne pour la présidence du football africain",Le Monde,2021-01-26
« J’étais le rabat-joie de service » : Anthony Fauci raconte sa difficile année à conseiller Donald Trump,Le Monde,2021-01-26
"En Algérie, trois ans de prison requis en appel contre un militant pour des mèmes",Le Monde,2021-01-26
Pourquoi l’Institut Pasteur a abandonné son principal projet de vaccin anti-Covid-19,Le Monde,2021-01-26
L’Iran met un coup d’arrêt au planning familial pour relancer la natalité,Le Monde,2021-01-26
"A droite comme à gauche, le Covid-19 remet la souveraineté économique au goût du jour",Le Monde,2021-01-26
"Kaja Kallas, première femme chef du gouvernement en Estonie",Le Monde,2021-01-26
Condition animale : le projet de référendum d’initiative partagée sur la cause animale encalminé,Le Monde,2021-01-26
Nouvelle défection en Corée du Sud d’un diplomate nord-coréen,Le Monde,2021-01-26
"A l’arrêt, les 1 600 discothèques de France prêtes à se transformer en « centres de vaccination d’urgence »",Le Monde,2021-01-26
"Louis Schweitzer : contre la maltraitance des animaux, « il reste beaucoup à faire »",Le Monde,2021-01-26
"Face à la Turquie, la Grèce ne baisse pas la garde",Le Monde,2021-01-26
"Dégressivité des allocations-chômage : une « incitation au déclassement », selon l’OFCE",Le Monde,2021-01-26
"Au Johnny Circus, « 90 % de notre spectacle, ce sont les animaux »",Le Monde,2021-01-26
Le premier ministre italien Giuseppe Conte démissionne... pour tenter de rester en place,Le Monde,2021-01-26
L’éventuelle mise en examen du ministre de la justice Eric Dupond-Moretti bientôt tranchée,Le Monde,2021-01-26
Le monde culturel espère toucher quinze milliards d’euros dans le cadre du plan de relance européen,Le Monde,2021-01-26
"Au Mali, première visite ministérielle à Kidal depuis le coup d’Etat",Le Monde,2021-01-26
Une enquête préliminaire pour provocation à la haine raciale ouverte à l’encontre du groupuscule d’extrême droite Génération identitaire,Le Monde,2021-01-26
"« C’était un précurseur » : nombreux hommages après la mort de Jean-Pierre Michel, l’un des « pères » du pacs",Le Monde,2021-01-26
"Alstom, mauvais perdant du supercontrat du RER B",Le Monde,2021-01-26
La reprise de l’exploitation du Boeing 737 MAX en Europe suscite des inquiétudes,Le Monde,2021-01-26
L’ancienne ambassadrice de Trump en Afrique du Sud avait obtenu une résidence secondaire luxueuse,Le Monde,2021-01-26
"Face à la concurrence, « le long chemin de croix d’EDF »",Le Monde,2021-01-26
Ces boutiques de vape sanctionnées pour leur vente de cannabidiol trop chargé en THC,Le Monde,2021-01-26
Inceste : la force de la parole libérée,Le Monde,2021-01-26
Menaces d’« un mouvement de grève dur et long » dans les aéroports de Roissy-Charles-de-Gaulle et d’Orly,Le Monde,2021-01-26
« Le “patriotisme économique” faisait sourire il y a quinze ans »,Le Monde,2021-01-26
Comment fonctionne le partenariat entre « Le Monde » et la Fondation Gates,Le Monde,2021-01-26
Quelle souveraineté économique pour la France après le veto contre le rachat de Carrefour ?,Le Monde,2021-01-26
"Agroalimentaire : Lesaffre, le leadeur mondial de la levure, ne connaît pas la crise",Le Monde,2021-01-26
"Pour la présidente de la BERD, « les difficultés d’accès aux vaccins dans certains pays risquent de peser lourdement sur la reprise »",Le Monde,2021-01-26
« On n’est pas loin du théâtre de l’absurde » : une « rentrée fantôme » à l’université Bordeaux-Montaigne,Le Monde,2021-01-26
Egalité professionnelle : le bilan critique des RH sur les 10 ans de la loi Copé-Zimmermann,Le Monde,2021-01-26
L’hymne à la vie de la cinéaste Rebecca Zlotowski,Le Monde,2021-01-26
Retrouver en DVD le cinéma hongkongais grâce à Fruit Chan et Johnnie To,Le Monde,2021-01-26
"Un jour, un objet fait en France (2/10, saison 2) : la bibliothèque Frisco",Le Monde,2021-01-26
Encadrement des loyers : encore 40 % d’annonces illégales à Paris,Le Monde,2021-01-26
« Utopie » ou la force d’un concept survivant,Le Monde,2021-01-26
"« La gouvernance des entreprises reste un univers fortement genré, pour ne pas dire masculin »",Le Monde,2021-01-26
"Les danses fascinantes des microtubules, à la fois squelettes de nos cellules et autoroutes pour molécules",Le Monde,2021-01-26
Sanofi va aider Pfizer et BioNTech à produire leur vaccin,Le Monde,2021-01-26
"Enseignement de la Shoah : le projet « Convoi 77 », pour « apprendre à comprendre au lieu de chercher à haïr »",Le Monde,2021-01-26
« Pour des objectifs de mixité contraignants à la tête des entreprises » : l’appel de sept dirigeants de grandes entreprises,Le Monde,2021-01-26
"A Oman, les instants volés des prolétaires du désert",Le Monde,2021-01-26
Archives classées « secret-défense » : « Un règlement absurde interrompt brutalement des centaines de travaux de recherche »,Le Monde,2021-01-26
"« Entre la Chine et le Pakistan, la “route de la soie” est devenue un corridor de la dette »",Le Monde,2021-01-26
"« Le passeport vaccinal européen, une idée au mieux prématurée, au pire irréfléchie »",Le Monde,2021-01-26
Les épargnants doivent-ils avoir peur de l’inflation ?,Le Monde,2021-01-26
"« La caricature de la “dame du CDI”, c’est fini ! » : le blues des professeurs-documentalistes",Le Monde,2021-01-26
"Des microentrepreneurs « à bout de forces, épuisés moralement et physiquement »",Le Monde,2021-01-26
"Des anonymes au monde politique, réticences et résistances contre un troisième confinement",Le Monde,2021-01-26
« Il y a une vraie colère qui monte » : appel à la grève dans l’éducation nationale ce mardi,Le Monde,2021-01-26
"D’Apt à Sciences Po, le voyage d’une transfuge de classe",Le Monde,2021-01-26
La proposition de loi contre la maltraitance animale symbolise la prise de conscience de son importance politique,Le Monde,2021-01-26
Nouvelles émeutes dans plusieurs villes des Pays-Bas après l’imposition d’un couvre-feu,Le Monde,2021-01-26
Joe Biden veut reconstruire l’Amérique en achetant américain,Le Monde,2021-01-26
"Face à la pandémie de Covid-19, « sommes-nous prêts, encore, à consentir ? »",Le Monde,2021-01-26
La procédure d’impeachment contre Donald Trump est officiellement ouverte,Le Monde,2021-01-26
"Eric Dupond-Moretti à la justice, l’iconoclaste cherche la preuve par le terrain",Le Monde,2021-01-26
« Les stéréotypes et le plafond de verre sont encore puissants » : le long chemin vers la parité dans les directions des entreprises,Le Monde,2021-01-26
Janet Yellen devient officiellement la première femme à diriger le Trésor américain,Le Monde,2021-01-26
« Une envie de se sentir utile » : une nouvelle génération de jeunes engagés,Le Monde,2021-01-26
"« Rien n’est vrai, puisque tout est une blague » : ce que l’affaire Navalny dit de la Russie",Le Monde,2021-01-26
"« On a été trahis ! » : en Ukraine, l’essoufflement de la présidence Zelensky",Le Monde,2021-01-26
Dissolution de Génération Identitaire : « Traquer des migrants est réservé aux forces de l’ordre »,Nord Presse,2021-01-26
"Covid-19: assez de doses pour vacciner tous les Américains d'ici la fin de l'été, annonce la Maison Blanche",Science et Avenir,2021-01-26
Covid-19: résultats encourageants pour les anticorps de Lilly et Regeneron,Science et Avenir,2021-01-26
"A Los Angeles, des jeunes partent à la ""chasse aux vaccins"" devant les hôpitaux",Science et Avenir,2021-01-26
"L’objectif de limitation des températures à 1,5°C largement compromis",Science et Avenir,2021-01-26
Vaccination Covid-19: l'ouverture de nouveaux rendez-vous décalée à vendredi,Science et Avenir,2021-01-26
"Des loups s'échappent d'un parc animalier: deux  abattus, deux introuvables",Science et Avenir,2021-01-26
Le Royaume-Uni passe le cap des 100.000 morts du Covid,Science et Avenir,2021-01-26
"Kraken Mare, anorexie et planètes en rythme : l’actu des sciences",Science et Avenir,2021-01-26
Covid-19: pourquoi le variant anglais pourrait être plus mortel,Science et Avenir,2021-01-26
Covid-19 : les temps forts de la semaine du 26 janvier 2021,Science et Avenir,2021-01-26
"Virus: Chez les indigènes du Brésil, les fausses informations devancent le vaccin",Science et Avenir,2021-01-26
Vitamine D chez les enfants: attention au surdosage avec les compléments alimentaires,Science et Avenir,2021-01-26
Trappist : 7 planètes très semblables autour d'une étoile,Science et Avenir,2021-01-26
"Covid: les anticorps de synthèse de Lilly réduisent hospitalisations et décès, affirme le groupe",Science et Avenir,2021-01-26
La plus ancienne forme de monnaie européenne pourrait remonter à l'âge du Bronze,Science et Avenir,2021-01-26
EN COURBES. Covid-19 : sommes-nous près du reconfinement ?,Science et Avenir,2021-01-26
La Villa Borghese de Rome accueille le clone d'un platane du XVIIe siècle,Science et Avenir,2021-01-26
EN COURBES. Covid-19 : les taux de vaccination par région,Science et Avenir,2021-01-26
Suffit-il de planter des arbres pour sauver le climat ?,Science et Avenir,2021-01-26
6 planètes dansent une gigue rythmée et mystérieuse,Science et Avenir,2021-01-26
Fruits et légumes: les Français ne sont toujours pas au niveau requis de consommation,Science et Avenir,2021-01-26
La fonte des glaces s'est fortement accélérée en trois décennies,Science et Avenir,2021-01-26
Yvan Bourgnon présente son futur bateau ramasseur de plastiques,Science et Avenir,2021-01-26
Anorexie et microbiote : le cercle vicieux,Science et Avenir,2021-01-26
Covid-19: l'exécutif veut prendre son temps avant un éventuel confinement,Science et Avenir,2021-01-26
"Pompili élue ""boulet du climat"" de Greenpeace, prix spécial à Macron",Science et Avenir,2021-01-26
Covid-19 : Moderna affirme que son vaccin est encore efficace contre le variant sud-africain,Science et Avenir,2021-01-26
"Recherche: la fuite des cerveaux marque le ""déclassement"" de la France, selon Bayrou",Science et Avenir,2021-01-26
"A Davos, Ursula von der Leyen réclame un ""Accord de Paris"" pour la biodiversité",Science et Avenir,2021-01-26
Les baleines grises du nord-est du Pacifique meurent de faim,Science et Avenir,2021-01-26
"Plutôt Pfizer ou Sinopharm? Au Moyen-Orient, une ""diplomatie des vaccins""",Science et Avenir,2021-01-26
Covid-19 : l'épidémie était déjà visible sur les réseaux sociaux dès janvier 2020,Science et Avenir,2021-01-26
Le vaccin AstraZeneca peu efficace chez les seniors ?,Science et Avenir,2021-01-26
"En Afrique du Sud, des containers pour des morts du Covid",Science et Avenir,2021-01-26
Un robot aquatique propulsé comme une méduse,Science et Avenir,2021-01-26
Virus: plus de 100 millions de cas dans le monde,Science et Avenir,2021-01-26
"Virus: 2e nuit d'émeutes aux Pays-Bas, Biden entrevoit l'immunité collective",Science et Avenir,2021-01-26
"L'Assemblée nationale au chevet des animaux, ""sujet politique""",Science et Avenir,2021-01-26
"Vaccins Covid: des médecins libéraux dénoncent une répartition ""aux dépens des soignants""",Science et Avenir,2021-01-26
"Au chevet des animaux, l'Assemblée nationale dans une relative concorde",Science et Avenir,2021-01-26
Covid-19: enquête sur un ministre brésilien après le chaos en Amazonie,Science et Avenir,2021-01-26
Covid-19: Las Vegas veut rouvrir ses écoles par crainte d'une hausse des suicides,Science et Avenir,2021-01-26
Berlin dément la faible efficacité du vaccin AstraZeneca pour les personnes âgées,Science et Avenir,2021-01-26
Mutations du virus : le Royaume-Uni va partager son expertise en termes de génomes,Science et Avenir,2021-01-26
Royaume-Uni: les supermarchés toujours accros aux emballages plastiques,Science et Avenir,2021-01-26
Michael Douglas grand-père pour la deuxième fois : sa première fois avec le petit Ryder,Closer,2021-01-26
Gérard Louvin : ce document à charge que possèdent ses avocats contre son neveu qui l'accuse,Closer,2021-01-26
Flavie Flament : son conseil très émouvant aux victimes de viol,Closer,2021-01-26
"Inquiet de ses agissements, Gérald Darmanin envisage la dissolution de Francis Lalanne",Gorafi,2021-01-26
Factcheck : Les personnes qui rigolaient en chuchotant dans le tram se moquaient bien de vous,Gorafi,2021-01-26
À la une ce mercredi 27 janvier…,La Point,2021-01-26
États-Unis : plus de 150 personnes inculpées après les violences au Capitole,La Point,2021-01-26
Théâtre : décès du grand dramaturge suédois Lars Norén,La Point,2021-01-26
New Start: Poutine a soumis un projet de loi prolongeant l'accord de 5 ans,La Point,2021-01-26
"E85, la formule gagnante de Ford",La Point,2021-01-26
"4,6 millions de doses du vaccin d'AstraZeneca livrés à la France d'ici fin mars",La Point,2021-01-26
"Biden évoque les sujets qui fâchent avec Poutine, qui appelle à une ""normalisation""",La Point,2021-01-26
Covid-19 : les hospitalisations en hausse mais les réanimations stables,La Point,2021-01-26
"Football : après son éviction du PSG, Thomas Tuchel débarque à Chelsea",La Point,2021-01-26
Italie : une nonagénaire survit au Covid et découvre une fortune chez elle,La Point,2021-01-26
"Pour son premier appel avec Poutine, Biden a évoqué « l'empoisonnement » de Navalny",La Point,2021-01-26
Inde: renforts paramilitaires à Delhi après des heurts entre agriculteurs et policiers,La Point,2021-01-26
Elections régionales: le Sénat donne son accord au report en juin,La Point,2021-01-26
Régionales-Audrey Pulvar officialise sa candidature en Ile-de-France,La Point,2021-01-26
"Discret comme jamais, Trump reste profondément influent",La Point,2021-01-26
Facebook : des millions de numéros de téléphone revendus sur Telegram,La Point,2021-01-26
"Crise sanitaire, salaires...: mobilisation d'une partie du monde de l'éducation",La Point,2021-01-26
Covid-19 : que sait-on de la létalité du variant britannique ?,La Point,2021-01-26
Découverte d’un système planétaire unique en son genre,La Point,2021-01-26
"Biden promet d'agir contre le racisme, adopte des mesures restreintes",La Point,2021-01-26
Académie française : qui succédera à Jean d’Ormesson ?,La Point,2021-01-26
"Antony Blinken, un interventionniste dans une Amérique qui ne veut plus l'être",La Point,2021-01-26
Comment le gouvernement veut sauver sa réforme de l’assurance-chômage,La Point,2021-01-26
Le Royaume-Uni passe le cap des 100.000 morts du Covid,La Point,2021-01-26
Covid-19 : Sanofi va aider Pfizer et BioNTech à conditionner leur vaccin,La Point,2021-01-26
Israël rouvre une mission diplomatique au Maroc,La Point,2021-01-26
Covid-19 : la barre des 100 000 morts dépassée au Royaume-Uni,La Point,2021-01-26
La Mercedes GLA élue « plus belle voiture de l’année »,La Point,2021-01-26
"Champagne: les ventes mondiales ont chuté de 18% en 2020, mais le pire a été évité",La Point,2021-01-26
Des centaines de Tunisiens manifestent près du Parlement barricadé,La Point,2021-01-26
Agression de Yuriy : l'adolescent était connu des services de police,La Point,2021-01-26
"Dans un Liban confiné et en crise, survivre est devenu une mission quotidienne",La Point,2021-01-26
Beauvais : branle-bas de combat pour éviter la libération d’un détenu jugé dangereux,La Point,2021-01-26
Arthur Chevallier – La France préfère l’idée de la liberté à la liberté,La Point,2021-01-26
Le prof en liberté #27 – Pourquoi le vin est arrivé en Europe d’abord ?,La Point,2021-01-26
