titre,journal,date
"« L’Équipe » suspend sa grève, mais « le mouvement continue »",La Point,2021-01-22
"Il y a 44 ans, l’exploit d’Éric Tabarly",La Point,2021-01-22
29 juin 1976 : Tabarly vainqueur de la Transat en solitaire,La Point,2021-01-22
"#Metoogay: à leur tour, les gays libèrent la parole sur les violences sexuelles",La Point,2021-01-22
États-Unis : l’acte d’accusation contre Donald Trump sera transmis lundi au Sénat,La Point,2021-01-22
Masque lavable ou chirurgical : que pouvez-vous encore porter ?,La Point,2021-01-22
Brésil: des jeunes de Manaus se mobilisent contre le Covid-19,La Point,2021-01-22
Camion charnier : lourdes peines pour les responsables de la mort de 39 migrants,La Point,2021-01-22
"Jean-Luc Mélenchon ne s'est jamais ""senti si prêt à gouverner""",La Point,2021-01-22
Le pass Navigo peut désormais se recharger sur iPhone,La Point,2021-01-22
"Mode homme hiver 2021 : 24 heures, selon Dries Van Noten",La Point,2021-01-22
"Pour Camélia Jordana, Deneuve et Bardot incarnent « l’antiféminisme par excellence »",La Point,2021-01-22
Make America « fashion » again !,La Point,2021-01-22
"Londres : en plein confinement, la police interrompt un mariage de 400 personnes",La Point,2021-01-22
La Centrafrique sur un volcan,La Point,2021-01-22
Castex retrouve Philippe au Havre pour une carte postale maritime,La Point,2021-01-22
La préfecture de police refuse d’intégrer le meilleur élève gardien de la paix,La Point,2021-01-22
"En Allemagne, des capsules futuristes installées dans les rues pour les sans-abri",La Point,2021-01-22
2020 : une année record pour « Le Point »,La Point,2021-01-22
Zinédine Zidane testé positif au Covid-19,La Point,2021-01-22
"Avec #MeTooGay, la communauté gay raconte les violences sexuelles sur Twitter",La Point,2021-01-22
À quoi servent les sous-préfets à la relance ?,La Point,2021-01-22
Nicolas Dupont-Aignan : « Je n’ai pas besoin de câlins »,La Point,2021-01-22
L’Arabie saoudite se rachète sur les droits de l’homme,La Point,2021-01-22
FOG – Emmanuel le Hardi… ou le Flapi ?,La Point,2021-01-22
Europe : les voyages non essentiels fortement découragés,La Point,2021-01-22
"Face au Covid, le gouvernement s'efforce de maintenir le calendrier scolaire",La Point,2021-01-22
Zinédine Zidane testé positif au Covid-19,La Point,2021-01-22
Vallancien – Covid : l’info défigurée !,La Point,2021-01-22
Le jour où Olivier Duhamel… n’a pas reçu la Légion d’honneur,La Point,2021-01-22
Sahel : 2 millions de déplacés internes à cause des violences,La Point,2021-01-22
Mode hommes hiver 2021 : Vuitton sans frontières,La Point,2021-01-22
#Metoogay: des gays racontent à leur tour les violences sexuelles sur Twitter,La Point,2021-01-22
"Sans masque à l'aéroport, François Bayrou crée une polémique",La Point,2021-01-22
Un « Soulages » ayant appartenu à Léopold Sédar Senghor aux enchères,La Point,2021-01-22
Moscou : la police « réprimera » toute manifestation samedi pour Navalny,La Point,2021-01-22
Vaccin : vers des « sanctions » contre les laboratoires en cas de retard ?,La Point,2021-01-22
Biden plaide pour son plan de sauvetage et s'attaque à la crise alimentaire,La Point,2021-01-22
Un réseau de braqueurs de boutiques de gare SNCF démantelé,La Point,2021-01-22
« 66 millions de procureurs » : Jadot évoque « l’intelligence collective »,La Point,2021-01-22
États-Unis : de quels avantages bénéficiera l'ex-président Donald Trump ?,La Point,2021-01-22
New Start: un important traité russo-américain de désarmement nucléaire,La Point,2021-01-22
"Plantu quittera le Monde fin mars, ""rien à voir"" avec la polémique Gorce",La Point,2021-01-22
"Hong Kong: la Chine dénonce une ""ingérence"" du Parlement européen",La Point,2021-01-22
"Le Japon s'accroche à ses Jeux, malgré des bruits d'annulation",La Point,2021-01-22
"""66 millions de procureurs"": Jadot appelle Macron à user de ""l'intelligence collective""",La Point,2021-01-22
La Russie menace et interpelle les opposants avant des manifestations pour Navalny,La Point,2021-01-22
"Rémy Julienne, le cascadeur star, est mort",La Point,2021-01-22
Les Contrariantes #8 – Le pouvoir des réseaux sociaux & Hala Oukili,La Point,2021-01-22
Covid-19 : pas de changement des vacances de février pour l’instant,La Point,2021-01-22
Un digne héritier chez Zenith,La Point,2021-01-22
"France Télévisions va lancer ""Culturebox"", une chaîne éphémère pour soutenir la culture",La Point,2021-01-22
Vaccins anti-Covid : pourquoi l’Afrique du Sud doit payer plus cher,La Point,2021-01-22
Votre argent – Une nouvelle manière d’investir dans le non-coté,La Point,2021-01-22
Ils nous ont quittés - Jean-Pierre Bacri,La Point,2021-01-22
Le carnet - Un timbre à l’effigie de Simone de Beauvoir,La Point,2021-01-22
Diary Sow a voulu se donner « une sorte de répit salutaire dans (sa) vie »,La Point,2021-01-22
Présidentielle 2022 : Mélenchon ne s’est jamais « senti si prêt à gouverner »,La Point,2021-01-22
Europe : les voyages non essentiels fortement découragés,La Point,2021-01-22
Histoires secrètes de la gauche caviar,La Point,2021-01-22
L’invraisemblable pétition de soutien à Houria Bouteldja,La Point,2021-01-22
Diary Sow : l'étudiante sénégalaise disparue en France a été retrouvée,La Point,2021-01-22
Abus sexuels dans le sport : « Il faut une révolution culturelle ! »,La Point,2021-01-22
"Stanislas Guerini, boulet ou bouc émissaire de la macronie ?",La Point,2021-01-22
"Virus: en Amazonie brésilienne, des hôpitaux débordés",La Point,2021-01-22
"Violences, racisme? Le parcours ""semé d'embûches"" de policiers qui ""dénoncent""",La Point,2021-01-22
Allemagne : l’exécutif veut débarrasser la loi de ses derniers vestiges nazis,La Point,2021-01-22
Biden veut prolonger le dernier traité nucléaire avec Moscou mais affiche sa fermeté,La Point,2021-01-22
Les étranges excuses du député Benoît Simian pour échapper à la justice,La Point,2021-01-22
Mort du cascadeur Rémy Julienne des suites du Covid-19,La Point,2021-01-22
États-Unis : de quels avantages bénéficiera l’ex-président Donald Trump ?,La Point,2021-01-22
"Rémy Julienne, le cascadeur star, est mort",La Point,2021-01-22
"Avec Joe Biden, la foi catholique pour rassembler l'Amérique",La Point,2021-01-22
Nathalie et Alain Delon : ils s’étaient retrouvés au soir de leur vie,La Point,2021-01-22
"Coignard – Macron : 66 millions de procureurs, et combien d’électeurs ?",La Point,2021-01-22
James Bond : la sortie en salles de « Mourir peut attendre » encore repoussée,La Point,2021-01-22
Une peinture inédite de Manet sera bientôt vendue aux enchères,La Point,2021-01-22
Séparatisme : les députés adoptent de nouvelles mesures contre la haine en ligne,La Point,2021-01-22
Ford Mustang Mach-E : un vrai rival pour le Tesla Model Y ?,La Point,2021-01-22
"Covid-19 : la Guyane se confine, mais seulement les dimanches",La Point,2021-01-22
Regroupement familial : le Conseil d’État suspend la décision prise par l’exécutif face au Covid,La Point,2021-01-22
"L'étudiante sénégalaise disparue en France rassure: elle fait ""une pause pour retrouver ses esprits""",La Point,2021-01-22
"Après l’Espagne, le conflit Thermomix-Lidl arrive en France",La Point,2021-01-22
Nouveau bac: épreuves de spécialité annulées au profit du contrôle continu,La Point,2021-01-22
Covid-19 en France : des tests PCR imposés aux voyageurs européens dès dimanche,La Point,2021-01-22
"""Je suis une quiche""... Michel Cymes gaffe sur Instagram, l'animateur obligé de s'expliquer et de s'excuser !",Public,2021-01-22
Pascal Praud encense Brigitte Macron : Les propos élogieux lâchés par le journaliste à la Première Dame !,Public,2021-01-22
Michel Sardou généreux : cet énorme chèque qu'il a signé pour sauver les Restos du coeur,Public,2021-01-22
"Une chroniqueuse de ""TPMP"" balance en plein direct sur cette célébrité casée qui lui a mis la main entre les jambes !",Public,2021-01-22
"M. Pokora : gros retournement de situation dans sa carrière, l'info qui vient de tomber !",Public,2021-01-22
"PHOTOS : Casting DALS, ces personnalités qui adoreraient y participer... et certains noms sont surprenants !",Public,2021-01-22
"""Pas confondre la télé et la foire"", Mimie Mathy violemment attaquée... cet homme connu qui a été trop loin !",Public,2021-01-22
Danse avec les stars : cet ancien membre du jury qui pourrait signer son grand retour !,Public,2021-01-22
PHOTOS - Stéphane Plaza visiblement alcoolisé... Karine Le Marchand en panique !,Public,2021-01-22
Maddy Burciaga : sa photo HOT avec Benjamin Samat fait le buzz !,Public,2021-01-22
Jean-Jacques Goldman de retour en France ? On a la réponse !,Public,2021-01-22
Télé-réalité : Le programme TV de ce vendredi 22 janvier 2021,Public,2021-01-22
James Bond (encore) repoussé : (Re)découvrez les acteurs majeurs du 25ème film de la saga !,Public,2021-01-22
Flavie Flament : L'animatrice publie une photo à l'âge auquel elle a été violée,Public,2021-01-22
Horoscope du jour (vendredi 22 janvier 2021),Public,2021-01-22
"Jean-Paul Belmondo : nouveau drame, la COVID-19 lui a enlevé un sacré allié...",Public,2021-01-22
"Danièle Gilbert en proie à de ""graves problèmes financier"", elle ne mange plus à sa faim...",Public,2021-01-22
Iris Mittenaere : on craque pour son total look noir !,Public,2021-01-22
"David Hallyday refoulé de l'aéroport, à peine arrivé à Paris : que s'est-il passé ?",Public,2021-01-22
"La baisse de désir dans le couple, une étape obligatoire à passer ? Pas de panique !",Public,2021-01-22
"Zapping : Cyril Hanouna recadre fermement Thaïs D'Escufon, militante d'extrême-droite",Public,2021-01-22
"Photos - Grand concours des animateurs : Karine Ferri, Iris Mittenaere, Jean-Luc Reichmann et pleins d'autres, jouent pour Brigitte Macron !",Public,2021-01-22
Gigi Hadid maman : le prénom de sa fille de 4 mois enfin dévoilé !,Public,2021-01-22
Miss France 2021 : Comment April Benayoum a découvert les injures anti-sémites dont elle a été victime ?,Public,2021-01-22
"« Trop petite », « grosse », « beaux seins », Catherine Deneuve, sa description absolument édifiante faite par son ex-mari",Public,2021-01-22
Karl Lagarfeld : son garde du corps Sébastien Jondeau révèle ce qu'il lui a dit avant de mourir,Public,2021-01-22
"Une heure avec... Ricky Martin : ""Avant mon coming out, j'ai surjoué les hétéros""",Public,2021-01-22
Nabilla : Les lèvres gonflées après avoir craqué pour cette nouvelle tendance beauté !,Public,2021-01-22
Public Story - Charlotte Gainsbourg : femme libérée,Public,2021-01-22
"""Je te quitte, t’es naze au lit”, les textos salés de Cauet !",Public,2021-01-22
Zinedine Zidane positif au Covid-19 :va-t-il perdre sa place au Real Madrid ?,Public,2021-01-22
Les Reines du shopping : l'accident de culotte d'une candidate... en plein essayage !,Public,2021-01-22
"La livre recule, l'économie britannique souffre du confinement",Figaro,2021-01-22
Le gouvernement Biden a signifié à Kaboul sa volonté de revoir l'accord avec les talibans,Figaro,2021-01-22
«Séparatisme»: Darmanin ironise sur «les 50 nuances de LR»,Figaro,2021-01-22
Covid: les réactions allergiques graves au vaccin Moderna sont rares,Figaro,2021-01-22
"Fibre en zone rurale: Orange s'associe avec La Banque des Territoires, CNP Assurances et EDF Invest",Figaro,2021-01-22
"Les masques en tissu sont toujours aussi efficaces, selon l'OMS",Figaro,2021-01-22
"Wall Street hésite à la clôture, nouveau record du Nasdaq",Figaro,2021-01-22
"New York, à court de vaccins, met la pression sur le gouvernement Biden",Figaro,2021-01-22
"Emmené par un grand Mbappé, le Paris SG surclasse Montpellier",Figaro,2021-01-22
"Pas-de-Calais: meurtre d'une nonagénaire, un voisin mis en examen",Figaro,2021-01-22
Braquage pour l'argent ou à visée terroriste ? Quatre hommes jugés à Paris,Figaro,2021-01-22
Retour en Côte d'Ivoire des corps des quatre soldats tués au Mali,Figaro,2021-01-22
Syndicat Avenir lycéen: Blanquer saisit l'Inspection générale,Figaro,2021-01-22
"Georges Tron testé négatif au Covid-19, son procès en appel va pouvoir reprendre",Figaro,2021-01-22
"Brésil: Un mort du Covid toutes les six minutes, Sao Paulo durcit les mesures",Figaro,2021-01-22
"La semaine du FigaroVox - Et maintenant, même Babar est colonialiste!",Figaro,2021-01-22
Russes et Américains vers une prolongation du traité New Start,Figaro,2021-01-22
"Officine Générale, testé et approuvé",Figaro,2021-01-22
Un réseau de prostitution chinois démantelé à Besançon,Figaro,2021-01-22
"L'action GameStop, prisée des vendeurs à découvert, s'envole à Wall Street",Figaro,2021-01-22
"EVgo, réseau de bornes de recharge électrique, va entrer en Bourse",Figaro,2021-01-22
"Chez Dior, le vêtement comme remède à la morosité ambiante",Figaro,2021-01-22
Septaine «sur l’honneur»: les flous d’un confinement autogéré,Figaro,2021-01-22
Biden estime que le Covid-19 fera plus de 600.000 morts aux États-Unis,Figaro,2021-01-22
La foire 1-54 défie la pandémie en transportant l'Afrique de Marrakech à Paris,Figaro,2021-01-22
Décideurs: les nominations du jour,Figaro,2021-01-22
«Frontières: totem et tabou»,Figaro,2021-01-22
"Chicago: fort repli du blé, du maïs et du soja",Figaro,2021-01-22
Le pétrole bat en retraite devant les nouveaux cas de Covid-19 en Chine,Figaro,2021-01-22
"Une nouvelle secousse de magnitude 3,4 ressentie à Strasbourg",Figaro,2021-01-22
Comment dénicher une délégation d’assurance pour son crédit immobilier?,Figaro,2021-01-22
Les télécoms visent la neutralité carbone,Figaro,2021-01-22
L'Italie bloque TikTok pour les utilisateurs dont l'âge n'est pas garanti,Figaro,2021-01-22
Derniers jours pour s’inscrire sur les listes électorales dans les TPE,Figaro,2021-01-22
Des augmentations de salaire plus rares en 2021,Figaro,2021-01-22
La tech innove pour protéger l’environnement,Figaro,2021-01-22
«C'est juste pour des potes» : plongée dans le monde des restaurants clandestins,Figaro,2021-01-22
Covid-19: la pandémie réveille la déflation au Japon,Figaro,2021-01-22
Covid-19: la Belgique se barricade face aux variants,Figaro,2021-01-22
"Après le mariage Fiat-PSA, les confidences du chef de la dynastie Agnelli",Figaro,2021-01-22
"Covid-19: 23.292 nouveaux cas en 24 heures, plus de 139.000 personnes vaccinées en France",Figaro,2021-01-22
Vivendi s’invite au capital de l’espagnol Prisa,Figaro,2021-01-22
La vaccination du patron de Richemont se fait sourciller les Suisses,Figaro,2021-01-22
Le bal des résultats s’annonce périlleux pour les marchés,Figaro,2021-01-22
La crise complique les entretiens annuels,Figaro,2021-01-22
"Attaques de distributeurs à l'explosif: six hommes mis en examen, trois écroués",Figaro,2021-01-22
Les Pays-Bas veulent remplacer le Royaume-Uni comme «porte d'entrée» de l'UE pour les Etats-Unis,Figaro,2021-01-22
Aux origines religieuses du capitalisme,Figaro,2021-01-22
Inceste: le PS veut mettre LREM face à ses responsabilités,Figaro,2021-01-22
"Paul Smith, la nostalgie au service des hommes d'aujourd'hui",Figaro,2021-01-22
"Guillaume Tabard: «Le retour incertain d’Arnaud Montebourg, le chantre de la “démondialisation”»",Figaro,2021-01-22
Arnaud Montebourg tente de lancer une coalition transpartisane,Figaro,2021-01-22
Crise sanitaire: écoutons Ricardo plutôt que Keynes,Figaro,2021-01-22
"Masques, places fixes, gel: dans une cantine scolaire sous protocole renforcé",Figaro,2021-01-22
Le Tribunal de Paris fait sa rentrée après une année houleuse,Figaro,2021-01-22
La crise du Covid-19 enterre le bac national,Figaro,2021-01-22
"Aux arrivées de Roissy, les contrôles de tests PCR irritent les passagers",Figaro,2021-01-22
Covid-19: livraisons de vaccin AstraZeneca/Oxford moins importantes que prévues en Europe,Figaro,2021-01-22
«Joe Biden réintroduit la discrimination positive que Trump avait supprimée»,Figaro,2021-01-22
"Balzac, Stendhal et Flaubert ne peuvent-ils plus «capter l’attention» des jeunes?",Figaro,2021-01-22
La sélection Figaro Live: les vidéos qu'il ne fallait pas rater,Figaro,2021-01-22
"Léopold Sédar Senghor, premier fan de Soulages",Figaro,2021-01-22
Covid-19:  l'Académie de médecine recommande de se taire dans le métro,Figaro,2021-01-22
Covid-19 : un «masque sportif» dans l'espoir de rouvrir les salles de sport,Figaro,2021-01-22
Comment les entreprises s'adaptent au couvre-feu,Figaro,2021-01-22
"En Alsace, Jean Castex devra expliquer le retard des vaccinations",Figaro,2021-01-22
"Chloé Morin, l’experte de l’opinion qui monte à gauche",Figaro,2021-01-22
"Le contrôle des frontières, thème devenu inévitable pour Macron et ses opposants",Figaro,2021-01-22
Covid-19 : la Belgique interdit les voyages non essentiels à l'étranger à partir de mercredi,Figaro,2021-01-22
Roland Lescure: «Il faut que la solidarité européenne prévale»,Figaro,2021-01-22
La CFDT propose à Jean Castex une mission pour gérer l'après-crise,Figaro,2021-01-22
Les canards des Landes abattus en masse,Figaro,2021-01-22
"Face au Covid-19, l’Europe restreint la liberté de circulation",Figaro,2021-01-22
Emmanuel Macron échange lundi avec 100 patrons étrangers pour attirer les investissements,Figaro,2021-01-22
Pourquoi certains clients sont payés pour consommer de l'électricité,Figaro,2021-01-22
Jean-Baptiste Lemoyne : «Le débat sur le passeport vaccinal pour voyager est prématuré»,Figaro,2021-01-22
"«Je vais déshonorer ma famille» : les certificats de virginité, une pratique archaïque qui persiste en France",Figaro,2021-01-22
Les Européens se méfient des ouvertures d’Erdogan,Figaro,2021-01-22
Bouygues Telecom: Une sélection de Smartphones à partir de 1 euro seulement,Figaro,2021-01-22
Vaccins: peu d’effets indésirables graves,Figaro,2021-01-22
Klaus Schwab: «Nous risquons d'avoir une génération de jeunes désenchantée»,Figaro,2021-01-22
"Covid-19: en Espagne, un épais maquis de règles",Figaro,2021-01-22
"Andrew Doyle: «En parodiant la gauche woke, je me moque d’un mouvement devenu dominant»",Figaro,2021-01-22
Tokyo englué dans le bourbier olympique,Figaro,2021-01-22
"Mathieu Bock-Côté: «Affaire Xavier Gorce: demain, à qui le tour?»",Figaro,2021-01-22
"Laurent Choain, DRH de Mazars : « Il faut savoir voler sous les radars »",Figaro,2021-01-22
Corse : 20 ans de prison pour un homme ayant tué sa compagne,Figaro,2021-01-22
La Bourse de Londres pâtit de mauvaises nouvelles économiques,Figaro,2021-01-22
Accord entre Pfizer-BioNtech et l'OMS pour apporter 40 millions de doses de vaccins au système Covax,Figaro,2021-01-22
La Bourse de Paris finit la semaine dans le rouge en manque de sérénité,Figaro,2021-01-22
"Pour le Pr Antoine Flahault, les différences de situation épidémique justifient le contrôle des déplacements en Europe",Figaro,2021-01-22
Covid-19 : le variant britannique est «lié à un degré plus élevé de mortalité» annonce Boris Johnson,Figaro,2021-01-22
L’Allemagne renforce la surveillance à ses  frontières,Figaro,2021-01-22
Andreas Rödder: «Armin Laschet ressemble plus à Helmut Kohl qu’à Angela Merkel»,Figaro,2021-01-22
Que faire pour les vacances de février ?,Figaro,2021-01-22
Les révoltés chinois du Covid-19 refusent de se laisser bâillonner,Figaro,2021-01-22
"The Crown, la série qui froisse la monarchie anglaise",Figaro,2021-01-22
La Bourse de Francfort clôture la semaine dans le rouge,Figaro,2021-01-22
"Var : un ancien candidat de téléréalité se fait passer pour un prêtre, l'Église catholique alerte",Figaro,2021-01-22
Enlèvement et viol d'une mineure de 11 ans : une arrestation à Dijon,Figaro,2021-01-22
"Rachel Marouani, ex-LVMH, prend la présidence du groupe Afflelou",Figaro,2021-01-22
"Cinq idées pour voir des expos gratuitement à Paris, malgré tout",Figaro,2021-01-22
Costa Croisières reporte la reprise de ses croisières au 13 mars,Figaro,2021-01-22
La fermeture des restaurants profite à la viande française,Figaro,2021-01-22
Thermomix obtient un premier retrait du robot «Monsieur Cuisine» de Lidl en Espagne,Figaro,2021-01-22
Aérospatial: perte de 5.800 salariés dans le Sud-Ouest en 2020,Figaro,2021-01-22
#Metoogay : des milliers de gays libèrent la parole sur les violences sexuelles,Figaro,2021-01-22
Économie circulaire: les entreprises pour la plupart en phase avec leurs engagements selon l'Afep,Figaro,2021-01-22
Territoire de Belfort : un homme soupçonné de l'assassinat de son épouse multiplie les versions des faits,Figaro,2021-01-22
Le très lourd tribut de la crise du Covid au Brésil,Figaro,2021-01-22
«J’appelle le gouvernement à un dialogue franc sur la vaccination!»: le cri de colère d’un maire ,Figaro,2021-01-22
L’impossible rêve de la France en Algérie ,Figaro,2021-01-22
Accord sur le nucléaire : Zarif appelle Biden à lever «sans conditions» les sanctions contre l'Iran,Figaro,2021-01-22
Covid-19 : un premier cas de variant brésilien identifié en Allemagne,Figaro,2021-01-22
David Rockwell: «Nous avons pu aider quarante restaurants dans tout New York»,Figaro,2021-01-22
Jusqu'à un an de prison ferme pour avoir organisé des soirées malgré les restrictions sanitaires,Figaro,2021-01-22
"Michelin, Cocteau, Méliès...Nos archives de la semaine sur Instagram",Figaro,2021-01-22
"Aux États-Unis, les reventes de logements en 2020 ont été au plus haut en 14 ans",Figaro,2021-01-22
Fabrice Hyber: «Un artiste doit être culotté!»,Figaro,2021-01-22
Le Kremlin nerveux avant les manifestations de samedi en faveur de Navalny,Figaro,2021-01-22
Huit plaintes après une intrusion violente d'un groupe «commando» au CHU de Nantes,Figaro,2021-01-22
Les boulangeries recrutent : 9000 postes sont à pourvoir en France,Figaro,2021-01-22
"L'Équipe : la grève est suspendue, le journal reparaît samedi dans les kiosques",Figaro,2021-01-22
"Fête sauvage en Bretagne : cinq nouvelles mises en examen, le détenu libéré",Figaro,2021-01-22
"Duralex : début de l'examen des offres de reprise, sans celle des actuels actionnaires",Figaro,2021-01-22
"À New York, tous en terrasse!",Figaro,2021-01-22
Le géant de la logistique FedEx se restructure en Europe,Figaro,2021-01-22
"La magie blanche de Marielle Nordmann, harpiste de légende",Figaro,2021-01-22
"Amazon ouvre un centre de vaccination à Seattle, 2000 personnes seront vaccinées dimanche",Figaro,2021-01-22
Covid-19 : le nombre d'établissements scolaires fermés a triplé en une semaine,Figaro,2021-01-22
Plaque d’immatriculation: fantaisie prohibée!,Figaro,2021-01-22
"La semaine des médias N°13 : François Busnel, Sandrine Plasseraud, Thomas Sotto, Erwann Gaucher, «Le Temps»…",Figaro,2021-01-22
Le secret des centenaires qui ont vaincu le coronavirus,Figaro,2021-01-22
François De Smet: «Et si l'on faisait de la Belgique un État laïque?»,Figaro,2021-01-22
Rémy Julienne : le monde du cinéma et du sport salue «le trompe-la-mort»,Figaro,2021-01-22
"Schlumberger creuse ses pertes en 2020, mais voit un début de reprise",Figaro,2021-01-22
Carrefour : les syndicats s'inquiètent des effets pervers de l'embauche de jeunes,Figaro,2021-01-22
La Lettre du « Fig Mag »du 23 janvier 2021,Figaro,2021-01-22
Couvre-feu: attention aux attestations de complaisance!,Figaro,2021-01-22
Loir-et-Cher : un couple mis en examen pour fraude au chômage partiel,Figaro,2021-01-22
"Albi : des policiers visés par des feux d'artifice, trois blessés",Figaro,2021-01-22
Jean-Pierre Bacri: nous ne râlerons plus ensemble,Figaro,2021-01-22
Ne pas parler d'argent à ses enfants pour les protéger: une grosse erreur,Figaro,2021-01-22
La Hongrie commande 2 millions de doses du vaccin russe Spoutnik V,Figaro,2021-01-22
PPDA piégé par le faux vainqueur du Vendée Globe: l'histoire d'une incroyable imposture,Figaro,2021-01-22
Vendée : 18 mois avec sursis pour apologie du terrorisme sur internet,Figaro,2021-01-22
"L’assimilation, une politique à réhabiliter",Figaro,2021-01-22
"«Abandonner la jeunesse, c’est la pousser vers un vote protestataire»",Figaro,2021-01-22
Les Mousquetaires rapportent un chiffre d'affaires en hausse en 2020,Figaro,2021-01-22
Le Royaume-Uni va interroger sur l'identité de genre dans son recensement,Figaro,2021-01-22
Air France renouvelle son contrat avec Michelin pour 10 années de plus,Figaro,2021-01-22
"Sur Disney+, les enfants privés de Peter Pan ou des Aristochats pour éviter les «représentations datées ou négatives de minorités»",Figaro,2021-01-22
"La veuve d'un compositeur Jacques Levy réclame 7,25 millions de dollars à Bob Dylan",Figaro,2021-01-22
Lancement du fonds d'urgence de 30 millions d'euros a destination de l'économie sociale et solidaire,Figaro,2021-01-22
Alstom signe un protocole d'accord pour le métro de Belgrade,Figaro,2021-01-22
"Maserati Ghibli Hybrid, la preuve par quatre ",Figaro,2021-01-22
Galleria Continua Paris défie la crise et la sinistrose,Figaro,2021-01-22
Covid-19 : le bénéfice de Volkswagen plonge de moitié en 2020,Figaro,2021-01-22
Grippe aviaire : la chasse suspendue dans le sud de la Manche,Figaro,2021-01-22
Angers : un local de militants antifascistes vandalisé par un groupuscule néonazi,Figaro,2021-01-22
Pas-de-Calais : une femme de 94 ans tuée chez elle au cours d'une agression,Figaro,2021-01-22
Russie : l'UE exige de Poutine «la libération immédiate» de Navalny,Figaro,2021-01-22
Une nouvelle interconnexion électrique France-Angleterre,Figaro,2021-01-22
"«Je suis très triste»: Alain Delon, bouleversé par la mort de Nathalie, «la seule Mme Delon»",Figaro,2021-01-22
"Sahel: deux millions de déplacés internes, un niveau jamais atteint selon l'ONU",Figaro,2021-01-22
