titre,journal,date
TPMP : Stéphane Tapie menacé par le braqueur de Kim Kardashian en direct,Closer,2021-02-09
Elon Musk crée un conducteur de Tesla qui ne dit pas à tout le monde qu’il roule en Tesla,Gorafi,2021-02-09
Leur tour du monde à vélo remplacé par un weekend dans sa belle-famille en Lozère,Gorafi,2021-02-09
À la une ce mercredi 10 février…,La Point,2021-02-09
Birmanie : l’armée investit le siège du parti d’Aung San Suu Kyi,La Point,2021-02-09
Lynchage de Yuriy : les dessous d’une rivalité violente entre bandes,La Point,2021-02-09
Les Français se résignent à un duel Macron-Le Pen en 2022,La Point,2021-02-09
"Patrick Balkany mis en examen pour ""prise illégale d'intérêts"" et ""abus de biens sociaux""",La Point,2021-02-09
Régionales en IdF: Hamon rejoint la liste de l'écologiste Bayou,La Point,2021-02-09
"Affaire Duhamel : Frédéric Mion, directeur de Sciences Po, démissionne",La Point,2021-02-09
"Dénonciations de violences sexuelles dans les IEP, enquête pour viol à Toulouse",La Point,2021-02-09
Patrick Balkany mis en examen pour « prise illégale d’intérêts » et « abus de biens sociaux »,La Point,2021-02-09
L'exécutif veut punir toute pénétration sexuelle sur mineur de 15 ans,La Point,2021-02-09
Coronavirus : le point sur la pandémie,La Point,2021-02-09
Ces millions de dollars volés par des hackers nord-coréens pour acheter des armes nucléaires,La Point,2021-02-09
Mort de Kobe Bryant : ce que révèle l’enquête,La Point,2021-02-09
Le Sénat juge le procès de Trump conforme à la Constitution,La Point,2021-02-09
Courchevel : deux morts et trois blessés dans un crash d’hélicoptère,La Point,2021-02-09
L’état d’urgence sanitaire prolongé jusqu’au 1er juin,La Point,2021-02-09
"Gérard Louvin et son mari visés par une enquête pour ""viols sur mineurs""",La Point,2021-02-09
Le prof en liberté #28 – Comment boire de la piquette ?,La Point,2021-02-09
Les juges plus sévères le ventre vide ?,La Point,2021-02-09
#Sciencesporcs : vague de dénonciations de violences sexuelles dans les IEP,La Point,2021-02-09
Artistes au travail – Emo de Medeiros : « S’arrimer à l’énergie de la vie »,La Point,2021-02-09
Procès en destitution: Trump et Biden discrets (pour le moment),La Point,2021-02-09
La ville de Vendôme cède son nom à LVMH,La Point,2021-02-09
Affaire Mila: cinq personnes en garde à vue pour menaces de mort et cyberharcèlement,La Point,2021-02-09
"Arthur Chevallier – Napoléon : le débat, oui, l’hystérisation, non !",La Point,2021-02-09
Les faux chiffres de la Fondation Nicolas Hulot,La Point,2021-02-09
Mime Marceau : « J’ai inspiré le Moonwalk de Michael Jackson »,La Point,2021-02-09
"Grand froid, neige et crues : 36 départements en vigilance orange",La Point,2021-02-09
"En Birmanie, comment la pop culture s’invite dans la révolte",La Point,2021-02-09
« LREM organisée comme un fan-club » : fin de mandat fébrile pour la macronie,La Point,2021-02-09
« L’islamo-gauchisme » face aux « réactionnaires de gauche »,La Point,2021-02-09
"Vallancien – Covid-19 : la médecine triomphe, les médecins plongent !",La Point,2021-02-09
Algérie : la justice ouvre sa première enquête sur un cas de torture,La Point,2021-02-09
"Diary Sow : soulagement au retour, mais incompréhension et colère aussi",La Point,2021-02-09
"""Pire que mon ex"" : la jeunesse birmane très connectée se mesure à la junte",La Point,2021-02-09
"Montauban : la maire, condamnée à 5 ans d’inéligibilité, doit quitter son poste",La Point,2021-02-09
Loi climat: le difficile pari vert de Macron,La Point,2021-02-09
Violences du 1er mai 2018 : Alexandre Benalla renvoyé en correctionnelle,La Point,2021-02-09
"Après 15 ans d’antenne, Ruth Elkrief quitte BFM TV",La Point,2021-02-09
Le tragique destin des salariés iraniens de Renault,La Point,2021-02-09
Perturbations en Allemagne et au Royaume-Uni à cause de la neige,La Point,2021-02-09
Molière au Panthéon : « Un mélange de Dany Boon et de Laurent Gerra »,La Point,2021-02-09
"La maire LR de Montauban condamnée à cinq ans d'inéligibilité, doit quitter son poste",La Point,2021-02-09
Violences du 1er mai 2018: le parquet demande un procès pour Benalla,La Point,2021-02-09
Covid-19 : l'animal à l'origine du virus « pas encore identifié »,La Point,2021-02-09
Viols : enquête ouverte contre Gérard Louvin et son mari Daniel Moyne,La Point,2021-02-09
"Virus: à Wuhan, l'OMS privilégie la piste de l'animal ""intermédiaire"" à l'origine de la transmission",La Point,2021-02-09
"Climat: en Finlande, une ville polaire candidate aux JO... d'été",La Point,2021-02-09
Sénégal : la plainte pour viol contre Sonko crée une tempête politique,La Point,2021-02-09
"La frontière Gaza-Egypte rouvre pour une ""durée indéterminée""",La Point,2021-02-09
Comment la France peut affronter les guerres hybrides,La Point,2021-02-09
TRIBUNE. Jetez la clé de la cave à vin !,La Point,2021-02-09
"Strauch-Bonart – L’UE et les vaccins, les raisons d’un fiasco",La Point,2021-02-09
"À Marseille, un village de start-up révolutionne la formation",La Point,2021-02-09
La France a franchi la barre des 80 000 morts du Covid-19,La Point,2021-02-09
L'Egypte ouvre sa frontière avec Gaza pour une durée indéterminée,La Point,2021-02-09
"Suez: l'intersyndicale obtient la garantie que ""l'Etat jouera son rôle""",La Point,2021-02-09
Référendum sur le climat: étape à l'Assemblée nationale le 9 mars,La Point,2021-02-09
Covid-19 : l'appel des experts pour de meilleurs masques,La Point,2021-02-09
Covid-19: la France franchit la barre des 80.000 morts,La Point,2021-02-09
"Covid-19: à Avicenne, la ""réa"" s'agrandit pour éviter la submersion",La Point,2021-02-09
Première en France: Perpignan rouvre quatre musées malgré l'interdiction Covid,La Point,2021-02-09
« Poissonnière » : un député LREM sanctionné pour « injures sexistes »,La Point,2021-02-09
Covid-19: l'Iran lance sa campagne de vaccination,La Point,2021-02-09
Pyrénées : ces stations de ski qui font de la résistance,La Point,2021-02-09
Covid-19 : l’animal à l’origine du virus « pas encore identifié »,La Point,2021-02-09
"Mary Wilson, chanteuse des Supremes, est morte à l’âge de 76 ans",La Point,2021-02-09
"Dans le Golfe, les Koweïtiennes lancent leur premier #MeToo",La Point,2021-02-09
EXCLUSIF. L’ancien patron de la DGSE Bernard Bajolet rejoint Amarante,La Point,2021-02-09
Tunisie : un nouveau vent révolutionnaire ?,La Point,2021-02-09
"""Insulte sexiste"" dans l'hémicycle: un député LREM sanctionné",La Point,2021-02-09
"Ghibli, à toutes les sauces",La Point,2021-02-09
Comment « Rectify » sort aujourd’hui de l’oubli,La Point,2021-02-09
Les armées françaises à la conquête de l’espace,La Point,2021-02-09
Serbie : comment l'Europe rate sa « diplomatie du vaccin »,La Point,2021-02-09
Menaces de mort contre Mila: cinq personnes en garde à vue,La Point,2021-02-09
Rupture d'un glacier en Inde : tenter à tout prix de retrouver des survivants dans un tunnel,La Point,2021-02-09
"Mort de Jean-Claude Carrière, un conteur entre cinéma et littérature",La Point,2021-02-09
Cinq choses à savoir sur Jean-Claude Carrière,La Point,2021-02-09
La dette pharaonique du PS qui menace une candidature en 2022,La Point,2021-02-09
Affaire Mila : 5 personnes en garde à vue après des menaces de mort,La Point,2021-02-09
"Total perd de l’argent, mais gagne un nouveau nom",La Point,2021-02-09
Comment stocker du mobilier en toutes occasions ?,La Point,2021-02-09
"A Wuhan, l'équipe de l'OMS se cantonne à des hypothèses sur l'origine du coronavirus",La Point,2021-02-09
Séparatisme: polygamie et certificats de virginité au crible des députés,La Point,2021-02-09
"L’ultime roman de Zamiatine, l’homme qui a inspiré Orwell",La Point,2021-02-09
"Livre – Éric-Emmanuel Schmitt, l’écrivain qui veut défier Yuval Noah Harari",La Point,2021-02-09
La marine française a patrouillé en mer de Chine méridionale,La Point,2021-02-09
L’Allemagne serait-elle l’autre pays de l’horlogerie ?,La Point,2021-02-09
"A la Biennale du cirque, retour sur scène éphémère et surréaliste",La Point,2021-02-09
Le Danemark veut imposer la traduction des sermons,La Point,2021-02-09
"Près d'un tiers des salariés du privé en télétravail fin 2020, selon un sondage",La Point,2021-02-09
L'essentiel du procès en destitution de Donald Trump,La Point,2021-02-09
Décès du scénariste et écrivain Jean-Claude Carrière,La Point,2021-02-09
Covid-19 : l'appel des experts pour de meilleurs masques,La Point,2021-02-09
"Alerte à la neige de la Bretagne au Grand Est, grand froid dans le nord",La Point,2021-02-09
Urgence sanitaire jusqu'au 1er juin: vers un vote tiède du Parlement,La Point,2021-02-09
Covid-19 : seulement un tiers des salariés du privé en télétravail,La Point,2021-02-09
"Coignard – À 4 000 euros par mois, on est riche ?",La Point,2021-02-09
"Hors-série - Hannah Arendt, penser sans entraves",La Point,2021-02-09
Covid-19 : « Il n’y a pas que le brevet dans la production de vaccins »,La Point,2021-02-09
EXCLUSIF. Le tragique destin des salariés iraniens de Renault,La Point,2021-02-09
Pyrénées : ces stations de ski qui font de la résistance,La Point,2021-02-09
Barochez – Ceci n’est pas une démocratie,La Point,2021-02-09
EXCLUSIF. La dette pharaonique du PS qui menace une candidature en 2022,La Point,2021-02-09
Hong Kong: La loi sur la sécurité confortée avec le maintien en détention de Jimmy Lai,La Point,2021-02-09
La Nouvelle-Zélande suspend les contacts politiques et militaires avec la Birmanie,La Point,2021-02-09
"La sonde ""Hope"" se place en orbite autour de Mars, une première arabe",La Point,2021-02-09
"Violentes images à l'appui, les démocrates lancent le réquisitoire contre Trump",La Point,2021-02-09
Hongkong : la justice ordonne le maintien en détention du magnat Jimmy Lai,La Point,2021-02-09
Birmanie: l'armée mène un raid contre le siège du parti d'Aung San Suu Kyi,La Point,2021-02-09
"Grand froid, neige et crues : 36 départements en vigilance orange",La Point,2021-02-09
La justice hongkongaise ordonne le maintien en détention provisoire du magnat Jimmy Lai,La Point,2021-02-09
Armement : l’ONU accuse Pyongyang et Téhéran d’avoir relancé leur coopération,La Point,2021-02-09
La marine française a patrouillé en mer de Chine méridionale,La Point,2021-02-09
Le danger des fêtes prénatales aux États-Unis,La Point,2021-02-09
"Jean-Claude Carrière, entre cinéma et littérature",La Point,2021-02-09
"Une Tesla Model Y pour un bitcoin, ce pourrait bientôt être possible",La Point,2021-02-09
Brèves – Charlotte Casiraghi ressuscite Lou Andreas-Salomé,La Point,2021-02-09
Covid-19 : premier décès d’un parlementaire siégeant au Congrès américain,La Point,2021-02-09
Le scénariste et écrivain Jean-Claude Carrière est mort,La Point,2021-02-09
"""Mon père ce héros"" : Cyril Lignac montre une rare photo de son papa sur Instagram !",Public,2021-02-09
Renaud : Bénabar donne des nouvelles de l’état de santé du chanteur,Public,2021-02-09
"""Je T'aime"", Alice Taglioni en deuil, la compagne de Laurent Delahousse fait une triste annonce à ses fans...",Public,2021-02-09
Léa Salamé poste une rare photo de famille avec Raphaël Glucksmann et fait le buzz !,Public,2021-02-09
"""Ouverte de tous les côtés"" après son accouchement, Loana fait passer sa fille, Mindy, pour morte auprès du papa ""pour voir sa réaction""...",Public,2021-02-09
Gérard Louvin accusé de viol : Jean-Pierre Foucault vole à son secours !,Public,2021-02-09
Zapping : Un célèbre acteur annonce sa candidature pour l'élection présidentielle de 2022,Public,2021-02-09
Plus Belle la Vie : Cette bombe atomique qui vient de débarquer dans la série !,Public,2021-02-09
Saint Valentin : 3 idées de choses à faire en amoureux en période de Covid,Public,2021-02-09
"Loana fracasse sa mère en direct dans ""TPMP"" et révèle une horrible anecdote à son sujet...",Public,2021-02-09
"Loana : ""Il me tapait la tête contre..."" : le récit glaçant des violences infligées par son père",Public,2021-02-09
TikTok : pourquoi ce mascara à 11€ rend fous les internautes,Public,2021-02-09
L'ex Miss France Alicia Aylies a fait une annonce totalement inattendue cette nuit !,Public,2021-02-09
Gérard Louvin : quatre autres hommes portent plainte contre son mari et lui pour agressions sexuelles et viols,Public,2021-02-09
Masturbation lors d'un rassemblement de l'Equipe de France : cette vidéo qui enflamme les réseaux sociaux !,Public,2021-02-09
"PHOTOS : Tenue PLUS que transparente, sex-toys, baisers langoureux..., Cardi B se dévoile plus incendiaire que jamais...",Public,2021-02-09
"Wejdene ""plus vierge"" ? Ces déclarations sur Instagram qui font le buzz",Public,2021-02-09
Loana dans TPMP : les internautes sous le choc après avoir découvert sa mâchoire...,Public,2021-02-09
"Line Papin, la jeune compagne de Marc Lavoine annonce un heureux évènement sur Instagram !",Public,2021-02-09
"""Mon coeur est brisé aujourd'hui""... Laeticia Hallyday annonce une séparation aussi brutale que douloureuse sur Instagram !",Public,2021-02-09
Des nouvelles d’Astrid Poubel... la candidate de télé-réalité a changé d’univers et a quitté sa frange !,Public,2021-02-09
"""Tu vas me manquer"" : Ophélie Winter affronte un nouveau deuil...",Public,2021-02-09
"""Mes rêvent s'écroulent..."", Le rappeur Hatik (Validé) en compagnie d’une très belle inconnue, ses fans sont à bout",Public,2021-02-09
"""Des soucis d’argent"", Slimane, chamboulé, prend un ton grave sur Instagram pour une grosse mise au point…",Public,2021-02-09
"""Je n'ai pas voulu voir..."" : Christophe Beaugrand se confie sur la terrible maladie qui a touché sa famille...",Public,2021-02-09
"Photos - Louane, Kendji Girac, Amel Bent reprennent les tubes de leur enfance !",Public,2021-02-09
Télé-réalité : Le programme TV de ce mardi 9 février 2021,Public,2021-02-09
"""Complètement folle"" : Fred Cauvin taxe Loana de droguée après son dépot de plainte...",Public,2021-02-09
La famille royale s'agrandit ! La princesse Eugénie a donné naissance à son premier enfant,Public,2021-02-09
Horoscope du jour (mardi 9 février 2021),Public,2021-02-09
"Marie Drucker, danseuse : Laurent Ruquier balance un gros dossier sur son passé, la journaliste gênée...",Public,2021-02-09
"Jennifer Lawrence : Après avoir été conduite d'urgence à l'hôpital, elle embrasse à pleine bouche Timothée Chamalet !",Public,2021-02-09
"PHOTO : Jessica Thivenin accro à la chirurgie esthétique ? Cette fois c'est trop, les internautes s'insurgent, ""Oh mon dieu...""",Public,2021-02-09
Zahia tétons apparents : cette vidéo HOT qui fait le buzz sur Instagram,Public,2021-02-09
Caroline Receveur très critiquée sur sa prise de poids après cette photo… Elle répond cash et fait une GROSSE mise au point,Public,2021-02-09
Sarah Fraisou : de retour avec l'autre homme de sa vie...,Public,2021-02-09
Nanterre : un étudiant qui a accusé un élu parisien de viol retrouvé mort,Figaro,2021-02-09
Wall Street finit proche de l'équilibre au lendemain de records,Figaro,2021-02-09
Wall Street menace de quitter New York si l'État rétablit une taxe sur les transactions financières,Figaro,2021-02-09
Premières doses du vaccin russe au Venezuela la semaine prochaine,Figaro,2021-02-09
Salvador : les députés de droite mettent en doute la santé mentale du président Nayib Bukele,Figaro,2021-02-09
Covid: les États-Unis se distancient de la théorie d'une fuite d'un laboratoire chinois,Figaro,2021-02-09
"Dans un vote, le Sénat juge le procès de Trump conforme à la Constitution",Figaro,2021-02-09
Cannabis: des parlementaires veulent sortir de la situation «quasiment ubuesque» autour du CBD,Figaro,2021-02-09
Des actionnaires veulent forcer Tesco à lutter contre l'obésité,Figaro,2021-02-09
Covid-19: l’école renforce les mesures pour se garder des variants,Figaro,2021-02-09
"Twitter a atteint les 192 millions d'utilisateurs quotidiens fin 2020, pendant les élections américaines",Figaro,2021-02-09
"Le dollar faiblit, la livre au plus haut depuis près de trois ans",Figaro,2021-02-09
Sénégal: l'armée revendique la prise de bases rebelles en Casamance avec l'appui de Bissau,Figaro,2021-02-09
"Le pétrole enchaîne une nouvelle hausse, au plus haut en un an",Figaro,2021-02-09
"En Allemagne, Ursula von der Leyen n’a pas laissé de bons souvenirs",Figaro,2021-02-09
Somalie: le Conseil de sécurité appelle les dirigeants à reprendre «d'urgence le dialogue»,Figaro,2021-02-09
Libye: le Conseil de sécurité de l'ONU apporte son soutien aux nouvelles autorités de transition,Figaro,2021-02-09
"Le procès de Trump est «politique» et va «déchirer le pays», dénonce son avocat",Figaro,2021-02-09
"«Ils se sont reclus dans la peur, dans la folie» : quand le Covid brise les relations",Figaro,2021-02-09
La pénurie de semi-conducteurs bloque de nombreuses industries,Figaro,2021-02-09
Sahara: le Polisario affirme avoir tué trois militaires marocains,Figaro,2021-02-09
"Le procès de Trump a une «dimension personnelle», confie en pleurs son procureur démocrate",Figaro,2021-02-09
Le versement de la prime informatique pour les enseignants reporté à fin février,Figaro,2021-02-09
Vaccins en Europe: Ursula von der Leyen dans la tempête,Figaro,2021-02-09
"Algérie: un foyer de grippe aviaire détecté, 2000 animaux abattus",Figaro,2021-02-09
Chicago: le maïs chute après une baisse moins forte que prévu des estimations de stocks,Figaro,2021-02-09
Chine: la consommation de blé et les importations de maïs revues en hausse,Figaro,2021-02-09
Régionales en IdF: Benoît Hamon rejoint la liste de l'écologiste Julien Bayou,Figaro,2021-02-09
Biden rencontre des grands patrons pour discuter du plan de relance et du salaire minimum,Figaro,2021-02-09
Fréjus: un septuagénaire mis en examen pour le meurtre de sa compagne,Figaro,2021-02-09
La Commission propose de prolonger l'application provisoire de l'accord post-Brexit,Figaro,2021-02-09
Une augmentation d’impôts qui ne dit pas son nom,Figaro,2021-02-09
L'Italie espère une ouverture encadrée de ses stations de ski le 15 février,Figaro,2021-02-09
Stations de ski: les professionnels comptent sur l’aide de l’État,Figaro,2021-02-09
Composants électroniques: l’Europe à la recherche de souveraineté,Figaro,2021-02-09
Destitution: Donald Trump jugé au Sénat pour la seconde fois,Figaro,2021-02-09
Covid-19 : la France a franchi la barre des 80.000 morts,Figaro,2021-02-09
"Bicentenaire de Napoléon: «Courage, fuyons»",Figaro,2021-02-09
David Lisnard: «La droite ne peut avoir un projet mou»,Figaro,2021-02-09
Gouvernement: les ministres bataillent pour le calendrier,Figaro,2021-02-09
Nissan entrevoit le bout du tunnel,Figaro,2021-02-09
Patrick Balkany mis en examen pour «prise illégale d'intérêts» et «abus de biens sociaux»,Figaro,2021-02-09
"En Israël, la vaccination fait reculer l’épidémie",Figaro,2021-02-09
Napoléon: un bicentenaire sous haute surveillance,Figaro,2021-02-09
La crise du Covid a-t-elle figé la donne politique pour l’opinion?,Figaro,2021-02-09
L’exécutif cherche à faire atterrir le chèque alimentaire,Figaro,2021-02-09
Le rachat d’Arm par Nvidia suscite un tollé des autorités de la concurrence,Figaro,2021-02-09
Proportionnelle: Hervé Morin dit oui mais sans référendum,Figaro,2021-02-09
"Guillaume Tabard: «Le refus du match retour Macron-Le Pen, mais après?»",Figaro,2021-02-09
Bertille Bayart: «Une épidémie d’inconséquence»,Figaro,2021-02-09
Emmanuel Macron-Marine Le Pen: le duel à distance a déjà commencé,Figaro,2021-02-09
Chantal Delsol: «Notre maître aujourd’hui? La peur»,Figaro,2021-02-09
"Aux Contamines, le premier cluster, «on a su tirer notre épingle du jeu»",Figaro,2021-02-09
Un mort dans une fusillade dans une clinique aux États-Unis,Figaro,2021-02-09
"Napoléon: Paris, Ajaccio, Fontainebleau, Waterloo… des expositions en ordre de bataille",Figaro,2021-02-09
La sélection Figaro Live: les vidéos qu'il ne fallait pas rater,Figaro,2021-02-09
«La dette française est écrasante: allongeons sa durée dans l’intérêt de la jeunesse»,Figaro,2021-02-09
Yaël Braun-Pivet:  «Le président est 100 % concentré sur la crise»,Figaro,2021-02-09
"Au Mans, la collecte des déchets à cheval ravive le débat antispéciste",Figaro,2021-02-09
L’impossible diplomatie européenne face à Poutine,Figaro,2021-02-09
LVMH s’offre le symbole mondial de la joaillerie de luxe… pour 10.000 euros,Figaro,2021-02-09
"Jean-Claude Carrière, conteur de génie",Figaro,2021-02-09
Pourquoi le vaccin de Pfizer devrait rester très efficace contre tous les variants actuels,Figaro,2021-02-09
Le gouvernement veut un «nouveau crime» pour pénaliser toute pénétration sexuelle sur mineur de 15 ans,Figaro,2021-02-09
Covid-19: Air Canada suspend 17 liaisons internationales jusqu'à fin avril,Figaro,2021-02-09
Relance: Bruxelles veut des réformes de la Hongrie,Figaro,2021-02-09
"Le nombre de dépôts de marques dépasse les 100.000 en 2020, un record",Figaro,2021-02-09
"Décès de Léo Kouper, illustrateur et affichiste de Charlie Chaplin, à 94 ans",Figaro,2021-02-09
Menus sans porc à la cantine: revers judiciaire pour la municipalité RN de Beaucaire,Figaro,2021-02-09
Les acteurs français de la publicité digitale vent debout face à Apple,Figaro,2021-02-09
Covid-19: la Grèce sous un confinement plus serré à partir de jeudi,Figaro,2021-02-09
"Audi e-Tron GT, le grand tourisme transcendé",Figaro,2021-02-09
Napoléon: les enchères font fi de la polémique,Figaro,2021-02-09
Boeing: les annulations continuent de surpasser les commandes d'avions,Figaro,2021-02-09
Jeux vidéo: Ubisoft a vu son chiffre d'affaires plus que doublé au troisième trimestre,Figaro,2021-02-09
Crash d'hélicoptère à Courchevel : enquête ouverte pour homicides involontaires,Figaro,2021-02-09
Les États ont évité une hécatombe d’entreprises,Figaro,2021-02-09
Stations de ski fermées: les saisonniers dans l’attente d’une solution,Figaro,2021-02-09
Ehpad: Orpea enregistre des revenus 2020 en hausse grâce aux acquisitions en France et Irlande,Figaro,2021-02-09
Couvre-feu : aucune loi ne permet de limiter le nombre d'invités chez soi,Figaro,2021-02-09
Défense : l'Institut Montaigne souligne les fragilités des armées,Figaro,2021-02-09
"La sonde des Emirats arabes unis se place en orbite autour de Mars, une première arabe",Figaro,2021-02-09
"Raphaël Poirée, homme enfin apaisé à l’ombre du champion",Figaro,2021-02-09
Nouveau succès de Thales Alenia Space dans les constellations,Figaro,2021-02-09
Outre-mer: les collectivités rejettent «toute modification» de l'octroi de mer,Figaro,2021-02-09
"À Valberg, on tente de garder «la tête hors de l’eau»",Figaro,2021-02-09
Covid-19: les stations de ski toujours privées d’horizon,Figaro,2021-02-09
Gérard Perrier: activité toujours en retrait au 4ème trimestre,Figaro,2021-02-09
Les monuments nationaux ont perdu les deux tiers de leurs visiteurs avec le Covid-19,Figaro,2021-02-09
Ouverture d'une enquête pour viols sur mineurs contre le producteur Gérard Louvin et son mari,Figaro,2021-02-09
Biathlon: pourquoi l’après Martin Fourcade est si compliqué,Figaro,2021-02-09
"Les conditions de remboursement du Smecta se durcissent, son fabricant s'inquiète",Figaro,2021-02-09
Le colza en forte progression avant un rapport américain,Figaro,2021-02-09
Protection sociale: un modèle à repenser,Figaro,2021-02-09
Le pape François apporte son soutien aux musiciens réduits au silence par le Covid-19,Figaro,2021-02-09
"La Bourse de Paris gagne 0,10% à la clôture",Figaro,2021-02-09
Covid-19 : l'Espagne franchit la barre des trois millions de cas,Figaro,2021-02-09
BPCE veut devenir la première banque non cotée d'Europe,Figaro,2021-02-09
"Logement, transports, consommation : les mesures du plan climat touchent tous les pans de la vie quotidienne",Figaro,2021-02-09
Covid-19 : le Pérou lance sa campagne de vaccination,Figaro,2021-02-09
La nouvelle patronne de l'OMC devrait être nommée lundi,Figaro,2021-02-09
Raid de l'armée birmane au siège du parti d'Aung San Suu Kyi,Figaro,2021-02-09
"Vaccins: l'UE publie un troisième contrat, signé avec Sanofi et GSK... encore amputé d'éléments sensibles",Figaro,2021-02-09
Les Français anticipent un duel entre Macron et Le Pen en 2022 mais ne le souhaitent pas,Figaro,2021-02-09
Impeachment saison II : qui sont les avocats de Donald Trump ?,Figaro,2021-02-09
"Doubs : des bus caillassés dans une petite commune, le service suspendu",Figaro,2021-02-09
Inondations: le musée de la bande dessinée d'Angoulême sauvé des eaux,Figaro,2021-02-09
L'usine Bridgestone de Béthune pourrait devenir un parc industriel,Figaro,2021-02-09
"Séquelles du Covid: les demandes de reconnaissance en maladie professionnelle seront traitées «sous trois mois», assure Olivier Véran",Figaro,2021-02-09
Le Brésil enterre l’enquête choc «Lava Jato» ,Figaro,2021-02-09
L’automobile frappée par la pénurie de semi-conducteurs,Figaro,2021-02-09
Habillement: Devernois en redressement judiciaire,Figaro,2021-02-09
Virus : Merkel veut prolonger les restrictions en Allemagne malgré la grogne,Figaro,2021-02-09
"L'Autriche isole le Tyrol, plus gros foyer européen du variant sud-africain",Figaro,2021-02-09
Le propriétaire de Madrange n'a plus à craindre un défaut de paiement,Figaro,2021-02-09
Pénurie de puces électroniques: General Motors prolonge d'un mois la fermeture de trois usines,Figaro,2021-02-09
Décideurs: les nominations du jour,Figaro,2021-02-09
Feu vert du Parlement à la prolongation de l'état d'urgence sanitaire jusqu'au 1er juin,Figaro,2021-02-09
